Coptic,English
ⲁⲛⲁⲩ ⲉⲣⲟϥ ⲉϥϫⲱ ⲙⲙⲟⲥ ⲛⲁⲓ ϫⲉϭⲉⲡⲏ ⲁⲙⲟⲩ ⲉⲃⲟⲗ ϩⲛⲧϩⲓⲉⲣⲟⲩⲥⲁⲗⲏⲙ . ϫⲉⲥⲉⲛⲁϫⲓ ⲙⲛⲧⲙⲛⲧⲣⲉ ⲁⲛ ⲛⲧⲟⲟⲧⲕ ⲉⲧⲃⲏⲏⲧ .,"and saw him saying to me, 'Hurry and get out of Jerusalem quickly, because they will not receive testimony concerning me from you.'"
ⲡϫⲟⲉⲓⲥ ⲛⲧⲟⲕ ⲡⲉ ⲧⲁϭⲟⲙ ⲙⲛⲧⲁⲃⲟⲏⲑⲓⲁ ⲁⲩⲱ ⲡⲁⲙⲁ ⲙⲡⲱⲧ ϩⲙⲡⲉϩⲟⲟⲩ ⲛⲙⲡⲉⲧϩⲟⲟⲩ ⲛϩⲉⲑⲛⲟⲥ ⲥⲉⲛⲏⲩ ϣⲁⲣⲟⲕ ϫⲓⲛⲁⲣⲏϫϥ ⲙⲡⲕⲁϩ ⲛⲥⲉϫⲟⲟⲥ ⲙⲡⲉⲕⲙⲧⲟ ⲉⲃⲟⲗ ϫⲉⲉϣϫⲉ ϩⲉⲛⲛⲟⲩϫ ⲛⲉ ⲛⲉⲓⲇⲱⲗⲟⲛ ⲛⲧⲁⲛⲉⲛⲉⲓⲟⲧⲉ ϫⲡⲟⲟⲩ ⲛⲁⲩ ⲁⲩⲱ ⲙⲙⲛϩⲏⲩ ⲛϩⲏⲧⲟⲩ,"O Lord, thou art my strength, and mine help, and my refuge in days of evil: to thee the Gentiles shall come from the end of the earth, and shall say, How vain were the idols which our fathers procured to themselves, and there is no help in them."
ⲣⲓⲕⲉ ⲙⲡⲉⲕⲙⲁⲁϫⲉ ⲉⲣⲟⲓ ⲛⲅϭⲉⲡⲏ ⲉⲧⲟⲩϫⲟⲉⲓ ϣⲱⲡⲉ ⲛⲁⲓ ⲉⲩⲛⲟⲩⲧⲉ ⲛⲛⲁϣⲧⲉ ⲁⲩⲱ ⲟⲩⲏⲓ ⲉⲙⲁⲙⲡⲱⲧ ⲉⲧⲟⲩϫⲟⲉⲓ,"Incline thine ear to me; make haste to rescue me: be thou to me for a protecting God, and for a house of refuge to save me."
ⲁⲩⲱ ⲡϫⲟⲉⲓⲥ ⲡⲉⲛⲛⲟⲩⲧⲉ ⲁϥⲧⲁⲁϥ ⲉϩⲣⲁⲓ ⲉⲧⲟⲟⲧⲛ ⲛⲙⲱⲅ ⲡⲣⲣⲟ ⲛⲧⲃⲁⲥⲁⲛ ⲛⲙⲡⲉϥⲙⲏⲏϣⲉ ⲧⲏⲣϥ ⲁⲩⲱ ⲁⲛⲡⲁⲧⲁⲥⲥⲉⲓ ⲙⲙⲟϥ ⲙⲡⲛⲕⲁ ⲗⲁⲁⲩ ⲛⲥⲡⲉⲣⲙⲁ ⲛⲧⲁϥ ⲉⲡⲁϩⲟⲩ,"And the Lord our God delivered him into our hands, even Og the king of Basan, and all his people; and we smote him until we left none of his seed."
ⲡⲉⲛⲧⲁϥⲣ ⲛⲟⲃⲉ ⲁϥⲉⲓⲣⲉ ⲙⲡⲡⲟⲛⲏⲣⲟⲛ ϫⲓⲛⲛϣⲟⲣⲡ ⲁⲩⲱ ϣⲁⲧⲉⲩϩⲁⲏ ⲁⲩⲱ ϯⲥⲟⲟⲩⲛ ⲁⲛⲟⲕ ϫⲉⲟⲩⲛⲁⲅⲁⲑⲟⲛ ⲛⲁϣⲱⲡⲉ ⲛⲛⲉⲧⲟ ⲛϩⲟⲧⲉ ϩⲏⲧϥ ⲙⲡⲛⲟⲩⲧⲉ ϫⲉⲕⲁⲥ ⲉⲩⲣ ϩⲟⲧⲉ ϩⲁⲧⲉϥϩⲓⲏ,"He that has sinned has done evil from that time, and long from beforehand: nevertheless I know, that it is well with them that fear God, that they may fear before him:"
ϩⲛⲟⲩϣⲁϫⲉ ⲛⲧⲉⲧⲙⲉ ϩⲛⲟⲩϭⲟⲙ ⲛⲧⲉⲡⲛⲟⲩⲧⲉ ϩⲓⲧⲛⲛϩⲟⲡⲗⲟⲛ ⲛⲧⲇⲓⲕⲁⲓⲟⲥⲩⲛⲏ ⲛⲉⲧϩⲓⲟⲩⲛⲁⲙ ⲙⲛⲛⲉⲧϩⲓϩⲃⲟⲩⲣ .,"in the word of truth, in the power of God; by the armor of righteousness on the right hand and on the left,"
ⲥⲉⲛⲁⲧⲁⲁⲩ ϩⲙⲡⲛⲟⲙⲟⲥ ⲉⲣⲉⲡⲉⲛⲟⲩϫⲁⲓ ϩⲛⲛⲁϩⲱⲱⲣ ⲉⲣⲉⲧⲥⲟⲫⲓⲁ ⲙⲛⲧⲙⲛⲧⲣⲙⲛϩⲏⲧ ⲙⲛⲧⲙⲛⲧⲣⲙⲛⲛⲟⲩⲧⲉ ⲛⲏⲩ ⲛϩⲁⲣⲙ ⲡϫⲟⲉⲓⲥ ⲛⲁⲓ ⲛⲉ ⲛⲁϩⲱⲱⲣ ⲛⲧⲇⲓⲕⲁⲓⲟⲥⲩⲛⲏ,They shall be delivered up to the law: our salvation is our treasure: there are wisdom and knowledge and piety toward the Lord; these are the treasures of righteousness.
ⲉⲓϣⲁⲛⲣⲡⲟⲩⲱⲃϣ ⲧϩⲓⲉⲣⲟⲩⲥⲁⲗⲏⲙ ⲉⲩⲉⲣⲡⲱⲃϣ ⲛⲧⲁⲟⲩⲛⲁⲙ ⲉⲣⲉⲡⲁⲗⲁⲥ ⲧⲱϭⲉ ⲉⲧⲁϣⲟⲩⲱⲃⲉ,"If I forget thee, O Jerusalem, let my right hand forget its skill."
ⲁⲓϫⲟⲟⲥ ⲇⲉ ⲛⲁⲕ ϫⲉⲕⲱ ⲉⲃⲟⲗ ⲙⲡⲁⲗⲁⲟⲥ ϫⲉⲕⲁⲥ ⲉϥⲉϣⲙϣⲉ ⲛⲁⲓ ⲉϣⲱⲡⲉ ϭⲉ ⲛⲅⲟⲩⲱϣ ⲁⲛ ⲉⲕⲱ ⲙⲙⲟϥ ⲉⲃⲟⲗ ⲉⲓⲥ ϩⲏⲏⲧⲉ ⲁⲛⲟⲕ ϯⲛⲁⲙⲟⲩⲟⲩⲧ ⲙⲡⲉⲕϣⲣⲡⲙⲙⲓⲥⲉ,"And I said to thee, Send away my people, that they may serve me: now if thou wilt not send them away, see, I will slay thy first-born son."
ϫⲉⲛⲉⲩϫⲱ ⲙⲉⲛ ⲛⲁⲓ ⲛϩⲉⲛϣⲁϫⲉ ⲛⲉⲓⲣⲏⲛⲏ ⲉⲩⲙⲉⲉⲩⲉ ⲇⲉ ⲉϩⲉⲛⲕⲣⲟϥ ϩⲛⲟⲩⲟⲣⲅⲏ,"For to me they spoke peaceably, but imagined deceits in their anger."
ⲁⲩⲱ ⲁⲓⲕⲧⲟⲓ ⲁⲛⲟⲕ ⲉⲩⲙⲛⲧⲡⲉⲧϣⲟⲩⲉⲓⲧ ϩⲁⲣⲟϥ ⲙⲡⲣⲏ,"So I returned, and saw vanity under the sun."
ⲁϥⲕⲱ ⲛⲥⲱϥ ⲛⲛⲁⲍⲁⲣⲉⲑ . ⲁϥⲉⲓ ⲁϥⲟⲩⲱϩ ϩⲛⲕⲁⲡⲁⲣⲛⲁⲟⲩⲙ . ⲧⲁⲓ ⲉⲧϩⲁⲧⲛ ⲧϩⲁⲗⲁⲥⲥⲁ ϩⲛⲛⲧⲟϣ ⲛⲍⲁⲃⲟⲩⲗⲱⲛ ⲙⲛⲛⲉⲫⲑⲁⲗⲉⲓⲙ .,"Leaving Nazareth, he came and lived in Capernaum, which is by the sea, in the region of Zebulun and Naphtali,"
ⲧⲁⲓ ⲅⲁⲣ ⲧⲉ ⲧϩⲉ ⲉⲛⲉⲩⲕⲟⲥⲙⲉⲓ ⲙⲙⲟⲟⲩ ⲙⲡⲉⲓⲟⲩⲟⲉⲓϣ ⲛϭⲓⲛⲉϩⲓⲟⲙⲉ ⲉⲧⲟⲩⲁⲁⲃ ⲉⲧϩⲉⲗⲡⲓⲍ ⲉⲡⲛⲟⲩⲧⲉ . ⲉⲩⲥⲱⲧⲙ ⲛⲥⲁⲛⲉⲩϩⲁⲓ .,"For this is how the holy women before, who hoped in God also adorned themselves, being in subjection to their own husbands:"
ⲉϥϣⲁⲛϫⲟⲟⲥ ⲇⲉ ⲛϭⲓⲡϩⲙϩⲁⲗ ⲉⲧⲙⲙⲁⲩ ϩⲙⲡⲉϥϩⲏⲧ ϫⲉⲡⲁϫⲟⲉⲓⲥ ⲛⲁⲱⲥⲕ ⲉⲉⲓ ⲛϥⲁⲣⲭⲉⲓ ⲛϩⲓⲟⲩⲉ ⲉⲛϩⲙϩⲙϩⲁⲗ ⲛⲙⲛϩⲙϩⲁⲗ ⲛⲥϩⲓⲙⲉ ⲛϥⲟⲩⲱⲙ ⲛϥⲥⲱ ⲛϥϯϩⲉ .,"But if that servant says in his heart, 'My lord delays his coming,' and begins to beat the menservants and the maidservants, and to eat and drink, and to be drunken,"
ⲁⲩⲱ ⲡⲉϫⲉⲏⲥⲁⲓⲁⲥ ⲛⲁⲩ ϫⲉⲧⲁⲓ ⲧⲉ ⲧϩⲉ ⲉⲧⲉⲧⲛⲛⲁϫⲟⲟⲥ ⲙⲡⲉⲧⲛϫⲟⲉⲓⲥ ϫⲉⲛⲁⲓ ⲛⲉⲧⲉⲣⲉⲡϫⲟⲉⲓⲥ ϫⲱ ⲙⲙⲟⲟⲩ ϫⲉⲙⲡⲣⲣ ϩⲟⲧⲉ ϩⲏⲧⲟⲩ ⲛⲛϣⲁϫⲉ ⲛⲧⲁⲕⲥⲟⲧⲙⲟⲩ ⲛⲁⲓ ⲛⲧⲁⲩⲛⲉϭⲛⲟⲩϭⲧ ⲛϩⲏⲧⲟⲩ ⲛϭⲓⲛⲃⲁⲓϣⲓⲛⲉ ⲙⲡⲣⲣⲟ ⲛⲛⲁⲥⲥⲩⲣⲓⲟⲥ,"And Esaias said to them, Thus shall ye say to your master, Thus saith the Lord, Be not thou afraid at the words which thou hast heard, wherewith the ambassadors of the king of the Assyrians have reproached me,"
ⲓⲉⲥⲁⲭⲁⲣ ⲁϥⲉⲡⲓⲑⲩⲙⲉⲓ ⲉⲡⲡⲉⲧⲛⲁⲛⲟⲩϥ . . .,Issachar has desired that which is good; resting between the inheritances.
ⲡⲉϫⲁⲩ ⲛⲁⲩ ϫⲉⲁϫⲓⲥ ϫⲉⲧⲁⲭⲩ ⲁⲩⲱ ⲙⲡⲟⲩⲥⲟⲟⲩⲧⲛ ⲉϣⲁϫⲉ ϩⲓⲛⲁⲓ ⲁⲩⲁⲙⲁϩⲧⲉ ⲙⲙⲟⲟⲩ ⲁⲩⲕⲟⲛⲥⲟⲩ ϩⲁⲧⲉⲙⲙⲁ ⲛϫⲓⲟⲟⲣ ⲙⲡⲓⲟⲣⲇⲁⲛⲏⲥ ⲁⲩⲱ ⲁⲩϩⲉ ϩⲙⲡⲉⲟⲩⲟⲉⲓϣ ⲉⲧⲙⲙⲁⲩ ⲉⲃⲟⲗ ϩⲛⲉⲫⲣⲁⲓⲙ ⲛϭⲓϥⲧⲟⲟⲩ ⲛⲧⲃⲁ ⲙⲛϫⲟⲩⲱⲧ ⲛϣⲉ,"Then they said to him, Say now Stachys; and he did not rightly pronounce it so: and they took him, and slew him at the fords of Jordan; and there fell at that time of Ephraim two and forty thousand."
ⲁⲙⲟⲩ ⲉⲃⲟⲗ ϩⲛⲧⲃⲁⲃⲩⲗⲱⲛ ⲉⲕⲡⲏⲧ ⲉⲃⲟⲗ ϩⲛⲛⲉⲭⲁⲗⲇⲁⲓⲟⲥ ϫⲱ ⲙⲡⲉϩⲣⲟⲟⲩ ⲙⲡⲟⲩⲛⲟϥ ⲁⲩⲱ ⲙⲁⲣⲟⲩⲥⲉⲧⲙ ⲡⲁⲓ ⲁϫⲓϥ ϣⲁⲁⲣⲏϫϥ ⲙⲡⲕⲁϩ ⲁϫⲓϥ ϫⲉⲁⲡϫⲟⲉⲓⲥ ⲛⲉϩⲙ ⲡⲉϥϩⲙϩⲁⲗ ⲓⲁⲕⲱⲃ,"Go forth of Babylon, thou that fleest from the Chaldeans: utter aloud a voice of joy, and let this be made known, proclaim it to the end of the earth; say ye, The Lord hath delivered his servant Jacob."
ⲁϥⲣⲡⲙⲉⲉⲩⲉ ⲙⲡⲉϥⲛⲁ ⲛⲓⲁⲕⲱⲃ ⲁⲩⲱ ⲧⲉϥⲙⲉ ⲙⲡⲏⲓ ⲙⲡⲓⲥⲣⲁⲏⲗ ⲁⲛⲉⲕⲣⲣⲱⲟⲩ ⲧⲏⲣⲟⲩ ⲙⲡⲕⲁϩ ⲛⲁⲩ ⲉⲡⲟⲩϫⲁⲓ ⲙⲡⲉⲛⲛⲟⲩⲧⲉ,"He has remembered his mercy to Jacob, and his truth to the house of Israel; all the ends of the earth have seen the salvation of our God."
ⲡⲉⲧⲣⲟⲥ ϩⲱⲱϥ ⲙⲛⲓⲱϩⲁⲛⲛⲏⲥ · ⲛⲧⲉⲣⲟⲩⲥⲟϣⲟⲩ ϩⲙⲡⲥⲩⲛϩⲉⲇⲣⲓⲟⲛ · ⲁⲩⲉⲓ ⲉⲃⲟⲗ ⲉⲩⲣⲁϣⲉ · ϫⲉⲁⲩⲣⲙⲡϣⲁ · ⲉⲧⲣⲉⲩⲥⲟϣⲟⲩ ⲉϫⲙⲡⲣⲁⲛ ⲉⲧⲟⲩⲁⲁⲃ · ⲙⲡϫⲟⲉⲓⲥ · ⲉⲩϩⲉⲗⲡⲓⲍⲉ ⲉⲡⲧⲁⲉⲓⲟ ⲛⲧⲡⲉ ⁛—,"And Peter himself, and John, when they had been beaten in the Synagogue came out rejoicing, because they had been held to be worthy of being beaten for the sake of the Holy Name of the Lord, (for) they were hoping for the honour of heaven."
ϫⲉⲁⲛⲟⲕ ⲉⲩⲧⲩⲭⲓⲁⲛⲟⲥ · ϯⲕⲉⲗⲉⲩⲉ ⲉⲧⲣⲉⲩϫⲓ ⲙⲡⲉⲓⲁⲛϩⲟⲥⲓⲟⲥ ϫⲉⲃⲓⲕⲧⲱⲣ · ⲉⲡⲕⲁⲥⲧⲣⲟⲛ ⲛϩⲓⲉⲣⲁⲕⲓⲟⲛ · ⲛⲥⲉⲕⲁⲁϥ ϩⲙⲡⲙⲁ ⲉⲧⲙⲙⲁⲩ,"I, Eutuchianus, hereby command that this profane man Victor be taken to the Camp of Hierakion and that he be compelled to remain there until he die.'"
ϩⲁⲣⲉϩ ⲇⲉ ⲉⲛⲁⲉⲛⲧⲟⲗⲏ ⲛⲧⲁⲣⲉⲕⲱⲛϩ ϯ ⲛⲛⲁϣⲁϫⲉ ⲉⲛⲉⲕⲧⲏⲏⲃⲉ ⲛⲧϩⲉ ⲛϩⲉⲛⲕⲉⲕⲉ ⲛⲃⲁⲗ,"keep my commandments, and thou shalt live; and keep my words as the pupils of thine eyes."
ⲇⲁⲩⲉⲓⲇ ⲇⲉ ⲁϥⲙⲟⲟϣⲉ ⲉⲧⲡⲉ ⲙⲙⲏⲛⲉ ⲉϥⲛⲏⲩ ⲛⲁⲓⲁⲓ ⲁⲩⲱ ⲡϫⲟⲉⲓⲥ ⲡⲡⲁⲛⲧⲟⲕⲣⲁⲧⲱⲣ ⲛⲉϥⲛⲙⲙⲁϥ ⲡⲉ,"And David advanced and became great, and the Lord Almighty was with him."
ⲁⲩⲱ ⲛⲧⲉⲣⲉϥⲉⲓ ⲉϩⲣⲁⲓ ⲉⲧϩⲓⲉⲣⲟⲩⲥⲁⲗⲏⲙ ⲉⲧⲣⲉϥⲧⲱⲙⲛⲧ ⲉⲡⲣⲣⲟ ⲡⲉϫⲉⲡⲣⲣⲟ ⲛⲁϥ ϫⲉⲉⲧⲃⲉⲟⲩ ⲙⲡⲉⲕⲉⲣ ⲛⲁⲙⲟⲟϣⲉ ⲉⲃⲟⲗ ⲙⲉⲙⲫⲓⲃⲟⲥⲑⲉ,"And it came to pass when he went into Jerusalem to meet the king, that the king said to him, Why didst thou not go with me, Memphibosthe?"
ⲁⲛⲟⲕ ⲇⲉ ⲛⲉⲓϣⲗⲏⲗ ⲡⲉ ϩⲛⲧⲁⲯⲩⲭⲏ ⲉϩⲣⲁⲓ ⲉⲣⲟⲕ ⲡϫⲟⲉⲓⲥ ⲡⲉⲟⲩⲟⲉⲓϣ ⲙⲡⲉⲧⲉϩⲛⲁⲕ ⲡⲉ ⲡⲛⲟⲩⲧⲉ ϩⲙⲡⲁϣⲁⲓ ⲙⲡⲉⲕⲛⲁⲥⲱⲧⲙ ⲉⲡⲁⲟⲩϫⲁⲓ ϩⲛⲟⲩⲙⲉ,"But I will cry to thee, O Lord, in my prayer; O God, it is a propitious time: in the multitude of thy mercy hear me, in the truth of thy salvation."
ⲛⲁⲓ ⲉϩⲉⲛϣⲕⲟⲗ ⲙⲡⲉⲧⲣⲁ ⲛⲉ ⲛⲉⲩⲏⲓ,"whose houses were the caves of the rocks, who lived under the wild shrubs."
ⲡⲛⲟⲩⲧⲉ ⲉϥⲉⲭⲁⲣⲓⲍⲉ ⲛⲁⲕ ⲛⲧⲙⲛⲧϣⲟⲉⲓϫ ⲛⲛⲉⲧⲟⲩⲁⲁⲃ · ⲛⲥⲉⲧⲙϩⲉ ⲉⲉⲓⲇⲱⲗⲟⲛ ϩⲛⲧⲉⲕⲡⲟⲗⲓⲥ ·,"God granteth unto thee graciously the skill of the saints in contending, so that thou mayest not fall headlong before the image (or, phantom) in thy city."
ϫⲉⲟⲩⲗⲁⲁⲩ ⲡⲉ ⲙⲡⲉⲙⲧⲟ ⲉⲃⲟⲗ ⲙⲡϫⲟⲉⲓⲥ ϩⲙⲡⲉϩⲟⲟⲩ ⲙⲡⲙⲟⲩ ⲉⲧⲱⲱⲃⲉ ⲙⲡⲣⲱⲙⲉ ⲕⲁⲧⲁⲛⲉϥϩⲓⲟⲟⲩⲉ,For it is an easy thing unto the Lord in the day of death to reward a man according to his ways.
ⲛⲁⲙⲉⲣⲁⲧⲉ ⲉⲓⲉⲓⲣⲉ ⲛⲁⲡⲁⲧⲁⲁⲧ ⲙⲙⲁⲧⲉ ⲉⲧⲣⲁⲥϩⲁⲓ ⲛⲏⲧⲛ ⲉⲧⲃⲉⲡⲉⲛⲟⲩϫⲁⲓ ϩⲓⲟⲩⲥⲟⲡ ⲁⲡⲉⲧⲉϣϣⲉ ϣⲱⲡⲉ ⲛⲁⲓ ⲉⲧⲣⲁⲥϩⲁⲓ ⲛⲏⲧⲛ ⲉⲓⲡⲁⲣⲁⲕⲁⲗⲉⲓ ⲙⲙⲱⲧⲛ ⲉⲧⲉⲧⲛⲙⲓϣⲉ ϩⲉϫⲛ ⲧⲡⲓⲥⲧⲓⲥ ⲛⲧⲁⲩⲧⲁⲁⲥ ⲛⲟⲩⲥⲟⲡ ⲉⲧⲟⲟⲧⲟⲩ ⲛⲛⲉⲧⲟⲩⲁⲁⲃ,"Beloved, while I was very eager to write to you about our common salvation, I was constrained to write to you exhorting you to contend earnestly for the faith which was once for all delivered to the saints."
ⲁⲓⲇⲓⲱⲕⲉ ⲛⲥⲁⲧⲉⲓϩⲓⲏ ϣⲁϩⲣⲁⲓ ⲉⲡⲙⲟⲩ . ⲉⲓⲙⲟⲩⲣ ⲛⲛⲣⲱⲙⲉ ⲁⲩⲱ ⲛⲉϩⲓⲟⲙⲉ ⲉⲓⲛⲟⲩϫⲉ ⲙⲙⲟⲟⲩ ⲉⲛⲉϣⲧⲉⲕⲱⲟⲩ .,"I persecuted this Way to the death, binding and delivering into prisons both men and women."
ⲁⲧⲉⲕⲧⲁⲡⲣⲟ ⲧⲁϣⲉⲕⲁⲕⲓⲁ ⲁⲩⲱ ⲁⲡⲉⲕⲗⲁⲥ ϭⲗⲟⲙⲗⲙ ⲛⲟⲩϫⲓⲛϭⲟⲛⲥ,"Thy mouth has multiplied wickedness, and thy tongue has framed deceit."
ⲇⲁⲩⲉⲓⲇ ⲇⲉ ⲛⲉϥϣⲁϫⲉ ⲉϥϫⲱ ⲙⲙⲟⲥ ϫⲉⲙⲉϣⲁⲕ ⲟⲩⲛⲟⲃⲉ ⲡⲉ ⲛⲧⲁⲓⲁⲁϥ ⲉⲁⲓϩⲁⲣⲉϩ ⲉⲛⲉⲧϣⲟⲟⲡ ⲛⲁϥ ⲧⲏⲣⲟⲩ ϩⲛⲧⲉⲣⲏⲙⲟⲥ ⲉⲙⲡⲉⲛⲁⲓⲧⲉⲓ ⲙⲙⲟϥ ⲛⲗⲁⲁⲩ ⲉⲃⲟⲗ ϩⲛⲛⲉⲧⲛⲧⲁϥ ⲧⲏⲣⲟⲩ ⲁⲩⲱ ϩⲓⲛⲁⲓ ⲁϥⲧⲱⲱⲃⲉ ⲛⲁⲓ ⲛϩⲉⲛⲡⲉⲧϩⲟⲟⲩ ⲉⲡⲙⲁ ⲛϩⲉⲛⲡⲉⲧⲛⲁⲛⲟⲩⲟⲩ,"And David said, Perhaps I have kept all his possessions in the wilderness that he should wrong me, and we did not order the taking anything of all his goods; yet he has rewarded me evil for good."
ⲁⲩⲱ ⲛⲧⲉⲣⲟⲩⲛⲁⲩ ⲛϭⲓⲛⲣⲱⲙⲉ ⲙⲡⲓⲥⲣⲁⲏⲗ ϫⲉⲡⲉⲙⲗⲁϩ ⲛⲕⲣⲟϥ ⲁϥⲧⲱⲟⲩⲛ ⲁϥϫⲓⲅⲁⲃⲁⲁ ⲁⲩⲁϩⲉⲣⲁⲧⲟⲩ ϩⲙⲡⲙⲁ ⲙⲙⲓϣⲉ ⲁⲩⲱ ⲛϣⲏⲣⲉ ⲛⲃⲉⲛⲓⲁⲙⲓⲛ ⲁⲩϫⲱⲛⲧ ⲉⲣⲱϩⲧ ϩⲙⲡⲓⲥⲣⲁⲏⲗ ⲙⲙⲁⲁⲃ ⲛⲣⲱⲙⲉ ⲁⲩⲱ ⲛⲧⲟⲟⲩ ⲡⲉϫⲁⲩ ϫⲉⲡⲁⲗⲓⲛ ⲥⲉϩⲏⲩϩⲓⲏ ⲙⲙⲟⲛ ⲛⲧϩⲉ ⲙⲡⲉⲙⲗⲁϩ ⲛϣⲟⲣⲡ ⲉⲛⲧⲁϥϣⲱⲡⲉ,"And the children of Israel saw that the liers in wait had seized Gabaa, and they stood in line of battle; and Benjamin began to smite down wounded ones among the men of Israel about thirty men; for they said, Surely they fall again before us, as in the first battle."
ⲁⲩⲱ ⲛϫⲁⲓⲉ ⲙⲡⲓⲟⲣⲇⲁⲛⲏⲥ ⲛⲁϯ ⲟⲩⲱ ⲛⲥⲉⲧⲉⲗⲏⲗ ⲁⲩⲱ ⲁⲩϯ ⲛⲁⲥ ⲙⲡⲉⲟⲟⲩ ⲙⲡⲗⲓⲃⲁⲛⲟⲥ ⲁⲩⲱ ⲡⲧⲁⲉⲓⲟ ⲙⲡⲕⲁⲣⲙⲏⲗⲟⲥ ⲁⲩⲱ ⲡⲁⲗⲁⲟⲥ ⲛⲁⲛⲁⲩ ⲉⲡⲉⲟⲟⲩ ⲙⲡϫⲟⲉⲓⲥ ⲙⲛⲡϫⲓⲥⲉ ⲙⲡⲛⲟⲩⲧⲉ,"And the desert places of Jordan shall blossom and rejoice; the glory of Libanus has been given to it, and the honour of Carmel; and my people shall see the glory of the Lord, and the majesty of God."
ⲧⲉⲛⲟⲩ ϭⲉ ⲧⲱⲟⲩⲛ ⲛⲅⲉⲓ ⲉⲃⲟⲗ ⲛⲅϣⲁϫⲉ ⲛϩⲏⲧ ⲛⲛⲉⲕϩⲙϩⲁⲗ ϫⲉⲁⲓⲱⲣⲕ ϩⲙⲡϫⲟⲉⲓⲥ ϫⲉⲉϣⲱⲡⲉ ⲛⲅⲛⲏⲩ ⲁⲛ ⲉⲃⲟⲗ ⲙⲡϩⲟⲟⲩ ⲉⲛⲉ ⲟⲩⲛ ⲗⲁⲁⲩ ⲛⲣⲱⲙⲉ ⲛⲁϭⲱ ⲛⲙⲙⲁⲕ ⲛⲧⲉⲓⲟⲩϣⲏ ⲁⲩⲱ ⲉⲓⲙⲉ ⲛⲁⲕ ϫⲉⲡⲉⲓϩⲱⲃ ⲛⲁⲑⲗⲟ ⲛⲁⲕ ⲉϩⲟⲩⲉ ⲉⲙⲡⲉⲧϩⲟⲟⲩ ⲧⲏⲣⲟⲩ ⲛⲧⲁⲩⲉⲓ ⲉϫⲱⲕ ⲛϫⲓⲛ ⲧⲉⲕⲙⲛⲧⲕⲟⲩⲓ ϣⲁⲉϩⲣⲁⲓ ⲉϯⲟⲩⲛⲟⲩ,"And now arise, and go forth, and speak comfortably to thy servants; for I have sworn by the Lord, that unless thou wilt go forth to-day, there shall not a man remain with thee this night: and know for thyself, this thing will indeed be evil to thee beyond all the evil that has come upon thee from thy youth until now."
ⲙⲡⲟⲗⲓⲥ ⲧⲏⲣⲟⲩ ⲉⲩⲛⲁⲣⲙⲏⲧⲉ ⲙⲛⲛⲕⲉⲙⲁ ⲧⲏⲣⲟⲩ ⲉⲧⲏⲡ ⲉⲣⲟⲟⲩ ⲛⲇⲏⲙⲟⲥ ⲛϣⲏⲣⲉ ⲛⲅⲁⲁⲑ ⲛⲉⲛⲧⲁⲩϣⲱϫⲡ,"In all were given ten cities, and the suburbs of each belonging to them, to the families of the sons of Caath that remained."
ⲁϣⲣⲉⲡⲛⲟⲩⲧⲉ ⲅⲁⲣ ϯⲥⲃⲱ ⲙⲡⲉⲧϥⲙⲉ ⲙⲙⲟϥ ϣⲁϥⲙⲁⲥⲧⲓⲅⲟⲩ ⲇⲉ ⲛϣⲏⲣⲉ ⲛⲓⲙ ⲉⲧϥⲛⲁϣⲟⲡⲟⲩ ⲉⲣⲟϥ ⲛⲧⲟϥ ⲅⲁⲣ ϥⲛⲁⲙⲟⲕϩⲕ ⲁⲩⲱ ⲛϥⲧⲁϩⲟⲕ ⲉⲣⲁⲧⲕ ⲟⲛ,"for whom the Lord loves, he rebukes, and scourges every son whom he receives."
ϫⲉϣⲛϩⲧⲏⲕ ⲉϫⲱⲓ · ⲡϣⲏⲣⲉ ⲛⲟⲩⲱⲧ ⲛⲧⲉⲡⲉϥⲉⲓⲱⲧ ⲡⲁϫⲟⲉⲓⲥ ⲓⲏⲥⲟⲩⲥ ⲡⲉⲭⲣⲓⲥⲧⲟⲥ · ⲉⲕⲉⲛⲟⲩϩⲙ ⲙⲙⲟⲓ ϩⲛⲛⲁⲑⲗⲓⲯⲓⲥ ⲧⲏⲣⲟⲩ ·,"Shew Thy compassion upon me, O Thou only Son of Thy Father, my Lord Jesus the Christ, and deliver out of all my tribulations"
ϫⲉⲕⲁⲁⲥ ⲉϥⲉϫⲱⲕ ⲉⲃⲟⲗ ⲛϭⲓⲡⲉⲛⲧⲁⲩϫⲟⲟϥ ϩⲓⲧⲛⲏⲥⲁⲓⲁⲥ ⲡⲉⲡⲣⲟⲫⲏⲧⲏⲥ ⲉϥϫⲱ ⲙⲙⲟⲥ .,"that it might be fulfilled which was spoken through Isaiah the prophet, saying,"
ϣⲁⲣⲉⲙⲡⲟⲗⲓⲥ ⲇⲉ ϫⲓⲥⲉ ϩⲛⲛⲉⲥⲙⲟⲩ ⲛⲛⲇⲓⲕⲁⲓⲟⲥ,In the prosperity of righteous men a city prospers: but by the mouth of ungodly men it is overthrown.
ⲁⲩⲱ ⲛⲛⲉⲙⲟⲩⲓ ϣⲱⲡⲉ ⲙⲙⲁⲩ ⲟⲩⲇⲉ ⲛⲛⲉⲗⲁⲁⲩ ⲛⲑⲏⲣⲓⲱⲛ ⲙⲡⲟⲛⲏⲣⲟⲛ ⲁⲗⲉ ⲉϫⲱϥ ⲟⲩⲇⲉ ⲛⲛⲉⲩϩⲉ ⲉⲣⲟⲟⲩ ⲙⲙⲁⲩ ⲁⲗⲗⲁ ⲥⲉⲛⲁⲙⲟⲟϣⲉ ⲛϩⲏⲧⲥ ⲉⲁⲩⲥⲟⲧⲟⲩ,"And there shall be no lion there, neither shall any evil beast go up upon it, nor at all be found there; but the redeemed and gathered on the Lord's behalf, shall walk in it,"
ⲁⲩⲱ ⲛⲧⲉⲣⲟⲩϣⲱⲱⲧ ⲛⲏⲣⲡ . ⲡⲉϫⲉⲧⲙⲁⲁⲩ ⲛⲓⲏⲥⲟⲩⲥ ⲛⲁϥ . ϫⲉⲙⲙⲛⲧⲟⲩ ⲏⲣⲡ ⲙⲙⲁⲩ .,"When the wine ran out, Jesus' mother said to him, 'They have no wine.'"
ⲡⲉⲧⲛⲏⲩ ϣⲁⲣⲱⲧⲛ ⲛϥⲧⲙⲉⲓⲛⲉ ⲛⲏⲧⲛ ⲛⲧⲉⲓⲥⲃⲱ ⲙⲡⲉⲣϫⲓⲧϥ ⲉϩⲟⲩⲛ ⲉⲡⲉⲧⲉⲛⲏⲓ ⲁⲩⲱ ⲙⲡⲣϫⲟⲟⲥ ⲛⲁϥ ϫⲉⲭⲁⲓⲣⲉ,"If anyone comes to you, and doesn't bring this teaching, don't receive him into your house, and don't welcome him,"
ⲡⲁⲓ ϭⲉ ϯⲙⲉⲉⲩⲉ ⲉⲧⲛⲛⲟⲟⲩϥ ⲛⲧⲉⲩⲛⲟⲩ ⲉⲓϣⲁⲛⲉⲓⲙⲉ ⲉⲛⲉⲧϣⲟⲟⲡ ⲙⲙⲟⲓ .,"Therefore I hope to send him at once, as soon as I see how it will go with me."
ⲛⲁⲓ ⲉⲧⲉⲩϩⲁⲏ ⲡⲉ ⲡⲧⲁⲕⲟ ⲛⲁⲓ ⲉⲡⲉⲩⲛⲟⲩⲧⲉ ⲡⲉ ϩⲏⲧⲟⲩ ⲁⲩⲱ ⲉⲣⲉⲡⲉⲩⲉⲟⲟⲩ ϩⲙⲡⲉⲩϣⲓⲡⲉ ⲛⲉⲧⲙⲉⲉⲩⲉ ⲛⲁ ⲡⲕⲁϩ .,"whose end is destruction, whose god is the belly, and whose glory is in their shame, who think about earthly things."
ϩⲉⲛⲇⲣⲁⲕⲱⲛ ⲁⲩϭⲱⲗⲡ ⲉⲃⲟⲗ ⲛⲛⲉⲩⲉⲕⲓⲃⲉ ⲁⲩⲧⲥⲅⲕⲉ ⲛⲉⲩⲙⲁⲥ ⲛϣⲉⲉⲣⲉ ⲇⲉ ⲙⲡⲁⲗⲁⲟⲥ ⲁⲩϣⲱⲡⲉ ⲉⲙⲛⲡⲉⲧⲛⲁ ϩⲁⲣⲟⲟⲩ ⲛⲧϩⲉ ⲛⲟⲩϫⲁϫ ϩⲓⲡϫⲁⲓⲉ,"GIMEL. Nay, serpents have drawn out the breasts, they give suck to their young, the daughters of my people are incurably cruel, as an ostrich in a desert."
ⲁⲩⲱ ⲥⲛⲁϣⲱⲡⲉ ⲙⲛⲛⲥⲁⲛⲁⲓ ϯⲛⲁⲡⲱϩⲧ ⲉⲃⲟⲗ ϩⲙⲡⲁⲡⲛⲉⲩⲙⲁ ⲉϫⲛⲥⲁⲣⲝ ⲛⲓⲙ ⲛⲥⲉⲡⲣⲟⲫⲏⲧⲉⲩⲉ ⲛϭⲓⲛⲉⲧⲛϣⲏⲣⲉ ⲙⲛⲛⲉⲧⲛϣⲉⲉⲣⲉ ⲁⲩⲱ ⲛⲉⲧⲛϩⲗⲗⲟ ⲥⲉⲛⲁⲡⲱⲱⲣⲉ ⲛϩⲉⲛⲣⲁⲥⲟⲩ ⲁⲩⲱ ⲛⲉⲧⲛϣⲓⲣⲉ ⲥⲉⲛⲁⲛⲁⲩ ⲉϩⲉⲛϩⲟⲣⲁⲥⲓⲥ,"And it shall come to pass afterward, that I will pour out of my Spirit upon all flesh; and your sons and your daughters shall prophesy, and your old men shall dream dreams, and your young men shall see visions."
ⲁⲩⲱ ⲁϥⲕⲟⲧϥ ⲟⲛ ⲉⲧⲉϥⲡⲁⲣⲁⲃⲟⲗⲏ ⲡⲉϫⲁϥ ϫⲉⲱ ⲱ ⲛⲓⲙ ⲡⲉⲧⲛⲁϣⲱⲡⲉ ⲉⲣϣⲁⲛⲡⲛⲟⲩⲧⲉ ⲕⲁ ⲛⲁⲓ,"And he looked upon Og, and took up his parable and said, Oh, oh, who shall live, when God shall do these things?"
ⲁϥϫⲓⲙⲟⲉⲓⲧ ϩⲏⲧⲟⲩ ϩⲛⲟⲩⲕⲗⲟⲟⲗⲉ ⲙⲡⲉϩⲟⲟⲩ ⲁⲩⲱ ϩⲙⲡⲟⲩⲟⲉⲓⲛ ⲙⲡⲕⲱϩⲧ ⲛⲧⲉⲩϣⲏ ⲧⲏⲣⲥ,"And he guided them with a cloud by day, and all the night with a light of fire."
ⲉⲧⲟⲓⲕⲟⲛⲟⲙⲓⲁ ⲙⲡϫⲱⲕ ⲉⲃⲟⲗ ⲛⲛⲉⲟⲩⲟⲉⲓϣ ⲉϫⲉⲕ ⲡⲧⲏⲣϥ ϩⲙⲡⲉⲭⲣⲓⲥⲧⲟⲥ . ⲛⲉⲧϩⲛ ⲙⲡⲏⲩⲉ ⲁⲩⲱ ⲛⲉⲧϩⲓϫⲙ ⲡⲕⲁϩ ⲛϩⲏⲧϥ .,"to an administration of the fullness of the times, to sum up all things in Christ, the things in the heavens, and the things on the earth, in him;"
ⲡⲉⲧⲙⲟⲟϣⲉ ϩⲓϩⲏ ⲙⲙⲟⲛ ϩⲛⲧⲉϩⲓⲏ ϩⲓϩⲏ ⲉⲧⲣⲉϥⲥⲱⲧⲡ ⲛⲏⲧⲛ ⲛⲟⲩⲙⲁ ⲉϥⲥⲱⲕ ϩⲁϫⲱⲧⲛ ⲛⲧⲉⲩϣⲏ ϩⲛⲟⲩⲕⲱϩⲧ ⲉⲧⲁⲙⲱⲧⲛ ⲉⲧⲉϩⲓⲏ ⲉⲧⲉⲧⲛⲁⲙⲟⲟϣⲉ ⲛϩⲏⲧⲥ ⲁⲩⲱ ϩⲙⲡⲉϩⲟⲟⲩ ϩⲛⲟⲩⲕⲗⲟⲟⲗⲉ,"who goes before you in the way to choose you a place, guiding you in fire by night, shewing you the way by which ye go, and a cloud by day."
ⲁⲗⲏⲑⲱⲥ ⲕⲙⲡϣⲁ ⲛⲧⲁⲓⲟ ⲛⲓⲙ ϩⲓⲉⲟⲟⲩ ⲛⲓⲙ · ⲕⲁⲧⲁⲧϩⲉ ⲛⲧⲁⲡⲉⲯⲁⲗⲙⲱⲇⲟⲥ ⲇⲁⲩⲉⲓⲇ ϫⲟⲟⲥ ϫⲉⲁⲛⲓⲟⲩⲧⲁⲓⲟ ⲙⲛⲟⲩϯⲙⲏ ⲙⲡⲭⲣⲓⲥⲧⲟⲥ · ⲁⲛⲓⲟⲩⲉⲟⲟⲩ ⲙⲡⲉϥⲣⲁⲛ ⲉⲧⲟⲩⲁⲁⲃ ·,"Verily, (O Apa Pisentius,) thou art worthy of all honour and all glory, according to that which the Psalmist David saith, 'Bring honour and reverence unto the Lord, bring glory unto His holy Name'"
ⲉϣⲱⲡⲉ ⲅⲁⲣ ⲁⲛⲟⲕ ⲉⲓϣⲁⲛⲧⲙⲉⲓ ϣⲁⲣⲟⲕ ⲁⲩⲱ ⲛⲧⲟⲕ ϩⲱⲱⲕ ⲛⲅⲧⲙⲉⲓ ϣⲁⲣⲟⲓ ⲡⲛⲟⲩⲧⲉ ⲛⲁⲃⲣⲁϩⲁⲙ ⲁⲩⲱ ⲡⲛⲟⲩⲧⲉ ⲛⲛⲁⲭⲱⲣ ⲉϥⲉⲕⲣⲓⲛⲉ ⲙⲡⲉⲓⲧⲁⲗ ⲙⲛⲡⲉⲓⲟⲉⲓⲧ ϩⲛⲟⲩⲕⲁⲕⲓⲁ ⲁⲓⲁⲕⲱⲃ ⲱⲣⲕ . . .,The God of Abraam and the God of Nachor judge between us; and Jacob swore by the Fear of his father Isaac.
ϩⲁⲙⲏⲛ ϯϫⲱ ⲙⲙⲟⲥ ⲛⲏⲧⲛ ϫⲉⲡⲉⲧⲉⲛϥⲛⲁϣⲱⲡ ⲁⲛ ⲉⲣⲟϥ ⲛⲧⲙⲛⲧⲣⲣⲟ ⲙⲡⲛⲟⲩⲧⲉ ⲛⲧϩⲉ ⲛⲟⲩϣⲏⲣⲉ ⲕⲟⲩⲓ ⲛⲛⲉϥⲃⲱⲕ ⲉϩⲟⲩⲛ ⲉⲣⲟⲥ,"Most certainly I tell you, whoever will not receive the Kingdom of God like a little child, he will in no way enter into it.'"
ⲁϥⲡⲉⲓⲣⲁⲍⲉ ⲉϫⲱϩⲙ ⲙⲡⲉⲣⲡⲉ ⲡⲁⲓ ⲛⲧⲁⲛⲁⲙⲁϩⲧⲉ ⲙⲙⲟϥ .,"He even tried to profane the temple, and we arrested him."
ⲁⲩⲱ ⲡⲣⲣⲟ ⲁϥⲓ ⲉⲃⲟⲗ ⲙⲛⲛⲉϥϩⲙϩⲁⲗ ⲧⲏⲣⲟⲩ ⲉⲩⲙⲟⲟϣⲉ ⲛⲣⲁⲧⲟⲩ ⲁⲩⲱ ⲁⲩⲁϩⲉⲣⲁⲧⲟⲩ ϩⲙⲡⲏⲓ ⲉⲧⲟⲩⲏⲩ,And the king and all his servants went out on foot; and abode in a distant house.
ⲁⲩⲱ ⲁϥϫⲱ ⲉⲣⲟⲟⲩ · ⲛⲛⲉⲛⲧⲁⲩϣⲱⲡⲉ ⲙⲙⲟϥ ⲧⲏⲣⲟⲩ · ⲛⲧⲉⲣⲟⲩ ϫⲕ ⲙⲛⲧⲏ ⲇⲉ ⲛϩⲟⲟⲩ ⲉⲃⲟⲗ ⲉⲩⲙⲟⲟϣⲉ ϩⲓⲧⲉϩⲓⲏ ⲁⲩⲉⲓ ϣⲁⲧⲣⲁⲓⲁⲛⲟⲥ ⲡⲣⲣⲟ,"and he told them about all the things which had happened unto him. And when they had fulfilled fifteen days in marching on the road they came to the place where the Emperor Trajan was,"
ⲁⲩⲱ ⲁⲩⲉⲓ ⲛϭⲓⲛϩⲙϩⲁⲗ ⲙⲡⲣⲣⲟ ϣⲁⲏⲥⲁⲓⲁⲥ,So the servants of king Ezekias came to Esaias.
ϩⲱⲥⲧⲉ ⲡϣⲏⲣⲉ ⲙⲡⲣⲱⲙⲉ ⲡϫⲟⲉⲓⲥ ⲡⲉ ⲙⲡⲕⲉⲥⲁⲃⲃⲁⲧⲟⲛ .,Therefore the Son of Man is lord even of the Sabbath.'
ⲡⲉϫⲉⲙⲓⲭⲁ ⲛⲁⲩ ϫⲉⲉⲃⲟⲗϫⲉ ⲁⲧⲉⲧⲛϥⲓ ⲛⲛⲁⲛⲟⲩⲧⲉ ⲉⲛⲧⲁⲓⲧⲁⲙⲓⲟⲟⲩ ⲛⲁⲓ ⲁⲩⲱ ⲡⲟⲩⲏⲏⲃ ⲁⲧⲉⲧⲛⲃⲱⲕ ⲁⲩⲱ ⲟⲩ ⲡⲉ ⲡⲁϩⲏⲩ ϫⲓⲛⲙⲡⲉⲓⲛⲁⲩ ⲁⲩⲱ ⲛⲧⲱⲧⲛ ⲧⲉⲧⲛϫⲱ ⲙⲙⲟⲥ ⲛⲁⲓ ϫⲉⲁϩⲣⲟⲕ ⲕϫⲓϣⲕⲁⲕ ⲉⲃⲟⲗ,"And Michaias said, Because ye have taken my graven image which I made, and my priest, and are gone; and what have I remaining? and what is this that ye say to me, Why criest thou?"
ⲁⲩⲥⲙⲛⲡⲉⲓϫⲱⲱⲙⲉ ⲁⲩⲕⲁⲁϥ ϩⲙⲡⲉⲩⲙⲟⲛⲟⲥⲧⲏⲣⲓⲟⲛ ϫⲉⲕⲁⲥ ⲉⲩⲛⲁⲱϣ ⲛϩⲏⲧϥ ⲉⲩϩⲏⲩ ⲙⲛⲟⲩⲡⲗⲩⲣⲟⲫⲟⲣⲓⲁ ⲛⲛⲉⲧⲛⲁⲥⲱⲧⲙ ϩⲛⲟⲩϯϩⲧⲏϥ ⲡϫⲟⲉⲓⲥ ⲓⲏⲥⲟⲩⲥ ⲡⲉⲭⲣⲓⲥⲧⲟⲥ ⲉϥⲉⲭⲁⲣⲓⲍⲉ ⲛⲁⲩ ⲛⲟⲩⲛⲟϭ ⲛⲁϩⲉ ⲙⲛⲟⲏⲥⲩⲡⲟⲙⲟⲛⲏ · ⲛϥⲧⲟⲩϫⲟⲟⲩ ⲛϭⲟⲣϭⲥ ⲙⲡⲇⲓⲁⲃⲟⲗⲟⲥ · ⲙⲛⲛⲣⲱⲙⲉ ⲙⲡⲟⲛⲏⲣⲟⲥ ·,...
ⲛⲧⲉⲣⲉϥⲕⲧⲟϥ ⲇⲉ ⲛⲉϥϩⲙⲟⲟⲥ ϩⲓⲡⲉϥϩⲁⲣⲙⲁ . ⲉϥⲱϣ ⲛⲏⲥⲁⲓⲁⲥ ⲡⲉⲡⲣⲟⲫⲏⲧⲏⲥ .,"He was returning and sitting in his chariot, and was reading the prophet Isaiah."
ⲟⲩⲇⲉ ⲙⲉⲩϫⲉⲣⲉⲟⲩϩⲏⲃⲥ ⲛⲥⲉⲕⲁⲁϥ ϩⲁⲟⲩϣⲓ . ⲁⲗⲗⲁ ⲛϣⲁⲩⲕⲁⲁϥ ϩⲓϫⲛⲧⲗⲩⲭⲛⲓⲁ ⲛϥⲣⲟⲩⲟⲉⲓⲛ ⲉⲛⲉⲧϣⲟⲟⲡ ⲧⲏⲣⲟⲩ ϩⲙⲡⲏⲓ .,"Neither do you light a lamp, and put it under a measuring basket, but on a stand; and it shines to all who are in the house."
ϩⲉⲛⲉⲣⲱⲧⲉ ⲧⲁⲣⲉⲕϭⲛⲥⲁⲉⲓⲣⲉ ⲉⲕϣⲁⲛⲟϥⲟⲩ ⲇⲉ ⲡⲉⲥⲛⲟϥ ⲛⲏⲩ ⲉⲃⲟⲗ ⲉⲕϣⲁⲛⲥⲱⲕ ⲇⲉ ⲛϩⲉⲛϣⲁϫⲉ ϣⲁⲣⲉϩⲉⲛϩⲁⲡ ⲙⲛϩⲉⲛⲙⲓϣⲉ ⲉⲓ ⲉⲃⲟⲗ,"Milk out milk, and there shall be butter, and if thou wing one's nostrils there shall come out blood: so if thou extort words, there will come forth quarrels and strifes."
