Coptic,English
ⲁⲩⲉⲓⲛⲉ ⲛⲧⲁⲡⲉ ⲛⲓⲉⲃⲟⲩⲥⲑⲉ ⲉⲣⲁⲧϥ ⲛⲇⲁⲩⲉⲓⲇ ϩⲛⲭⲉⲃⲣⲱⲛ ⲡⲉϫⲁⲩ ⲉϩⲟⲩⲛ ϩⲙⲡⲣⲣⲟ ϫⲉⲉⲓⲥⲧⲁⲡⲉ ⲛⲓⲉⲃⲟⲩⲥⲑⲉ ⲡϣⲏⲣⲉ ⲛⲥⲁⲟⲩⲗ ⲡⲉⲕϫⲁϫⲉ ⲉⲛⲉϥⲕⲱⲧⲉ ⲛⲥⲁⲧⲉⲕⲯⲩⲭⲏ ⲁⲩⲱ ⲡϫⲟⲉⲓⲥ ⲁϥϯ ⲙⲡⲉⲛϫⲟⲉⲓⲥ ⲡⲣⲣⲟ ⲛⲟⲩϫⲓⲕⲃⲁ ⲛⲛⲉⲕϫⲁϫⲉ ⲛⲧϩⲉ ⲙⲡϩⲟⲟⲩ ⲛϩⲟⲟⲩ ⲉⲃⲟⲗ ϩⲛⲥⲁⲟⲩⲗ ⲡⲉⲕϫⲁϫⲉ ⲁⲩⲱ ⲉⲃⲟⲗ ϩⲙⲡⲉⲥⲡⲉⲣⲙⲁ ⲛⲇⲁⲩⲉⲓⲇ,"And they brought the head of Jebosthe to David to Chebron, and they said to the king, Behold the head of Jebosthe the son of Saul thy enemy, who sought thy life; and the Lord has executed for my lord the king vengeance on his enemies, as it is this day: even on Saul thy enemy, and on his seed."
ⲙⲛⲛⲥⲱⲥ ⲟⲩⲛⲧⲁⲛ ⲙⲙⲁⲩ ⲛⲟⲩⲕⲟⲩⲓ ⲛⲁⲡⲟⲕⲣⲓⲥⲓⲥ · ϩⲙⲡⲓⲧⲟϣ ⲉⲛⲟⲩⲱϣ ⲉⲧⲟϣⲥ · ⲁⲗⲗⲁ ϣⲗⲏⲗ ⲉϫⲱⲛ ⲡⲉⲛⲉⲓⲱⲧ ⲛⲧⲉⲡⲛⲟⲩⲧⲉ ⲙⲟⲟϣⲉ ⲛⲙⲙⲁⲛ ·,"In the second place, we have a little business in this neighbourhood which we wish to arrange ; but do thou pray on our behalf, O father, that God may journey with us."
ⲧⲉⲕⲙⲛⲧⲣⲣⲟ ⲟⲩⲙⲛⲧⲣⲣⲟ ⲧⲉ ⲉⲥϣⲟⲟⲡ ϣⲁⲛⲓⲉⲛⲉϩ ⲧⲏⲣⲟⲩ ⲁⲩⲱ ⲧⲉⲕⲙⲛⲧϫⲟⲉⲓⲥ ϣⲁϫⲱⲙ ⲛⲓⲙ ⲛϫⲱⲙ ⲟⲩⲡⲓⲥⲧⲟⲥ ⲡⲉ ⲡϫⲟⲉⲓⲥ ϩⲛⲛⲉϥϣⲁϫⲉ ⲁⲩⲱ ϥⲟⲩⲁⲁⲃ ϩⲛⲛⲉϥϩⲃⲏⲩⲉ ⲧⲏⲣⲟⲩ,"Thy kingdom is an everlasting kingdom, and thy dominion endures through all generations. The Lord is faithful in his words, and holy in all his works."
ⲥⲱⲧⲙ ϩⲱ ⲉⲣⲟⲓ ⲡϫⲟⲉⲓⲥ ϫⲉⲉⲓⲉϣⲁϫⲉ ⲁⲩⲱ ⲛⲧⲁϫⲛⲟⲩⲕ ⲛⲧⲟⲕ ⲇⲉ ⲙⲁⲧⲥⲁⲃⲟⲓ,"But hear me, O Lord, that I also may speak: and I will ask thee, and do thou teach me."
ⲉϥⲛⲕⲟⲧⲕ ϩⲁϣⲏⲛ ⲛⲓⲙ ϩⲁⲧⲛⲟⲩϫⲟⲟⲩϥ ⲙⲛⲟⲩⲕⲁϣ ⲙⲛⲟⲩⲧⲣⲃⲏⲓⲛ,"He lies under trees of every kind, by the papyrus, and reed, and bulrush."
ⲡⲉϫⲉⲛⲁⲁⲥ ⲡⲁⲙⲁⲛⲓⲧⲏⲥ ⲛⲁⲩ ϫⲉϯⲛⲁⲥⲙⲓⲛⲉ ⲛⲙⲙⲏⲧⲛ ⲛⲧⲇⲓⲁⲑⲏⲕⲏ ϩⲙⲡⲧⲣⲉ ⲡⲟⲩⲁ ⲡⲟⲩⲁ ⲙⲙⲱⲧⲛ ⲡⲱⲣⲕ ⲙⲡⲉϥⲃⲁⲗ ⲛⲟⲩⲛⲁⲙ ϫⲉⲕⲁⲥ ⲉⲓⲉⲕⲱ ⲛⲟⲩⲛⲟϭⲛⲉϭ ⲉϫⲙⲡⲓⲥⲣⲁⲏⲗ,"Naas the Ammanite said to them, On these terms will I make a covenant with you, that I should put out all your right eyes, and I will lay a reproach upon Israel."
ⲡϫⲟⲉⲓⲥ ⲟⲛϩ ⲁⲩⲱ ϥⲥⲙⲁⲙⲁⲁⲧ ⲛϭⲓⲡⲁⲛⲟⲩⲧⲉ ⲙⲁⲣⲉϥϫⲓⲥⲉ ⲛϭⲓⲡⲛⲟⲩⲧⲉ ⲙⲡⲁⲟⲩϫⲁⲓ,The Lord lives; and blessed be my God; and let the God of my salvation be exalted.
ⲙⲏ ⲡⲉⲧⲥⲕⲁⲓ ⲛⲁⲥⲕⲁⲓ ⲙⲡⲉϩⲟⲟⲩ ⲧⲏⲣϥ ⲏ ϥⲛⲁⲥⲃⲧⲉ ⲡⲉϥϭⲣⲟϭ ⲉⲙⲡⲁⲧⲧⲉϥⲣ ϩⲱⲃ ⲉⲡⲕⲁϩ,"Will the ploughman plough all the day? or will he prepare the seed beforehand, before he tills the ground?"
ⲁⲩⲱ ⲧⲉⲯⲩⲭⲏ ⲉⲧⲛⲁⲟⲩⲉⲙ ⲛⲕⲁ ⲉϥⲙⲟⲟⲩⲧ ⲏ ⲡⲉⲛⲧⲁ ⲟⲩⲑⲏⲣⲓⲟⲛ ϥⲱϭⲉ ⲉⲣⲟϥ ϩⲛⲛⲣⲙⲛϯⲙⲉ ⲏ ϩⲛⲛⲉⲡⲣⲟⲥⲏⲗⲩⲧⲟⲥ ⲉϥⲉϣⲱⲙ ⲛⲛⲉϥϩⲟⲓⲧⲉ ⲁⲩⲱ ⲉϥⲉϫⲟⲕⲙⲉϥ ϩⲛⲟⲩⲙⲟⲟⲩ ⲁⲩⲱ ⲉϥⲉϭⲱ ⲉϥϫⲁϩⲙ ϣⲁⲡⲛⲁⲩ ⲛⲣⲟⲩϩⲉ ⲁⲩⲱ ⲛϥⲧⲃⲃⲟ,"And every soul which eats that which has died of itself, or is taken of beasts, either among the natives or among the strangers, shall wash his garments, and bathe himself in water, and shall be unclean until evening: then shall he be clean."
. . . ⲛⲁϣⲱⲡⲉ ⲉⲕⲥⲙⲁⲙⲁⲁⲧ . . . . . ⲃⲱⲕ ⲉϩⲟⲩⲛ . . . two leaves lost,"Blessed shalt thou be in thy coming in, and blessed shalt thou be in thy going out."
ⲁⲩⲱ ϯⲛⲁϫⲟⲟⲩ ⲛⲛⲁⲙⲏ ϩⲁⲧⲉⲕϩⲏ ⲛⲥⲉⲛⲟⲩϫⲉ ⲉⲃⲟⲗ ϩⲏⲧⲕ ⲛⲛⲉⲭⲁⲛⲁⲛⲁⲓⲟⲥ ⲙⲛⲛⲁⲙⲟⲣⲣⲁⲓⲟⲥ ⲙⲛⲛⲉⲭⲉⲧⲧⲁⲓⲟⲥ,"And I will send hornets before thee, and thou shalt cast out the Amorites and the Evites, and the Chananites and the Chettites from thee."
ⲁⲩⲱ ϩⲛⲟⲩⲁⲛⲁϣ ⲁϥϩⲟⲙⲟⲗⲟⲅⲉⲓ ⲉϯ ⲛⲁⲥ ⲙⲡⲉⲧⲥⲛⲁⲁⲓⲧⲉⲓ ⲙⲙⲟϥ .,Whereupon he promised with an oath to give her whatever she should ask.
ⲧϣⲟⲣⲡ ⲛⲧⲁⲝⲓⲥ ⲛⲥⲉⲣⲁⲫⲉⲓⲛ ⲛⲉⲧϩⲱⲃⲥ ⲉⲡⲉⲓⲱⲧ ⲉⲣⲉϩⲉⲛϣⲟⲩⲣⲏ ⲛⲛⲟⲩⲃ ⲛⲧⲟⲟⲧⲟⲩ ⲉⲩϫⲱ ⲙⲙⲟⲥ ϫⲉⲁⲗⲗⲏⲗⲟⲩⲓⲁ,"The first rank [contained] the Seraphim, who were dressed in the grain-plant, and they had golden censers in their hands, and they said, ‘Hallelujah!’"
ⲁⲩⲱ ⲟⲩⲛ ⲟⲩⲙⲁⲥⲉ ⲙⲛⲟⲩⲥⲁⲣⲝ ⲛⲁⲙⲟⲟⲛⲉ ϩⲓⲟⲩⲥⲟⲡ ⲁⲩⲱ ⲛⲉⲩϣⲏⲣⲉ ⲛⲁϣⲱⲡⲉ ⲙⲛⲛⲉⲩⲉⲣⲏⲩ ϩⲓⲟⲩⲥⲟⲡ ⲁⲩⲱ ⲟⲩⲛ ⲟⲩⲙⲁⲥⲉ ⲙⲛⲟⲩⲙⲟⲩⲓ ⲛⲁⲟⲩⲉⲙ ⲧⲱϩ ⲙⲛⲛⲉⲩⲉⲣⲏⲩ,And the ox and bear shall feed together; and their young shall be together: and the lion shall eat straw like the ox.
ⲉⲧⲃⲉⲡⲁⲓ ⲧⲁⲓ ⲧⲉ ⲧϩⲉ ⲉⲛⲧⲁⲡϫⲟⲉⲓⲥ ϫⲟⲟⲥ ϫⲉⲉⲡⲉⲓⲇⲏ ⲁⲩⲥⲱⲧⲙ ⲛϭⲓⲛϣⲏⲣⲉ ⲛⲓⲱⲛⲁⲇⲁⲃ ⲡϣⲏⲣⲉ ⲛⲣⲏⲭⲁⲃ ⲛⲥⲁⲧⲉⲛⲧⲟⲗⲏ ⲙⲡⲉⲩⲉⲓⲱⲧ ⲉⲧⲣⲉⲩⲉⲓⲣⲉ ⲕⲁⲧⲁⲧϩⲉ ⲉⲛⲧⲁϥϩⲱⲛ ⲉⲧⲟⲟⲧⲟⲩ ⲛϭⲓⲡⲉⲩⲉⲓⲱⲧ,"Therefore thus saith the Lord; Since the sons of Jonadab the son of Rechab have hearkened to the command of their father, to do as their father commanded them:"
ⲉⲛⲁⲛⲁⲩ ⲉⲣⲟϥ ⲁⲛ ϩⲓⲧⲛⲟⲩⲁⲓⲛⲓⲅⲙⲁ · ⲁⲗⲗⲁ ⲉⲛⲁⲑⲉⲱⲣⲉⲓ ⲙⲙⲟϥ ⲟⲛ ⲛⲧϩⲉ ⲉⲧϥϣⲟⲟⲡ ⲙⲙⲟⲥ · ϩⲛⲛⲉⲛⲃⲁⲗ ⲙⲙⲓⲛⲙⲙⲟⲛ ⲕⲁⲧⲁⲧⲙⲛⲧⲙⲛⲧⲣⲉ ⲙⲡⲁⲡⲟⲥⲧⲟⲗⲟⲥ ⲓⲱϩⲁⲛⲛⲏⲥ ⲡⲣⲉϥϣⲁϫⲉ ⲉⲧⲃⲉⲡⲛⲟⲩⲧⲉ ·,"We shall not see Him in a riddle, but we shall | see Him as He really is, with our own eyes, according to the testimony of the Apostle John, who preached concerning God."
ⲥⲱⲧⲡ ⲇⲉ ⲛⲉⲥⲛⲏⲩ ⲛⲥⲁϣϥ ⲛⲣⲱⲙⲉ ⲛϩⲏⲧ ⲧⲏⲩⲧⲛ . ⲉⲩⲣⲙⲛⲧⲣⲉ ϩⲁⲣⲟⲟⲩ ⲉⲩϫⲏⲕ ⲉⲃⲟⲗ ⲙⲡⲛⲉⲩⲙⲁ ⲉϥⲟⲩⲁⲁⲃ ϩⲓⲥⲟⲫⲓⲁ . ⲧⲁⲣⲛⲧⲁϩⲟⲟⲩ ⲉⲣⲁⲧⲟⲩ ⲉϩⲣⲁⲓ ⲉϫⲛⲧⲉⲓⲭⲣⲉⲓⲁ .,"Therefore select from among you, brothers, seven men of good report, full of the Holy Spirit and of wisdom, whom we may appoint over this business."
ⲉⲧⲉⲧⲛϭⲱϣⲧ ⲉϩⲟⲩⲛ ⲉϩⲣⲁⲓ ⲛⲧⲉⲧⲛⲣϣⲡⲏⲣⲉ ⲛⲧⲉⲧⲛϯ ⲧⲉⲧⲛϭⲓϫ ⲉⲣⲛ ⲧⲛ,"Look upon me, and wonder, laying your hand upon your cheek."
ⲙⲁⲣⲉⲟⲩⲁϣⲕⲁⲕ ϣⲱⲡⲉ ϩⲛⲛⲉⲩⲏⲓ ϩⲛⲟⲩⲥϣⲛⲉ ⲉⲕⲉⲉⲓⲛⲉ ⲉϩⲣⲁⲓ ⲉϫⲱⲟⲩ ⲛϩⲉⲛⲥⲟⲟⲛⲉ ϫⲉⲁⲩϩⲓ ⲧⲟⲟⲧⲟⲩ ⲉⲩϣⲁϫⲉ ⲉⲧⲣⲉⲩⲁⲙⲁϩⲧⲉ ⲙⲙⲟⲓ ⲁⲩⲱ ⲁⲩϩⲱⲡ ⲉⲣⲟⲓ ⲛϩⲉⲛⲡⲁϣ,"Let there be a cry in their houses: thou shalt bring upon them robbers suddenly: for they have formed a plan to take me, and have hidden snares for me."
ⲛⲉⲣⲉ ⲧϩⲟⲧⲉ ⲅⲁⲣ ⲙⲡϫⲟⲉⲓⲥ ⲁⲙⲁϩⲧⲉ ⲙⲙⲟⲓ ⲡⲉ,"For the fear of the Lord constrained me, and I cannot bear up by reason of his burden."
ⲁⲩⲱ ⲙⲛⲛⲥⲁϣⲉⲧⲁⲓⲟⲩ ⲛϩⲟⲟⲩ ⲁⲧⲕⲓⲃⲱⲧⲟⲥ ϩⲙⲟⲟⲥ ⲉϩⲣⲁⲓ ⲉϫⲛⲧⲁⲡⲉ ⲙⲡⲧⲟⲟⲩ ⲛⲁⲣⲁⲣⲁⲧ ϩⲙⲡⲙⲉϩⲥⲁϣϥ ⲛⲉⲃⲟⲧ ⲛⲥⲟⲩⲙⲏⲧ ⲥⲁⲱϥ ⲙⲡⲉⲃⲟⲧ,And the water continued to decrease until the tenth month.
ⲉϥⲧⲁⲩⲟ ⲇⲉ ⲉⲃⲟⲗ ⲛϩⲉⲛϣⲟⲛⲧⲉ ⲙⲛϩⲉⲛⲁⲣⲟⲟⲩⲉ . ϥⲧⲥⲧⲏⲩ ⲉⲃⲟⲗ ⲁⲩⲱ ϥϩⲏⲛ ⲉϩⲟⲩⲛ ⲉⲡⲥⲁϩⲟⲩ . ⲡⲁⲓ ⲉⲧⲉⲣⲉⲧⲉϥϩⲁⲏ ⲛⲁϣⲱⲡⲉ ⲉⲡⲣⲟⲕϩϥ .,"but if it bears thorns and thistles, it is rejected and near being cursed, whose end is to be burned."
ⲛⲛⲉⲣⲱⲙⲉ ϫⲓ ⲛⲧϩⲓⲙⲉ ⲙⲡⲉⲧϩⲓⲧⲟⲩⲱϥ ⲏ ⲙⲡⲉϥⲉⲓⲱⲧ ⲁⲩⲱ ⲛⲛⲉϥϭⲱⲗⲡ ⲉⲃⲟⲗ,"the man who lay with her shall give to the father of the damsel fifty silver didrachms, and she shall be his wife, because he has humbled her; he shall never be able to put her away."
ⲁϥⲣϣⲡⲏⲣⲉ ⲛϭⲓⲓⲱϩⲁⲛⲛⲏⲥ ⲉⲡⲉϩⲟⲩⲟ · ⲉϥⲛⲁⲩ ⲉⲡⲥⲟⲛ ⲙⲙⲟⲛⲁⲭⲟⲥ ⲙⲛⲡⲉϥⲥⲭⲏⲙⲁ · ⲙⲛⲧⲉϥϭⲓⲛϣⲁϫⲉ ⲉⲧϩⲟⲗϭ ⲙⲛⲛⲉϥⲙⲉⲉⲩⲉ · ⲉϩⲟⲩⲛ ⲉⲡⲛⲟⲩⲧⲉ ⲛⲧϩⲉ ⲛⲟⲩⲕⲱϩⲧ ⁛,"and John marvelled exceedingly when he saw the monkish brother, and his garb, and perceived his pleasant manner of speech, and his internal thought about God, which was like fire."
ⲙⲁⲧⲁⲙⲟⲓ ϫⲉⲕⲁⲥ,"Explain to me so that I may sacrifice my own soul (or, life) to save thee."
ⲛⲧⲉⲧⲛⲥⲃⲃⲉ ⲙⲡⲉⲧⲛϩⲏⲧ ⲉⲧⲛⲁϣⲧ ⲁⲩⲱ ⲛⲧⲉⲧⲛⲧⲙⲕⲉⲧ ⲧⲏⲩⲧⲛ ⲉⲣⲛⲁϣⲧ ⲙⲁⲕϩ,"Therefore ye shall circumcise the hardness of your heart, and ye shall not harden your neck."
ⲡϣⲓ ⲛⲛⲧⲏⲩ ⲙⲛⲧⲏⲡⲉ ⲛⲙⲙⲟⲟⲩ,"all that he has made; the weight of the winds, the measures of the water."
ⲟⲩⲇⲉ ⲉⲧⲉⲧⲛϣⲁⲛⲉⲓ ⲉⲟⲩⲱⲛϩ ⲛⲁⲓ ⲉⲃⲟⲗ ⲛⲓⲙ ⲅⲁⲣ ⲡⲉⲛⲧⲁϥϣⲓⲛⲉ ⲛⲥⲁⲛⲁⲓ ⲉⲃⲟⲗ ϩⲓⲧⲉⲛ ⲧⲏⲩⲧⲛ ⲛⲛⲉⲧⲉⲛⲟⲩⲱϩ ⲉⲧⲉⲧⲏⲩⲧⲛ ⲉⲡⲁⲧⲉⲓ ⲛⲧⲁⲁⲩⲗⲏ,neither shall ye come with these to appear before me; for who has required these things at your hands? Ye shall no more tread my court.
ⲉⲕϣⲁⲛⲃⲱⲕ ⲇⲉ ⲉⲃⲟⲗ ⲉⲡⲡⲟⲗⲉⲙⲟⲥ ⲉⲙⲓϣⲉ ⲛⲙⲛⲉⲕϫⲓϫⲉⲉⲩⲉ ⲁⲩⲱ ⲛⲅⲛⲁⲩ ⲉⲩϩⲧⲟ ⲙⲛⲡⲉⲧϩⲓϫⲱϥ ⲁⲩⲱ ⲟⲩⲙⲏⲏϣⲉ ⲉϥⲟϣ ⲉⲣⲟⲕ ⲛⲛⲉⲕⲣ ϩⲟⲧⲉ ϩⲏⲧⲟⲩ ⲉⲃⲟⲗ ϫⲉⲡϫⲟⲉⲓⲥ ⲡⲉⲕⲛⲟⲩⲧⲉ ϣⲟⲟⲡ ⲛⲉⲙⲁⲕ ⲡⲉⲛⲧⲁϥⲛⲧⲕ ⲉⲃⲟⲗ ϩⲛⲡⲕⲁϩ ⲛⲕⲏⲙⲉ,"And if thou shouldest go forth to war against thine enemies, and shouldest see horse, and rider, and a people more numerous than thyself; thou shalt not be afraid of them, for the Lord thy God is with thee, who brought thee up out of the land of Egypt."
ⲧⲟⲧⲉ ⲁϥⲙⲟⲩⲧⲉ ⲉⲣⲟⲟⲩ ⲛϭⲓⲡⲁⲅⲅⲉⲗⲟⲥ ϩⲛⲟⲩϩⲱⲡ ⲡⲉϫⲁϥ ⲛⲁⲩ ϫⲉⲥⲙⲟⲩ ⲉⲡⲛⲟⲩⲧⲉ ⲛⲧⲉⲧⲛⲉⲝⲟⲙⲟⲗⲟⲅⲉⲓ ⲡⲁϥ ⲛⲧⲉⲧⲛϫⲓⲥⲉ ⲙⲙⲟϥ ⲙⲡⲙⲧⲟ ⲉⲃⲟⲗ ⲛⲛⲉⲧⲟⲛϩ ⲧⲏⲣⲟⲩ ⲉⲧⲃⲉⲛⲉⲛⲧⲁϥⲁⲁⲩ ⲛⲏⲧⲛ ⲟⲩⲁⲅⲁⲑⲟⲛ ⲡⲉ ⲥⲙⲟⲩ ⲉⲡⲛⲟⲩⲧⲉ ⲁⲩⲱ ⲉϫⲓⲥⲉ ⲙⲡⲉϥⲣⲁⲛ ⲛϣⲁϫⲉ ⲙⲡⲛⲟⲩⲧⲉ ⲙⲛⲛⲉϥϩⲃⲏⲩⲉ ⲉⲧⲉⲧⲛⲟⲩⲱⲛϩ ⲙⲙⲟⲟⲩ ⲉⲃⲟⲗ ϩⲛⲟⲩⲙⲡϣⲁ ⲁⲩⲱ ⲙⲡⲣϫⲛⲁⲁⲩ ⲉⲉⲝⲟⲙⲟⲗⲟⲅⲉⲓ ⲛⲁϥ,"Then he took them both apart, and said unto them, Bless God, praise him, and magnify him, and praise him for the things which he hath done unto you in the sight of all that live. It is good to praise God, and exalt his name, and honourably to shew forth the works of God; therefore be not slack to praise him."
ⲧⲉⲥⲧⲏⲗⲟⲅⲣⲁⲫⲓⲁ ⲛⲇⲁⲩⲉⲓⲇ ϩⲁⲣⲉϩ ⲉⲣⲟⲓ ⲡϫⲟⲉⲓⲥ ϫⲉⲁⲓⲕⲁϩⲧⲏⲓ ⲉⲣⲟⲕ,"Keep me, O Lord; for I have hoped in thee."
ϩⲙⲟⲟⲥ ⲙⲡⲉⲓⲙⲁ ϩⲁϩⲧⲏⲓ ⲛⲅⲧⲉⲙⲣϩⲟⲧⲉ ϫⲉⲡⲙⲁ ⲉϯⲛⲁⲕⲱⲧⲉ ⲛⲥⲁⲙⲙⲁ ⲙⲡⲱⲧ ⲛⲧⲁⲯⲩⲭⲏ ⲉⲣⲟϥ ϯⲛⲁⲕⲱⲧⲉ ϩⲱⲱϥ ⲛⲥⲁⲟⲩⲙⲁ ⲛⲧⲉⲕⲯⲩⲭⲏ ϫⲉⲛⲧⲟⲕ ⲁⲕⲡⲱⲧ ⲉⲣⲁⲧ,"Dwell with me; fear not, for wherever I shall seek a place of safety for my life, I will also seek a place for thy life, for thou art safely guarded while with me."
ⲡⲉⲧⲉⲛϥⲧⲁⲗϭⲟ ⲙⲙⲟϥ ⲁⲛ ϩⲛⲛⲉϥϩⲃⲏⲩⲉ ⲡⲥⲟⲛ ⲡⲉ ⲙⲡⲉⲧⲧⲁⲕⲟ ⲙⲙⲟϥ ⲟⲩⲁⲁϥ ⲟⲩⲁⲧϩⲏⲧ ⲉϥϣⲁⲛϣⲓⲡⲉ ⲥⲛⲁⲱⲡ ⲉⲣⲟϥ ⲉⲩⲥⲟⲫⲓⲁ ⲁⲩⲱ ⲡⲉⲧⲧⲁⲗϭⲟ ⲙⲙⲟϥ ϩⲛⲛⲉϥϩⲃⲏⲩⲉ ⲑⲙⲙⲓⲛ ⲙⲙⲟϥ,A man who helps not himself by his labour is brother of him that ruins himself.
ⲛⲱⲛⲉⲛⲉⲥⲛⲏⲟⲩ ⲙⲙⲟⲛⲁⲭⲟⲥ,...
ⲇⲁⲩⲉⲓⲇ ⲇⲉ ⲛⲧⲉⲣⲉϥⲛⲁⲩ ⲉⲡⲁⲅⲅⲉⲗⲟⲥ ⲡⲉϫⲁϥ ϩⲓⲧϩⲏ ⲙⲡϫⲟⲉⲓⲥ ϫⲉⲉⲓⲥϩⲏⲏⲧⲉ ⲁⲛⲟⲕ ⲡⲉ ⲛⲧⲁⲓⲣⲛⲟⲃⲉ ⲁⲛⲟⲕ ⲡϣⲱⲥ ⲁⲓⲉⲓⲣⲉ ⲛⲟⲩϫⲓⲛϭⲟⲛⲥ ⲛⲁⲓ ⲇⲉ ⲛⲉ ϩⲉⲛⲉⲥⲟⲟⲩ ⲛⲉ ⲙⲡⲟⲩⲉⲣ ⲗⲁⲁⲩ ⲛⲧⲁⲩ ⲧⲉⲛⲟⲩ ϭⲉ ⲡϫⲟⲉⲓⲥ ⲙⲁⲣⲉⲧⲉⲕϭⲓϫ ⲉⲓ ⲉϩⲣⲁⲓ ⲉϫⲱⲓ ⲁⲩⲱⲉϫⲙ ⲡⲏⲓ ⲙⲡⲁⲉⲓⲱⲧ,"And David spoke to the Lord when he saw the angel smiting the people, and he said, Behold, it is I that have done wrong, but these sheep what have they done? Let thy hand, I pray thee, be upon me, and upon my father's house."
ⲉϥⲥⲟⲟⲩⲛ ⲛϭⲓⲓⲏⲥⲟⲩⲥ ϫⲉⲁⲡⲉⲓⲱⲧ ϯⲛⲕⲁ ⲛⲓⲙ ⲉⲛⲉϥϭⲓϫ ⲁⲩⲱ ϫⲉⲛⲧⲁϥⲉⲓ ⲉⲃⲟⲗ ϩⲓⲧⲙⲡⲛⲟⲩⲧⲉ ⲁⲩⲱ ⲉϥⲛⲁ ⲉⲣⲁⲧϥ ⲙⲡⲛⲟⲩⲧⲉ .,"Jesus, knowing that the Father had given all things into his hands, and that he came forth from God, and was going to God,"
ⲁⲩⲱ ⲁⲛⲃⲱⲕ ⲡⲟⲩⲁ ⲡⲟⲩⲁ ϩⲛⲛⲟⲩⲱϣ ⲙⲡⲉⲛϩⲏⲧ ⲉⲧϩⲟⲟⲩ ⲉⲧⲣⲉⲛⲉⲓⲣⲉ ⲛϩⲉⲛϩⲃⲏⲩⲉ ⲛϩⲉⲛⲛⲟⲩⲧⲉ ⲛϣⲙⲙⲟ ϫⲉⲉⲛⲉⲣ ⲡⲉⲧϩⲟⲟⲩ ⲙⲡⲉⲙⲧⲟ ⲉⲃⲟⲗ ⲙⲡϫⲟⲉⲓⲥ ⲡⲉⲛⲛⲟⲩⲧⲉ,"But every man followed the imagination of his own wicked heart, to serve strange gods, and to do evil in the sight of the Lord our God."
ⲟⲩⲟⲓ ⲛⲛϣⲏⲣⲉ ⲛⲁⲡⲟⲥⲧⲁⲧⲏⲥ ⲛⲁⲓ ⲛⲉⲧⲉⲣⲉⲡϫⲟⲉⲓⲥ ϫⲱ ⲙⲙⲟⲟⲩ ⲁⲧⲉⲧⲛⲉⲓⲣⲉ ⲛⲟⲩϣⲟϫⲛⲉ ⲉⲃⲟⲗ ϩⲓⲧⲟⲟⲧⲁⲛ ⲁⲩⲱ ϩⲛⲁⲩⲱ ⲉⲃⲟⲗ ϩⲓⲧⲙⲡⲁⲡⲛⲉⲩⲙⲁ ⲁⲛ ⲉⲟⲩⲉϩ ⲛⲟⲃⲉ ⲉϫⲛⲛⲉⲧⲛⲛⲟⲃⲉ,"Woe to the apostate children, saith the Lord: ye have framed counsel, not by me, and covenants not by my Spirit, to add sins to sins:"
ϯⲛⲁϫⲟⲟⲣⲟⲩ ⲉⲃⲟⲗ ϩⲛⲟⲩϫⲱⲱⲣⲉ ⲉⲃⲟⲗ ϩⲛϩⲛⲡⲩⲗⲏ ⲛⲧⲉⲡⲁⲗⲁⲟⲥ ⲁⲓⲉⲣ ⲁⲧϣⲏⲣⲉ ⲁⲓⲧⲁⲕⲟ ⲙⲡⲁⲗⲁⲟⲥ ⲉⲧⲃⲉⲛⲉⲩϫⲓⲛϭⲟⲛⲥ,And I will completely scatter them; in the gates of my people they are bereaved of children: they have destroyed my people because of their iniquities.
ⲉⲩϣⲁⲛⲧⲁϩⲉ ⲟⲩⲣⲱⲙⲉ ⲇⲉ ⲉϥⲛⲕⲟⲧⲕ ⲙⲛⲟⲩⲥϩⲓⲙⲉ ⲉⲥⲟⲩⲏϩ ⲙⲛⲡⲉⲥϩⲁⲓ ⲉⲧⲉⲧⲛⲉⲙⲟⲟⲩⲧⲟⲩ ϩⲓⲟⲩⲥⲟⲡ ⲡⲣⲱⲙⲉ ⲉⲧⲛⲕⲟⲧⲕ ⲙⲛⲧⲉⲥϩⲓⲙⲉ ⲁⲩⲱ ⲟⲛ ⲧⲕⲉⲥϩⲓⲙⲉ ⲛⲅϥⲓ ⲙⲡⲡⲟⲛⲏⲣⲟⲥ ⲉⲃⲟⲗ ϩⲛⲧⲉⲧⲛⲙⲏⲧⲉ,"then shall they bring out the damsel to the doors of her father's house, and shall stone her with stones, and she shall die; because she has wrought folly among the children of Israel, to defile the house of her father by whoring: so thou shalt remove the evil one from among you."
ⲁⲩⲱ ⲁⲧⲉⲧⲛⲟⲩⲱϣⲃ ⲛⲁⲓ ⲉⲧⲉⲧⲛϫⲱ ⲙⲙⲟⲥ ϫⲉⲛⲁⲛⲟⲩ ⲡϣⲁϫⲉ ⲉⲛⲧⲁⲕϫⲟⲟϥ ⲉⲁⲁϥ,"And ye answered me and said, The thing which thou hast told us is good to do."
ⲡⲉⲧⲧⲁⲉⲓⲟ ⲙⲡⲉϥⲉⲓⲱⲧ ϥⲛⲁⲉⲩⲫⲣⲁⲛⲉ ϣⲏⲣⲉ ⲁⲩⲱ ⲥⲉⲛⲁⲥⲱⲧⲙ ⲉⲣⲟϥ ϩⲟⲟⲩ ⲙⲡⲉϥϣⲗⲏⲗ,"Whoso honoureth his father shall have joy of his own children; and when he maketh his prayer, he shall be heard."
ϫⲉⲛⲛⲟⲩⲧⲉ ⲧⲏⲣⲟⲩ ⲛⲛϩⲉⲑⲛⲟⲥ ϩⲉⲛⲉⲓⲇⲱⲗⲟⲛ ⲛⲉⲛⲇⲁⲓⲙⲟⲛⲓⲟⲛ ⲡϫⲟⲉⲓⲥ ⲇⲉ ⲛⲧⲟϥ ⲁϥⲧⲁⲙⲓⲉ ⲙⲡⲏⲩⲉ,For all the gods of the heathen are devils: but the Lord made the heavens.
ⲁⲩⲱ ⲛϣⲏⲣⲉ ⲙⲡⲓⲥⲣⲁⲏⲗ ⲁⲩϯ ⲛⲛⲗⲉⲩⲓⲧⲏⲥ ⲛⲛⲉⲓⲡⲟⲗⲓⲥ ⲙⲛⲛⲉⲩⲙⲁ ⲉⲧⲏⲡ ⲉⲣⲟⲟⲩ ϩⲛⲟⲩⲕⲗⲏⲣⲟⲥ ⲕⲁⲧⲁⲧϩⲉ ⲉⲛⲧⲁⲡϫⲟⲉⲓⲥ ϩⲱⲛ ⲉⲧⲟⲟⲧϥ ⲙⲙⲱⲟⲩⲥⲏⲥ,"And the children of Israel gave to the Levites the cities and their suburbs, as the Lord commanded Moses, by lot."
ⲛⲧⲟϥ ⲇⲉ ⲉⲧⲃⲉⲧⲉϥⲙⲛⲧϫⲱⲱⲣⲉ ⲛⲧⲁϥⲉⲓⲙⲉ ⲉⲣⲟⲥ · ⲁⲩⲱ ⲧⲉϥϭⲓⲛϩⲉ ⲉⲧⲉϥⲥϩⲓⲙⲉ ⲙⲛⲛⲉϥϣⲏⲣⲉ ⲁϥⲧⲁϣⲟ ⲙⲡⲉϥⲟⲩⲣⲟⲧ ⲉⲡⲉϩⲟⲩⲟ ·,"And he, because of his valour, whereof he was conscious, and because of his meeting with his wife and sons, was filled to the uttermost with his joy."
ⲁϥⲉⲓ ⲇⲉ ⲉϩⲣⲁⲓ ⲉⲛⲁⲍⲁⲣⲉⲑ ⲡⲙⲁ ⲉⲛⲧⲁⲩⲥⲁⲛⲟⲩϣϥ ⲛϩⲏⲧϥ . ⲁⲩⲱ ⲁϥⲃⲱⲕ ⲉϩⲟⲩⲛ ⲕⲁⲧⲁⲡⲉϥⲥⲱⲛⲧ ϩⲛⲛⲉϩⲟⲟⲩ ⲛⲛⲥⲁⲃⲃⲁⲧⲟⲛ ⲉⲧⲥⲩⲛⲁⲅⲱⲅⲏ . ⲁϥⲧⲱⲟⲩⲛ ⲇⲉ ⲉⲱϣ,"He came to Nazareth, where he had been brought up. He entered, as was his custom, into the synagogue on the Sabbath day, and stood up to read."
ⲡⲧⲱϣ ⲇⲉ ⲙⲡⲉϩⲟⲟⲩ ⲛⲧⲉⲣⲉϥϣⲱⲡⲉ ⲉⲗⲅⲁⲛⲁ ⲁϥϣⲱⲱⲧ ⲛⲧⲉϥⲑⲩⲥⲓⲁ ⲁϥⲧ ⲛϩⲉⲛⲙⲉⲣⲓⲥ ⲙⲫⲉⲛⲁⲛⲛⲁ ⲧⲉϥⲥϩⲓⲙⲉ ⲙⲛⲛⲉϥϣⲏⲣⲉ ⲧⲏⲣⲟⲩ ⲙⲛⲛⲉϥϣⲉⲉⲣⲉ,"And the day came, and Helkana sacrificed, and gave portions to his wife Phennana and her children."
ⲙⲁⲣⲛⲉⲓ,"Let us come forth from our habits which are evil, , and remove ourselves into the city which is in the heavens."
ⲁϥⲱϣ ⲉϩⲣⲁⲓ ⲉⲡϫⲟⲉⲓⲥ ϩⲛⲟⲩⲗⲩⲡⲏ ⲙⲛⲟⲩⲙⲕⲁϩ ⲛϩⲏⲧ ·,'And he cried out to the Lord in grief and in tribulation of heart.
ⲁⲓϫⲓⲥⲉ ⲛⲧϩⲉ ⲛⲛⲓⲕⲉⲇⲣⲟⲥ ⲉⲧϩⲛⲡⲗⲓⲃⲁⲛⲟⲥ ⲁⲩⲱ ⲛⲧϩⲉ ⲛⲛⲓⲕⲩⲡⲁⲣⲓⲥⲥⲟⲥ ⲉⲧϩⲛⲛⲧⲟⲟⲩ ⲛⲛⲁⲉⲣⲙⲱⲛ,"I was exalted like a cedar in Libanus, and as a cypress tree upon the mountains of Hermon."
ⲙⲁⲧⲟⲩϫⲟⲓ ⲉⲃⲟⲗ ϩⲛⲧϭⲓϫ ⲙⲡⲁⲥⲟⲛ ⲁⲩⲱ ⲉⲃⲟⲗ ϩⲛⲧϭⲓϫ ⲛⲏⲥⲁⲩ ϫⲉϯⲣϩⲟⲧⲉ ⲁⲛⲟⲕ ϩⲏⲧϥ ⲙⲏⲡⲟⲧⲉ ⲛϥⲉⲓ ⲛϥⲣⲱϩⲧ ⲙⲙⲟⲓ ⲁⲩⲱ ⲙⲙⲁⲁⲩ ⲉϩⲣⲁⲓ ⲉϫⲛⲛⲉⲩϣⲏⲣⲉ,"But thou saidst, I will do thee good, and will make thy seed as the sand of the sea, which shall not be numbered for multitude."
ϯⲛⲁⲣⲱϩⲧ ⲛⲛⲉϥϫⲓϫⲉⲉⲩⲉ ϩⲁⲧⲉϥϩⲏ ⲁⲩⲱ ϯⲛⲁⲟⲩⲱⲗⲥ ⲛⲛⲉⲧⲙⲟⲥⲧⲉ ⲙⲙⲟϥ,"And I will hew down his foes before him, and put to flight those that hate him."
ⲡⲉϩⲟⲟⲩ ϫⲱ ⲛⲟⲩϣⲁϫⲉ ⲙⲡⲉϩⲟⲟⲩ ⲧⲉⲩϣⲏ ϫⲱ ⲛⲟⲩⲥⲟⲟⲩⲛ ⲛⲧⲉⲩϣⲏ,"Day to day utters speech, and night to night proclaims knowledge."
ⲡⲉⲧⲙⲉ ⲛⲧⲉϥⲯⲩⲭⲏ ϥⲛⲁⲥⲟⲣⲙⲉⲥ . ⲁⲩⲱ ⲡⲉⲧⲙⲟⲥⲧⲉ ⲛⲧⲉϥⲯⲩⲭⲏ ϩⲙⲡⲉⲓⲕⲟⲥⲙⲟⲥ . ϥⲛⲁϩⲉ ⲉⲣⲟⲥ ⲉⲩⲱⲛϩ ϣⲁⲉⲛⲉϩ .,He who loves his life will lose it. He who hates his life in this world will keep it to eternal life.
ⲁϥϣⲟⲡⲟⲩ ⲉⲣⲟϥ ϩⲛⲧⲉϩⲓⲏ ⲛⲧⲉⲩⲁⲛⲟⲙⲓⲁ ⲛⲧⲁⲩⲑⲃⲃⲓⲟ ⲅⲁⲣ ⲉⲧⲃⲉⲛⲉⲩⲁⲛⲟⲙⲓⲁ,He helped them out of the way of their iniquity; for they were brought low because of their iniquities.
ⲛⲧϩⲉ ⲙⲡϣⲏⲣⲉ ⲙⲡⲣⲱⲙⲉ ⲛⲧⲁϥⲉⲓ ⲁⲛ ⲉⲧⲣⲉⲩⲇⲓⲁⲕⲟⲛⲉⲓ ⲛⲁϥ . ⲁⲗⲗⲁ ⲉⲇⲓⲁⲕⲟⲛⲉⲓ . ⲁⲩⲱ ⲉϯ ⲛⲧⲉϥⲯⲩⲭⲏ ⲛⲥⲱⲧⲉ ϩⲁϩⲁϩ .,"even as the Son of Man came not to be served, but to serve, and to give his life as a ransom for many.'"
ⲟⲩⲁ ⲙⲉⲛ ⲁϥϯ ⲛⲁϥ ⲛϯⲟⲩ ⲛϭⲓⲛϭⲱⲣ ⲟⲩⲁ ⲇⲉ ⲁϥϯ ⲛⲁϥ ⲛⲥⲛⲁⲩ ⲟⲩⲁ ⲇⲉ ⲁϥϯ ⲛⲁϥ ⲛⲟⲩⲁ ⲡⲟⲩⲁ ⲡⲟⲩⲁ ⲕⲁⲧⲁⲧⲉϥϭⲟⲙ ⲁϥⲁⲡⲟⲇⲏⲙⲉⲓ .,"To one he gave five talents, to another two, to another one; to each according to his own ability. Then he went on his journey."
ⲛⲅⲡⲱⲧ ⲉⲣⲁⲧϥ ⲙⲡⲉⲕⲥⲟⲛ ·,"thou shalt flee to the feet of thy brother,"
ⲡⲉⲯⲁⲗⲙⲟⲥ ⲛⲧⲙⲛⲧⲣⲙⲛϩⲏⲧ ⲛⲁⲥⲁⲫ ϯϩⲧⲏⲧⲛ ⲡⲁⲗⲁⲟⲥ ⲉⲡⲁⲛⲟⲙⲟⲥ ⲣⲉⲕⲧⲡⲉⲧⲛⲙⲁⲁϫⲉ ⲉⲛϣⲁϫⲉ ⲛⲧⲁⲧⲁⲡⲣⲟ,"Give heed, O my people, to my law: incline your ear to the words of my mouth."
ⲙⲡϫⲟⲉⲓⲥ ⲇⲉ ⲁϥⲕⲱ ⲉⲃⲟⲗ ⲛⲧⲕⲁⲕⲓⲁ ⲉⲛⲧⲁϥϫⲟⲟⲥ ⲉⲁⲁⲥ ⲙⲡⲉϥⲗⲁⲟⲥ,And the Lord was prevailed upon to preserve his people.
ⲁⲩⲱ ⲧⲡⲁϣⲉ ⲙⲡⲕⲁϩ ⲛⲅⲁⲗⲁⲁⲇ ⲁⲩⲱ ϩⲛⲁⲥⲇⲣⲁⲣⲱⲑ ⲁⲩⲱ ϩⲛⲉⲇⲣⲁⲉⲓⲛ ⲙⲡⲟⲗⲓⲥ ⲛⲧⲙⲛⲧⲣⲣⲟ ⲛⲱⲅ ϩⲙⲡⲕⲁϩ ⲛⲧⲃⲁⲥⲁⲛ ⲁϥⲧⲁⲁⲩ ⲛⲛϣⲏⲣⲉ ⲙⲙⲁⲭⲉⲓⲣ ⲡϣⲏⲣⲉ ⲙⲙⲁⲛⲁⲥⲥⲏ ⲕⲁⲧⲁⲛⲉⲩⲇⲏⲙⲟⲥ,"and the half of Galaad, and in Astaroth, and in Edrain, royal cities of Og in the land of Basan, Moses gave to the sons of Machir the sons of Manasse, even to the half-tribe sons of Machir the sons of Manasse, according to their families."
ⲁϥϯ ⲡⲉϥⲟⲩⲟⲉⲓ ⲇⲉ ⲛϭⲓⲡⲭⲓⲗⲓⲁⲣⲭⲟⲥ ⲁϥϫⲛⲟⲩϥ ⲉϥϫⲱ ⲙⲙⲟⲥ ϫⲉⲛⲧⲟⲕ ⲛⲧⲕ ⲟⲩϩⲣⲱⲙⲁⲓⲟⲥ . ⲛⲧⲟϥ ⲇⲉ ⲡⲉϫⲁϥ ϫⲉⲉϩⲉ .,"The commanding officer came and asked him, 'Tell me, are you a Roman?' He said, 'Yes.'"
ⲉⲧⲁⲇⲓⲕⲁⲓⲟⲥⲩⲛⲏ ⲙⲡⲓϩⲱⲡ ⲛⲧⲉⲕⲙⲉ ϩⲙⲡⲁϩⲏⲧ ⲁⲩⲱ ⲁⲓϫⲱ ⲙⲡⲉⲕⲟⲩϫⲁⲓ ⲙⲡⲓϩⲱⲡ ⲙⲡⲉⲕⲛⲁ ⲁⲩⲱ ⲧⲉⲕⲙⲉ ⲉⲩⲥⲩⲛⲁⲅⲱⲅⲏ ⲉⲛⲁϣⲱⲥ,"I have not hid thy truth within my heart, and I have declared thy salvation; I have not hid thy mercy and thy truth from the great congregation."
ⲡⲁⲓ ⲛⲉⲩⲣⲙⲛⲧⲣⲉ ϩⲁⲣⲟϥ ⲉⲃⲟⲗ ϩⲓⲧⲛⲛⲉⲥⲛⲏⲩ ⲉⲧϩⲛⲗⲩⲥⲇⲣⲟⲥ ⲙⲛϩⲓⲕⲟⲛⲓⲟⲥ .,The brothers who were at Lystra and Iconium gave a good testimony about him.
ⲧⲁⲓ ⲉⲧⲟⲩϩⲁⲣⲉϩ ⲉⲣⲟⲥ ϫⲓⲛⲛϣⲟⲣⲡ ⲕⲁⲧⲁⲧϩⲉ ⲛⲧⲁⲓϫⲟⲟⲥ ⲉⲧⲃⲉⲧⲙⲛⲧⲣⲉϥϫⲓⲛϭⲟⲛⲥ ⲙⲡⲛⲁⲩⲕⲗⲏⲣⲟⲥ · ⲁⲩⲱ ⲛⲧⲩⲣⲁⲛⲛⲟⲥ ϩⲓⲧⲛⲧⲙⲛⲧϥⲁⲓⲣⲟⲟⲩϣ ⲙⲡⲛⲟⲩⲧⲉ ⁛—,"Now this woman had, from the very first, been preserved, even as I have already said, through the care of God, from the violence of the captain of the ship (and of other) masters."
ⲉⲓⲥ ⲟⲩⲕⲁⲥⲧⲣⲟⲛ ⲥⲁⲣⲏⲥ ⲙⲙⲟⲛ ⲉϥϣⲏϥ ·,"Behold, there is a certain Camp very far away in the south which is deserted, and there is no man living in it."
ⲁϥⲃⲱⲕ ⲇⲉ ⲉϩⲟⲩⲛ ⲁϥⲙⲟⲩϣⲧ ⲛϩⲓⲉⲣⲓⲭⲱ,He entered and was passing through Jericho.
ⲁⲛⲟⲕ ⲡⲉ ⲡϫⲟⲉⲓⲥ ⲡⲛⲟⲩⲧⲉ ⲡⲁⲓ ⲡⲉ ⲡⲁⲣⲁⲛ ⲛϯⲛⲁϯ ⲙⲡⲁⲉⲟⲟⲩ ⲁⲛ ⲛⲕⲉⲟⲩⲁ ⲁⲩⲱ ⲛⲁⲁⲣⲉⲧⲏ ⲛⲛⲙⲟⲩⲛⲅ ⲛϭⲓϫ,"I am the Lord God: that is my name: I will not give my glory to another, nor my praises to graven images."
ⲛⲧⲉⲣⲟⲩⲉⲓ ⲇⲉ ⲁⲩϩⲉ ⲉⲡⲱⲛⲉ ⲉⲁⲩⲥⲕⲣⲕⲱⲣϥ ⲉⲃⲟⲗ ϩⲙⲡⲉⲙϩⲁⲟⲩ .,They found the stone rolled away from the tomb.
