Coptic,English
ⲛⲧⲉⲣⲉϥⲟⲩⲱⲛ ⲇⲉ ⲛⲧⲙⲉϩϣⲟⲙⲧⲉ ⲛⲥⲫⲣⲁⲅⲓⲥ ⲁⲓⲥⲱⲧⲙ ⲉⲡⲙⲉϩϣⲟⲙⲛⲧ ⲛⲍⲱⲟⲛ ⲉϥϫⲱ ⲙⲙⲟⲥ ϫⲉⲁⲙⲟⲩ . ⲁⲩⲱ ⲉⲓⲥ ⲟⲩϩⲧⲟ ⲛⲕⲁⲙⲏ ⲁⲩⲱ ⲡⲉⲧⲧⲁⲗⲏⲩ ⲉⲣⲟϥ ⲉⲟⲩⲛⲟⲩⲙⲁϣⲉ ϩⲛⲧⲉϥϭⲓϫ .,"When he opened the third seal, I heard the third living creature saying, 'Come and see!' And behold, a black horse, and he who sat on it had a balance in his hand."
ⲉⲩⲙⲟⲕϩ ⲛϩⲏⲧ ⲉⲃⲟⲗ ϫⲉⲛⲉⲩϯⲥⲃⲱ ⲙⲡⲗⲁⲟⲥ . ⲁⲩⲱ ⲛⲉⲩⲧⲁϣⲉⲟⲉⲓϣ ϩⲛⲓⲏⲥⲟⲩⲥ ⲛⲧⲁⲛⲁⲥⲧⲁⲥⲓⲥ ⲛⲛⲉⲧⲙⲟⲟⲩⲧ .,being upset because they taught the people and proclaimed in Jesus the resurrection from the dead.
ⲛⲧⲱⲧⲛ ⲇⲉ ⲛⲁⲙⲉⲣⲁⲧⲉ ⲛⲧⲉⲧⲛⲣ ϣⲣⲡ ⲥⲟⲟⲩⲛ ⲉϩⲁⲣⲉϩ ⲉⲣⲱⲧⲛ ϫⲉⲕⲁⲁⲥ ⲛⲛⲉⲩϫⲓ ⲧⲏⲩⲧⲛ ϩⲛⲧⲉⲩⲡⲗⲁⲛⲏ ⲛⲛⲁⲛⲟⲙⲟⲥ ⲛⲧⲉⲧⲛϩⲉ ⲉⲃⲟⲗ ϩⲙⲡⲉⲧⲉⲛⲧⲁϫⲣⲟ,"You therefore, beloved, knowing these things beforehand, beware, lest being carried away with the error of the wicked, you fall from your own steadfastness."
ⲁⲩⲱ ⲉⲛⲉ ⲙⲡϩⲟⲟⲩ ⲙⲙⲁⲧⲉ ⲡⲉ ⲛⲧⲁⲓϫⲟⲛⲧ ⲉϣⲓⲛⲉ ⲛⲁϥ ⲙⲡⲛⲟⲩⲧⲉ ⲙⲡⲉⲣϭⲱⲛⲧ ⲡⲣⲣⲟ ⲁⲩⲱ ⲙⲡⲉⲣⲧⲣⲉ ⲟⲩϣⲁϫⲉ ⲉⲓ ⲉⲃⲟⲗ ϩⲛⲣⲱϥ ⲙⲡⲣⲣⲟ ⲉϫⲙⲡⲉⲕϩⲙϩⲁⲗ ⲁⲩⲱ ⲡⲏⲓ ⲧⲏⲣϥ ⲙⲡⲁⲉⲓⲱⲧ ϫⲉⲡⲉⲕϩⲙϩⲁⲗ ⲉⲧⲉⲁⲛⲟⲕ ⲡⲉ ⲛϯⲥⲟⲟⲩⲛ ⲁⲛ ⲉϩⲱⲃ ⲛⲉⲓⲙⲓⲛⲉ ⲟⲩⲇⲉ ϫⲓⲛⲟⲩⲕⲟⲩⲓ ⲛϣⲁϫⲉ ϣⲁⲟⲩⲛⲟϭ,"Have I begun to-day to enquire of God for him? By no means: let not the king bring a charge against his servant, and against thee whole of my father's house; for thy servant knew not in all these matters anything great or small."
ⲁⲩⲱ ⲁϥⲉⲓⲣⲉ ⲛϭⲓⲡϭⲙⲡϣⲓⲛⲉ ⲧⲏⲣϥ ⲛⲛϣⲏⲣⲉ ⲙⲡⲓⲥⲣⲁⲏⲗ ⲙⲛⲧⲉⲩϭⲟⲙ ϫⲓⲛϫⲟⲩⲱⲧⲉ ⲛⲣⲟⲙⲡⲉ ⲉⲧⲡⲉ ⲟⲩⲟⲛ ⲛⲓⲙ ⲉⲧⲛⲏⲩ ⲉⲃⲟⲗ ⲉⲥⲣⲙⲗⲁϩ ⲉⲃⲟⲗ ϩⲣⲁⲓ ϩⲙⲡⲓⲥⲣⲁⲏⲗ,"And the whole numbering of the children of Israel with their host from twenty years old and upward, every one that goes out to set himself in battle array in Israel, came to"
ⲧⲉⲧⲛⲁⲛⲁⲩ ⲉⲩⲣⲣⲟ ⲙⲛⲟⲩⲉⲟⲟⲩ ⲁⲩⲱ ⲛⲉⲧⲛⲃⲁⲗ ⲛⲁⲛⲁⲩ ⲉⲩⲕⲁϩ ⲙⲡⲟⲩⲉ,Ye shall see a king with glory: your eyes shall behold a land from afar.
ⲁⲥϣⲱⲡⲉ ⲇⲉ ⲟⲛ ⲛⲟⲩϩⲟⲟⲩ · ⲁⲡⲁϫⲟⲉⲓⲥ ⲛⲉⲓⲱⲧ ⲧⲛⲛⲟⲟⲩⲧ ⲛⲟⲩⲁⲡⲟⲕⲣⲏⲥⲓⲥ · ⲉⲛⲁⲛⲁⲅⲕⲁⲓⲟⲛ ⲉⲙⲙⲉⲣⲟⲥ ⲛϫⲏⲏⲙⲉ ·,"Now it came to pass again on a certain day that my lord and father sent me on a message, which was urgent, to a certain district of Djeme."
ⲁⲩⲱ ϥⲛⲁⲉⲓ ⲛϭⲓⲡϫⲟⲉⲓⲥ ⲡⲁⲛⲟⲩⲧⲉ ⲙⲛⲛⲉⲧⲟⲩⲁⲁⲃ ⲧⲏⲣⲟⲩ ⲛⲙⲙⲁϥ,"And the valley of my mountains shall be closed up, and the valley of the mountains shall be joined on to Jasod, and shall be blocked up as it was blocked up in the days of the earthquake, in the days of Ozias king of Juda; and the Lord my God shall come, and all the saints with him."
ⲁⲩⲱ ⲛⲣⲱⲙⲉ ⲙⲡⲓⲥⲣⲁⲏⲗ ⲁⲩⲛⲁⲩ ϫⲉⲛⲥⲉⲛⲁⲉϣϭⲙϭⲟⲙ ⲁⲛ ⲉⲁϩⲉⲣⲁⲧⲟⲩ ⲉⲣⲟⲟⲩ ⲡⲗⲁⲟⲥ ⲙⲡⲓⲥⲣⲁⲏⲗ ⲁⲩϩⲟⲡⲟⲩ ϩⲛⲙϩⲁⲁⲩ ⲁⲩⲱ ϩⲛⲛⲉⲃⲏⲃ ⲁⲩⲱ ϩⲛⲛⲉϩⲓⲉⲓⲧ ⲙⲛⲛⲉϣⲏⲓ,"And the men of Israel saw that they were in a strait so that they could not draw nigh, and the people hid themselves in caves, and sheepfolds, and rocks, and ditches, and pits."
ⲛⲧⲁϥⲣⲡⲁⲓ ⲇⲉ ⲛϭⲓⲡⲁⲉⲓⲱⲧ ϫⲉⲛⲛϥⲧⲥⲟϥ ⲛⲧⲟϥ ϩⲛⲛⲉϥϭⲓϫ ⲛⲧⲉⲛⲇⲁⲓⲙⲱⲛⲓⲟⲛ ⲉⲓ ⲉⲃⲟⲗ ϩⲛⲟⲩϭⲉⲡⲏ · ⲛⲧⲉⲛⲣⲱⲙⲉ ϣⲟⲩϣⲟⲩ ⲙⲙⲟⲟⲩ ⲉϫⲱϥ ϫⲉⲁⲁⲡⲁ ⲡⲉⲥⲩⲛⲑⲓⲟⲥ ⲛⲉϫⲡⲇⲁⲓⲙⲩⲱⲛⲓⲟⲛ ⲉⲃⲟⲗ ϩⲙⲡϣⲏⲣⲉ ⲛⲛⲓⲙ ⲛⲣⲱⲙⲉ · ⲉⲃⲟⲗ ϫⲉⲛⲉϥⲟⲩⲱϣ ⲁⲛ ⲉϫⲓⲉⲟⲟⲩ ⲉⲃⲟⲗ ϩⲓⲧⲟⲟⲧⲟⲩ ⲛⲛⲣⲱⲙⲉ ·,"Now, my father acted in this way and did not himself give the youth the water to drink with his own hands, and so make the demon come out from him immediately, lest men should ascribe praise to him, and say, Apa Pisentius hath cast the demon out of the son of such and such a man, because he did not wish to receive glorifying from the children of men."
ⲡⲣⲣⲟ ⲇⲉ ⲁϥⲙⲟⲩⲧⲉ,"And the Emperor called him, and asked him why he did not come into the temple of Apollo, (saying), 'Thou must pour out a libation to the gods in return for thy victory, and because thou hast returned from the war, and thou must offer up sacrifices of thanksgiving to them, especially as thou hast found thy wife and thy sons.'"
ⲉⲓⲥ ϩⲏⲏⲧⲉ ⲛⲁⲓ ⲛⲏⲟⲩ ⲙⲡⲟⲩⲉ ⲁⲩⲱ ⲛⲉⲓⲕⲟⲟⲩⲉ ⲉⲃⲟⲗ ϩⲙⲡⲉⲙϩⲓⲧ ⲙⲛⲧⲑⲁⲗⲁⲥⲥⲁ ϩⲉⲛⲕⲟⲟⲩⲉ ⲇⲉ ⲉⲃⲟⲗ ϩⲙⲡⲕⲁϩ ⲛⲛⲡⲉⲣⲥⲟⲥ,"Behold, these shall come from far: and these from the north and the west, and others from the land of the Persians."
ⲉⲧⲉⲡⲁⲓ ⲡⲉ ϫⲉⲛϣⲏⲣⲉ ⲁⲛ ⲛⲧⲥⲁⲣⲝ ⲛⲁⲓ ⲛⲉ ⲛϣⲏⲣⲉ ⲙⲡⲛⲟⲩⲧⲉ . ⲁⲗⲗⲁ ⲛϣⲏⲣⲉ ⲙⲡⲉⲣⲏⲧ ⲛⲉⲧⲟⲩⲛⲁⲟⲡⲟⲩ ⲉⲡⲉⲥⲡⲉⲣⲙⲁ .,"That is, it is not the children of the flesh who are children of God, but the children of the promise are counted as a seed."
ⲡⲗⲏⲛ ϯϫⲱ ⲙⲙⲟⲥ ⲛⲏⲧⲛ . ϫⲉⲟⲩⲛⲟⲩⲙⲧⲟⲛ ⲛⲁϣⲱⲡⲉ ⲛⲧⲩⲣⲟⲥ ⲙⲛⲥⲓⲇⲱⲛ ⲙⲡⲉϩⲟⲟⲩ ⲛⲧⲉⲕⲣⲓⲥⲓⲥ ⲉϩⲟⲩⲉⲉⲣⲱⲧⲛ .,"But I tell you, it will be more tolerable for Tyre and Sidon on the day of judgment than for you."
ⲡⲉϫⲉϩⲟⲓⲛⲉ ⲛⲛⲉⲫⲁⲣⲓⲥⲥⲁⲓⲟⲥ ϫⲉⲉⲧⲃⲉⲟⲩ ⲧⲉⲧⲛⲓⲣⲉ ⲙⲡⲉⲧⲉⲙⲉϣϣⲉ ϩⲙⲡⲥⲁⲃⲃⲁⲧⲟⲛ .,"But some of the Pharisees said to them, 'Why do you do that which is not lawful to do on the Sabbath day?'"
ⲁⲩⲱ ⲛⲛⲁⲕⲱ ⲛⲥⲱⲓ ⲛⲛⲉϥⲟⲩⲉϩⲥⲁϩⲛⲉ ⲁⲓϩⲱⲡ ⲇⲉ ⲛⲛⲉϥϣⲁϫⲉ ϩⲛⲕⲟⲩⲛⲧ .,neither shall I transgress; but I have hid his words in my bosom.
ⲛⲉⲩⲛ ⲟⲩⲁ ⲇⲉ ϣⲱⲛⲉ ϫⲉⲗⲁⲍⲁⲣⲟⲥ ⲉⲃⲟⲗ ϩⲛⲃⲏⲑⲁⲛⲓⲁ ⲡϯⲙⲉ ⲙⲙⲁⲣⲓⲁ ⲛⲙⲙⲁⲣⲑⲁ ⲧⲉⲥⲥⲱⲛⲉ .,"Now a certain man was sick, Lazarus from Bethany, of the village of Mary and her sister, Martha."
ⲉⲧϭⲁⲉⲓⲟ ⲛⲟⲩⲣⲱⲙⲉ ϩⲙⲡⲧⲣⲉⲩϯ ϩⲁⲡ ⲉⲣⲟⲩ ⲉⲙⲡⲉⲡϫⲟⲉⲓⲥ ϫⲟⲟⲥ,"to condemn a man unjustly in his judgment, the Lord has not given commandment."
ⲁⲡϫⲟⲉⲓⲥ ϣⲱⲡⲉ ⲙⲙⲁ ⲙⲡⲱⲧ ⲙⲡϩⲏⲕⲉ ⲛⲃⲟⲏⲑⲟⲥ ϩⲙⲡⲉⲟⲩⲟⲉⲓϣ ⲛⲧⲉⲑⲗⲓⲯⲓⲥ,"The Lord also is become a refuge for the poor, a seasonable help, in affliction."
ⲛⲁⲛⲟⲩ ⲛⲉⲛⲧⲁⲩϣⲟⲟϭⲟⲩ ϩⲛⲧⲥⲏϥⲉ ⲉϩⲟⲩⲉ ⲛⲉⲛⲧⲁⲩϣⲱϭⲉ ϩⲙⲡϩⲉⲃⲱⲱⲛ ϫⲉⲁⲩⲙⲟⲟϣⲉ ⲉⲩϫⲟⲧϩ ϩⲁⲡⲉϩⲕⲟ ⲛⲟⲉⲓⲕ ⲙⲛⲛⲉϩⲣⲏⲩⲉ ⲛⲧⲥⲱϣⲉ,"TETH. The slain with the sword were better than they that were slain with hunger: they have departed, pierced through from want of the fruits of the field."
ⲥⲉⲛⲁⲟⲩⲱϩ ⲅⲁⲣ ⲉⲣⲟⲕ ⲛⲟⲩⲛⲟϭ ⲛⲁϩⲉ ⲙⲛϩⲉⲛⲣⲙⲡⲟⲟⲩⲉ ⲛⲱⲛϩ ⲙⲛⲟⲩⲉⲓⲣⲏⲛⲏ,"for length of existence, and years of life, and peace, shall they add to thee."
ⲁⲩⲱ ⲓⲏⲥⲟⲩⲥ ⲁϥϫⲟⲟⲩ ⲛϩⲉⲛϥⲁⲓϣⲓⲛⲉ ⲛⲥⲱⲟⲩ ⲁⲩⲱ ⲁⲩⲡⲱⲧ ⲉϩⲣⲁⲓ ⲉⲧⲉⲥⲕⲩⲛⲏ ⲉⲧⲡⲉⲣⲉⲙⲃⲟⲗⲏ ⲁⲩⲱ ⲛⲁⲓ ⲉⲩⲗⲏϭ ϩⲛⲧⲉⲥⲕⲩⲛⲏ ⲁⲩⲱ ⲡϩⲁⲧ ⲉⲛⲉϥϩⲁⲣⲟⲟⲩ,"And Joshua sent messengers, and they ran to the tent into the camp; and these things were hidden in his tent, and the silver under them."
ⲁⲕⲥⲟⲟϥ ⲙⲛⲛⲉⲧⲙⲟⲟⲩⲧ ⲁⲩⲟⲡⲕ ⲙⲛⲛⲉⲧⲃⲏⲕ ⲉⲡⲉⲥⲏⲧ ⲉⲁⲙⲛⲧⲉ,That thou art counted with them that go down into the grave?
ⲁϥⲱⲣⲕ ⲉϥϫⲱ ⲙⲙⲟⲥ · ϫⲉϣⲉⲡⲁⲡⲟⲗⲗⲱⲛ,"and he swore an oath, saying, ' By Apollo, the greatest of the gods, I will deliver thee over to the Emperor (so that) He may destroy thee."
ⲁϥⲃⲱⲕ ⲇⲉ ⲉϩⲟⲩⲛ ⲛϭⲓⲙⲱⲩⲥⲏⲥ ⲁϥϫⲱ ⲛⲛⲁϩⲣⲙⲡⲗⲁⲟⲥ ⲛⲛϣⲁϫⲉ ⲧⲏⲣⲟⲩ ⲙⲡⲛⲟⲩⲧⲉ ⲙⲛⲛⲉϥⲇⲓⲕⲁⲓⲱⲙⲁ ⲁϥⲟⲩⲱϣⲃ ⲇⲉ ⲛϭⲓⲡⲗⲁⲟⲥ ⲧⲏⲣϥ ϩⲛⲟⲩⲥⲙⲏ ⲛⲟⲩⲱⲧ ⲉⲩϫⲱ ⲙⲙⲟⲥ ϫⲉⲛϣⲁϫⲉ ⲧⲏⲣⲟⲩ ⲉⲛⲧⲁⲡϫⲟⲉⲓⲥ ϫⲟⲟⲩ ⲧⲛⲛⲁⲁⲩ ⲁⲩⲱ ⲛⲧⲛⲥⲱⲧⲙ ⲉⲣⲟⲟⲩ,"And Moses went in and related to the people all the words of God and the ordinances; and all the people answered with one voice, saying, All the words which the Lord has spoken, we will do and be obedient."
ⲛⲥⲉⲣⲡⲙⲉⲉⲩⲉ ⲛⲛⲁⲛⲟⲙⲓⲁ ⲛⲛⲉϥⲉⲓⲟⲧⲉ ⲙⲡⲉⲙⲧⲟ ⲉⲃⲟⲗ ⲙⲡϫⲟⲉⲓⲥ ⲛⲥⲉⲧⲙϥⲱⲧⲉ ⲉⲃⲟⲗ ⲙⲡⲛⲟⲃⲉ ⲛⲧⲉϥⲙⲁⲁⲩ,Let the iniquity of his fathers be remembered before the Lord; and let not the sin of his mother be blotted out.
ⲛⲉⲧⲉⲙⲡⲟⲩⲟⲩⲱϣ ⲉⲥⲱⲧⲙ ⲛⲥⲁⲛⲁϣⲁϫⲉ ⲁⲗⲗⲁ ⲁⲩⲃⲱⲕ ⲁⲩⲟⲩⲁϩⲟⲩ ⲛⲥⲁϩⲙⲛⲛⲟⲩⲧⲉ ⲛϣⲙⲙⲟ ⲉⲧⲣⲉⲩⲣ ϩⲙϩⲁⲗ ⲛⲁⲩ ⲁⲩⲱ ⲛⲥⲉⲟⲩⲱϣⲧ ⲛⲁⲩ ⲉⲩϣⲱⲡⲉ ⲛⲧϩⲉ ⲙⲡⲉⲓⲡⲉⲣⲓⲍⲱⲙⲁ ⲡⲁⲓ ⲉⲧⲉⲛϥⲛⲁⲣ ϣⲁⲩⲁⲛ ϭⲉ ⲉⲗⲁⲁⲩ,"even this great pride of the men that will not hearken to my words, and have gone after strange gods, to serve them, and to worship them: and they shall be as this girdle, which can be used for nothing."
ⲁⲩⲱ ⲡⲉϫⲁⲩ ⲛⲛⲉⲩⲉⲣⲏⲩ ϫⲉⲁⲙⲏⲓⲧⲛ ⲛⲧⲛϣⲟϫⲛⲉ ⲛⲟⲩⲙⲟⲕⲙⲉⲕ ⲉⲓⲉⲣⲏⲙⲓⲁⲥ ϫⲉⲛϥⲛⲁⲧⲁⲕⲟ ⲁⲛ ⲛϭⲓⲡⲛⲟⲙⲟⲥ ⲉⲃⲟⲗ ϩⲓⲧⲙⲡⲟⲩⲏⲏⲃ ⲁⲩⲱ ⲟⲩϣⲟϫⲛⲉ ⲉⲃⲟⲗ ϩⲓⲧⲛⲟⲩⲥⲁⲃⲉ ⲁⲩⲱ ⲟⲩϣⲁϫⲉ ⲉⲃⲟⲗ ϩⲓⲧⲛⲟⲩⲡⲣⲟⲫⲏⲧⲏⲥ ⲁⲙⲏⲓⲧⲛ ⲛⲧⲛϫⲓ ⲕⲣⲟϥ ⲙⲙⲟϥ ϩⲛⲟⲩϣⲁϫⲉ ⲛⲧⲛⲥⲱⲧⲙ ⲉⲛⲉϥϣⲁϫⲉ ⲧⲏⲣⲟⲩ,"Then they said, Come, and let us devise a device against Jeremias; for the law shall not perish from the priest, nor counsel from the wise, nor the word from the prophet. Come, and let us smite him with the tongue, and we will hear all his words."
ⲧⲟⲧⲉ ⲁϥϫⲱ ⲛϭⲓⲙⲱⲩⲥⲏⲥ ⲛⲧⲟϥ ⲙⲛⲛϣⲏⲣⲉ ⲙⲡⲓⲥⲣⲁⲏⲗ ⲛⲧⲉⲓϩⲱⲇⲏ ⲙⲡⲛⲟⲩⲧⲉ ⲁⲩⲱ ⲡⲉϫⲁⲩ ϫⲉⲁϫⲓⲥ ϫⲉⲙⲁⲣⲛⲥⲙⲟⲩ ⲉⲡⲛⲟⲩⲧⲉ ϩⲛⲟⲩⲉⲟⲟⲩ ⲅⲁⲣ ⲁϥϫⲓⲉⲟⲟⲩ ⲟⲩϩⲧⲟ ⲙⲛⲡⲉⲧⲧⲁⲗⲉ ⲉϫⲱϥ ⲁϥⲛⲟϫϥ ⲉϩⲣⲁⲓ ⲉⲑⲁⲗⲁⲥⲥⲁ,"Then sang Moses and the children of Israel this song to God, and spoke, saying, Let us sing to the Lord, for he is very greatly glorified: horse and rider he has thrown into the sea."
ⲥⲉⲛⲁϫⲓ ⲛϩⲉⲛⲡⲁⲣⲑⲉⲛⲟⲥ ⲙⲡⲣⲣⲟ ϩⲓⲡⲁϩⲟⲩ ⲙⲙⲟⲥ ⲥⲉⲛⲁⲉⲓⲛⲉ ⲛⲁⲕ ⲛⲛⲉⲧϩⲓⲧⲟⲩⲱⲥ,in embroidered clothing: virgins shall be brought to the king after her: her fellows shall be brought to thee.
ⲁⲛⲟⲛ ⲇⲉ ⲛⲉⲥⲛⲏⲩ ⲉⲁⲛⲣⲡⲉⲧⲛⲃⲟⲗ ⲡⲣⲟⲥⲡⲟⲩⲟⲉⲓϣ ⲛⲛⲁⲟⲩⲟⲩⲛⲟⲩ ϩⲙⲡϩⲟ ϩⲙⲡϩⲏⲧ ⲁⲛ . ⲁⲛϭⲉⲡⲏ ⲛϩⲟⲩⲟ ⲉⲛⲁⲩ ⲉⲛⲉⲧⲛϩⲟ ϩⲛⲟⲩⲛⲟϭ ⲛⲟⲩⲱϣ,"But we, brothers, being bereaved of you for a short season, in presence, not in heart, tried even harder to see your face with great desire,"
ⲁⲩⲣⲱⲕϩ ⲙⲡⲉⲕⲡⲉⲧⲟⲩⲁⲁⲃ ϩⲛⲟⲩⲕⲱϩⲧ ⲁⲩⲧⲁⲟⲩⲟ ⲉⲡⲉⲥⲏⲧ ⲙⲡⲙⲁ ⲛϣⲱⲡⲉ ⲙⲡⲉⲕⲣⲁⲛ,They have burnt thy sanctuary with fire to the ground; they have profaned the habitation of thy name.
ⲙⲡⲣⲧⲣⲉⲗⲁⲁⲩ ϭⲉ ⲟⲩⲛ ⲛⲣⲱⲙⲉ ⲣⲁⲡⲓⲥⲧⲟⲥ,"Therefore let no man allow himself to be unbelieving concerning this matter which I have related unto him concerning the holy man Apa Pisentius the bishop, for he was worthy to see Elijah the Tishbite."
ⲉⲧⲃⲉⲡⲁⲓ ⲉⲓⲥ ϩⲏⲏⲧⲉ ⲁⲛⲟⲕ ϯϣⲟⲟⲡ ⲟⲩⲃⲉ ⲛⲉⲡⲣⲟⲫⲏⲧⲏⲥ ⲡⲉϫⲉⲡϫⲟⲉⲓⲥ …,"Behold, I am therefore against the prophets, saith the Lord God, that steal my words every one from his neighbour."
ⲙⲡⲣⲥⲱⲧⲙ ⲛⲥⲁⲛⲇⲁⲓⲙⲟⲛⲓⲟⲛ ⲛⲅⲣⲙⲙⲉⲗⲟⲥ ⲙⲡⲉⲭⲣⲓⲥⲧⲟⲥ ⲙⲙⲉⲗⲟⲥ ⲙⲡⲟⲣⲛⲏ ·,"Do not hearken to the devils, and make the member of the Christ into the member of a whore."
ϫⲱ ⲛⲛⲁⲓ ⲁⲩⲱ ⲛⲅⲡⲁⲣⲁⲕⲁⲗⲉⲓ ⲛⲅϫⲡⲓⲟ ϩⲛⲟⲩⲉϩⲥⲁϩⲛⲉ ⲛⲓⲙ . ⲙⲡⲣⲧⲣⲉⲗⲁⲁⲩ ⲕⲁⲧⲁⲫⲣⲟⲛⲉⲓ ⲙⲙⲟⲕ .,Say these things and exhort and reprove with all authority. Let no man despise you.
ⲥⲁⲙⲟⲩⲏⲗ ⲇⲉ ⲁϥϫⲓⲥⲉ ⲁⲩⲱ ⲡϫⲟⲉⲓⲥ ⲛⲉϥϣⲟⲟⲡ ⲛⲙⲙⲁϥ ⲉⲙⲡⲉ ⲗⲁⲁⲩ ϩⲛⲛⲉϥϣⲁϫⲉ ⲧⲏⲣⲟⲩ ϩⲉ ⲉⲃⲟⲗ ϩⲓϫⲙⲡⲕⲁϩ,"And Samuel grew, and the Lord was with him, and there did not fall one of his words to the ground."
ϩⲛⲟⲩⲧⲁⲕⲟ ⲉⲧⲉⲧⲛⲉⲧⲁⲕⲟ ⲛⲛⲉⲩⲙⲁ ⲧⲏⲣⲟⲩ ⲉⲛⲧⲁⲩϣⲙϣⲉ ⲛϩⲏⲧⲟⲩ ⲛⲛⲉⲩⲛⲟⲩⲧⲉ ⲛϭⲓⲛϩⲉⲑⲛⲟⲥ ⲛⲁⲓ ⲛⲧⲱⲧⲛ ⲉⲧⲉⲧⲛⲛⲁⲕⲗⲏⲣⲟⲛⲟⲙⲉⲓ ⲙⲙⲟⲟⲩ ⲉϣⲁⲩⲧⲁⲗⲉ ⲑⲩⲥⲓⲁ ⲉϩⲣⲁⲓ ⲉϫⲛⲛⲧⲟⲩⲉⲓⲏ ⲉⲧϫⲟⲥⲉ ⲁⲩⲱ ϩⲓϫⲛⲛⲉⲕⲣⲣⲱⲟⲩ ⲛⲧⲉⲑⲁⲗⲁⲥⲥⲁ ⲁⲩⲱ ϩⲁⲣⲟⲟⲩ ⲛⲛϣⲏⲛ ⲉⲧⲟ ⲛϩⲁⲓⲃⲉⲥ,"Ye shall utterly destroy all the places in which they served their gods, whose land ye inherit, on the high mountains and on the hills, and under the thick tree."
ⲛⲧⲉⲣⲉϥⲡⲟⲟⲛⲉϥ ⲇⲉ ⲉⲃⲟⲗ ϩⲙⲡⲙⲟⲉⲓⲧ ⲛⲣⲱⲙⲉ ⲇⲉ ⲧⲏⲣⲟⲩ ⲙⲡⲓⲥⲣⲁⲏⲗ ⲁⲩⲡⲁⲣⲁⲅⲉ ⲉⲩⲟⲩⲏϩ ⲛⲥⲁⲓⲱⲁⲃ ⲉⲡⲱⲧ ⲛⲥⲁⲥⲁⲃⲉⲉ ⲡϣⲏⲣⲉ ⲛⲃⲟⲭⲟⲣⲓ,"And when he was quickly removed from the road, every man of Israel passed after Joab to pursue after Sabee the son of Bochori."
ⲁⲗⲗⲁ ⲉⲣⲉⲡϫⲟⲉⲓⲥ ⲛⲁϣⲁϫⲉ ⲛⲙⲙⲁⲕ ⲛⲁϣⲛϩⲉ .,"But oh that the Lord would speak to thee, and open his lips to thee!"
ⲁⲓⲛⲟⲩϭⲥ ⲉϫⲛⲡⲁⲗⲁⲟⲥ ⲁⲥⲱⲱϥ ⲛⲧⲁⲕⲗⲏⲣⲟⲛⲟⲙⲓⲁ ⲁⲛⲟⲕ ⲁⲓϯ ⲛⲧⲁⲕⲗⲏⲣⲟⲛⲟⲙⲓⲁ ⲉⲧⲟⲩϭⲓϫ ⲛⲧⲟ ⲇⲉ ⲙⲡⲉϯ ⲗⲁⲁⲩ ⲛⲁⲩ ⲛⲛⲁⲁϩⲣⲟϣ ⲙⲡⲛⲁϩⲃⲉϥ ⲙⲡϩⲗⲗⲟ ⲉⲙⲁⲧⲉ,"I have been provoked with my people; thou hast defiled mine inheritance: I gave them into thy hand, but thou didst not extend mercy to them: thou madest the yoke of the aged man very heavy,"
ⲟⲩⲛⲡⲉⲧⲉⲛϥⲣⲛⲟⲃⲉ ⲁⲛ ⲉⲧⲃⲉⲧⲉϥⲙⲛⲧϩⲏⲕⲉ,"There is that is hindered from sinning through want: and when he taketh rest, he shall not be troubled."
ⲙⲡⲣϣⲟϫⲛⲉ ⲙⲛⲟⲩⲥⲟϭ ⲙⲛϣϭⲟⲙ ⲙⲙⲟⲟⲩ ⲉⲁⲙⲁϩⲧⲉ ⲛⲛϣⲁϫⲉ,Consult not with a fool; for he cannot keep counsel.
ⲉⲧⲉⲧⲛⲁϣⲱⲡ ⲛⲧⲟⲟⲧⲟⲩ ⲛⲛⲉⲧⲉⲧⲛⲁⲟⲩⲟⲙⲟⲩ ⲉⲟⲩⲱⲙ ⲁⲩⲱ ⲛⲧⲉⲧⲛϫⲓ ⲛⲧⲟⲟⲧⲟⲩ ⲛⲟⲩⲙⲟⲟⲩ ϩⲛⲟⲩϣⲓ ϩⲁϩⲟⲙⲧ ⲛⲧⲉⲧⲛⲥⲟⲟϥ,"Buy food of them for money and eat, and ye shall receive water of them by measure for money, and drink."
ⲁⲩⲱ ⲡⲣⲣⲟ ⲁϥϫⲓⲟⲟⲣ ⲉⲅⲁⲗⲅⲁⲗⲁ ⲭⲁⲙⲁⲁⲙ ⲇⲉ ⲁϥϫⲓⲟⲟⲣ ⲛⲙⲙⲁϥ ⲁⲩⲱ ⲡⲗⲁⲟⲥ ⲧⲏⲣϥ ⲛⲓⲟⲩⲇⲁ ⲁⲩϫⲓⲟⲟⲣ ⲙⲛⲡⲣⲣⲟ ⲁⲩⲱ ⲧⲡⲁϣⲉ ⲙⲡⲗⲁⲟⲥ ⲙⲡⲓⲥⲣⲁⲏⲗ,"And the king went over to Galgala, and Chamaam went over with him: and all the men of Juda went over with the king, and also half the people of Israel."
ⲭⲱⲣⲓⲥ ⲛⲉⲧϩⲓⲃⲟⲗ ⲛⲉⲧⲛⲏⲩ ⲉϫⲱⲓ ⲙⲙⲏⲛⲉ ⲛⲣⲟⲟⲩϣ ⲛⲛⲉⲕⲕⲗⲏⲥⲓⲁ ⲧⲏⲣⲟⲩ .,"Besides those things that are outside, there is that which presses on me daily, anxiety for all the assemblies."
ⲥⲉⲛⲁⲗⲱϫϩ ⲙⲡⲕⲁϩ ⲛⲧϩⲉ ⲛⲛϩⲟϥ ⲉⲩⲥⲱϣ ϩⲓⲡⲉⲥⲏⲧ ⲥⲉⲛⲁⲥⲱⲟⲩϩ ⲉϩⲟⲩⲛ ⲉⲟⲣⲃⲟⲩ ⲉϩⲟⲩⲛ ⲥⲉⲛⲁⲣϣⲡⲏⲣⲉ ⲇⲉ ⲟⲛ ⲉϫⲙⲡϫⲟⲉⲓⲥ ⲡⲉⲛⲛⲟⲩⲧⲉ ⲛⲥⲉⲣϩⲟⲧⲉ ϩⲁⲧⲉϥϩⲏ,"They shall lick the dust as serpents crawling on the earth, they shall be confounded in their holes; they shall be amazed at the Lord our God, and will be afraid of thee."
ⲙⲡⲣⲟⲇⲟⲧⲏⲥ . ⲉⲩⲁⲥⲱⲟⲩ ⲛϫⲁⲥⲓϩⲏⲧ . ⲉⲩⲟ ⲙⲙⲁⲓ ϩⲏⲇⲟⲛⲏ ⲉϩⲟⲩⲉ ⲙⲉⲣⲉ ⲡⲛⲟⲩⲧⲉ .,"traitors, headstrong, conceited, lovers of pleasure rather than lovers of God;"
ⲁⲥϭⲱ ⲉⲥⲣⲓⲙⲉ ⲉϩⲟⲩⲛ ⲉϩⲣⲁϥ ⲙⲡⲥⲁϣϥ ⲛϩⲟⲟⲩ ⲉⲣⲉⲡϩⲟⲟⲡ ϣⲟⲟⲡ ⲛϩⲏⲧⲟⲩ ⲁⲩⲱ ⲁⲥϣⲱⲡⲉ ϩⲙⲡⲉⲥⲙⲉϩⲥⲁϣϥ ⲛϩⲟⲟⲩ ⲁϥⲧⲁⲩⲟϥ ⲉⲣⲟⲥ ⲉⲃⲟⲗ ϫⲉⲁⲥϭⲱ ⲉⲥⲉⲛⲱⲭⲗⲉⲓ ⲛⲁϥ ⲛⲧⲟⲥ ϩⲱⲱⲥ ⲁⲥϫⲟⲟϥ ⲉⲛϣⲏⲣⲉ ⲙⲡⲉⲥⲗⲁⲟⲥ,"And she wept before him the seven days, during which their banquet lasted: and it came to pass on the seventh day, that he told her, because she troubled him; and she told it to the children of her people."
ⲁⲓⲕⲁϩⲧⲏⲓ ⲉⲣⲟⲕ ⲡϫⲟⲉⲓⲥ ⲙⲡⲣⲧⲣⲁϫⲓϣⲓⲡⲉ ϣⲁⲉⲛⲉϩ ⲛⲁϩⲙⲉⲧ ⲛⲅⲧⲟⲩϫⲟⲓ ϩⲛⲧⲉⲕⲇⲓⲕⲁⲓⲟⲥⲩⲛⲏ,"O Lord, I have hoped in thee; let me never be ashamed: deliver me in thy righteousness and rescue me."
ⲁϥⲣⲓⲙⲉ ϩⲛⲟⲩⲛⲟϭ ⲛⲣⲓⲙⲉ ⲉⲛⲁϣⲱϥ ·, and he wept bitterly and shed many tears.
ⲉⲁⲛⲉⲓⲙⲉ ϭⲉ ⲉⲛⲁⲓ ⲧⲏⲣⲟⲩ · ⲙⲁⲣⲛⲃⲟⲏⲑⲉⲓ ⲉⲣⲟⲛ ⲙⲙⲓⲛⲙⲙⲟⲛ ·,"Since, therefore, we know all these things, let us help ourselves."
ⲁϥⲕⲱϩ ⲉⲛⲉⲭⲁⲛⲁⲛⲁⲓⲟⲥ ϩⲛⲟⲩⲡⲟⲣⲛⲉⲓⲁ ⲁⲩⲡⲟⲣⲛⲉⲩⲉ ⲉⲧⲃⲏⲏⲧⲁⲩⲙⲉⲣⲉⲡⲥⲱϣ ⲉⲃⲟⲗ ϩⲙⲡⲉϥϣⲟⲩϣⲟⲩ,He has chosen the Chananites: they have grievously gone a-whoring: they have loved dishonour through her insolence.
ϩⲟⲧⲁⲛ ⲇⲉ ⲉϥϣⲁⲛⲉⲓ ⲛϭⲓⲡⲡⲁⲣⲁⲕⲗⲏⲧⲟⲥ ⲡⲉⲡⲛⲉⲩⲙⲁ ⲉⲧⲟⲩⲁⲁⲃ ⲡⲉⲧⲉⲣⲉ ⲡⲉⲓⲱⲧ ⲛⲁⲧⲛⲛⲟⲟⲩϥ ϩⲙⲡⲁⲣⲁⲛ ⲡⲉⲧⲙⲙⲁⲩ ⲛⲁⲧⲥⲁⲃⲉ ⲧⲏⲩⲧⲛ ⲉϩⲱⲃ ⲛⲓⲙ ⲁⲩⲱ ⲛϥⲧⲣⲉⲧⲛⲣⲡⲙⲉⲉⲩⲉ ⲛϣⲁϫⲉ ⲛⲓⲙ ⲉⲛⲧⲁⲓϫⲟⲟⲩ ⲛⲏⲧⲛ .,"But the Counselor, the Holy Spirit, whom the Father will send in my name, he will teach you all things, and will remind you of all that I said to you."
ⲛⲧⲉⲩⲛⲟⲩ ⲉⲓⲥ ⲛ... ⲉⲃⲟⲗ ϩⲛⲧⲡⲉ ⲁⲩⲟⲩⲱⲙ ϩⲛⲧⲉⲛⲙⲏⲧⲉ ⲉⲩⲥⲟⲩⲗⲱⲗ ⲉϩⲉⲛⲙⲁⲡⲡⲁ ⲛϣⲉⲉⲛⲥ,...
ⲉⲓⲉ ⲉⲣⲉⲧⲉⲕϩⲟⲧⲉ ϣⲟⲟⲡ ⲁⲛ ϩⲛⲟⲩⲙⲛⲧⲁⲧϩⲏⲧ ⲁⲩⲱ ⲧⲉⲕϩⲉⲗⲡⲓⲥ ⲙⲛⲧⲕⲁⲕⲓⲁ ⲛⲧⲉⲕϩⲓⲏ .,"Is not thy fear founded in folly, thy hope also, and the mischief of thy way?"
ⲉⲧⲉⲧⲛϣⲁⲛⲃⲱⲕ ϭⲉ ⲉϩⲟⲩⲛ ⲉⲧⲃⲁⲃⲩⲗⲱⲛ ⲧⲉⲧⲛⲛⲁⲉⲓⲣⲉ ⲛϩⲉⲛⲣⲟⲙⲡⲉ ⲉⲛⲁϣⲱⲟⲩ ϩⲙⲡⲙⲁ ⲉⲧⲙⲙⲁⲩ ⲙⲛⲟⲩⲛⲟϭ ⲛⲟⲩⲟⲉⲓϣ ϣⲁϩⲣⲁⲓ ⲉⲥⲁϣϥ ⲛϫⲱⲙ ⲙⲛⲛⲥⲁⲛⲁⲓ ⲇⲉ ϯⲛⲁⲛ ⲧⲏⲩⲧⲛ ⲉⲟⲃⲗ ϩⲙⲡⲙⲁ ⲉⲧⲙⲙⲁⲩ ϩⲛⲟⲩⲉⲓⲣⲏⲛⲏ,"So when ye be come unto Babylon, ye shall remain there many years, and for a long season, namely, seven generations: and after that I will bring you away peaceably from thence."
ⲡⲁⲓ ⲉⲛⲧⲁⲕⲥⲃⲧⲱⲧϥ ⲙⲡⲉⲕⲧⲟ ⲉⲃⲟⲗ ⲛⲛⲗⲁⲟⲥ ⲧⲏⲣⲟⲩ,which you have prepared before the face of all peoples;
ⲟⲩϩⲱⲃ ⲛⲟⲩⲱⲧ ⲡⲉⲛⲧⲁⲓⲁⲓⲧⲉⲓ ⲙⲙⲟϥ ⲛⲧⲙ ⲡϫⲟⲉⲓⲥ ⲡⲁⲓ ⲡⲉⲧⲓϣⲓⲛⲉ ⲛⲥⲱϥ ⲉⲧⲣⲁⲟⲩⲱϩ ϩⲙⲡⲏⲓ ⲙⲡϫⲟⲉⲓⲥ ⲛⲛⲉϩⲟⲟⲩ ⲧⲏⲣⲟⲩ ⲙⲡⲁⲱⲛϩ ⲉⲧⲣⲁⲛⲁⲩ ⲉⲡⲟⲩⲛⲟϥ ⲙⲡϫⲟⲉⲓⲥ ⲉϭⲙⲡϣⲓⲛⲉ ⲙⲡⲉϥⲗⲁⲟⲥ,"One thing have I asked of the Lord, this will I earnestly seek: that I should dwell in the house of the Lord, all the days of my life, that I should behold the fair beauty of the Lord, and survey his temple."
ⲁⲍⲁⲏⲗ ⲇⲉ ⲁϥⲡⲱⲧ ⲛⲥⲁⲁⲃⲉⲛⲛⲏⲣ ⲙⲡⲉϥⲁⲗⲉϥ ⲉⲃⲟⲗ ⲙⲙⲟϥ ⲉⲃⲱⲕ ⲉⲟⲩⲛⲁⲛ ⲏ ⲉϩⲃⲟⲩⲣ ⲉϥⲡⲏⲧ ϩⲓⲛⲁⲓ ⲛⲥⲁⲁⲃⲉⲛⲛⲏⲣ,"And Asael followed after Abenner, and turned not to go to the right hand or to the left from following Abenner."
ⲉⲙⲡⲟⲩϫⲟⲟⲥ ϩⲙⲡⲉⲩϩⲏⲧ ϫⲉⲙⲁⲣⲛⲣ ϩⲟⲧⲉ ϭⲉ ϩⲁⲧϩⲏ ⲙⲡϫⲟⲉⲓⲥ ⲡⲉⲛⲛⲟⲩⲧⲉ ⲡⲉⲧϯ ⲛⲁⲛ ⲛⲟⲩϩⲱⲟⲩ ⲛϣⲟⲣⲡ ⲁⲩⲱ ⲛϩⲁⲉ …,"and they have not said in their heart, Let us fear now the Lord our God, who gives us the early and latter rain, according to the season of the fulfillment of the ordinance of harvest, and has preserved it for us."
ⲁⲛⲟⲕ ⲛⲙⲡⲁⲉⲓⲱⲧ ⲁⲛⲟⲛ ⲟⲩⲁ .,I and the Father are one.'
ⲁⲩⲱ ⲁⲩⲡⲛⲁ ⲉⲓ ⲉϩⲣⲁⲓ ⲉϫⲱⲓ ⲁϥⲧⲁϩⲟⲓ ⲉⲣⲁⲧⲉϫⲛⲛⲁⲟⲩⲉⲣⲏⲧⲉ ⲁⲩⲱ ⲁϥϣⲁϫⲉ ⲛⲙⲙⲁⲓ ⲉϥϫⲱ ⲙⲙⲟⲥ ϫⲉⲃⲱⲕ ⲉϩⲟⲩⲛ ⲉⲧⲙⲏⲧⲉ ⲙⲡⲉⲕⲏⲓ ⲛⲅϣⲧⲁⲙ ⲉⲣⲁⲕ,"Then the Spirit came upon me, and set me on my feet, and spoke to me, and said to me, Go in, and shut thyself up in the midst of thine house."
ⲁⲩⲱ ⲅⲉⲇⲉⲱⲛ ⲁϥⲉⲓⲙⲉ ϫⲉⲟⲩⲁⲅⲅⲉⲗⲟⲥ ⲛⲧⲉⲡϫⲟⲉⲓⲥ ⲡⲉ ⲡⲁⲓ ⲡⲉϫⲉⲅⲉⲇⲉⲱⲛ ϫⲉⲟⲩⲟⲉⲓ ⲛⲁⲓ ⲡϫⲟⲉⲓⲥ ⲡⲛⲟⲩⲧⲉ ⲉⲃⲟⲗϫⲉ ⲁⲓⲛⲁⲩ ⲉⲡⲁⲅⲅⲉⲗⲟⲥ ⲙⲡϫⲟⲉⲓⲥ ⲛϩⲟ ϩⲓϩⲟ,"And Gedeon saw that he was an angel of the Lord; and Gedeon said, Ah, ah, Lord my God! for I have seen the angel of the Lord face to face."
ϩⲁⲧϩⲏ ⲛϩⲱⲃ ⲛⲓⲙ ⲉⲟⲩⲛⲧⲏⲧⲛ ⲙⲙⲁⲩ ⲛⲧⲁⲅⲁⲡⲏ ⲉϩⲟⲩⲛ ⲉⲛⲉⲧⲛⲉⲣⲏⲩ ⲁϫⲛⲱϫⲛ ϫⲉϣⲁⲣⲉⲧⲁⲅⲁⲡⲏ ϩⲱⲃⲥ ⲉⲃⲟⲗ ⲉϫⲛⲟⲩⲙⲏⲏϣⲉ ⲛⲛⲟⲃⲉ,"And above all things be earnest in your love among yourselves, for love covers a multitude of sins."
ⲛⲧⲉⲣⲉϥⲕⲱ ⲇⲉ ⲉⲃⲟⲗ ⲛⲙⲙⲏⲏϣⲉ ⲁϥⲁⲗⲉ ⲉϩⲣⲁⲓ ⲉϫⲙⲡⲧⲟⲟⲩ ⲙⲁⲩⲁⲁϥ ⲁϥϣⲗⲏⲗ . ⲣⲟⲩϩⲉ ⲇⲉ ⲛⲧⲉⲣⲉϥϣⲱⲡⲉ ⲛⲉϥϩⲙⲡⲙⲁ ⲉⲧⲙⲙⲁⲩ ⲙⲁⲩⲁⲁϥ .,"After he had sent the multitudes away, he went up into the mountain by himself to pray. When evening had come, he was there alone."
ⲉⲡⲉⲓⲇⲏ ⲛⲉⲧⲟⲩⲁⲁⲃ ⲧⲏⲣⲟⲩ ⲡⲏⲧ ⲉⲃⲟⲗ ⲙⲡⲉⲟⲟⲩ ⲙⲡⲉⲓⲕⲟⲥⲙⲟⲥ · ⲧⲁⲓ ϩⲱⲱϥ ⲧⲉ ⲧϩⲉ ⲙⲡⲉⲛⲉⲓⲱⲧ ⲉⲧⲧⲁⲓⲏⲩ ⲁⲡⲁ ⲡⲉⲥⲩⲛⲑⲓⲟⲥ ⲡⲁⲓ ⲛⲧⲁⲡⲛⲟⲩⲧⲉ ⲟⲩⲟⲛϩϥ ⲛⲁⲛ ⲉⲃⲟⲗ ϩⲛⲛⲉⲛϩⲟⲟⲩ,"For all the saints have fled from the glory (or, adulation) of this world, and this did also our glorious father, Apa Pisentius, whom God hath made manifest to us in our own days."
ⲓⲟⲩⲇⲁⲥ ⲇⲉ ⲁϥϫⲡⲟ ⲙⲫⲁⲣⲉⲥ ⲙⲛⲍⲁⲣⲁ ⲉⲃⲟⲗ ϩⲛⲑⲁⲙⲁⲣ ⲫⲁⲣⲉⲥ ⲇⲉ ⲁϥϫⲡⲟ ⲛⲉⲥⲣⲱⲙ . ⲉⲥⲣⲱⲙ ⲇⲉ ⲁϥϫⲡⲟ ⲛⲁⲣⲁⲙ .,Judah became the father of Perez and Zerah by Tamar. Perez became the father of Hezron. Hezron became the father of Ram.
