Coptic,English
ⲁϥⲟⲩⲱϣⲃ ⲛϭⲓⲓⲏⲥⲟⲩⲥ ⲡⲉϫⲁϥ ⲛⲁⲩ ϫⲉⲁⲛⲟⲕ ϩⲱ ϯⲛⲁϫⲛⲉⲧⲏⲩⲧⲛ ⲉⲩϣⲁϫⲉ ⲛⲟⲩⲱⲧ . ⲡⲁⲓ ⲉⲧⲉⲧⲛϣⲁⲛϫⲟⲟϥ ⲛⲁⲓ . ⲁⲛⲟⲕ ϩⲱ ϯⲛⲁϫⲟⲟⲥ ⲛⲏⲧⲛ ϫⲉⲉⲓⲉⲓⲣⲉ ⲛⲛⲁⲓ ϩⲛⲁϣ ⲛⲉⲝⲟⲩⲥⲓⲁ .,"Jesus answered them, 'I also will ask you one question, which if you tell me, I likewise will tell you by what authority I do these things."
ⲉⲓⲥ ϩⲏⲏⲧⲉ ⲡⲛⲟⲩⲧⲉ ⲡⲁⲥⲱⲣ ⲡⲉ ⲡϫⲟⲉⲓⲥ ϯⲙⲁϣⲱⲡⲉ ⲉⲓⲛⲁϩⲧⲉ ⲉⲣⲟϥ ⲁⲩⲱ ϯⲛⲁⲟⲩϫⲁⲓ ⲉⲃⲟⲗ ϩⲓⲧⲟⲟⲧϥ ⲛϯⲛⲁⲣ ϩⲟⲧⲉ ⲁⲛ ϫⲉⲡⲁⲉⲟⲟⲩ ⲙⲛⲡⲁⲥⲙⲟⲩ ⲡⲉ ⲡϫⲟⲉⲓⲥ ⲁϥϣⲱⲡⲉ ⲛⲁⲓ ⲛⲥⲱⲣ,"Behold, my God is my Saviour; I will trust in him, and not be afraid: for the Lord is my glory and my praise, and is become my salvation."
ⲁⲙⲏⲓⲧⲛ ⲛⲧⲛⲟⲩⲱϣⲧ ⲛⲧⲛⲡⲁϩⲧⲛ ⲛⲁϥ ⲛⲧⲛⲣⲓⲙⲉ ⲙⲡⲉⲙⲧⲟ ⲉⲃⲟⲗ ⲙⲡϫⲟⲉⲓⲥ ⲡⲉⲛⲧⲁϥⲧⲁⲙⲓⲟⲛ,"Come, let us worship and fall down before him; and weep before the Lord that made us."
ⲥⲁⲟⲩⲗ ⲇⲉ ⲁϥϫⲟⲟⲩ ⲛϩⲉⲛⲃⲁⲓϣⲓⲛⲉ ⲛⲥⲁⲇⲁⲩⲉⲓⲇ ⲉϥϫⲱ ⲙⲙⲟⲥ ⲛⲁⲩ ϫⲉⲧⲁⲗⲟϥ ⲉϫⲉⲙ ⲡⲉⲓϭⲗⲟϭ ⲛⲧⲉⲧⲛⲛⲧϥ ⲛⲁⲓ ϫⲉⲉⲓⲉⲙⲟⲟⲩⲧϥ,"And he sends to David, saying, Bring him to me on the bed, that I may slay him."
ⲧⲱⲕ ϭⲉ ⲛϩⲏⲧ ⲛⲁϣⲏⲣⲉ ⲛⲧⲉⲧⲛⲁϣϣⲕⲁⲕ ⲉϩⲣⲁⲓ ⲉⲡⲛⲟⲩⲧⲉ ⲁⲩⲱ ϥⲛⲁⲛⲁϩⲙ ⲧⲏⲩⲧⲛ ⲉⲡϫⲓ ⲛϭⲟⲛⲥ ⲉⲧϩⲛⲧϭⲓϫ ⲛⲛϫⲁϫⲉ,"Be of good cheer, O my children, cry unto the Lord, and he will deliver you from the power and hand of the enemies."
ϩⲁⲣⲉϩ ⲉⲧⲁⲯⲩⲭⲏ ⲛⲅⲧⲟⲩϫⲟⲓ ⲙⲡⲣⲧⲣⲁϫⲓϣⲓⲡⲉ ϫⲉⲁⲓϩⲉⲗⲡⲓⲍⲉ ⲉⲣⲟⲕ,"Keep my soul, and deliver me: let me not be ashamed; for I have hoped in thee."
ϩⲙⲡⲉϩⲟⲟⲩ ⲉⲧⲙⲙⲁⲩ ⲡⲉϫⲉⲡϫⲟⲉⲓⲥ ϫⲉϯⲛⲁⲥⲱⲟⲩϩ ⲉϩⲟⲩⲛ ⲛⲧⲉⲛⲧⲁⲩⲟⲩⲟϣϥ ⲁⲩⲱ ⲧⲉⲛⲧⲁⲩⲛⲟϫⲥ ⲉⲃⲟⲗ ϯⲛⲁϣⲟⲡⲥ ⲉⲣⲟⲓ ⲁⲩⲱ ⲧⲉⲛⲧⲁⲩⲙⲟⲕϩⲥ,"In that day, saith the Lord, I will gather her that is bruised, and will receive her that is cast out, and those whom I rejected."
ⲛϣⲏⲣⲉ ⲛⲕⲁⲁⲑ ⲁⲙⲃⲣⲁⲙ ⲙⲛⲓⲥⲥⲁⲁⲣ ⲭⲉⲃⲣⲱⲛ ⲙⲛⲟⲍⲉⲓⲏⲗ ⲁⲩⲱ ⲛⲣⲟⲙⲡⲉ ⲙⲡⲱⲛϩ ⲛⲕⲁⲁⲑ ϣⲉ ⲙⲁⲃϣⲟⲙⲧⲉ ⲛⲣⲟⲙⲡⲉ,"Ambram and Issaar, Chebron, and Oziel; and the years of the life of Caath were a hundred and thirty-three years."
ⲁⲩⲱ ⲥⲁⲗⲡⲁⲁⲇ ⲡϣⲏⲣⲉ ⲛⲟⲫⲉⲣ ⲛⲉⲙⲛϣⲣϩⲟⲟⲩⲧ ϣⲟⲟⲡ ⲛⲁϥ ⲛⲥⲁϩⲉⲛϣⲉⲉⲣⲉ ⲛⲥϩⲓⲙⲉ ⲁⲩⲱ ⲛⲁⲓ ⲛⲉ ⲛⲣⲁⲛ ⲛⲛϣⲉⲉⲣⲉ ⲛⲥⲁⲗⲡⲁⲁⲇ ⲙⲁⲁⲗⲁ ⲁⲩⲱ ⲛⲟⲩⲁ ⲁⲩⲱ ⲉⲅⲗⲁ ⲙⲛⲙⲉⲗⲭⲁ ⲙⲛⲑⲉⲣⲥⲁ,"And Salpaad the sons of Opher had no sons but daughters: and these are the names of the daughters of Salpaad; Maala, and Nua, and Egla, and Melcha, and Thersa."
ⲙⲙⲟⲛ ⲇⲉ ⲁⲗⲗⲁ ⲉⲧⲉⲧⲛϯⲧⲱⲛ ⲧⲏⲣⲧⲛ ⲛϯϭⲛ ⲙⲉ ⲅⲁⲣ ⲁⲛ ⲛϩⲏⲧⲧⲏⲩⲧⲛ,"Howbeit, do ye all strengthen yourselves and come now, for I do not find truth in you."
ⲡⲉⲧϭⲱϣⲧ ⲉϫⲙⲡⲕⲁϩ ⲉⲧⲣⲉϥⲥⲧⲱⲧ ⲡⲉϣⲁϥϫⲱϩ ⲉⲛⲧⲟⲟⲩ ⲛⲥⲉϯⲕⲁⲡⲛⲟⲥ,"who looks upon the earth, and makes it tremble; who touches the mountains, and they smoke."
ⲏⲉⲧⲉⲧⲛⲟ ⲛⲁⲧⲥⲟⲟⲩⲛ ϫⲉⲟⲩⲟⲛ ⲛⲓⲙ ⲉⲁⲛⲃⲁⲡⲧⲓⲍⲉ ⲉⲡⲉⲭⲣⲓⲥⲧⲟⲥ ⲓⲏⲥⲟⲩⲥ . ⲛⲧⲁⲛⲃⲁⲡⲧⲓⲍⲉ ⲉⲡⲉϥⲙⲟⲩ .,Or don't you know that all we who were baptized into Christ Jesus were baptized into his death?
ⲡⲁⲓ ⲉⲛⲧⲁϥϫⲟⲟϥ ⲛⲛⲁϩⲣⲙⲡⲗⲁⲟⲥ ⲧⲏⲣϥ ⲛⲧⲉⲓⲟⲩⲇⲁ ⲙⲛⲛⲉⲧϣⲟⲟⲡ ϩⲛⲧϩⲓⲉⲣⲟⲩⲥⲁⲗⲏⲙ …,"which he spoke to all the people of Juda, and to the inhabitants of Jerusalem, saying,"
ⲥⲉⲛⲁⲣ ⲡⲁⲙⲉⲉⲩⲉ ⲁⲩⲱ ⲉⲣⲉⲧⲁⲯⲩⲭⲏ ϫⲓ ϩⲣⲁⲥ ⲛⲙⲙⲁⲓ,and my soul shall meditate with me.
ϫⲉⲙⲏⲧⲓ ⲟⲩⲛ ϣϭⲟⲙ ⲛⲗⲁⲁⲩ ⲉⲕⲱⲗⲩ ⲙⲡⲙⲟⲟⲩ . ⲉⲧⲣⲉⲛⲁⲓ ϫⲓⲃⲁⲡⲧⲓⲥⲙⲁ . ⲛⲁⲓ ⲛⲧⲁⲩϫⲓ ⲙⲡⲉⲡⲛⲉⲩⲙⲁ ⲉⲧⲟⲩⲁⲁⲃ ϩⲱⲟⲩ ⲛⲧⲛϩⲉ .,"'Can any man forbid the water, that these who have received the Holy Spirit as well as we should not be baptized?'"
ⲙⲡⲣϣⲡⲧⲱⲣⲉ ⲡⲁⲣⲁⲧⲉⲕϭⲟⲙ ⲁⲩⲱ ⲉⲕϣⲁⲛϣⲡⲧⲱⲣⲉ ϥⲓⲡⲣⲟⲟⲩϣ ⲛⲧⲁⲁⲩ,"Be not surety above thy power: for if thou be surety, take care to pay it."
ⲡⲇⲟⲩⲝ ⲇⲉ ⲡⲉϫⲁϥ ⲛⲁϥ ·,"And the Duke said unto him,"
ϯϫⲱ ⲙⲙⲟⲥ ⲛⲏⲧⲛ ϫⲉϣⲁⲣⲉⲟⲩⲣⲁϣⲉ ⲛⲧⲉⲓϩⲉ ϣⲱⲡⲉ ⲉϫⲛⲟⲩⲣⲉϥⲣⲛⲟⲃⲉ ⲉϥϣⲁⲛⲙⲉⲧⲁⲛⲟⲉⲓ . ⲉϩⲟⲩⲉ ⲡⲓⲡⲥⲧⲁⲓⲟⲩⲯⲓⲥ ⲛⲇⲓⲕⲁⲓⲟⲥ ⲛⲁⲓ ⲉⲧⲉⲛⲥⲉⲣⲭⲣⲉⲓⲁ ⲁⲛ ⲙⲙⲉⲧⲁⲛⲟⲓⲁ .,"I tell you that even so there will be more joy in heaven over one sinner who repents, than over ninety-nine righteous people who need no repentance."
ⲁⲓⲁⲕⲱⲃ ⲇⲉ ⲥⲱⲧⲙ ϫⲉⲁⲥⲩⲭⲉⲙ ⲡϣⲏⲣⲉ ⲛⲉⲙⲱⲣ ϫⲱϩⲙ ⲛⲇⲓⲛⲁ ⲧⲉϥϣⲉⲉⲣⲉ ⲛⲉϥϣⲏⲣⲉ ⲇⲉ ⲛⲉⲩϩⲛⲧⲥⲱϣⲉ ⲙⲛⲛⲉϥⲧⲃⲛⲟⲟⲩⲉ ⲁⲓⲁⲕⲱⲃ ⲇⲉ ⲕⲁⲣⲱϥ ϣⲁⲛⲧⲟⲩⲉⲓ ⲉϩⲣⲁⲓ,And Jacob heard that the son of Emmor had defiled Dina his daughter (now his sons were with his cattle in the plain). And Jacob was silent until they came.
ⲁⲩⲱ ⲛⲧⲉⲣⲟⲩⲙⲟⲟϣⲉ ⲁⲩⲕⲏⲣⲩⲥⲥⲉ ϫⲉⲉⲩⲉⲙⲉⲧⲁⲛⲟⲉⲓ,They went out and preached that people should repent.
ϣⲁⲣⲉⲧⲉⲥⲃⲱ ϩⲁⲣⲉϩ ⲉⲛⲉϩⲓⲟⲟⲩⲉ ⲙⲡⲱⲛϩ ⲧⲉⲥⲃⲱ ⲇⲉ ⲉⲧⲉⲙⲡⲟⲩϫⲡⲓⲟⲥ ⲡⲗⲁⲛⲁ,Instruction keeps the right ways of life; but instruction unchastened goes astray.
ⲁⲩⲟⲩⲱⲥϥ ⲅⲁⲣ ϣⲱⲡⲉ ⲛⲧϣⲟⲣⲡ ⲛⲉⲛⲧⲟⲗⲏ ⲉⲧⲃⲉⲧⲉⲥⲙⲛⲧⲁⲧϭⲟⲙ . ⲁⲩⲱ ⲧⲉⲥⲙⲛⲧⲁⲧⲛⲟϥⲣⲉ .,For there is an annulling of a foregoing commandment because of its weakness and uselessness
ⲁⲩϫⲟⲟⲩ ϭⲉ ϣⲁⲣⲟϥ ⲛϭⲓⲛⲉϥⲥⲱⲛⲉ ⲉⲩϫⲱ ⲙⲙⲟⲥ ϫⲉⲡϫⲟⲉⲓⲥ ⲉⲓⲥ ϩⲏⲏⲧⲉ ϥϣⲱⲛⲉ ⲛϭⲓⲡⲉⲧⲕⲙⲉ ⲙⲙⲟϥ .,"The sisters therefore sent to him, saying, 'Lord, behold, he for whom you have great affection is sick.'"
ⲁⲗⲗⲁ ϣⲁⲩⲕⲧⲟⲟⲩ ⲉⲧⲉⲩⲉⲓ ⲉⲡϣⲱⲧ ⲛⲕⲉⲥⲟⲡ ⲛⲥⲉⲣⲣⲙⲙⲁⲟ ·,"but they go back again regularly to the markets,"
ⲛϥⲥⲟⲟⲩⲧⲛ ⲛϭⲓⲡⲛⲁϩⲃⲉϥ ⲙⲡⲉϥⲕⲗⲁⲗ ⲉⲟⲩⲛ ⲟⲩⲕⲣⲟϥ ϩⲛⲧⲉϥϭⲓϫ ⲛϥϫⲓⲥⲉ ⲛϭⲓⲡⲉϥϩⲏⲧ ⲛϥⲧⲁⲕⲟ ⲛϩⲁϩ ϩⲛⲟⲩⲕⲣⲟϥ ⲛϥⲁϩⲉⲣⲁⲧϥ ⲉϫⲙⲡⲧⲁⲕⲟ ⲛϩⲁϩ ⲛⲉϥⲟⲩⲱϣϥ ⲙⲙⲟⲟⲩ ϩⲛⲛⲉϥϭⲓϫ ⲛⲧϩⲉ ⲛϩⲛⲥⲟⲟⲩϩⲉ,"And the yoke of his chain shall prosper: there is craft in his hand; and he shall magnify himself in his heart, and by craft shall destroy many, and he shall stand up for the destruction of many, and shall crush them as eggs in his hand."
ⲧⲉ ⲧϩⲉ ⲉⲧⲉⲣⲉⲡϫⲟⲉⲓⲥ ϫⲱ ⲙⲙⲟⲥ ϫⲉⲁⲡⲁⲗⲁⲟⲥ ⲃⲱⲕ ⲉⲡⲉⲥⲏⲧ ⲉⲕⲏⲙⲉ ⲛϣⲟⲣⲡ ⲉⲟⲩⲱϩ ⲙⲙⲁⲩ ⲁⲩⲱ ⲁϥϥⲓⲧⲟⲩ ⲛϭⲟⲛⲥ ⲉⲛⲁⲥⲥⲩⲣⲓⲟⲥ,"Thus saith the Lord, My people went down before to Egypt to sojourn there; and were carried away forcibly to the Assyrians."
ⲛⲟⲩⲉⲃⲟⲗ ϩⲛϩⲱⲃ ⲁⲛ ⲡⲉ . ϫⲉⲛⲛⲉⲟⲩⲁ ϣⲟⲩϣⲟⲩ ⲙⲙⲟϥ .,"not of works, that no one would boast."
ⲡⲁϣⲏⲣⲉ ϣⲉⲡⲡⲉⲕⲉⲓⲱⲧ ⲉⲣⲟⲁⲩⲱ ⲙⲡⲣⲗⲩⲡⲉⲓ ⲙⲙⲟϥ ϩⲙⲡⲉϥⲱⲛϩ,"My son, help thy father in his age, and grieve him not as long as he liveth."
ⲁⲩⲱ ⲛⲧⲱⲧⲛ ⲉⲧⲉⲧⲛⲙⲟⲟⲩⲧ ϩⲛⲛⲉⲧⲛⲡⲁⲣⲁⲡⲧⲱⲙⲁ ⲙⲛⲛⲉⲧⲛⲛⲟⲃⲉ .,"You were made alive when you were dead in transgressions and sins,"
ⲛⲉⲩⲁϩⲉ ⲇⲉ ⲉⲣⲁⲧⲟⲩ ⲛϭⲓⲛⲟⲩⲏⲏⲃ ⲉⲧⲧⲱⲟⲩⲛ ϩⲁⲧϭⲓⲃⲱⲧⲟⲥ ⲙⲡϫⲟⲉⲓⲥ ϩⲙⲡⲓⲟⲣⲇⲁⲛⲏⲥ ϣⲁⲛⲧⲉⲓⲏⲥⲟⲩⲥ ϫⲱⲕ ⲉⲃⲟⲗ ⲛϩⲱⲃ ⲛⲓⲙ ⲉⲛⲧⲁⲡϫⲟⲉⲓⲥ ϩⲱⲛ ⲙⲙⲱⲟⲩ ⲉⲧⲟⲟⲧϥ ⲉⲧⲣⲉϥⲧⲁⲩⲟⲟⲩ ⲉⲡⲗⲁⲟⲥ ⲡⲗⲁⲟⲥ ⲇⲉ ⲁⲩϭⲉⲡⲏ ⲁⲩϭⲓⲟⲟⲣ ⲧⲏⲣⲟⲩ,"And the priests that bore the ark of the covenant stood in Jordan, until Joshua had finished all that the Lord commanded him to report to the people; and the people hasted and passed over."
ⲁⲩⲕⲧⲟⲟⲩ ⲟⲛ ⲉϩⲣⲁⲓ ⲉⲧⲡⲁⲣⲁⲉⲙⲃⲟⲗⲏ ⲧⲁⲓ ⲧⲉ ⲧϩⲉ ⲉⲛⲉⲩⲉⲓⲣⲉ ⲙⲙⲟⲥ ⲛⲥⲟⲟⲩ ⲛϩⲟⲟⲩ,"And all the rest of the multitude compassed the city six times from within a short distance, and went back again into the camp; this they did six days."
ⲧⲟⲧⲉ ⲟⲩⲛ ⲟⲩⲱⲛϣ ⲛⲁⲙⲟⲟⲛⲉ ϩⲓⲟⲩⲥⲟⲡ ⲙⲛⲟⲩϩⲓⲉⲓⲃ ⲁⲩⲱ ⲟⲩⲛ ⲟⲩⲡⲁⲣⲇⲁⲗⲓⲥ ⲛⲁⲙⲧⲟⲛ ⲙⲙⲟⲥ ϩⲓⲟⲩⲥⲟⲡ ⲙⲛⲟⲩⲃⲁⲁⲙⲡⲉ ⲁⲩⲱ ⲟⲩⲛ ⲟⲩⲕⲧⲏⲣ ⲙⲛⲟⲩⲙⲟⲩⲓ ⲙⲛⲟⲩⲙⲁⲥⲉ ⲛⲁⲙⲟⲟⲛⲉ ϩⲓⲟⲩⲥⲟⲡ ⲁⲩⲱ ⲟⲩⲛ ⲟⲩⲕⲟⲩⲓ ⲛϣⲏⲣⲉ ϣⲏⲙ ⲛⲁⲙⲟⲟⲛⲉ ⲙⲙⲟⲟⲩ,"And the wolf shall feed with the lamb, and the leopard shall lie down with the kid; and the young calf and bull and lion shall feed together; and a little child shall lead them."
ϣⲟⲕ ⲙⲫⲏⲕⲉ ⲉⲧⲃⲉⲧⲉⲛⲧⲟⲗⲏ ⲁⲩⲱ ⲕⲁⲧⲁⲡⲉϥϭⲣⲱϩ ⲙⲡⲣⲕⲧⲟϥ ⲉⲃⲟⲗ ⲉϥϣⲟⲩⲉⲓⲧ,"Help the poor for the commandment's sake, and turn him not away because of his poverty."
ϫⲉⲙⲛⲡⲉⲧⲉⲓⲣⲉ ⲙⲡⲉⲕⲙⲉⲉⲩⲉ ϩⲛⲛⲉⲧⲙⲟⲟⲩⲧ ⲛⲓⲙ ⲇⲉ ⲡⲉⲧⲛⲁⲟⲩⲱⲛϩ ⲛⲁⲕ ⲉⲃⲟⲗ ϩⲛⲁⲙⲛⲧⲉ,For in death no man remembers thee: and who will give thee thanks in Hades?
ⲁⲩⲱ ⲅⲟⲑⲟⲛⲓⲏⲗ ⲡϣⲏⲣⲉ ⲛⲅⲉⲛⲉⲍ ⲡⲥⲟⲛ ⲛⲭⲁⲗⲉⲃ ⲡⲕⲟⲩⲓ ⲉⲣⲟϥ ⲁϥϫⲓⲧⲡⲟⲗⲓⲥ ⲁⲩⲱ ⲭⲁⲗⲉⲃ ⲁϥϯ ⲛⲁϥ ⲛⲧⲉϥϣⲉⲉⲣⲉ ⲉⲧⲣⲉⲥϣⲱⲡⲉ ⲛⲁϥ ⲛⲥϩⲓⲙⲉ,And Gothoniel the younger son of Kenez the brother of Chaleb took it; and Chaleb gave him his daughter Ascha to wife.
ⲙⲡⲣⲧⲁⲕⲉⲙⲙⲉⲗⲟⲥ · ⲙⲡⲉⲭⲣⲓⲥⲧⲟⲥ ·,Destroy not the member of the Christ.
ⲁϥⲧⲁⲗⲉⲛⲉϥϭⲓϫ ⲉϩⲣⲁⲓ ⲉϫⲱⲟⲩ ⲁϥⲃⲱⲕ ⲉⲃⲟⲗ ϩⲙⲡⲙⲁ ⲉⲧⲙⲙⲁⲩ .,"He laid his hands on them, and departed from there."
ⲉⲕⲣⲓⲛⲉ ⲙⲡⲉⲕⲗⲁⲟⲥ ϩⲛⲟⲩⲥⲟⲟⲩⲧⲛ ⲁⲩⲱ ⲛⲉⲕϩⲏⲕⲉ ϩⲛⲟⲩϩⲁⲡ,"that he may judge thy people with righteousness, and thy poor with judgment."
ⲁϩⲣⲟⲟⲩ ⲛϩⲉⲑⲛⲟⲥ ⲁⲩϫⲓⲥⲉ ⲛϩⲏⲧ ⲁⲛⲗⲁⲟⲥ ⲙⲉⲗⲉⲧⲁ ⲛϩⲉⲛⲡⲉⲧϣⲟⲩⲉⲓⲧ,"Wherefore did the heathen rage, and the nations imagine vain things?"
ⲧⲟⲧⲉ ⲙⲙⲁⲑⲏⲧⲏⲥ ⲁⲩϯⲡⲉⲩⲟⲩⲟⲓ ⲉⲓⲏⲥⲟⲩⲥ ⲛⲥⲁⲟⲩⲥⲁ ⲡⲉϫⲁⲩ ⲛⲁϥ . ϫⲉⲉⲧⲃⲉⲟⲩ ⲁⲛⲟⲛ ⲙⲡⲉⲛⲉϣϭⲙϭⲟⲙ ⲉⲛⲟϫϥ ⲉⲃⲟⲗ .,"Then the disciples came to Jesus privately, and said, 'Why weren't we able to cast it out?'"
ⲧⲁϫⲓⲧⲏⲩⲧⲛ ⲉϩⲟⲩⲛ ⲉⲩⲕⲁϩ ⲉϥϣⲟⲩⲉ ⲉⲣⲱⲧⲉ ⲉⲃⲟⲗ ϩⲓⲉⲃⲓⲱ ⲛⲛⲁⲓ ⲅⲁⲣ ⲛⲙⲙⲁⲕ ϫⲉⲡⲉⲓⲗⲁⲟⲥ ⲟⲩⲙⲁϣⲧⲙⲁⲕϩ ⲡⲉ ϫⲉⲕⲁⲥ ⲛⲛⲁϥⲟⲧⲕ ⲉⲃⲟⲗ ϩⲣⲁⲓ ϩⲛⲧⲉϩⲓⲏ,"And I will bring thee into a land flowing with milk and honey; for I will not go up with thee, because thou art a stiff-necked people, lest I consume thee by the way."
ⲡⲣⲣⲟ ⲛⲁⲡϩⲟⲩⲟ ⲡⲣⲣⲟ ⲛⲟⲫⲉⲣ,"the king of Taphut, the king of Opher,"
ϫⲉⲛⲧⲱⲧⲛ ⲧⲉⲧⲛⲥⲟⲟⲩⲛ ⲛⲧϩⲉ ⲉⲛⲧⲁⲛⲟⲩⲱϩ ϩⲛⲡⲕⲁϩ ⲛⲕⲏⲙⲉ ⲁⲩⲱ ⲛⲧϩⲉ ⲉⲛⲧⲁⲛⲡⲁⲣⲁⲓ ⲙⲙⲏⲧⲉ ⲛⲛϩⲉⲑⲛⲟⲥ . . . . . . ⲉⲧⲉⲧⲛⲡⲁⲣⲁⲓ,"For ye know how we dwelt in the land of Egypt, how we came through the midst of the nations through whom ye came."
ⲛⲧⲟⲥ ⲇⲉ ⲡⲉϫⲁⲥ ϫⲉⲙⲁⲣⲛⲉⲩⲭⲁⲣⲓⲥⲧⲟⲩ ⲙⲡϫⲟⲉⲓⲥ ⲧⲁⲭⲁ ⲅⲁⲣ ⲛⲧϩⲉ ⲛⲧⲁϥⲭⲁⲣⲓⲍⲉ ⲙⲙⲟⲛ ⲛⲛⲉⲛⲉⲣⲏⲩ ϥⲛⲁⲭⲁⲣⲓⲍⲉ ⲛⲁⲛ ⲟⲛ ⲛⲛⲉⲛϣⲏⲣⲉ ·,"And she said unto him, ' Let us give thanks unto the Lord, for even as He hath given us each to the other, so will He speedily give unto us our sons.'"
ⲡⲉⲣⲡⲗⲁⲛⲁ ⲛⲁⲥⲛⲏⲩ ⲛⲁⲙⲉⲣⲁⲧⲉ,"Don't be deceived, my beloved brothers."
ⲁϥⲟⲩⲱϣⲃ ⲛϭⲓⲓⲏⲥⲟⲩⲥ ⲡⲉϫⲁϥ ⲛⲁⲩ . ϫⲉϭⲱϣⲧ ⲙⲏⲡⲟⲧⲉ ⲛⲧⲉⲟⲩⲁ ⲡⲗⲁⲛⲁ ⲙⲙⲱⲧⲛ .,"Jesus answered them, 'Be careful that no one leads you astray."
ⲓⲱⲁⲃ ⲇⲉ ⲁϥⲥϩⲁⲓ ⲛⲇⲁⲩⲉⲓⲇ ⲛⲛⲉϣⲁϫⲉ ⲧⲏⲣⲟⲩ ⲙⲡⲡⲟⲗⲉⲙⲟⲥ,"And Joab sent, and reported to David all the events of the war, so as to tell them to the king."
ⲙⲡⲣϫⲟⲟⲥ ϫⲉⲛⲧⲁⲓ … … ⲡϫⲟⲉⲓⲥ ⲛⲛⲉⲕⲉⲓⲣⲉ ⲙⲡⲉⲛⲧ…,"Say not thou, It is through the Lord that I fell away: for thou oughtest not to do the things that he hateth."
ϯⲟⲩⲱϣ ϭⲉ ⲁⲛ ⲉⲧⲣⲁϭⲱ ϩⲙⲡⲉⲓⲕⲟⲥⲙⲟⲥ ⲉⲧⲛⲁⲃⲱⲗ ⲉⲃⲟⲗ ⲛϥⲧⲁⲕⲟ ·,"(and I would not do so). And, moreover, I do not wish to remain in this world which shall dissolve away and perish."
ⲧⲁⲓ ⲧⲉ ⲧϩⲉ ⲉⲧⲉⲣⲉⲡϫⲟⲉⲓⲥ ⲡⲛⲟⲩⲧⲉ ⲉϫⲱ ⲙⲙⲟⲥ ⲡⲉⲛⲧⲁϥⲧⲁⲙⲓⲟⲕ ⲁϥⲡⲗⲁⲥⲥⲉ ⲙⲙⲟⲕ ⲉⲃⲟⲗ ϩⲛⲧϩⲏ ϫⲉⲁⲓⲃⲟⲏⲑⲉⲓ ⲉⲣⲟⲕ ⲙⲡⲣⲣϩⲟⲧⲉ ⲡⲁϩⲙϩⲁⲗ ⲓⲁⲕⲱⲃ ⲁⲩⲱ ⲡⲁⲙⲉⲣⲓⲧ ⲡⲓⲥⲣⲁⲏⲗ ⲛⲧⲁⲓⲥⲟⲧⲡϥ,"Thus saith the Lord God that made thee, and he that formed thee from the womb; Thou shalt yet be helped: fear not, my servant Jacob; and beloved Israel, whom I have chosen."
ⲁⲥⲡⲗⲁⲛⲁ ⲇⲉ ⲙⲙⲟϥ ϩⲛⲟⲩⲛⲟϭ ⲛϩⲟⲙⲓⲗⲓⲁ ⲛϣⲁϫⲉ ⲁⲥⲙⲟⲣϥ ⲇⲉ ⲛϩⲉⲛⲛϩⲁϭⲉ ⲛⲉ ⲉⲃⲟⲗ ϩⲛⲛⲉⲥⲥⲡⲟⲧⲟⲩ ⲁⲥⲑⲓⲟϥ ⲉⲃⲟⲗ,"So with much converse she prevailed on him to go astray, and with the snares of her lips forced him from the right path."
ⲉⲧⲃⲉⲡⲁⲓ ⲁⲡⲛⲟⲩⲧⲉ ⲧⲁⲁⲩ ⲉϩⲣⲁⲓ ⲉϩⲉⲛⲡⲁⲑⲟⲥ ⲉⲩⲥⲏϣ . ⲉⲓⲧⲉ ⲅⲁⲣ ⲛⲉⲩϩⲓⲟⲙⲉ ⲁⲩϣⲓⲃⲉ ⲙⲡϩⲱⲃ ⲛⲧⲉⲩⲫⲩⲥⲓⲥ ⲉⲩⲡⲁⲣⲁ ⲧⲉⲩⲫⲩⲥⲓⲥ .,"For this reason, God gave them up to vile passions. For their women changed the natural function into that which is against nature."
ⲛⲉⲓⲛⲁϫⲓ ⲕⲃⲁ ⲙⲙⲱⲧⲛ ⲁⲛ ϣⲁⲉⲛⲉϩ ⲟⲩⲇⲉ ⲛⲉⲉⲓⲛⲁⲛⲟⲩϭⲥ ⲉⲣⲱⲧⲛ ⲁⲛ ϣⲁⲃⲟⲗ ⲟⲩⲛ ⲟⲩⲡⲛⲉⲩⲙⲁ ⲅⲁⲣ ⲛⲏⲟⲩ ⲉⲃⲟⲗ ϩⲓⲧⲟⲟⲧⲁⲩⲱ ⲁⲛⲟⲕ ⲡⲉⲛⲧⲁⲓⲧⲁⲙⲓⲉ ⲛⲓϥⲉ ⲛⲓⲙ,"I will not take vengeance on you for ever, neither will I be always angry with you: for my Spirit shall go forth from me, and I have created all breath."
ⲛⲛⲉⲕϫⲓⲛϩⲉⲛⲇⲱⲣⲟⲛ ⲛⲇⲱⲣⲟⲛ ⲅⲁⲣ ϣⲁⲩⲧⲱⲙ ⲛⲛⲃⲁⲗ ⲛⲛⲉⲧⲛⲁⲩ ⲉⲃⲟⲗ ⲁⲩⲱ ⲛⲥⲉⲧⲁⲕⲟ ⲛⲛϣⲁϫⲉ ⲙⲙⲉ,"And thou shalt not receive gifts; for gifts blind the eyes of the seeing, and corrupt just words."
ⲁⲩⲱ ⲟⲩⲙⲁⲥⲉ ⲙⲛⲟⲩⲟⲉⲓⲗⲉ ⲉⲩⲑⲩⲥⲓⲁ ⲛⲟⲩϫⲁⲓ ⲙⲡⲉⲙⲧⲟ ⲉⲃⲟⲗ ⲙⲡϫⲟⲉⲓⲥ ⲁⲩⲱ ⲟⲩⲥⲁⲙⲓⲧ ⲉϥⲟⲩⲟϣⲙ ϩⲓⲛⲉϩ ϫⲉⲉⲣⲉⲡϫⲟⲉⲓⲥ ⲛⲁⲟⲩⲱⲛϩ ⲉⲃⲟⲗ ⲛϩⲏⲧⲧⲏⲩⲧⲛ ⲙⲡϩⲟⲟⲩ,"and a calf and a ram for a peace offering before the Lord, and fine flour mingled with oil, for to-day the Lord will appear among you."
ⲧⲡⲉ ⲙⲛⲡⲕⲁϩ ⲛⲁⲡⲁⲣⲁⲅⲉ . ⲛⲁϣⲁϫⲉ ⲇⲉ ⲛⲁⲡⲁⲣⲁⲅⲉ ⲁⲛ .,"Heaven and earth will pass away, but my words will not pass away."
ⲁⲛⲟⲕ ϩⲱ ⲓⲱϩⲁⲛⲛⲏⲥ ⲡⲉⲧⲛⲥⲟⲛ ⲁⲩⲱ ⲡⲉⲧⲛϣⲃⲏⲣ ⲕⲟⲓⲛⲟⲛⲟⲥ ϩⲛⲧⲉⲑⲗⲓⲯⲓⲥ ⲁⲩⲱ ⲧⲙⲛⲧⲣⲣⲟ ⲙⲛⲧϩⲩⲡⲟⲙⲟⲛⲏ ⲙⲡⲛϫⲟⲉⲓⲥ ⲓⲏⲥⲟⲩⲥ ⲡⲉⲭⲣⲓⲥⲧⲟⲥ ⲁⲓϣⲱⲡⲉ ϩⲛⲧⲛⲏⲥⲟⲥ ⲉⲧⲟⲩⲙⲟⲩⲧⲉ ⲉⲣⲟⲥ ϫⲉⲡⲁⲧⲙⲟⲥ ⲉⲧⲃⲉⲡϣⲁϫⲉ ⲙⲡⲛⲟⲩⲧⲉ ⲁⲩⲱ ⲉⲧⲃⲉⲧⲙⲛⲧⲙⲛⲧⲣⲉ ⲛⲓⲏⲥⲟⲩⲥ ⲡⲉⲭⲣⲓⲥⲧⲟⲥ .,"I John, your brother and partner with you in oppression, Kingdom, and perseverance in Christ Jesus, was on the isle that is called Patmos because of God's Word and the testimony of Jesus Christ."
ⲉϥϣⲁϫⲉ ⲇⲉ ⲛⲙⲙⲁϥ ⲁϥⲃⲱⲕ ⲉϩⲟⲩⲛ . ⲁⲩⲱ ⲁϥϩⲉ ⲉⲩⲙⲏⲏϣⲉ ⲉⲩⲥⲟⲟⲩϩ .,"As he talked with him, he went in and found many gathered together."
ⲉϥϣⲁⲛϫⲓⲧⲕ ⲇⲉ ⲉϩⲟⲩⲛ ⲛϭⲓⲡϫⲟⲉⲓⲥ ⲡⲉⲕⲛⲟⲩⲧⲉ ⲉⲡⲕⲁϩ ⲡⲁⲓ ⲉⲧⲕⲛⲁⲃⲱⲕ ⲛⲧⲟⲕ ⲉϩⲟⲩⲛ ⲉⲣⲟϥ ⲉⲕⲗⲏⲣⲟⲛⲟⲙⲉⲓ ⲙⲙⲟϥ ⲁⲩⲱ ⲛϥϥⲓ ⲙⲙⲁⲩ ϩⲓϩⲏ ⲙⲙⲟⲕ ⲛⲛⲛⲟϭ ⲛϩⲉⲑⲛⲟⲥ ⲁⲩⲱ ⲉⲧⲛⲁϣⲱⲟⲩ ⲡⲉⲭⲉⲧⲧⲁⲓⲟⲥ ⲛⲙⲡⲅⲉⲣⲅⲉⲣⲁⲓⲥⲁⲓⲟⲥ ⲛⲙⲡⲁⲙⲟⲣⲣⲁⲓⲟⲥ ⲛⲙⲡⲉⲭⲁⲛⲁⲛⲁⲓⲟⲥ ⲛⲙⲡⲉⲫⲉⲣⲉⲍⲁⲓⲟⲥ ⲛⲙⲡⲉⲩϩⲁⲓⲟⲥ ⲛⲙⲡⲓⲉⲃⲟⲩⲥⲁⲓⲟⲥ ⲥⲁϣϥ ⲛϩⲉⲑⲛⲟⲥ ⲉⲛⲁϣⲱⲟⲩ ⲁⲩⲱ ⲉⲩϫⲟⲟⲣ ⲉⲣⲱⲧⲛ,"And when the Lord thy God shall bring thee into the land, into which thou goest to possess it, and shall remove great nations from before thee, the Chettite, and Gergesite, and Amorite, and Chananite, and Pherezite, and Evite, and Jebusite, seven nations more numerous and stronger than you,"
ⲁⲗⲗⲁ ⲡⲁⲓ ⲡⲉⲛⲧⲁⲩϫⲟⲟϥ ⲉⲃⲟⲗ ϩⲓⲧⲛⲓⲱⲏⲗ ⲡⲉⲡⲣⲟⲫⲏⲧⲏⲥ .,But this is what has been spoken through the prophet Joel:
ⲧⲱⲟⲩⲛ ⲧϩⲓⲏⲙ ⲛⲧⲉⲕⲟⲛⲧⲟ ⲕⲁϩⲏⲟⲩ ⲛⲧⲉⲥⲧⲟⲗⲏ ⲙⲡⲟⲩϩⲏⲃⲉ ⲙⲛⲡⲟⲩⲡⲉⲧϩⲟⲟⲩ ⲛⲧⲉϯ ϩⲓⲱⲱⲧⲉ ⲙⲡⲉⲟⲟⲩ ⲛⲧⲟⲩⲙⲛⲧⲥⲁⲓ ⲉⲧⲉⲃⲟⲗ ϩⲓⲧⲟⲟⲧϥ ⲙⲡⲛⲟⲩⲧⲉ ϣⲁⲉⲛⲉϩ,"Put off, O Jerusalem, the garment of mourning and affliction, and put on the comeliness of the glory that cometh from God for ever."
ϩⲛⲟⲩϯⲥⲃⲱ ⲁⲡϫⲟⲉⲓⲥ ϯⲥⲃⲱ ⲛⲁⲓ ⲁⲩⲱ ⲙⲡϥⲧⲁⲁⲧ ⲉⲧⲟⲟⲧϥ ⲙⲡⲙⲟⲩ,The Lord has chastened me sore: but he has not given me up to death.
ⲡⲉⲧⲛⲁϩⲁⲣⲉϩ ⲉⲧⲉⲛⲧⲟⲗⲏ ⲛϥⲛⲁⲉⲓⲙⲉ ⲟⲛ ⲉⲩϣⲁϫⲉ ⲙⲡⲟⲛⲏⲣⲟⲛ ⲁⲩⲱ ⲡⲉⲟⲩⲟⲉⲓϣ ⲙⲡϩⲁⲡ ⲡϩⲏⲧ ⲙⲡⲥⲟⲫⲟⲥ ⲛⲁⲉⲓⲙⲉ ⲉⲣⲟϥ,He that keeps the commandment shall not know an evil thing: and the heart of the wise knows the time of judgment.
ⲥⲟⲟⲩ ⲛϩⲟⲟⲩ ⲉⲕⲉⲉⲓⲣⲉ ⲛⲛⲉⲕϩⲃⲏⲩⲉ ⲡⲙⲉϩⲥⲁϣϥ ⲇⲉ ⲛϩⲟⲟⲩ ⲡⲥⲁⲃⲃⲁⲧⲟⲛ ⲡⲉ ⲙⲧⲟⲛ ⲉⲧⲟⲩⲁⲁⲃ ⲙⲡϫⲟⲉⲓⲥ ⲟⲩⲟⲛ ⲛⲓⲙ ⲉⲧⲛⲁⲣϩⲱⲃ ϩⲙⲡⲙⲉϩⲥⲁϣϥ ⲛϩⲟⲟⲩ ϩⲛⲟⲩⲙⲟⲩ ⲉⲩⲉⲙⲟⲩⲟⲩⲧ ⲙⲙⲟϥ,"Six days thou shalt do works, but the seventh day is the sabbath, a holy rest to the Lord; every one who shall do a work on the seventh day shall be put to death."
ⲁⲡⲁⲉⲓⲱⲧ ⲁⲙⲁϩⲧⲉ ⲙⲛϥⲱ ⲛⲧⲉϥⲁⲡⲉ,"And my father laid hold upon the hair of his head,"
ⲁⲩⲧⲱⲟⲩⲛ ⲉⲃⲟⲗ ϩⲛⲗⲉⲃⲱⲛⲁ ⲁⲩⲉⲓ ⲉϩⲣⲁⲓ ⲉⲇⲉⲥⲥⲁ,"And they departed from Lebona, and encamped in Ressan."
ⲙⲛⲡⲉⲧⲧⲁⲩⲟ ⲛⲟⲩⲙⲛⲧϫⲱⲱⲣⲉ ⲉϩⲟⲩⲛ ⲉⲡⲉⲧϩⲓⲧⲟⲩⲱϥ · ⲁⲗⲗⲁ ⲡⲟⲩⲁ ⲡⲟⲩⲁ ϩⲟϫϩϫ ⲙⲡⲉⲧϩⲓⲧⲟⲩⲱϥ ·,"No man sheweth bravery on behalf of his neighbour, but every man inflicteth persecution on his neighbour."
ⲛⲧⲁⲩⲥⲉϩⲛⲉⲓϣⲁϫⲉ ⲇⲉ ⲛⲁⲛ · ϫⲉⲕⲁⲥ ⲉⲛⲛⲁⲡⲓⲥⲧⲉⲩⲉ ⲉⲡⲛⲟⲩⲧⲉ ⲛⲧⲛⲁⲅⲱⲛⲓⲍⲉ ϫⲓⲛⲟⲩⲕⲟⲩⲓ ϣⲁⲟⲩⲛⲟϭ ϩⲛϩⲉⲛⲛⲏⲥⲧⲉⲓⲁ ⲙⲛϩⲉⲛϣⲗⲏⲗ ⲙⲛⲡⲕⲉⲥⲉⲉⲡⲉ ⲛϣⲙϣⲉ · ϣⲁϩⲣⲁⲓ ⲉⲩⲡⲁϭⲥⲉ · ⲉⲁⲥϣⲟⲟⲩⲉ ϩⲛⲣⲱⲕ ϩⲛⲟⲩⲛⲏⲥⲧⲉⲓⲁ ·,"These words have been written down for us in order that we may believe in God, and that we, from the least among us even to the greatest, may strive in the contest with fastings, and with prayers, and with other kinds of service, until the spittle drieth in thy mouth through fasting."
ⲟⲩⲛⲡⲉⲧϣⲉⲡϩⲁϩ ϩⲁⲟⲩⲕⲟⲩⲓ ⲁⲩⲱ ⲛϥⲧⲟⲟⲃⲟⲩ ⲛⲥⲁϣϥ ⲛⲕⲱⲃ,"There is that buyeth much for a little, and repayeth it sevenfold."
ⲉⲓⲥⲛⲁⲅⲅⲉⲗⲟⲥ ⲛⲧⲡⲉ ⲁⲩϫⲓⲧⲟⲩ ⲉⲡⲛⲟⲩⲛ ·,"Behold, the angels of heaven were taken into the abyss (?)."
ⲉϣⲱⲡⲉ ⲙⲙⲟⲛ ⲛⲓⲙ ⲡⲉⲧϫⲱ ⲙⲙⲟⲥ ϫⲉⲉⲓϫⲓϭⲟⲗ,"But if not, who is he that says I speak falsely, and will make my words of no account?"
ⲁϥϫⲱ ⲇⲉ ⲛⲧⲉⲓⲡⲁⲣⲁⲃⲟⲗⲏ ⲉϥϫⲱ ⲙⲙⲟⲥ,He told them this parable.
ⲉⲧⲃⲉⲡⲁⲓ ⲛⲁⲓ ⲛⲉⲧⲉⲣⲉⲡϫⲟⲉⲓⲥ ϫⲱ ⲙⲙⲟⲟⲩ ϫⲉⲉⲓⲥϩⲏⲏⲧⲉ ⲁⲛⲟⲕ ϯⲛⲁⲉⲓⲛⲉ ⲉϫⲙⲡⲉⲓⲗⲁⲟⲥ ⲛⲟⲩϣⲱⲛⲉ ⲛⲥⲉⲣ ϭⲱⲃ ⲛϩⲏⲧϥ ⲛϭⲓⲛⲉⲓⲟⲧⲉ ⲙⲛⲛϣⲏⲣⲉ ϩⲓⲟⲩⲥⲟⲡ ⲟⲩⲧⲉϣⲉ ⲙⲛⲡⲉⲧϩⲓⲧⲟⲩⲱϥ ⲥⲉⲛⲁⲧⲁⲕⲟ,"Therefore thus saith the Lord, Behold, I will bring weakness upon this people, and the fathers and sons shall be weak together; the neighbour and his friend shall perish."
ϣⲁⲣⲉⲛⲁⲅⲅⲉⲗⲟⲥ ⲟⲩⲱϣⲃ ϫⲉϩⲁⲙⲏⲛ ·,"the angels make answer, 'Amen.'"
ⲉϥⲃⲱⲗ ⲙⲙⲟⲟⲩ ⲉϥⲧⲁⲙⲟ ⲙⲙⲟⲟⲩ ⲉⲡⲉⲭⲣⲓⲥⲧⲟⲥ . ϫⲉϩⲁⲡⲥ ⲉⲧⲣⲉϥⲙⲟⲩ ⲁⲩⲱ ⲛϥⲧⲱⲟⲩⲛ ⲉⲃⲟⲗ ϩⲛⲛⲉⲧⲙⲟⲟⲩⲧ . ⲁⲩⲱ ϫⲉⲡⲉⲭⲣⲓⲥⲧⲟⲥ ⲓⲏⲥⲟⲩⲥ ⲡⲉ ⲡⲁⲓ ⲉϯⲧⲁϣⲉⲟⲉⲓϣ ⲛⲏⲧⲛ .,"explaining and demonstrating that the Christ had to suffer and rise again from the dead, and saying, 'This Jesus, whom I proclaim to you, is the Christ.'"
ⲁⲩⲱ ⲇⲁⲩⲉⲓⲇ ⲁϥⲧⲱⲟⲩⲛ ⲙⲛⲡⲉϥⲧⲟⲟⲩ ⲛϣⲉ ⲛⲣⲱⲙⲉ ⲉⲧⲛⲙⲙⲁϥ ⲁϥⲃⲱⲕ ⲉⲣⲁⲧϥ ⲛⲁⲭⲟⲩⲥ ⲡϣⲏⲣⲉ ⲙⲙⲁⲁϫ ⲡⲣⲣⲟ ⲛⲅⲉⲑ,"So David arose, and the six hundred men that were with him, and he went to Anchus, son Ammach, king of Geth."
ⲁϥⲉⲓ ⲛϭⲓⲓⲏⲥⲟⲩⲥ ⲁϥϫⲓ ⲙⲡⲟⲉⲓⲕ ⲁϥϯ ⲛⲁⲩ ⲁⲩⲱ ⲟⲛ ⲉⲃⲟⲗ ϩⲙⲡⲧⲃⲧ .,"Then Jesus came and took the bread, gave it to them, and the fish likewise."
ⲛⲛⲉⲕϫⲉ ⲗⲁⲁⲩ ⲛϣⲁϫⲉ ⲛⲉⲓⲣⲏⲛⲓⲕⲉ ⲛⲉⲣⲟⲟⲩ ⲁⲩⲱ ⲉϥⲟ ⲛⲛⲟϥⲣⲉ ⲛⲁⲩ ⲛⲛⲉϩⲟⲟⲩ ⲧⲏⲣⲟⲩ ϣⲁⲉⲛⲉϩ,Thou shalt not speak peaceably or profitably to them all thy days for ever.
ⲛⲅϣⲁϣⲟⲩ ⲛⲧⲉⲡⲧⲏⲩ ϥⲓⲧⲟⲩ ⲛⲧⲉⲟⲩϩⲁⲧⲏⲩ ϫⲟⲟⲣⲟⲩ ⲉⲃⲟⲗ ⲛⲧⲟⲕ ⲇⲉ ⲕⲛⲁⲉⲩⲫⲣⲁⲛⲉ ϩⲛⲙⲡⲉⲧⲟⲩⲁⲁⲃ ⲙⲡⲓⲥⲣⲁⲏⲗ,"and thou shalt winnow them, and the wind shall carry them away, and a tempest shall scatter them: but thou shalt rejoice in the holy ones of Israel."
ⲡⲙⲉⲉⲩⲉ ⲅⲁⲣ ⲛⲧⲥⲁⲣⲝ ⲡⲙⲟⲩ ⲡⲉ . ⲡⲙⲉⲉⲩⲉ ⲇⲉ ⲙⲡⲉⲡⲛⲉⲩⲙⲁ ⲡⲱⲛϩ ⲡⲉ ⲙⲛⲧⲉⲓⲣⲏⲛⲏ .,"For the mind of the flesh is death, but the mind of the Spirit is life and peace;"
