Book Category,Book Name,Chapter,Verse,Translation,Number
sahidica-new-testament,44_Acts of the Apostles_8,8,ⲉⲩⲙⲟⲟϣⲉ ⲇⲉ ϩⲓⲧⲉϩⲓⲏ ⲁⲩⲉⲓ ⲉϩⲣⲁⲓ ⲉϫⲛⲟⲩⲙⲟⲟⲩ . ⲡⲉϫⲉⲡⲉⲥⲓⲟⲩⲣ ⲙⲫⲓⲗⲓⲡⲡⲟⲥ ϫⲉⲉⲓⲥⲡⲙⲟⲟⲩ ⲟⲩ ⲡⲉⲧⲕⲱⲗⲩ ⲙⲙⲟⲓ ⲉⲧⲣⲁϫⲓⲃⲁⲡⲧⲓⲥⲙⲁ .,"As they went on the way, they came to some water, and the eunuch said, 'Behold, here is water. What is keeping me from being baptized?'",36
sahidica-new-testament,44_Acts of the Apostles_8,8,,,37
sahidica-new-testament,44_Acts of the Apostles_8,8,ⲁϥⲟⲩⲉϩⲥⲁϩⲛⲉ ⲛϭⲓⲫⲓⲗⲓⲡⲡⲟⲥ ⲉⲧⲣⲉⲡϩⲁⲣⲙⲁ ⲁϩⲉⲣⲁⲧϥ . ⲁⲩⲃⲱⲕ ⲙⲡⲉⲥⲛⲁⲩ ⲉϩⲣⲁⲓ ⲉⲡⲙⲟⲟⲩ . ⲁⲩⲱ ⲁⲫⲓⲗⲓⲡⲡⲟⲥ ⲃⲁⲡⲧⲓⲍⲉ ⲙⲙⲟϥ .,"He commanded the chariot to stand still, and they both went down into the water, both Philip and the eunuch, and he baptized him.",38
sahidica-new-testament,44_Acts of the Apostles_8,8,ⲛⲧⲉⲣⲟⲩⲉⲓ ⲇⲉ ⲉϩⲣⲁⲓ ϩⲙⲡⲙⲟⲟⲩ . ⲟⲩⲡⲛⲉⲩⲙⲁ ⲛⲧⲉⲡϫⲟⲉⲓⲥ ⲁϥⲧⲱⲣⲡ ⲙⲫⲓⲗⲓⲡⲡⲟⲥ . ⲁⲩⲱ ⲙⲡϥⲕⲟⲧϥ ⲉⲛⲁⲩ ⲉⲣⲟϥ ⲛϭⲓⲡⲉⲥⲓⲟⲩⲣ ⲛⲉϥⲙⲟⲟϣⲉ ⲅⲁⲣ ⲡⲉ ⲛⲧⲉϥϩⲓⲏ ⲉϥⲣⲁϣⲉ .,"When they came up out of the water, the Spirit of the Lord caught Philip away, and the eunuch didn't see him any more, for he went on his way rejoicing.",39
sahidica-new-testament,44_Acts of the Apostles_8,8,ⲫⲓⲗⲓⲡⲡⲟⲥ ⲇⲉ ⲁⲩϩⲉ ⲉⲣⲟϥ ϩⲛⲁⲍⲱⲧⲟⲥ . ⲁⲩⲱ ⲉϥⲙⲟⲟϣⲉ ⲉϥⲧⲁϣⲉⲟⲉⲓϣ ⲛⲙⲡⲟⲗⲓⲥ ⲧⲏⲣⲟⲩ . ϣⲁⲛⲧϥⲉⲓ ⲉϩⲣⲁⲓ ⲉⲕⲁⲓⲥⲁⲣⲓⲁ .,"But Philip was found at Azotus. Passing through, he preached the Good News to all the cities, until he came to Caesarea.",40
sahidica-new-testament,44_Acts of the Apostles_9,9,ⲥⲁⲩⲗⲟⲥ ⲇⲉ ⲉⲧⲓ ⲛⲉϥⲙⲉϩ ⲛⲁⲡⲉⲓⲗⲏ ϩⲓϩⲱⲧⲃ ⲉϩⲟⲩⲛ ⲉⲙⲙⲁⲑⲏⲧⲏⲥ ⲙⲡϫⲟⲉⲓⲥ . ⲁϥϯ ⲡⲉϥⲟⲩⲟⲉⲓ ⲉⲡⲁⲣⲭⲓⲉⲣⲉⲩⲥ,"But Saul, still breathing threats and slaughter against the disciples of the Lord, went to the high priest,",1
sahidica-new-testament,44_Acts of the Apostles_9,9,ⲁϥⲁⲓⲧⲉⲓ ⲉⲃⲟⲗ ⲛϩⲉⲛⲉⲡⲓⲥⲧⲟⲗⲏ . ⲉⲃⲟⲗ ϩⲓⲧⲟⲟⲧϥ ⲉⲇⲁⲙⲁⲥⲕⲟⲥ ϣⲁⲛⲥⲩⲛⲁⲅⲱⲅⲏ ϫⲉⲕⲁⲁⲥ ⲛⲉⲧϥⲛⲁϩⲉ ⲉⲣⲟⲟⲩ ⲉⲃⲟⲗ ϩⲛⲧⲉϩⲓⲏ ⲛⲣⲱⲙⲉ ⲁⲩⲱ ⲛⲉϩⲓⲟⲙⲉ . ⲉϥⲉϫⲓⲧⲟⲩ ⲉⲩⲙⲏⲣ ⲉϩⲣⲁⲓ ⲉⲧϩⲓⲉⲣⲟⲩⲥⲁⲗⲏⲙ .,"and asked for letters from him to the synagogues of Damascus, that if he found any who were of the Way, whether men or women, he might bring them bound to Jerusalem.",2
sahidica-new-testament,44_Acts of the Apostles_9,9,ⲁⲥϣⲱⲡⲉ ⲇⲉ ⲉϥⲙⲟⲟϣⲉ ⲛⲧⲉⲣⲉϥϩⲱⲛ ⲉϩⲟⲩⲛ ⲉⲇⲁⲙⲁⲥⲕⲟⲥ . ϩⲛⲟⲩϣⲥⲛⲉ ⲁⲩⲟⲩⲟⲉⲓⲛ ϣⲁⲉϩⲣⲁⲓ ⲉϫⲱϥ ⲉⲃⲟⲗ ϩⲛⲧⲡⲉ .,"As he traveled, it happened that he got close to Damascus, and suddenly a light from the sky shone around him.",3
sahidica-new-testament,44_Acts of the Apostles_9,9,ⲁⲩⲱ ⲛⲧⲉⲣⲉϥϩⲉ ⲉϩⲣⲁⲓ ⲉϫⲙⲡⲕⲁϩ ⲁϥⲥⲱⲧⲙ ⲉⲩⲥⲙⲏ ⲉⲥϫⲱ ⲙⲙⲟⲥ ⲛⲁϥ . ϫⲉⲥⲁⲩⲗⲉ ⲥⲁⲩⲗⲉ ⲁϩⲣⲟⲕ ⲕⲡⲏⲧ ⲛⲥⲱⲓ .,"He fell on the earth, and heard a voice saying to him, 'Saul, Saul, why do you persecute me?'",4
sahidica-new-testament,44_Acts of the Apostles_9,9,ⲡⲉϫⲁϥ ⲇⲉ ϫⲉⲛⲧⲕ ⲛⲓⲙ ⲡϫⲟⲉⲓⲥ . ⲡⲉϫⲉⲡϫⲟⲉⲓⲥ ⲇⲉ ϫⲉⲁⲛⲟⲕ ⲡⲉ ⲓⲏⲥⲟⲩⲥ ⲡⲉⲧⲕⲡⲏⲧ ⲛⲥⲱϥ .,"He said, 'Who are you, Lord?' The Lord said, 'I am Jesus, whom you are persecuting.",5
sahidica-new-testament,44_Acts of the Apostles_9,9,ⲁⲗⲗⲁ ⲧⲱⲟⲩⲛ ⲛⲅⲃⲱⲕ ⲉϩⲟⲩⲛ ⲉⲧⲡⲟⲗⲓⲥ . ⲁⲩⲱ ⲥⲉⲛⲁⲧⲁⲙⲟⲕ ϫⲉⲟⲩ ⲡⲉⲧⲉϣϣⲉ ⲉⲣⲟⲕ ⲉⲁⲁϥ .,"But rise up, and enter into the city, and you will be told what you must do.'",6
sahidica-new-testament,44_Acts of the Apostles_9,9,ⲛⲣⲱⲙⲉ ⲇⲉ ⲉⲧⲙⲟⲟϣⲉ ⲛⲙⲙⲁϥ ⲛⲉⲩⲁϩⲉⲣⲁⲧⲟⲩ ⲉⲩⲟⲛϣ . ⲛⲉⲩⲥⲱⲧⲙ ⲙⲉⲛ ⲉⲧⲉⲥⲙⲏ ⲛⲥⲉⲛⲟⲉⲓ ⲁⲛ . ⲛⲉⲩⲛⲁⲩ ⲅⲁⲣ ⲁⲛ ⲉⲗⲁⲁⲩ .,"The men who traveled with him stood speechless, hearing the sound, but seeing no one.",7
sahidica-new-testament,44_Acts of the Apostles_9,9,ⲥⲁⲩⲗⲟⲥ ⲇⲉ ⲁϥⲧⲱⲟⲩⲛ ⲉⲃⲟⲗ ϩⲓϫⲙⲡⲕⲁϩ ⲉⲣⲉⲛⲉϥⲃⲁⲗ ⲇⲉ ⲟⲩⲏⲛ ⲛⲉϥⲛⲁⲩ ⲉⲃⲟⲗ ⲁⲛ . ⲁⲩϫⲓⲙⲟⲉⲓⲧ ⲇⲉ ϩⲏⲧϥ ⲁⲩϫⲓⲧϥ ⲉϩⲟⲩⲛ ⲉⲇⲁⲙⲁⲥⲕⲟⲥ .,"Saul arose from the ground, and when his eyes were opened, he saw no one. They led him by the hand, and brought him into Damascus.",8
sahidica-new-testament,44_Acts of the Apostles_9,9,ⲁϥⲣ ϣⲟⲙⲛⲧ ⲇⲉ ⲛϩⲟⲟⲩ ⲉⲛϥⲛⲁⲩ ⲁⲛ ⲉⲃⲟⲗ . ⲁⲩⲱ ⲙⲡϥⲟⲩⲱⲙ ⲟⲩⲇⲉ ⲙⲡϥⲥⲱ .,"He was without sight for three days, and neither ate nor drank.",9
sahidica-new-testament,44_Acts of the Apostles_9,9,ⲛⲉⲩⲛ ⲟⲩⲙⲁⲑⲏⲧⲏⲥ ⲇⲉ ϩⲛⲇⲁⲙⲁⲥⲕⲟⲥ ⲉⲡⲉϥⲣⲁⲛ ⲡⲉ ⲁⲛⲁⲛⲓⲁⲥ . ⲡⲉϫⲉⲡϫⲟⲉⲓⲥ ⲛⲁϥ ϩⲛⲟⲩϩⲟⲣⲟⲙⲁ ϫⲉⲁⲛⲁⲛⲓⲁ . ⲛⲧⲟϥ ⲇⲉ ⲡⲉϫⲁϥ ϫⲉⲉⲓⲥϩⲏⲏⲧⲉ ⲁⲛⲟⲕ ⲡϫⲟⲉⲓⲥ .,"Now there was a certain disciple at Damascus named Ananias. The Lord said to him in a vision, 'Ananias!' He said, 'Behold, it's me, Lord.'",10
sahidica-new-testament,44_Acts of the Apostles_9,9,ⲡⲉϫⲉⲡϫⲟⲉⲓⲥ ⲇⲉ ⲛⲁϥ ϫⲉⲧⲱⲟⲩⲛ ⲛⲅⲃⲱⲕ ⲉⲡϩⲓⲣ ⲉⲧⲟⲩⲙⲟⲩⲧⲉ ⲉⲣⲟϥ ϫⲉⲡⲉⲧⲥⲟⲩⲧⲱⲛ . ⲛⲅϣⲓⲛⲉ ϩⲙⲡⲏⲓ ⲛⲓⲟⲩⲇⲁⲥ ⲛⲥⲁⲟⲩⲣⲙⲧⲁⲣⲥⲟⲥ ⲉⲡⲉϥⲣⲁⲛ ⲡⲉ ⲥⲁⲩⲗⲟⲥ . ⲉⲓⲥ ϩⲏⲏⲧⲉ ⲅⲁⲣ ⲛⲧⲟϥ ⲉϥϣⲗⲏⲗ .,"The Lord said to him, 'Arise, and go to the street which is called Straight, and inquire in the house of Judah for one named Saul, a man of Tarsus. For behold, he is praying,",11
sahidica-new-testament,44_Acts of the Apostles_9,9,ⲁϥⲛⲁⲩ ⲉⲩⲣⲱⲙⲉ ϫⲉⲁⲛⲁⲛⲓⲁⲥ ⲉⲁϥⲃⲱⲕ ⲉϩⲟⲩⲛ ⲁϥⲧⲁⲗⲉ ⲧⲟⲟⲧϥ ⲉϫⲱϥ ϫⲉⲉϥⲉⲛⲁⲩ ⲉⲃⲟⲗ,"and in a vision he has seen a man named Ananias coming in, and laying his hands on him, that he might receive his sight.'",12
sahidica-new-testament,44_Acts of the Apostles_9,9,ⲁϥⲟⲩⲱϣⲃ ⲇⲉ ⲛϭⲓⲁⲛⲁⲛⲓⲁⲥ ⲡⲉϫⲁϥ ϫⲉⲡϫⲟⲉⲓⲥ ⲁⲓⲥⲱⲧⲙ ⲛⲧⲛϩⲁϩ ⲉⲧⲃⲉⲡⲉⲓⲣⲱⲙⲉ . ϫⲉⲁϥⲣϩⲁϩ ⲙⲡⲉⲧϩⲟⲟⲩ ⲛⲛⲉⲕⲡⲉⲧⲟⲩⲁⲁⲃ ϩⲛⲧϩⲓⲉⲣⲟⲩⲥⲁⲗⲏⲙ .,"But Ananias answered, 'Lord, I have heard from many about this man, how much evil he did to your saints at Jerusalem.",13
sahidica-new-testament,44_Acts of the Apostles_9,9,ⲁⲩⲱ ⲟⲛ ⲁϥϫⲓ ⲉⲝⲟⲩⲥⲓⲁ ⲙⲡⲉⲓⲙⲁ ⲉⲃⲟⲗ ϩⲓⲧⲛⲛⲁⲣⲭⲓⲉⲣⲉⲩⲥ ⲉⲙⲟⲩⲣ ⲛⲟⲩⲟⲛ ⲛⲓⲙ ⲉⲧⲉⲡⲓⲕⲁⲗⲉⲓ ⲙⲡⲉⲕⲣⲁⲛ .,Here he has authority from the chief priests to bind all who call on your name.',14
sahidica-new-testament,44_Acts of the Apostles_9,9,ⲡⲉϫⲉⲡϫⲟⲉⲓⲥ ⲛⲁϥ ϫⲉⲃⲱⲕ ϫⲉⲡⲁⲓ ⲟⲩⲥⲕⲉⲩⲟⲥ ⲛⲁⲓ ⲛⲥⲱⲧⲡ ⲡⲉ . ⲉⲧⲣⲉϥϥⲓ ϩⲁⲡⲁⲣⲁⲛ ⲙⲡⲉⲙⲧⲟ ⲉⲃⲟⲗ ⲛⲛϩⲉⲑⲛⲟⲥ ⲙⲛⲛⲉⲣⲣⲱⲟⲩ ⲙⲛⲛϣⲏⲣⲉ ⲙⲡⲓⲥⲣⲁⲏⲗ .,"But the Lord said to him, 'Go your way, for he is my chosen vessel to bear my name before the nations and kings, and the children of Israel.",15
sahidica-new-testament,44_Acts of the Apostles_9,9,ⲁⲛⲟⲕ ⲅⲁⲣ ϯⲛⲁⲧⲁⲙⲟϥ ⲉⲛϩⲓⲥⲉ ⲉⲧϥⲛⲁϣⲟⲡⲟⲩ ϩⲁⲡⲁⲣⲁⲛ .,For I will show him how many things he must suffer for my name's sake.',16
sahidica-new-testament,44_Acts of the Apostles_9,9,ⲁϥⲙⲟⲟϣⲉ ⲇⲉ ⲛϭⲓⲁⲛⲁⲛⲓⲁⲥ ⲁϥⲃⲱⲕ ⲉϩⲟⲩⲛ ⲉⲡⲏⲓ ⲁϥⲧⲁⲗⲉ ⲛⲉϥϭⲓϫ ⲉϫⲛⲥⲁⲩⲗⲟⲥ ⲡⲉϫⲁϥ ϫⲉⲥⲁⲩⲗⲉ ⲡⲁⲥⲟⲛ ⲡϫⲟⲉⲓⲥ ⲓⲏⲥⲟⲩⲥ ⲡⲉⲛⲧⲁϥⲧⲛⲛⲟⲟⲩⲧ ⲡⲁⲓ ⲛⲧⲁϥⲟⲩⲱⲛϩ ⲛⲁⲕ ⲉⲃⲟⲗ ϩⲛⲧⲉϩⲓⲏ ⲉⲧⲕⲛⲏⲩ ⲙⲙⲟⲥ ϫⲉⲕⲁⲁⲥ ⲉⲕⲉⲛⲁⲩ ⲉⲃⲟⲗ ⲁⲩⲱ ⲛⲅⲙⲟⲩϩ ⲉⲃⲟⲗ ϩⲙⲡⲉⲡⲛⲉⲩⲙⲁ ⲉⲧⲟⲩⲁⲁⲃ .,"Ananias departed, and entered into the house. Laying his hands on him, he said, 'Brother Saul, the Lord, who appeared to you on the road by which you came, has sent me, that you may receive your sight, and be filled with the Holy Spirit.'",17
sahidica-new-testament,44_Acts of the Apostles_9,9,ⲛⲧⲉⲩⲛⲟⲩ ⲇⲉ ⲁⲩϩⲉ ⲉⲃⲟⲗ ϩⲛⲛⲉϥⲃⲁⲗ ⲛⲧϩⲉ ⲛϩⲉⲛϩⲃⲥ . ⲁⲩⲱ ⲁϥⲛⲁⲩ ⲉⲃⲟⲗ . ⲛⲧⲉⲩⲛⲟⲩ ⲇⲉ ⲁϥⲧⲱⲟⲩⲛ ⲁϥϫⲓⲃⲁⲡⲧⲓⲥⲙⲁ .,"Immediately something like scales fell from his eyes, and he received his sight. He arose and was baptized.",18
sahidica-new-testament,44_Acts of the Apostles_9,9,ⲁⲩⲱ ⲛⲧⲉⲣⲉϥⲟⲩⲱⲙ ⲁϥϭⲙϭⲟⲙ . ⲁϥϣⲱⲡⲉ ⲇⲉ ⲙⲛⲙⲙⲁⲑⲏⲧⲏⲥ ⲉⲧϩⲛⲇⲁⲙⲁⲥⲕⲟⲥ ⲛϩⲉⲛϩⲟⲟⲩ .,He took food and was strengthened. Saul stayed several days with the disciples who were at Damascus.,19
sahidica-new-testament,44_Acts of the Apostles_9,9,ⲁⲩⲱ ⲛⲧⲉⲩⲛⲟⲩ ⲁϥⲕⲏⲣⲩⲥⲥⲉ ⲙⲡϫⲟⲉⲓⲥ ⲓⲏⲥⲟⲩⲥ ϩⲛⲛⲥⲩⲛⲁⲅⲱⲅⲏ ⲛⲛⲓⲟⲩⲇⲁⲓ . ϫⲉⲡⲁⲓ ⲡⲉ ⲡⲉⲭⲣⲓⲥⲧⲟⲥ ⲡϣⲏⲣⲉ ⲙⲡⲛⲟⲩⲧⲉ .,"Immediately in the synagogues he proclaimed the Christ, that he is the Son of God.",20
sahidica-new-testament,44_Acts of the Apostles_9,9,ⲁⲩⲡⲱϣⲥ ⲇⲉ ⲛϭⲓⲟⲩⲟⲛ ⲛⲓⲙ ⲉⲧⲥⲱⲧⲙ ⲉⲣⲟϥ ⲁⲩⲱ ⲛⲉⲩϫⲱ ⲙⲙⲟⲥ ϫⲉⲙⲏ ⲙⲡⲁⲓ ⲁⲛ ⲡⲉ ⲉⲛⲧⲁϥϫⲱⲱⲣⲉ ⲉⲃⲟⲗ ϩⲛⲧϩⲓⲉⲣⲟⲩⲥⲁⲗⲏⲙ ⲛⲛⲉⲧⲉⲡⲓⲕⲁⲗⲉⲓ ⲙⲡⲉⲓⲣⲁⲛ ⲁⲩⲱ ⲛⲧⲁⲩⲧⲛⲛⲟⲟⲩϥ ⲉⲧⲃⲉⲡⲁⲓ ⲉⲡⲉⲓⲙⲁ ϫⲉⲕⲁⲁⲥ ⲉϥⲉϫⲓⲧⲟⲩ ⲉⲩⲙⲏⲣ ⲉⲣⲁⲧⲟⲩ ⲛⲛⲁⲣⲭⲓⲉⲣⲉⲩⲥ .,"All who heard him were amazed, and said, 'Isn't this he who in Jerusalem made havoc of those who called on this name? And he had come here intending to bring them bound before the chief priests!'",21
sahidica-new-testament,44_Acts of the Apostles_9,9,ⲥⲁⲩⲗⲟⲥ ⲇⲉ ⲛⲉϥϭⲙϭⲟⲙ ⲛϩⲟⲩⲟ . ⲁⲩⲱ ⲉϥϣⲧⲟⲣⲧⲣ ⲛⲛⲓⲟⲩⲇⲁⲓ ⲉⲧⲟⲩⲏϩ ϩⲛⲇⲁⲙⲁⲥⲕⲟⲥ ⲉϥⲧⲁⲙⲟ ⲙⲙⲟⲟⲩ ϫⲉⲡⲁⲓ ⲡⲉ ⲡⲉⲭⲣⲓⲥⲧⲟⲥ .,"But Saul increased more in strength, and confounded the Jews who lived at Damascus, proving that this is the Christ.",22
sahidica-new-testament,44_Acts of the Apostles_9,9,ⲛⲧⲉⲣⲉⲟⲩⲙⲏⲏϣⲉ ⲇⲉ ⲛϩⲟⲟⲩ ϫⲱⲕ ⲉⲃⲟⲗ . ⲁⲩϫⲓϣⲟϫⲛⲉ ⲛϭⲓⲛⲓⲟⲩⲇⲁⲓ ⲉϩⲟⲧⲃⲉϥ .,"When many days were fulfilled, the Jews conspired together to kill him,",23
sahidica-new-testament,44_Acts of the Apostles_9,9,ⲁⲩⲧⲁⲙⲉ ⲥⲁⲩⲗⲟⲥ ⲉⲡⲉⲩϣⲟϫⲛⲉ . ⲛⲉⲩϩⲁⲣⲉϩ ⲇⲉ ⲉⲙⲡⲩⲗⲏ ⲙⲡⲉϩⲟⲟⲩ ⲙⲛⲧⲉⲩϣⲏ ϫⲉⲕⲁⲁⲥ ⲉⲩⲉⲙⲟⲩⲟⲩⲧ ⲙⲙⲟϥ .,"but their plot became known to Saul. They watched the gates both day and night that they might kill him,",24
sahidica-new-testament,44_Acts of the Apostles_9,9,ⲁⲩϫⲓⲧϥ ⲇⲉ ⲛϭⲓⲙⲙⲁⲑⲏⲧⲏⲥ ⲁⲩⲭⲁⲗⲁ ⲙⲙⲟϥ ⲉⲃⲟⲗ ϩⲓⲧⲙⲡⲥⲟⲃⲧ ϩⲛⲟⲩⲃⲓⲣ ⲛⲧⲉⲩϣⲏ .,"but his disciples took him by night, and let him down through the wall, lowering him in a basket.",25
sahidica-new-testament,44_Acts of the Apostles_9,9,ⲛⲧⲉⲣⲉϥⲃⲱⲕ ⲇⲉ ⲉϩⲣⲁⲓ ⲉⲧϩⲓⲉⲣⲟⲩⲥⲁⲗⲏⲙ ⲁϥϫⲱⲛⲧ ⲉⲧⲟϭϥ ⲉⲙⲙⲁⲑⲏⲧⲏⲥ . ⲁⲩⲱ ⲛⲉⲩⲣϩⲟⲧⲉ ϩⲏⲧϥ ⲧⲏⲣⲟⲩ ⲛⲥⲉⲡⲓⲥⲧⲉⲩⲉ ⲁⲛ ϫⲉⲟⲩⲙⲁⲑⲏⲧⲏⲥ ⲡⲉ .,"When Saul had come to Jerusalem, he tried to join himself to the disciples; but they were all afraid of him, not believing that he was a disciple.",26
sahidica-new-testament,44_Acts of the Apostles_9,9,ⲃⲁⲣⲛⲁⲃⲁⲥ ⲇⲉ ⲁϥⲁⲙⲁϩⲧⲉ ⲙⲙⲟϥ ⲁϥϫⲓⲧϥ ⲉⲣⲁⲧⲟⲩ ⲛⲛⲁⲡⲟⲥⲧⲟⲗⲟⲥ ⲁⲩⲱ ⲁϥⲧⲁⲙⲟⲟⲩ ⲉⲧϩⲉ ⲛⲧⲁϥⲛⲁⲩ ⲉⲡϫⲟⲉⲓⲥ ϩⲛⲧⲉϩⲓⲏ ⲁⲩⲱ ϫⲉⲁϥϣⲁϫⲉ ⲛⲙⲙⲁϥ ⲁⲩⲱ ⲛⲧϩⲉ ⲛⲧⲁϥⲡⲁⲣⲣⲏⲥⲓⲁⲍⲉ ⲙⲙⲟϥ ϩⲛⲇⲁⲙⲁⲥⲕⲟⲥ ϩⲙⲡⲣⲁⲛ ⲛⲓⲏⲥⲟⲩⲥ .,"But Barnabas took him, and brought him to the apostles, and declared to them how he had seen the Lord in the way, and that he had spoken to him, and how at Damascus he had preached boldly in the name of Jesus.",27
sahidica-new-testament,44_Acts of the Apostles_9,9,ⲛⲉϥϣⲟⲟⲡ ⲇⲉ ⲛⲙⲙⲁⲩ ⲡⲉ ⲉϥⲃⲏⲕ ⲉϩⲟⲩⲛ ⲉϥⲛⲏⲩ ⲉⲃⲟⲗ ϩⲛⲧϩⲓⲉⲣⲟⲩⲥⲁⲗⲏⲙ . ⲁⲩⲱ ⲉϥⲡⲁⲣⲣⲏ ⲥⲓⲁⲍⲉ ⲙⲙⲟϥ ϩⲙⲡⲣⲁⲛ ⲙⲡϫⲟⲉⲓⲥ .,"He was with them entering into Jerusalem,",28
sahidica-new-testament,44_Acts of the Apostles_9,9,ⲛⲉϥϣⲁϫⲉ ⲇⲉ ⲁⲩⲱ ⲛⲉϥϯⲧⲱⲛ ⲙⲛⲛⲟⲩⲉⲉⲓⲉⲛⲓⲛ . ⲛⲧⲟⲟⲩ ⲇⲉ ⲁⲩϩⲓⲧⲟⲟⲧⲟⲩ ⲉϩⲟⲧⲃⲉϥ .,preaching boldly in the name of the Lord Jesus. but they were seeking to kill him.,29
sahidica-new-testament,44_Acts of the Apostles_9,9,ⲛⲧⲉⲣⲟⲩⲉⲓⲙⲉ ⲇⲉ ⲛϭⲓⲛⲉⲥⲛⲏⲩ . ⲁⲩⲛⲧϥ ⲉϩⲣⲁⲓ ⲉⲕⲁⲓⲥⲁⲣⲓⲁ ⲛⲧⲉⲩϣⲏ . ⲁⲩⲱ ⲁⲩϫⲟⲟⲩϥ ⲉⲧⲁⲣⲥⲟⲥ .,"When the brothers knew it, they brought him down to Caesarea, and sent him off to Tarsus.",30
sahidica-new-testament,44_Acts of the Apostles_9,9,ⲧⲉⲕⲕⲗⲏⲥⲓⲁ ⲇⲉ ⲉⲧϩⲛⲧⲓⲟⲩⲇⲁⲓⲁ ⲧⲏⲣⲥ ⲙⲛⲧⲅⲁⲗⲓⲗⲁⲓⲁ ⲙⲛⲧⲥⲁⲙⲁⲣⲓⲁ ⲛⲉⲥϣⲟⲟⲡ ϩⲛⲟⲩⲉⲓⲣⲏⲛⲏ ⲉⲩⲕⲱⲧ ⲙⲙⲟⲥ ⲉⲥⲙⲟⲟϣⲉ ϩⲛⲧϩⲟⲧⲉ ⲙⲡϫⲟⲉⲓⲥ ⲁⲩⲱ ϩⲙⲡⲥⲟⲡⲥ ⲙⲡⲉⲡⲛⲉⲩⲙⲁ ⲉⲧⲟⲩⲁⲁⲃ ⲛⲉⲥⲁϣⲁⲓ .,"So the assemblies throughout all Judea and Galilee and Samaria had peace, and were built up. They were multiplied, walking in the fear of the Lord and in the comfort of the Holy Spirit.",31
sahidica-new-testament,44_Acts of the Apostles_9,9,ⲁⲥϣⲱⲡⲉ ⲇⲉ ⲛⲧⲉⲣⲉⲡⲉⲧⲣⲟⲥ ⲉⲓ ⲉⲃⲟⲗ ϩⲓⲧⲛⲟⲩⲟⲛ ⲛⲓⲙ ⲉⲧⲣⲉϥⲃⲱⲕ ϣⲁⲛⲉⲧⲟⲩⲁⲁⲃ ⲉⲧⲟⲩⲏϩ ϩⲛⲗⲩⲇⲇⲁ .,"It happened, as Peter went throughout all those parts, he came down also to the saints who lived at Lydda.",32
sahidica-new-testament,44_Acts of the Apostles_9,9,ⲁⲩⲱ ⲁϥϩⲉ ⲉⲩⲣⲱⲙⲉ ⲙⲙⲁⲩ ⲉⲡⲉϥⲣⲁⲛ ⲡⲉ ⲉⲛⲛⲁⲓⲁⲥ . ⲉⲁϥⲣ ϣⲙⲟⲩⲛⲉ ⲛⲣⲟⲙⲡⲉ ⲉϥⲥⲏϭ ⲉϥⲛⲏϫ ϩⲓϫⲛⲟⲩϭⲗⲟϭ .,"There he found a certain man named Aeneas, who had been bedridden for eight years, because he was paralyzed.",33
sahidica-new-testament,44_Acts of the Apostles_9,9,ⲁⲩⲱ ⲡⲉⲧⲣⲟⲥ ⲁϥϭⲱϣⲧ ⲉⲣⲟϥ ⲡⲉϫⲁϥ ⲛⲁϥ . ϫⲉⲉⲛⲁⲓⲁ ⲁϥⲧⲁⲗϭⲟⲕ ⲛϭⲓⲡϫⲟⲉⲓⲥ ⲓⲏⲥⲟⲩⲥ ⲡⲉⲭⲣⲓⲥⲧⲟⲥ ⲧⲱⲟⲩⲛ ⲛⲅⲡⲱⲣϣ ϩⲁⲣⲟⲕ . ⲁⲩⲱ ⲛⲧⲉⲩⲛⲟⲩ ⲁϥⲧⲱⲟⲩⲛ .,"Peter said to him, 'Aeneas, Jesus Christ heals you. Get up and make your bed!' Immediately he arose.",34
sahidica-new-testament,44_Acts of the Apostles_9,9,ⲁⲩⲛⲁⲩ ⲇⲉ ⲉⲣⲟϥ ⲛϭⲓⲟⲩⲟⲛ ⲛⲓⲙ ⲉⲧⲟⲩⲏϩ ϩⲛⲗⲩⲇⲇⲁ ⲙⲛⲥⲁⲣⲱⲛⲁ . ⲁⲩⲱ ⲁϩⲁϩ ⲕⲟⲧⲟⲩ ⲉⲡⲛⲟⲩⲧⲉ .,"All who lived at Lydda and in Sharon saw him, and they turned to the Lord.",35
sahidica-new-testament,44_Acts of the Apostles_9,9,ⲛⲉⲩⲛ ⲟⲩⲥⲱⲛⲉ ⲇⲉ ϩⲛⲓⲟⲡⲡⲏ ⲉⲡⲉⲥⲣⲁⲛ ⲡⲉ ⲧⲁⲃⲓⲑⲁ ⲧⲁⲓ ⲉϣⲁⲩⲟⲩⲁϩⲙⲉⲥ ϫⲉⲧⲟⲣⲕⲁⲥ ⲧⲁⲓ ⲛⲉⲥϫⲏⲕ ⲉⲃⲟⲗ ⲡⲉ ⲛϩⲱⲃ ⲛⲓⲙ ⲉⲛⲁⲛⲟⲩϥ ϩⲓⲙⲛⲧⲛⲁ ⲛⲁⲓ ⲉⲛⲉⲥⲉⲓⲣⲉ ⲙⲙⲟⲟⲩ .,"Now there was at Joppa a certain disciple named Tabitha, which when translated, means Dorcas. This woman was full of good works and acts of mercy which she did.",36
sahidica-new-testament,44_Acts of the Apostles_9,9,ⲁⲥϣⲱⲡⲉ ⲇⲉ ϩⲛⲛⲉϩⲟⲟⲩ ⲉⲧⲙⲙⲁⲩ ⲉⲧⲣⲉⲥϣⲱⲛⲉ ⲛⲥⲙⲟⲩ . ⲁⲩϫⲟⲕⲙⲉⲥ ⲇⲉ ⲁⲩⲱ ⲁⲩⲕⲁⲁⲥ ϩⲛⲟⲩⲙⲁ ⲛⲧⲡⲉ .,"It happened in those days that she fell sick, and died. When they had washed her, they laid her in an upper chamber.",37
sahidica-new-testament,44_Acts of the Apostles_9,9,ⲉⲣⲉⲗⲩⲇⲇⲁ ⲇⲉ ϩⲏⲛ ⲉϩⲟⲩⲛ ⲉⲓⲟⲡⲡⲏ . ⲛⲧⲉⲣⲟⲩⲥⲱⲧⲙ ϫⲉⲡⲉⲧⲣⲟⲥ ⲙⲙⲁⲩ . ⲁⲩϫⲟⲟⲩ ϣⲁⲣⲟϥ ⲛⲣⲱⲙⲉ ⲥⲛⲁⲩ ⲉⲩⲥⲟⲡⲥ ⲙⲙⲟϥ ⲉⲩϫⲱ ⲙⲙⲟⲥ ϫⲉⲙⲡⲣϫⲛⲁⲁⲩ ⲉⲉⲓ ϣⲁⲣⲟⲛ .,"As Lydda was near Joppa, the disciples, hearing that Peter was there, sent two men to him, imploring him not to delay in coming to them.",38
sahidica-new-testament,44_Acts of the Apostles_9,9,ⲡⲉⲧⲣⲟⲥ ⲇⲉ ⲁϥⲧⲱⲟⲩⲛ ⲁϥⲃⲱⲕ ⲛⲙⲙⲁⲩ ⲛⲧⲉⲣⲉϥⲉⲓ ⲇⲉ ⲁⲩϫⲓⲧϥ ⲉϩⲣⲁⲓ ⲉⲡⲙⲁ ⲛⲧⲡⲉ ⲁⲩⲱ ⲁⲛⲉⲭⲏⲣⲁ ⲧⲏⲣⲟⲩ ⲁϩⲉⲣⲁⲧⲟⲩ ⲉⲣⲟϥ ⲉⲩⲣⲓⲙⲉ ⲉⲩⲧⲥⲁⲃⲟ ⲙⲙⲟϥ ⲉϩⲉⲛϣⲧⲏⲛ ⲙⲛϩⲉⲛϩⲟⲓⲧⲉ ⲛⲁⲓ ⲉⲛⲉⲥⲧⲁⲙⲓⲟ ⲙⲙⲟⲟⲩ ⲉⲥⲛⲙⲙⲁⲩ ⲛϭⲓⲇⲟⲣⲕⲁⲥ .,"Peter got up and went with them. When he had come, they brought him into the upper chamber. All the widows stood by him weeping, and showing the coats and garments which Dorcas had made while she was with them.",39
sahidica-new-testament,44_Acts of the Apostles_9,9,ⲡⲉⲧⲣⲟⲥ ⲇⲉ ⲛⲧⲉⲣⲉϥⲛⲟⲩϫⲉ ⲉⲃⲟⲗ ⲛⲟⲩⲟⲛ ⲛⲓⲙ ⲁⲩⲱ ⲁϥⲕⲱⲗϫ ⲛⲛⲉϥⲡⲁⲧ ⲁϥϣⲗⲏⲗ ⲁϥⲕⲧⲟϥ ⲇⲉ ⲉⲡⲥⲱⲙⲁ ⲡⲉϫⲁϥ ϫⲉⲧⲁⲃⲓⲑⲁ ⲧⲱⲟⲩⲛ ϩⲙⲡⲣⲁⲛ ⲙⲡⲉⲛϫⲟⲉⲓⲥ ⲓⲏⲥⲟⲩⲥ ⲡⲉⲭⲣⲓⲥⲧⲟⲥ ⲛⲧⲟⲥ ⲇⲉ ⲁⲥⲟⲩⲱⲛ ⲛⲛⲉⲥⲃⲁⲗ ⲛⲧⲉⲩⲛⲟⲩ ⲁⲩⲱ ⲛⲧⲉⲣⲉⲥⲛⲁⲩ ⲉⲡⲉⲧⲣⲟⲥ ⲁⲥϩⲙⲟⲟⲥ .,"Peter put them all out, and kneeled down and prayed. Turning to the body, he said, 'Tabitha, get up!' She opened her eyes, and when she saw Peter, she sat up.",40
sahidica-new-testament,44_Acts of the Apostles_9,9,ⲁϥϯ ⲧⲟⲟⲧⲥ ⲇⲉ ⲁϥⲧⲟⲩⲛⲟⲥⲥ ⲁⲩⲱ ⲁϥⲙⲟⲩⲧⲉ ⲉⲛⲉⲧⲟⲩⲁⲁⲃ ⲙⲛⲛⲉⲭⲏⲣⲁ ⲁϥⲧⲁϩⲟⲥ ⲉⲣⲁⲧⲥ ⲛⲁⲩ ⲉⲥⲟⲛϩ .,"He gave her his hand, and raised her up. Calling the saints and widows, he presented her alive.",41
sahidica-new-testament,44_Acts of the Apostles_9,9,ⲁⲡⲁⲓ ϣⲱⲡⲉ ⲉϥⲟⲩⲟⲛϩ ⲉⲃⲟⲗ ϩⲛⲓⲟⲡⲡⲏ ⲧⲏⲣⲥ . ⲁⲩⲱ ⲁϩⲁϩ ⲡⲓⲥⲧⲉⲩⲉ ⲉⲡϫⲟⲉⲓⲥ .,"And it became known throughout all Joppa, and many believed in the Lord.",42
sahidica-new-testament,44_Acts of the Apostles_9,9,ⲁⲥϣⲱⲡⲉ ⲇⲉ ⲉⲧⲣⲉϥϭⲱ ⲛϩⲁϩ ⲛϩⲟⲟⲩ ϩⲛⲓⲟⲡⲡⲏ ϩⲁⲧⲛⲟⲩⲁ ϫⲉⲥⲓⲙⲱⲛ ⲡⲃⲁⲕϣⲁⲁⲣ .,"It happened, that he stayed many days in Joppa with one Simon, a tanner.",43
sahidica-new-testament,41_Mark_8,8,ⲛⲉϩⲟⲟⲩ ⲉⲧⲙⲙⲁⲩ ⲛⲉⲩⲛⲟⲩⲛⲟϭ ⲟⲛ ⲙⲙⲏⲏϣⲉ ⲛⲙⲙⲁϥ ⲁⲩⲱ ⲉⲙⲙⲛⲧⲟⲩ ⲡⲉⲧⲟⲩⲛⲁⲟⲩⲟⲙϥ ⲁϥⲙⲟⲩⲧⲉ ⲉⲛⲉϥⲙⲁⲑⲏⲧⲏⲥ ⲡⲉϫⲁϥ ⲛⲁⲩ,Not Found,1
sahidica-new-testament,41_Mark_8,8,ϯϣⲛϩⲧⲏⲓ ⲉϫⲙⲡⲙⲏⲏϣⲉ ϫⲉⲏⲇⲏ ⲉⲓⲥϣⲟⲙⲛⲧ ⲛϩⲟⲟⲩ ⲥⲉⲡⲣⲟⲥⲕⲁⲣⲧⲉⲣⲉⲓ ⲉⲣⲟⲓ . ⲉⲙⲙⲛⲧⲟⲩ ⲡⲉⲧⲟⲩⲛⲁⲟⲩⲟⲙϥ,Not Found,2
sahidica-new-testament,41_Mark_8,8,ⲉⲓϣⲁⲛⲕⲁⲁⲩ ⲉⲃⲟⲗ ⲉⲙⲡⲟⲩⲟⲩⲱⲙ ⲥⲉⲛⲁⲥⲱϣⲙ ϩⲛⲧⲉϩⲓⲏ ⲉⲩⲛϩⲟⲓⲛⲉ ⲛϩⲏⲧⲟⲩ ϣⲟⲟⲡ ϩⲙⲡⲟⲩⲉ .,Not Found,3
sahidica-new-testament,41_Mark_8,8,ⲉⲩⲟⲩⲱϣⲃ ⲇⲉ ⲛⲁϥ ⲛϭⲓⲛⲉϥⲙⲁⲑⲏⲧⲏⲥ ϫⲉⲛⲓⲙ ⲡⲉⲧⲛⲁϣⲧⲥⲓⲉⲛⲁⲓ ⲛⲟⲉⲓⲕ ⲙⲡⲉⲓⲙⲁ ϩⲛⲟⲩϫⲁⲓⲉ .,Not Found,4
sahidica-new-testament,41_Mark_8,8,ⲁϥϫⲛⲟⲩⲟⲩ ϫⲉⲟⲩⲛⲧⲏⲧⲛ ⲟⲩⲏⲣ ⲙⲙⲁⲩ ⲛⲟⲉⲓⲕ . ⲛⲧⲟⲟⲩ ⲇⲉ ⲡⲉϫⲁⲩ ϫⲉⲥⲁϣϥ .,Not Found,5
sahidica-new-testament,41_Mark_8,8,ⲁϥϩⲱⲛ ⲉⲧⲟⲟⲧϥ ⲙⲡⲙⲏⲏϣⲉ ⲉⲧⲣⲉⲩⲛⲟϫⲟⲩ ϩⲓⲡⲉⲥⲏⲧ ⲁϥϫⲓ ⲇⲉ ⲙⲡⲥⲁϣϥ ⲛⲟⲉⲓⲕ ⲁϥϣⲡϩⲙⲟⲧ ⲉϫⲱⲟⲩ ⲁϥⲡⲟϣⲟⲩ ⲁⲩⲱ ⲁϥⲧⲁⲁⲩ ⲛⲛⲉϥⲙⲁⲑⲏⲧⲏⲥ ϫⲉⲉⲩⲉⲕⲁⲁⲩ ϩⲁⲣⲱⲟⲩ . ⲁⲩⲱ ⲁⲩⲕⲁⲁⲩ ϩⲁⲣⲱϥ ⲙⲡⲙⲏⲏϣⲉ,Not Found,6
sahidica-new-testament,41_Mark_8,8,ⲛⲉⲩⲛⲧⲟⲩ ⲕⲉϣⲏⲙ ⲇⲉ ⲛⲧⲃⲧ ⲛⲧⲉⲣⲉϥⲥⲙⲟⲩ ⲇⲉ ⲉⲣⲟⲟⲩ ⲁϥⲟⲩⲉϩⲥⲁϩⲛⲉ ⲉⲕⲁⲛⲉⲓⲕⲟⲟⲩⲉ ϩⲁⲣⲱⲟⲩ .,Not Found,7
sahidica-new-testament,41_Mark_8,8,ⲉⲩⲟⲩⲱⲙ ⲇⲉ ⲁⲩⲥⲉⲓ ⲁⲩⲱ ⲁⲩϥⲓ ⲛⲛⲗⲁⲕⲙ . ⲉⲛⲧⲁⲩⲣϩⲟⲩⲟ ⲉⲩⲛⲁⲣⲥⲁϣϥ ⲛⲃⲓⲣ,Not Found,8
sahidica-new-testament,41_Mark_8,8,ⲛⲉⲩⲛⲁⲣϩⲙⲉ ⲇⲉ ⲛϣⲉ ⲁⲩⲱ ⲁϥⲕⲁⲁⲩ ⲉⲃⲟⲗ .,Not Found,9
sahidica-new-testament,41_Mark_8,8,[..] ⲇⲉ ⲛⲧⲉⲣⲉϥⲁⲗⲉ ⲉⲡϫⲟⲉⲓ ⲙⲛⲛⲉϥⲙⲁⲑⲏⲧⲏⲥ ⲁϥⲉⲓ ⲉϩⲣⲁⲓ ⲉⲛⲥⲁ ⲛⲇⲁⲗⲙⲁⲛⲟⲩⲑⲁ .,Not Found,10
sahidica-new-testament,41_Mark_8,8,ⲁⲩⲉⲓ ⲉⲃⲟⲗ ⲛϭⲓⲛⲉⲫⲁⲣⲓⲥⲥⲁⲓⲟⲥ ⲁⲩⲁⲣⲭⲉⲓ ⲉϯⲧⲱⲛ ⲛⲙⲙⲁϥ ⲉⲩⲕⲱⲧⲉ ⲛⲥⲁⲟⲩⲙⲁⲉⲓⲛ ⲛⲧⲟⲟⲧϥ ⲉⲃⲟⲗ ϩⲛ ⲧⲡⲉ ⲉⲩⲡⲉⲓⲣⲁⲍⲉ ⲙⲙⲟϥ .,Not Found,11
sahidica-new-testament,41_Mark_8,8,ⲛⲧⲉⲣⲉϥⲁϣⲁϩⲟⲙ ϩⲙⲡⲉϥⲡⲛⲉⲩⲙⲁ ⲡⲉϫⲁϥ ϫⲉⲉⲧⲃⲉ ⲟⲩ ⲧⲉⲓⲅⲉⲛⲉⲁ ⲕⲱⲧⲉ ⲛⲥⲁⲟⲩⲙⲁⲉⲓⲛ ϩⲁⲙⲏⲛ ϯϫⲱ ⲙⲙⲟⲥ ⲛⲏⲧⲛ ϫⲉⲉϣⲱⲡⲉ ⲥⲉⲛⲁϯⲙⲁⲉⲓⲛ ⲛⲧⲉⲓⲅⲉⲛⲉⲁ .,Not Found,12
sahidica-new-testament,41_Mark_8,8,ⲛⲧⲉⲣⲉϥⲗⲟ ϩⲁⲣⲟⲟⲩ ⲁϥⲧⲁⲗⲉ ⲟⲛ ⲉⲡϫⲟⲉⲓ ⲁϥⲃⲱⲕ ⲉⲡⲉⲓⲕⲣⲟ,Not Found,13
sahidica-new-testament,41_Mark_8,8,ⲁⲩⲣⲡⲱⲃϣ ⲛϫⲓⲟⲉⲓⲕ ⲛⲁⲩ . ⲁⲩⲱ ⲛⲉ ⲙⲙⲛⲧⲁⲩ ⲙⲙⲁⲩ ⲛⲥⲁⲟⲩⲟⲉⲓⲕ ⲟⲩⲱⲧ ϩⲙⲡϫⲟⲉⲓ,Not Found,14
sahidica-new-testament,41_Mark_8,8,ⲁϥϩⲱⲛ ⲉⲧⲟⲟⲧⲟⲩ ⲉϥϫⲱ ⲙⲙⲟⲥ ϫⲉϭⲱϣⲧ ⲛⲧⲉⲧⲛϯϩⲧⲏⲧⲛ ⲉⲣⲱⲧⲛ ⲉⲡⲉⲑⲁⲃ ⲛⲛⲉⲫⲁⲣⲓⲥⲥⲁⲓⲟⲥ ⲙⲛⲡⲉⲑⲁⲃ ⲛϩⲏⲣⲱⲇⲏⲥ,Not Found,15
sahidica-new-testament,41_Mark_8,8,ⲁⲩⲙⲉⲕⲙⲟⲩⲕⲟⲩ ⲙⲛⲛⲉⲩⲉⲣⲏⲩ ϫⲉⲙⲛⲧⲟⲩⲟⲉⲓⲕ ⲙⲙⲁⲩ .,Not Found,16
sahidica-new-testament,41_Mark_8,8,ⲛⲧⲉⲣⲉϥⲉⲓⲙⲉ ⲇⲉ ⲡⲉϫⲁϥ ⲛⲁⲩ ϫⲉⲉⲧⲃⲉ ⲟⲩ ⲧⲉⲧⲛⲙⲟⲕⲙⲉⲕ ϫⲉⲙⲙⲛⲧⲏⲧⲛⲟⲉⲓⲕ ⲙⲙⲁⲩ . ⲛⲧⲉⲧⲛⲛⲟⲉⲓ ⲁⲛ ⲟⲩⲇⲉ ⲛⲧⲉⲧⲛϯ ⲁⲛ ⲛϩⲧⲏⲧⲛ ⲡⲉⲧⲛϩⲏⲧ ⲧⲏⲙ,Not Found,17
sahidica-new-testament,41_Mark_8,8,ⲉⲣⲉⲛⲉⲧⲛⲃⲁⲗ ⲙⲙⲱⲧⲛ ⲛⲧⲉⲧⲛⲉⲓⲱⲣϩ ⲁⲛ . ⲁⲩⲱ ⲉⲣⲉⲛⲉⲧⲛⲙⲁⲁϫⲉ ⲙⲙⲱⲧⲛ ⲛⲧⲉⲧⲛⲥⲱⲧⲙ ⲁⲛ ⲁⲩⲱ ⲛⲧⲉⲧⲛⲣⲡⲙⲉⲉⲩⲉ ⲁⲛ,Not Found,18
sahidica-new-testament,41_Mark_8,8,ⲛⲧⲉⲣⲓⲡⲉϣⲧⲓⲟⲩⲛⲟⲉⲓⲕ ⲉⲡϭⲓⲥⲧⲃⲁ ⲛⲣⲱⲙⲉ . ⲁⲧⲉⲧⲛϥⲓ ⲟⲩⲏⲣ ⲛⲕⲟⲧ ⲉⲩⲙⲉϩ ⲛⲗⲁⲕⲙ ⲡⲉϫⲁⲩ ⲛⲁϥ ϫⲉⲙⲛⲧⲥⲛⲟⲟⲩⲥ .,Not Found,19
