Book Category,Book Name,Chapter,Verse,Translation,Number
sahidica-new-testament,44_Acts of the Apostles_15,15,ⲉⲁⲩⲥϩⲁⲓ ⲉⲃⲟⲗ ϩⲓⲧⲟⲟⲧⲟⲩ ⲛⲟⲩⲉⲡⲓⲥⲧⲟⲗⲏ ⲛⲧⲉⲓϩⲉ ⲛⲁⲡⲟⲥⲧⲟⲗⲟⲥ ⲙⲛⲛⲉⲡⲣⲉⲥⲃⲩⲧⲉⲣⲟⲥ ⲉⲩⲥϩⲁⲓ ⲛⲛⲉⲥⲛⲏⲩ ⲉⲧϩⲛⲧⲁⲛⲧⲓⲟⲭⲓⲁ ⲙⲛⲧⲥⲩⲣⲓⲁ ⲙⲛⲧⲕⲓⲗⲓⲕⲓⲁ ⲛⲉⲧϣⲟⲟⲡ ⲉⲃⲟⲗ ϩⲛⲛϩⲉⲑⲛⲟⲥ ⲭⲁⲓⲣⲉⲧⲉ .,"They wrote these things by their hand: 'The apostles, the elders, and the brothers, to the brothers who are of the Gentiles in Antioch, Syria, and Cilicia: greetings.",23
sahidica-new-testament,44_Acts of the Apostles_15,15,ⲉⲡⲉⲓⲇⲏ ⲁⲛⲥⲱⲧⲙ ϫⲉⲁϩⲟⲓⲛⲉ ⲉⲃⲟⲗ ⲛϩⲏⲧⲛ ⲉⲓ ϣⲁⲣⲱⲧⲛ ⲁⲩϣⲧⲣⲧⲣ ⲧⲏⲩⲧⲛ ϩⲛϩⲉⲛϣⲁϫⲉ ⲉⲩϯⲙⲕⲁϩ ⲛⲛⲉⲧⲛⲯⲩⲭⲏ ⲙⲡⲛϩⲱⲛ ⲉⲧⲟⲟⲧⲟⲩ .,"Because we have heard that some who went out from us have troubled you with words, unsettling your souls, saying, 'You must be circumcised and keep the law,' to whom we gave no commandment;",24
sahidica-new-testament,44_Acts of the Apostles_15,15,ⲁⲥⲛⲇⲟⲕⲓ ⲛⲁⲛ ⲉⲁⲛⲉⲓ ⲉⲩⲙⲁ ⲛⲟⲩⲱⲧ ϩⲓⲟⲩⲥⲟⲡ ⲉⲧⲣⲉⲛⲥⲱⲧⲡ ⲛϩⲉⲛⲣⲱⲙⲉ ⲛⲧⲛⲧⲁⲩϩⲟⲟⲩ ϣⲁⲣⲱⲧⲛ . ⲙⲛⲛⲉⲛⲙⲉⲣⲁⲧⲉ ⲃⲁⲣⲛⲁⲃⲁⲥ ⲙⲛⲡⲁⲩⲗⲟⲥ .,"it seemed good to us, having come to one accord, to choose out men and send them to you with our beloved Barnabas and Paul,",25
sahidica-new-testament,44_Acts of the Apostles_15,15,ϩⲉⲛⲣⲱⲙⲉ ⲉⲁⲩϯ ⲛⲛⲉⲩⲯⲩⲭⲏ ϩⲁⲡⲣⲁⲛ ⲙⲡⲉⲛϫⲟⲉⲓⲥ ⲓⲏⲥⲟⲩⲥ .,men who have risked their lives for the name of our Lord Jesus Christ.,26
sahidica-new-testament,44_Acts of the Apostles_15,15,ⲁⲛⲧⲛⲛⲟⲟⲩ ⲇⲉ ⲛⲓⲟⲩⲇⲁⲥ ⲙⲛⲥⲓⲗⲁⲥ . ⲛⲧⲟⲟⲩ ϩⲱⲟⲩ ⲟⲛ ϩⲓⲧⲙⲡϣⲁϫⲉ ⲉⲩⲛⲁϫⲱ ⲛⲏⲧⲛ ⲛⲛⲁⲓ .,"We have sent therefore Judas and Silas, who themselves will also tell you the same things by word of mouth.",27
sahidica-new-testament,44_Acts of the Apostles_15,15,ⲁⲥⲛⲇⲟⲕⲓ ⲅⲁⲣ ⲙⲡⲉⲡⲛⲉⲩⲙⲁ ⲉⲧⲟⲩⲁⲁⲃ ⲁⲩⲱ ⲛⲁⲛ . ⲉⲧⲙⲧⲁⲗⲉ ⲗⲁⲁⲩ ⲛⲃⲁⲣⲟⲥ ⲉϫⲛⲧⲏⲩⲧⲛ ⲛⲥⲁⲛⲁⲓ ϩⲛⲟⲩϩⲧⲟⲣ .,"For it seemed good to the Holy Spirit, and to us, to lay no greater burden on you than these necessary things:",28
sahidica-new-testament,44_Acts of the Apostles_15,15,ⲉⲥⲁϩⲉ ⲧⲏⲩⲧⲛ ⲉⲃⲟⲗ ⲙⲙⲟⲟⲩ ⲛϣⲱⲱⲧ ⲛⲛⲉⲓⲇⲱⲗⲟⲛ ⲙⲛⲡⲉⲥⲛⲟϥ ⲙⲛⲛⲉϣⲁⲩⲙⲟⲩ ⲁⲩⲱ ⲧⲡⲟⲣⲛⲉⲓⲁ ⲙⲛⲛⲉⲧⲉⲧⲛⲟⲩⲁϣⲟⲩ ⲁⲛ ⲉⲧⲣⲉⲩϣⲱⲡⲉ ⲙⲙⲱⲧⲛ ⲙⲡⲣⲁⲁⲩ ⲛϭⲉ ⲛⲁⲓ ⲉⲧⲉⲧⲛϣⲁⲛϩⲁⲣⲉϩ ⲉⲣⲱⲧⲛ ⲉⲣⲟⲟⲩ ⲧⲉⲧⲛⲁⲣϣⲁⲩ ⲟⲩϫⲁⲓ .,"that you abstain from things sacrificed to idols, from blood, from things strangled, and from sexual immorality, from which if you keep yourselves, it will be well with you. Farewell.'",29
sahidica-new-testament,44_Acts of the Apostles_15,15,ⲛⲧⲟⲟⲩ ϭⲉ ⲛⲧⲉⲣⲟⲩⲕⲁⲁⲩ ⲉⲃⲟⲗ ⲁⲩⲉⲓ ⲉϩⲣⲁⲓ ⲉⲧⲁⲛⲧⲓⲟⲭⲓⲁ . ⲁⲩⲥⲉⲩϩ ⲡⲙⲏⲏϣⲉ . ⲁⲩϯ ⲛⲁⲩ ⲛⲧⲉⲡⲓⲥⲧⲟⲗⲏ,"So, when they were sent off, they came to Antioch. Having gathered the multitude together, they delivered the letter.",30
sahidica-new-testament,44_Acts of the Apostles_15,15,ⲁⲩⲱ ⲛⲧⲉⲣⲟⲩⲟϣⲥ ⲁⲩⲣⲁϣⲉ ⲉϩⲣⲁⲓ ⲉϫⲙⲡⲥⲟⲡⲥ .,"When they had read it, they rejoiced over the encouragement.",31
sahidica-new-testament,44_Acts of the Apostles_15,15,ⲓⲟⲩⲇⲁⲥ ⲇⲉ ⲙⲛⲥⲓⲗⲁⲥ ϩⲉⲛⲡⲣⲟⲫⲏⲧⲏⲥ ϩⲱⲟⲩ ⲛⲉ ⲉⲃⲟⲗ ϩⲓⲧⲛϩⲁϩ ⲛϣⲁϫⲉ . ⲁⲩⲥⲉⲡⲥ ⲛⲉⲥⲛⲏⲩ ⲁⲩⲱ ⲁⲩⲧⲁϫⲣⲟⲟⲩ .,"Judas and Silas, also being prophets themselves, encouraged the brothers with many words, and strengthened them.",32
sahidica-new-testament,44_Acts of the Apostles_15,15,ⲛⲧⲉⲣⲟⲩⲟⲩⲟⲉⲓϣ ⲇⲉ ⲁⲩϫⲟⲟⲩⲥⲉ ⲉⲃⲟⲗ ϩⲓⲧⲛⲛⲉⲥⲛⲏⲩ ϩⲛⲟⲩⲉⲓⲣⲏⲛⲏ ⲉϩⲣⲁⲓ ⲉⲧϩⲓⲉⲣⲟⲩⲥⲁⲗⲏⲙ ϣⲁⲛⲉⲛⲧⲁⲩⲧⲁⲟⲩⲟⲟⲩ .,"After they had spent some time there, they were sent back with greetings from the brothers to the apostles.",33
sahidica-new-testament,44_Acts of the Apostles_15,15,ⲁⲥⲛⲇⲟⲕⲓ ⲇⲉ ⲛⲥⲓⲗⲁⲥ ⲉⲧⲣⲉϥϭⲱ ⲙⲡⲙⲁ ⲉⲧⲙⲙⲁⲩ .,,34
sahidica-new-testament,44_Acts of the Apostles_15,15,ⲡⲁⲩⲗⲟⲥ ⲇⲉ ⲙⲛⲃⲁⲣⲛⲁⲃⲁⲥ ⲛⲉⲩϣⲟⲟⲡ ⲡⲉ ϩⲛⲧⲁⲛⲧⲓⲟⲭⲓⲁ . ⲉⲩϯⲥⲃⲱ ⲁⲩⲱ ⲉⲩⲉⲩⲁⲅⲅⲉⲗⲓⲍⲉ ⲙⲛϩⲉⲛⲕⲉⲙⲏⲏϣⲉ ⲙⲡϣⲁϫⲉ ⲙⲡⲛⲟⲩⲧⲉ .,"But Paul and Barnabas stayed in Antioch, teaching and preaching the word of the Lord, with many others also.",35
sahidica-new-testament,44_Acts of the Apostles_15,15,ⲙⲛⲛⲥⲁϩⲉⲛϩⲟⲟⲩ ⲇⲉ ⲡⲉϫⲉⲡⲁⲩⲗⲟⲥ ⲛⲃⲁⲣⲛⲁⲃⲁⲥ ϫⲉⲙⲁⲣⲛⲕⲟⲧⲛ ⲛⲧⲛϭⲙⲡϣⲓⲛⲉ ⲛⲛⲉⲥⲛⲏⲩ ⲕⲁⲧⲁⲡⲟⲗⲓⲥ ⲛⲓⲙ . ⲛⲁⲓ ⲛⲧⲁⲛⲧⲁϣⲉⲟⲉⲓϣ ⲛⲁⲩ ⲙⲡϣⲁϫⲉ ⲙⲡϫⲟⲉⲓⲥ ϫⲉⲥⲉⲣⲟⲩ .,"After some days Paul said to Barnabas, 'Let's return now and visit our brothers in every city in which we proclaimed the word of the Lord, to see how they are doing.'",36
sahidica-new-testament,44_Acts of the Apostles_15,15,ⲃⲁⲣⲛⲁⲃⲁⲥ ⲇⲉ ⲛⲉϥⲟⲩⲱϣ ⲉϫⲓ ⲛⲙⲙⲁϥ ⲛⲓⲱϩⲁⲛⲛⲏⲥ ⲡⲉϣⲁⲩⲙⲟⲩⲧⲉ ⲉⲣⲟϥ ϫⲉⲙⲁⲣⲕⲟⲥ .,"Barnabas planned to take John, who was called Mark, with them also.",37
sahidica-new-testament,44_Acts of the Apostles_15,15,ⲡⲁⲩⲗⲟⲥ ⲇⲉ ⲛⲉϥⲁⲝⲓⲟⲩ ⲉⲧⲙϫⲓ ⲡⲉⲛⲧⲁϥⲡⲱⲣϫ ⲉⲃⲟⲗ ⲙⲙⲟⲟⲩ ϫⲓⲛⲛⲧⲡⲁⲙⲫⲩⲗⲓⲁ ⲙⲡϥⲃⲱⲕ ⲛⲙⲙⲁⲩ ⲙⲡϩⲱⲃ .,"But Paul didn't think that it was a good idea to take with them someone who had withdrawn from them in Pamphylia, and didn't go with them to do the work.",38
sahidica-new-testament,44_Acts of the Apostles_15,15,ⲁⲩⲡⲁⲣⲟⲝⲩⲥⲙⲟⲥ ⲇⲉ ϣⲱⲡⲉ . ϩⲱⲥⲧⲉ ⲛⲥⲉⲥⲁϩⲱⲟⲩ ⲉⲃⲟⲗ ⲛⲛⲉⲩⲉⲣⲏⲩ . ⲃⲁⲣⲛⲁⲃⲁⲥ ⲙⲉⲛ ⲁϥϫⲓ ⲙⲙⲁⲣⲕⲟⲥ ⲁϥⲥϭⲏⲣ ⲉϩⲣⲁⲓ ⲉⲕⲩⲡⲣⲟⲥ .,"Then the contention grew so sharp that they separated from each other. Barnabas took Mark with him, and sailed away to Cyprus,",39
sahidica-new-testament,44_Acts of the Apostles_15,15,ⲡⲁⲩⲗⲟⲥ ⲇⲉ ⲁϥⲥⲱⲧⲡ ⲛⲥⲓⲗⲁⲥ . ⲁϥⲉⲓ ⲉⲃⲟⲗ ⲉⲩϯ ⲙⲙⲟϥ ⲛⲧⲉⲭⲁⲣⲓⲥ ⲙⲡϫⲟⲉⲓⲥ ϩⲓⲧⲛⲛⲉⲥⲛⲏⲩ .,"but Paul chose Silas, and went out, being commended by the brothers to the grace of God.",40
sahidica-new-testament,44_Acts of the Apostles_15,15,ⲁϥⲉⲓ ⲇⲉ ⲉⲃⲟⲗ ⲉⲧⲥⲩⲣⲓⲁ ⲙⲛⲧⲕⲓⲗⲓⲕⲓⲁ . ⲁϥⲧⲁϫⲣⲟ ⲛⲛⲉⲕⲕⲗⲏⲥⲓⲁ .,"He went through Syria and Cilicia, strengthening the assemblies.",41
sahidica-new-testament,47_2 Corinthians_13,13,ⲡⲙⲉϩϣⲟⲙⲛⲧ ⲡⲉ ⲡⲁⲓ ϯⲛⲏⲩ ϣⲁⲣⲱⲧⲛ ϩⲓⲧⲛⲧⲧⲁⲡⲣⲟ ⲙⲙⲛⲧⲣⲉ ⲥⲛⲁⲩ ⲏϣⲟⲙⲛⲧ ⲉⲣⲉϣⲁϫⲉ ⲛⲓⲙ ⲁϩⲉⲣⲁⲧϥ .,This is the third time I am coming to you. 'At the mouth of two or three witnesses shall every word be established.',1
sahidica-new-testament,47_2 Corinthians_13,13,ⲁⲓϫⲟⲟⲥ ⲅⲁⲣ ϫⲓⲛⲛϣⲟⲣⲡ ⲁⲩⲱ ⲟⲛ ϯϣⲣⲡ ϫⲱ ⲙⲙⲟⲥ ϩⲱⲥ ⲉⲉⲓϩⲁⲧⲉ ⲧⲏⲩⲧⲛ ⲙⲡⲙⲉϩⲥⲉⲡ ⲥⲛⲁⲩ ⲁⲩⲱ ⲟⲛ ⲛϯϩⲁⲧⲛ ⲧⲏⲩⲧⲛ ⲁⲛ ⲧⲉⲛⲟⲩ ⲉⲉⲓⲥϩⲁⲓ ⲛⲛⲉⲛⲧⲁⲩⲣⲛⲟⲃⲉ ϫⲓⲛⲛϣⲟⲣⲡ ⲁⲩⲱ ⲡⲕⲉⲥⲉⲉⲡⲉ ⲧⲏⲣϥ ϫⲉⲉⲓϣⲁⲛⲉⲓ ⲛⲕⲉⲥⲟⲡ ⲛϯⲛⲁϯⲥⲟ ⲁⲛ .,"I have said beforehand, and I do say beforehand, as when I was present the second time, so now, being absent, I write to those who have sinned before now, and to all the rest, that, if I come again, I will not spare;",2
sahidica-new-testament,47_2 Corinthians_13,13,ⲉⲃⲟⲗ ϫⲉⲧⲉⲧⲛϣⲓⲛⲉ ⲛⲥⲁⲧⲇⲟⲕⲓⲙⲏ ⲙⲡⲉⲭⲣⲓⲥⲧⲟⲥ ⲉⲧϣⲁϫⲉ ⲛϩⲏⲧ . ⲡⲁⲓ ⲉⲧⲉⲛϥⲟ ⲁⲛ ⲛⲁⲧϭⲟⲙ ⲉϩⲟⲩⲛ ⲉⲣⲱⲧⲛ . ⲁⲗⲗⲁ ϥϭⲙϭⲟⲙ ⲛϩⲏⲧ ⲧⲏⲩⲧⲛ .,"seeing that you seek a proof of Christ who speaks in me; who toward you is not weak, but is powerful in you.",3
sahidica-new-testament,47_2 Corinthians_13,13,ⲕⲁⲓⲅⲁⲣ ⲛⲧⲁⲩⲥⲧⲁⲩⲣⲟⲩ ⲙⲙⲟϥ ⲉⲃⲟⲗ ϩⲛⲟⲩⲁⲥⲑⲉⲛⲉⲓⲁ ⲁⲗⲗⲁ ϥⲟⲛϩ ⲉⲃⲟⲗ ϩⲛⲧϭⲟⲙ ⲙⲡⲛⲟⲩⲧⲉ ⲕⲁⲓⲅⲁⲣ ⲁⲛⲟⲛ ϩⲱⲱⲛ ⲧⲛϭⲟⲟⲃ ⲛϩⲏⲧϥ ⲁⲗⲗⲁ ⲧⲛⲛⲁⲱⲛϩ ⲛⲙⲙⲁϥ ⲉⲃⲟⲗ ϩⲛⲧϭⲟⲙ ⲙⲡⲛⲟⲩⲧⲉ ⲉϩⲟⲩⲛ ⲉⲣⲱⲧⲛ .,"For he was crucified through weakness, yet he lives through the power of God. For we also are weak in him, but we will live with him through the power of God toward you.",4
sahidica-new-testament,47_2 Corinthians_13,13,ϫⲛⲧ ⲧⲏⲩⲧⲛ ϫⲉⲧⲉⲧⲛϩⲛ ⲧⲡⲓⲥⲧⲓⲥ ⲇⲟⲕⲓⲙⲁⲍⲉ ⲙⲙⲱⲧⲛ ⲏⲛⲧⲉⲧⲛ ⲉⲓⲙⲉ ⲉⲣⲱⲧⲛ ⲁⲛ ϫⲉⲡⲉⲭⲣⲓⲥⲧⲟⲥ ⲓⲏⲥⲟⲩⲥ ⲛϩⲏⲧ ⲧⲏⲩⲧⲛ ⲉⲓⲙⲏⲧⲓ ϫⲉⲙⲉϣⲁⲕ ⲛⲧⲉⲧⲛϩⲉⲛϫⲟⲟⲩⲧ .,"Test your own selves, whether you are in the faith. Test your own selves. Or don't you know as to your own selves, that Jesus Christ is in you?--unless indeed you are disqualified.",5
sahidica-new-testament,47_2 Corinthians_13,13,ϯⲛⲁϩⲧⲉ ⲇⲉ ϫⲉⲧⲉⲧⲛⲁⲉⲓⲙⲉ ϫⲉⲁⲛⲟⲛ ⲁⲛϩⲉⲛϫⲟⲟⲩⲧ ⲁⲛ .,But I hope that you will know that we aren't disqualified.,6
sahidica-new-testament,47_2 Corinthians_13,13,ϯϣⲗⲏⲗ ⲇⲉ ⲉⲡⲛⲟⲩⲧⲉ ⲉⲧⲙⲧⲣⲉⲧⲛⲣ ⲗⲁⲁⲩ ⲙⲡⲉⲧϩⲟⲟⲩ ϫⲉⲕⲁⲁⲥ ⲁⲛ ⲁⲛⲟⲛ ⲉⲛⲉⲟⲩⲱⲛϩ ⲉⲃⲟⲗ ⲛⲥⲱⲧⲡ ⲁⲗⲗⲁ ϫⲉⲕⲁⲁⲥ ⲛⲧⲱⲧⲛ ⲉⲧⲉⲧⲛⲉⲣⲡ ⲡⲉⲧⲛⲁⲛⲟⲩϥ ⲁⲛⲟⲛ ⲇⲉ ⲛⲧⲛϣⲱⲡⲉ ϩⲱⲥ ⲥⲱⲧⲡ ⲁⲛ .,"Now I pray to God that you do no evil; not that we may appear approved, but that you may do that which is honorable, though we are as reprobate.",7
sahidica-new-testament,47_2 Corinthians_13,13,ⲙⲛϭⲟⲙ ⲅⲁⲣ ⲙⲙⲟⲛ ⲉϯ ⲟⲩⲃⲉ ⲧⲙⲉ . ⲁⲗⲗⲁ ⲉϫⲛⲧⲙⲉ .,"For we can do nothing against the truth, but for the truth.",8
sahidica-new-testament,47_2 Corinthians_13,13,ⲧⲛⲛⲁⲣⲁϣⲉ ⲅⲁⲣ ϩⲟⲧⲁⲛ ⲁⲛⲟⲛ ⲉⲛϣⲁⲛϭ ⲃⲃⲉ . ⲛⲧⲱⲧⲛ ⲇⲉ ⲛⲧⲉⲧⲛϣⲱⲡⲉ ⲉⲧⲉⲧⲛϫⲟⲟⲣ ⲡⲁⲓ ⲣⲱ ⲡⲉⲧⲛϣⲗⲏⲗ ⲉⲣⲟϥ ⲡⲉⲧⲛⲥⲟⲃⲧⲉ .,"For we rejoice when we are weak and you are strong. And this we also pray for, even your perfecting.",9
sahidica-new-testament,47_2 Corinthians_13,13,ⲉⲧⲃⲉⲡⲁⲓ ⲛϯϩⲁⲧⲉ ⲧⲏⲩⲧⲛ ⲁⲛ ϯⲥϩⲁⲓ ⲛⲛⲁⲓ . ϫⲉⲕⲁⲁⲥ ⲉⲛⲛⲁⲉⲓ ⲧⲁⲭⲣⲱ ϩⲛⲟⲩϣⲱⲱⲧ ⲉⲃⲟⲗ ⲕⲁⲧⲁⲧⲉⲝⲟⲩⲥⲓⲁ ⲉⲛⲧⲁⲡϫⲟⲉⲓⲥ ⲧⲁⲁⲥ ⲛⲁⲓ ⲉⲩⲕⲱⲧ ⲁⲩⲱ ⲉⲩϣⲟⲣϣⲣ ⲁⲛ .,"For this cause I write these things while absent, that I may not deal sharply when present, according to the authority which the Lord gave me for building up, and not for tearing down.",10
sahidica-new-testament,47_2 Corinthians_13,13,ⲧⲉⲛⲟⲩ ϭⲉ ⲛⲁⲥⲛⲏⲩ ⲣⲁϣⲉ ⲥⲃⲧⲉ ⲧⲏⲩⲧⲛ ⲥⲟⲡⲥ ⲙⲉⲉⲩⲉ ⲉⲡⲓⲙⲉⲉⲩⲉ ⲛⲟⲩⲱⲧ ⲁⲣⲓⲉⲓⲣⲏⲛⲏ ⲁⲩⲱ ⲡⲛⲟⲩⲧⲉ ⲛⲧⲉⲓⲣⲏⲛⲏ ⲙⲛⲧⲁⲅⲁⲡⲏ ⲛⲁϣⲱⲡⲉ ⲛⲙⲙⲏⲧⲛ . ⲁⲥⲡⲁⲍⲉ ⲛⲛⲉⲧⲛⲉⲣⲏⲩ ϩⲛⲟⲩⲡⲓ ⲉⲥⲟⲩⲁⲁⲃ .,"Finally, brothers, rejoice. Be perfected, be comforted, be of the same mind, live in peace, and the God of love and peace will be with you.",11
sahidica-new-testament,47_2 Corinthians_13,13,ⲥⲉϣⲓⲛⲉ ⲉⲣⲱⲧⲛ ⲛϭⲓⲛⲉⲧⲟⲩⲁⲁⲃ ⲧⲏⲣⲟⲩ .,Greet one another with a holy kiss.,12
sahidica-new-testament,47_2 Corinthians_13,13,ⲧⲉⲭⲁⲣⲓⲥ ⲙⲡⲉⲛϫⲟⲉⲓⲥ ⲓⲏⲥⲟⲩⲥ ⲡⲉⲭⲣⲓⲥⲧⲟⲥ ⲁⲩⲱ ⲧⲁⲅⲁⲡⲏ ⲙⲡⲛⲟⲩⲧⲉ ⲙⲛⲧⲕⲟⲓⲛⲱⲛⲓⲁ ⲙⲡⲉⲡⲛⲉⲩⲙⲁ ⲉⲧⲟⲩⲁⲁⲃ ⲛⲙⲙⲏⲧⲛ ⲧⲏⲣⲧⲛ .,All the saints greet you.,13
sahidica-new-testament,41_Mark_2,2,ⲛⲧⲉⲣⲉϥⲃⲱⲕ ⲇⲉ ⲉϩⲟⲩⲛ ⲉⲕⲁⲫⲁⲣⲛⲁⲟⲩⲙ ϩⲓϫⲛ ϩⲉⲛϩⲟⲟⲩ ⲁⲩⲥⲱⲧⲙ ϫⲉϥϩⲛⲟⲩⲏⲓ,"When he entered again into Capernaum after some days, it was heard that he was in the house.",1
sahidica-new-testament,41_Mark_2,2,ⲁⲩⲱ ⲁⲩⲙⲏⲏϣⲉ ⲥⲱⲟⲩϩ ⲙⲙⲁⲩ ϩⲱⲥⲧⲉ ⲛⲧⲉⲧⲙⲛⲉϣ ϩⲓⲣⲙⲡⲣⲟ ϣⲟⲡⲟⲩ . ⲁⲩⲱ ⲁϥϣⲁϫⲉ ⲛⲙⲙⲁⲩ ϩⲙⲡϣⲁϫⲉ .,"Immediately many were gathered together, so that there was no more room, not even around the door; and he spoke the word to them.",2
sahidica-new-testament,41_Mark_2,2,ⲁⲩⲉⲓⲛⲉ ⲇⲉ ⲉⲣⲁⲧϥ ⲛⲟⲩⲣⲱⲙⲉ ⲉϥⲥⲏϭ ⲉⲣⲉϥⲧⲟⲟⲩ ⲛⲣⲱⲙⲉ ϥⲓ ϩⲁⲣⲟϥ,"Four people came, carrying a paralytic to him.",3
sahidica-new-testament,41_Mark_2,2,ⲁⲩⲱ ⲙⲡⲟⲩϣⲃⲱⲕ ⲛⲁϥ ⲉϩⲟⲩⲛ ⲉⲧⲃⲉ ⲡⲙⲏⲏϣⲉ ⲁⲩϭⲉⲗⲡⲧⲟⲩⲉϩⲥⲟⲓ ⲉⲃⲟⲗ ⲙⲡⲙⲁ ⲉⲧϥⲛϩⲏⲧϥ ⲁⲩⲱ ⲛⲧⲉⲣⲟⲩϣⲟϫⲧ ⲁⲩⲭⲁⲗⲁ ⲙⲡⲉϭⲗⲟϭ ⲉⲡⲉⲥⲏⲧ ⲡⲉⲧⲉⲣⲉⲡⲉⲧⲥⲏϭ ⲛⲏϫ ϩⲓϫⲱϥ .,"When they could not come near to him for the crowd, they removed the roof where he was. When they had broken it up, they let down the mat that the paralytic was lying on.",4
sahidica-new-testament,41_Mark_2,2,ⲁⲩⲱ ⲓⲏⲥⲟⲩⲥ ⲛⲧⲉⲣⲉϥⲛⲁⲩ ⲉⲧⲉⲩⲡⲓⲥⲧⲓⲥ ⲡⲉϫⲁϥ ⲙⲡⲉⲧⲥⲏϭ ϫⲉⲡⲁϣⲏⲣⲉ ⲥⲉⲛⲁⲕⲁⲛⲉⲕⲛⲟⲃⲉ ⲛⲁⲕ ⲉⲃⲟⲗ .,"Jesus, seeing their faith, said to the paralytic, 'Son, your sins are forgiven you.'",5
sahidica-new-testament,41_Mark_2,2,ⲛⲉⲩⲛϩⲟⲓⲛⲉ ⲇⲉ ⲛⲛⲉⲅⲣⲁⲙⲙⲁⲧⲉⲩⲥ ϩⲙⲟⲟⲥ ⲙⲡⲙⲁ ⲉⲧⲙⲙⲁⲩ ⲉⲩⲙⲟⲕⲙⲉⲕ ϩⲛⲛⲉⲩϩⲏⲧ,"But there were some of the scribes sitting there, and reasoning in their hearts,",6
sahidica-new-testament,41_Mark_2,2,ϫⲉⲉⲧⲃⲉⲟⲩ ⲡⲁⲓ ϥϣⲁϫⲉ ϩⲓⲛⲁⲓ ⲉϥϫⲓⲟⲩⲁ ⲛⲓⲙ ⲡⲉⲧⲛⲁϣⲕⲁⲛⲟⲃⲉ ⲉⲃⲟⲗ ⲛⲥⲁⲡⲛⲟⲩⲧⲉ ⲙⲁⲩⲁⲁϥ .,Why does this man speak blasphemies like that? Who can forgive sins but God alone?',7
sahidica-new-testament,41_Mark_2,2,ⲁⲩⲱ ⲛⲧⲉⲩⲛⲟⲩ ⲛⲧⲉⲣⲉϥⲉⲓⲙⲉ ϩⲙⲡⲉϥⲡⲛⲉⲩⲙⲁ ϫⲉⲥⲉⲙⲟⲕⲙⲉⲕ ϩⲣⲁⲓ ⲛϩⲏⲧⲟⲩ ⲡⲉϫⲁϥ ⲛⲁⲩ ϫⲉⲉⲧⲃⲉⲟⲩ ⲧⲉⲧⲛⲙⲉⲉⲩⲉ ⲉⲛⲁⲓ ϩⲛⲛⲉⲧⲛϩⲏⲧ,"Immediately Jesus, perceiving in his spirit that they so reasoned within themselves, said to them, 'Why do you reason these things in your hearts?",8
sahidica-new-testament,41_Mark_2,2,ⲁϣ ⲅⲁⲣ ⲡⲉⲧⲙⲟⲧⲛ ⲉϫⲟⲟⲥ ⲙⲡⲉⲧⲥⲏϭ ϫⲉⲧⲱⲟⲩⲛ ⲛⲅϥⲓⲡⲉⲕϭⲗⲟϭ ⲛⲅⲙⲟⲟϣⲉ ϫⲛⲉϫⲟⲟⲥ ϫⲉⲥⲉⲛⲁⲕⲁⲛⲉⲕⲛⲟⲃⲉ ⲛⲁⲕ ⲉⲃⲟⲗ,"Which is easier, to tell the paralytic, 'Your sins are forgiven;' or to say, 'Arise, and take up your bed, and walk?'",9
sahidica-new-testament,41_Mark_2,2,ϫⲉⲕⲁⲁⲥ ⲇⲉ ⲉⲧⲉⲧⲛⲉⲛⲁⲩ ϫⲉⲟⲩⲛⲧϥⲉⲝⲟⲩⲥⲓⲁ ⲙⲙⲁⲩ ⲛϭⲓⲡϣⲏⲣⲉ ⲙⲡⲣⲱⲙⲉ ⲉⲕⲁⲛⲟⲃⲉ ⲉⲃⲟⲗ ϩⲓϫⲙⲡⲕⲁϩ ⲡⲉϫⲁϥ ⲙⲡⲉⲧⲥⲏϭ,But that you may know that the Son of Man has authority on earth to forgive sins'--he said to the paralytic--,10
sahidica-new-testament,41_Mark_2,2,ϫⲉⲧⲱⲟⲩⲛ ⲉⲓϫⲉⲣⲟⲕ ϥⲓ ⲙⲡⲉⲕϭⲗⲟϭ ⲃⲱⲕ ⲉⲡⲉⲕⲏⲓ,"I tell you, arise, take up your mat, and go to your house.'",11
sahidica-new-testament,41_Mark_2,2,ⲁⲩⲱ ⲁϥⲧⲱⲟⲩⲛ ⲛⲧⲉⲩⲛⲟⲩ ⲁϥⲧⲁⲗⲉⲡⲉϥϭⲗⲟϭ ⲉϫⲱϥ ⲁϥⲉⲓ ⲉⲃⲟⲗ ϩⲓⲧϩⲏ ⲙⲙⲟⲟⲩ ⲧⲏⲣⲟⲩ ϩⲱⲥⲧⲉ ⲛⲥⲉⲣϣⲡⲏⲣⲉ ⲧⲏⲣⲟⲩ ⲛⲥⲉϯⲉⲟⲟⲩ ⲙⲡⲛⲟⲩⲧⲉ ⲉⲩϫⲱ ⲙⲙⲟⲥ ϫⲉⲙⲡⲛⲛⲁⲩ ⲉⲟⲩⲟⲛ ⲉⲛⲉϩ ϩⲓⲛⲁⲓ .,"He arose, and immediately took up the mat, and went out in front of them all; so that they were all amazed, and glorified God, saying, 'We never saw anything like this!'",12
sahidica-new-testament,41_Mark_2,2,ⲁϥⲉⲓ ⲟⲛ ⲉⲃⲟⲗ ϩⲁⲧⲛⲧⲑⲁⲗⲁⲥⲥⲁ ⲁⲩⲱ ⲡⲙⲏⲏϣⲉ ⲧⲏⲣϥ ⲁⲩⲥⲱⲟⲩϩ ⲉⲣⲟϥ ⲁϥϯⲥⲃⲱ ⲛⲁⲩ,"He went out again by the seaside. All the multitude came to him, and he taught them.",13
sahidica-new-testament,41_Mark_2,2,ⲁⲩⲱ ⲉϥⲡⲁⲣⲁⲅⲉ ⲁϥⲛⲁⲩ ⲉⲗⲉⲟⲩⲉⲓ ⲡϣⲏⲣⲉ ⲛⲁⲗⲫⲁⲓⲟⲥ ⲉϥϩⲙⲟⲟⲥ ϩⲓⲡⲉϥⲧⲉⲗⲱⲛⲓⲟⲛ ⲡⲉϫⲁϥ ⲛⲁϥ ϫⲉⲟⲩⲁϩⲕ ⲛⲥⲱⲉⲓ ⲁⲩⲱ ⲁϥⲧⲱⲟⲩⲛ ⲁϥⲟⲩⲁϩϥ ⲛⲥⲱϥ .,"As he passed by, he saw Levi, the son of Alphaeus, sitting at the tax office, and he said to him, 'Follow me.' And he arose and followed him.",14
sahidica-new-testament,41_Mark_2,2,ⲁⲥϣⲱⲡⲉ ⲇⲉ ⲉϥⲛⲏϫ ϩⲙⲡⲉϥⲏⲓ ⲁϩⲁϩⲛⲧⲉⲗⲱⲛⲏⲥ ϩⲓⲣⲉϥⲣⲛⲟⲃⲉ ⲛⲟϫⲟⲩ ⲙⲛⲓⲏⲥⲟⲩⲥ ⲙⲛⲛⲉϥⲙⲁⲑⲏⲧⲏⲥ ⲛⲉⲩⲟϣ ⲅⲁⲣ . ⲁⲩⲱ ⲁⲩⲁϩⲟⲩ ⲛⲥⲱϥ,"It happened, that he was reclining at the table in his house, and many tax collectors and sinners sat down with Jesus and his disciples, for there were many, and they followed him.",15
sahidica-new-testament,41_Mark_2,2,ⲛⲉⲅⲣⲁⲙⲙⲁⲧⲉⲩⲥ ⲙⲛⲛⲉⲫⲁⲣⲓⲥⲥⲁⲓⲟⲥ ⲛⲧⲉⲣⲟⲩⲛⲁⲩ ϫⲉϥⲟⲩⲱⲙ ⲙⲛⲛⲣⲉϥⲣⲛⲟⲃⲉ ⲁⲩⲱ ⲛⲧⲉⲗⲱⲛⲏⲥ ⲡⲉϫⲁⲩ ⲛⲛⲉϥⲙⲁⲑⲏⲧⲏⲥ ϫⲉⲉⲧⲃⲉⲟⲩ ϥⲟⲩⲱⲙ ⲁⲩⲱ ϥⲥⲱ ⲙⲛⲛⲣⲉϥⲣⲛⲟⲃⲉ ⲁⲩⲱ ⲛⲧⲉⲗⲱⲛⲏⲥ,"The scribes and the Pharisees, when they saw that he was eating with the sinners and tax collectors, said to his disciples, 'Why is it that he eats and drinks with tax collectors and sinners?'",16
sahidica-new-testament,41_Mark_2,2,ⲁⲩⲱ ⲓⲏⲥⲟⲩⲥ ⲛⲧⲉⲣⲉϥⲥⲱⲧⲙ ⲡⲉϫⲁϥ ⲛⲁⲩ ϫⲉⲛⲥⲉⲣⲭⲣⲉⲓⲁ ⲁⲛ ⲛϭⲓⲛⲉⲧⲧⲏⲕ ⲙⲡⲥⲁⲓⲛ ⲁⲗⲗⲁ ⲛⲉⲧϣⲟⲟⲡ ⲕⲁⲕⲱⲥ ⲛⲧⲁⲓⲉⲓ ⲁⲛ ⲉⲧⲉϩⲙⲛⲇⲓⲕⲁⲓⲟⲥ ⲁⲗⲗⲁ ⲛⲣⲉϥⲣⲛⲟⲃⲉ .,"When Jesus heard it, he said to them, 'Those who are healthy have no need for a physician, but those who are sick. I came not to call the righteous, but sinners to repentance.'",17
sahidica-new-testament,41_Mark_2,2,ⲁⲩⲱ ⲙⲙⲁⲑⲏⲧⲏⲥ ⲛⲓⲱϩⲁⲛⲛⲏⲥ ⲛⲙⲛⲁⲛⲉⲫⲁⲣⲓⲥⲥⲁⲓⲟⲥ ⲛⲉⲩⲛⲏⲥⲧⲉⲩⲉ . ⲁⲩⲉⲓ ⲇⲉ ⲛⲁϥ ⲉⲩϫⲱ ⲙⲙⲟⲥ ϫⲉⲉⲧⲃⲉⲟⲩ ⲙⲙⲁⲑⲏⲧⲏⲥ ⲛⲓⲱϩⲁⲛⲛⲏⲥ ⲁⲩⲱ ⲙⲙⲁⲑⲏⲧⲏⲥ ⲛⲛⲉⲫⲁⲣⲓⲥⲥⲁⲓⲟⲥ ⲥⲉⲛⲏⲥⲧⲉⲩⲉ ⲛⲉⲕⲙⲁⲑⲏⲧⲏⲥ ⲇⲉ ⲛⲥⲉⲛⲏⲥⲧⲉⲩⲉ ⲁⲛ,"John's disciples and the Pharisees were fasting, and they came and asked him, 'Why do John's disciples and the disciples of the Pharisees fast, but your disciples don't fast?'",18
sahidica-new-testament,41_Mark_2,2,ⲡⲉϫⲉⲓⲏⲥⲟⲩⲥ ⲛⲁⲩ ϫⲉⲙⲏ ⲟⲩⲛϭⲟⲙ ⲉⲧⲣⲉⲩⲛⲏⲥⲧⲉⲩⲉ ⲛϭⲓ ⲛϣⲏⲣⲉ ⲙⲡⲙⲁ ⲛϣⲉⲗⲉⲉⲧ ϩⲟⲥⲟⲛ ⲉⲣⲉⲡⲁⲧϣⲉⲗⲉⲉⲧ ⲛⲙⲙⲁⲩ . ϩⲟⲥⲟⲛ ⲡⲁⲧϣⲉⲗⲉⲉⲧ ⲛⲙⲙⲁⲩ ⲛⲥⲉⲛⲁϣⲛⲏⲥⲧⲉⲩⲉ ⲁⲛ .,"Jesus said to them, 'Can the groomsmen fast while the bridegroom is with them? As long as they have the bridegroom with them, they can't fast.",19
sahidica-new-testament,41_Mark_2,2,ⲟⲩⲛϩⲉⲛϩⲟⲟⲩ ⲇⲉ ⲛⲏⲩ ϩⲟⲧⲁⲛ ⲉⲩϣⲁⲛϥⲓ ⲛⲧⲟⲟⲧⲟⲩ ⲙⲡⲁⲧϣⲉⲗⲉⲉⲧ ⲧⲟⲧⲉ ⲥⲉⲛⲁⲛⲏⲥⲧⲉⲩⲉ ϩⲛⲛⲉϩⲟⲟⲩ ⲉⲧⲙⲙⲁⲩ,"But the days will come when the bridegroom will be taken away from them, and then will they fast in that day.",20
sahidica-new-testament,41_Mark_2,2,ⲙⲉⲣⲉⲗⲁⲁⲩ ⲛⲉϫⲧⲟⲉⲓⲥ ⲛϣⲁⲉⲓ ⲉⲣⲛϣⲧⲏⲛ ⲙⲡⲗϭⲉ ⲉϣⲱⲡⲉ ⲙⲙⲟⲛ ⲧⲧⲟⲉⲓⲥ ⲛϣⲁⲓ ⲛⲁϥⲓⲡⲕⲱⲧⲉ ⲙⲙⲁⲩ ⲛⲧⲉϣⲧⲏⲛ ⲙⲡⲗϭⲉ ⲛⲥⲡⲱϩ ⲛϩⲟⲩⲟ .,"No one sews a piece of unshrunk cloth on an old garment, or else the patch shrinks and the new tears away from the old, and a worse hole is made.",21
sahidica-new-testament,41_Mark_2,2,ⲁⲩⲱ ⲙⲉⲣⲉⲗⲁⲁⲩ ⲛⲉϫⲏⲣⲡ ⲛⲃⲣⲣⲉ ⲉϩⲱⲧ ⲛⲁⲥ ⲉϣⲱⲡⲉ ⲙⲙⲟⲛ ⲡⲏⲣⲡ ⲛⲁⲡⲉϩⲛϩⲱⲧ ⲛⲧⲉⲡⲏⲣⲡ ⲡⲱⲛ ⲉⲃⲟⲗ ⲛⲧⲉⲛϩⲱⲧ ⲧⲁⲕⲟ . ⲁⲗⲗⲁ ⲉϣⲁⲩⲛⲉϫⲏⲣⲡ ⲛⲃⲣⲣⲉ ⲉϩⲱⲧ ⲛⲃⲣⲣⲉ .,"No one puts new wine into old wineskins, or else the new wine will burst the skins, and the wine pours out, and the skins will be destroyed; but they put new wine into fresh wineskins.'",22
sahidica-new-testament,41_Mark_2,2,ⲁⲩⲱ ⲁⲥϣⲱⲡⲉ ϩⲛⲛⲥⲁⲃⲃⲁⲧⲟⲛ ⲉⲧⲣⲉϥⲙⲟⲟϣⲉ ⲉⲃⲟⲗ ϩⲛⲛⲓⲱϩⲉ ⲉⲧⲣⲏⲧ ⲁⲩⲱ ⲛⲉϥⲙⲁⲑⲏⲧⲏⲥ ⲉⲩⲙⲟⲟϣⲉ ⲁⲩⲁⲣⲭⲓⲧⲗⲕϩⲙⲥ .,"It happened that he was going on the Sabbath day through the grain fields, and his disciples began, as they went, to pluck the ears of grain.",23
sahidica-new-testament,41_Mark_2,2,ⲛⲉⲫⲁⲣⲣⲓⲥⲁⲓⲟⲥ ⲇⲉ ⲡⲉϫⲁⲩ ⲛⲁϥ ϫⲉⲁⲛⲁⲩ ϫⲉⲉⲩⲣⲟⲩ ϩⲛⲛⲥⲁⲃⲃⲁⲧⲟⲛ ⲉⲟⲩⲕ ⲉⲝⲉⲥⲧⲓ ⲉⲁⲁϥ .,"The Pharisees said to him, 'Behold, why do they do that which is not lawful on the Sabbath day?'",24
sahidica-new-testament,41_Mark_2,2,ⲡⲉϫⲁϥ ⲛⲁⲩ ϫⲉⲙⲡⲉⲧⲛⲟϣϥ ⲗⲁⲁⲩ ϫⲉⲛⲧⲁⲇⲁⲩⲉⲓⲇ ⲣⲟⲩ ⲛⲧⲉⲣⲉϥϩⲕⲟ ⲛⲧⲟϥ ⲙⲛⲛⲉⲧⲛⲙⲙⲁϥ,"He said to them, 'Did you never read what David did, when he had need, and was hungry--he, and those who were with him?",25
sahidica-new-testament,41_Mark_2,2,ϫⲉⲛⲁϣ ⲛϩⲉ ⲁϥⲃⲱⲕ ⲉϩⲟⲩⲛ ⲉⲡⲏⲓ ⲙⲡⲛⲟⲩⲧⲉ ϩⲓⲁⲃⲓⲁⲑⲁⲣ ⲡⲁⲣⲭⲓⲉⲣⲉⲩⲥ ⲁⲩⲱ ⲛⲟⲉⲓⲕ ⲛⲧⲉⲡⲣⲟⲑⲉⲥⲓⲥ ⲁϥⲟⲩⲟⲙⲟⲩ ⲉⲟⲩⲕ ⲉⲝⲉⲥⲧⲓ ⲛⲁϥ ⲉⲟⲩⲟⲙⲟⲩ ⲛⲥⲁⲛⲟⲩⲏⲏⲃ ⲁⲩⲱ ⲁϥϯ ⲛⲛⲕⲟⲟⲩⲉ ⲉⲧⲛⲙⲙⲁϥ .,"How he entered into the house of God when Abiathar was high priest, and ate the show bread, which is not lawful to eat except for the priests, and gave also to those who were with him?'",26
sahidica-new-testament,41_Mark_2,2,ⲡⲉϫⲁϥ ⲟⲛ ⲛⲁⲩ ϫⲉⲡⲥⲁⲃⲃⲁⲧⲟⲛ ⲛⲧⲁϥϣⲱⲡⲉ ⲉⲧⲃⲉ ⲡⲣⲱⲙⲉ . ⲁⲩⲱ ⲛⲧⲁⲡⲣⲱⲙⲉ ϣⲱⲡⲉ ⲁⲛ ⲉⲧⲃⲉ ⲡⲥⲁⲃⲃⲁⲧⲟⲛ .,"He said to them, 'The Sabbath was made for man, not man for the Sabbath.",27
sahidica-new-testament,41_Mark_2,2,ϩⲱⲥⲧⲉ ⲡϣⲏⲣⲉ ⲙⲡⲣⲱⲙⲉ ⲡϫⲟⲉⲓⲥ ⲡⲉ ⲙⲡⲕⲉⲥⲁⲃⲃⲁⲧⲟⲛ .,Therefore the Son of Man is lord even of the Sabbath.',28
sahidica-new-testament,61_2 Peter_2,2,ⲁⲩϣⲱⲡⲉ ⲇⲉ ⲛϭⲓϩⲉⲛⲡⲣⲟⲫⲏⲧⲏⲥ ⲛⲛⲟⲩϫ ⲕⲁⲧⲁⲧϩⲉ ⲉⲧⲉⲟⲩⲛ ϩⲉⲛⲥⲁϩ ⲛⲛⲟⲩϫ ⲛⲁϣⲱⲡⲉ ⲛϩⲏⲧ ⲧⲏⲩⲧⲛ ⲛⲁⲓ ⲉⲧⲛⲁⲉⲓⲛⲉ ⲉϩⲟⲩ ⲛϩⲉⲛϩⲉⲣⲏⲥⲓⲥ ⲛⲧⲁⲕⲟ ⲁⲩⲱ ⲉⲩⲁⲣⲛⲁ ⲙⲡϫⲟⲉⲓⲥ ⲛⲧⲁϥϣⲟⲡⲟⲩ ⲉⲩⲉⲓⲛⲉ ⲉϩⲣⲁⲓ ⲉϫⲱⲟⲩ ⲛⲛⲟⲩⲧⲁⲕⲟ ⲏⲛ ⲟⲩϭⲉⲡⲏ,"But false prophets also arose among the people, as false teachers will also be among you, who will secretly bring in destructive heresies, denying even the Master who bought them, bringing on themselves swift destruction.",1
