Book Category,Book Name,Chapter,Verse,Translation,Number
sahidica-new-testament,41_Mark_12,12,ⲁϥϫⲉⲩⲕⲉⲟⲩⲁ ⲁⲩⲱ ⲡⲕⲉⲧ ⲁⲩⲙⲟⲟⲩⲧϥ ⲙⲛϩⲉⲛⲕⲟⲟⲩⲉ ⲧⲏⲣⲟⲩ ϩⲟⲓⲛⲉ ⲙⲉⲛ ⲉⲩϩⲓⲟⲩⲉ ⲉⲣⲟⲟⲩ ϩⲉⲛⲕⲟⲟⲩⲉ ⲇⲉ ⲉⲩⲙⲟⲟⲩⲧ ⲙⲙⲟⲟⲩ .,Not Found,5
sahidica-new-testament,41_Mark_12,12,ⲉⲧⲓ ⲛⲉⲟⲩⲛⲧϥ ⲟⲩϣⲏⲣⲉ ⲙⲙⲁⲩ ⲙⲙⲉⲣⲓⲧ ⲁϥϫⲟⲟⲩϥ ⲉⲣⲁⲧⲟⲩ . ⲙⲛⲛⲥⲱⲟⲩ ⲉϥϫⲱ ⲙⲙⲟⲥ ϫⲉⲥⲉⲛⲁϣⲓⲡⲉ ϩⲏⲧϥ ⲙⲡⲁϣⲏⲣⲉ .,Not Found,6
sahidica-new-testament,41_Mark_12,12,ⲛⲉϭⲙⲏⲩ ⲇⲉ ⲉⲧⲙⲙⲁⲩ ⲁⲩϣⲁϫⲉ ⲙⲛⲛⲉⲩⲉⲣⲏⲩ ⲉⲩϫⲱ ⲙⲙⲟⲥ ϫⲉⲡⲁⲓ ⲡⲉ ⲡⲉⲕⲗⲏⲣⲟⲛⲟⲙⲟⲥ . ⲁⲙⲏⲓⲧⲛ ⲛⲧⲛⲙⲟⲟⲩⲧϥ . ⲁⲩⲱ ⲧⲉⲕⲗⲏⲣⲟⲛⲟⲙⲓⲁ ⲛⲁⲣⲧⲱⲛ .,Not Found,7
sahidica-new-testament,41_Mark_12,12,ⲛⲧⲉⲣⲟⲩⲁⲙⲁϩⲧⲉ ⲇⲉ ⲙⲙⲟϥ ⲁⲩⲙⲟⲟⲩⲧϥ ⲁⲩⲱ ⲁⲩⲛⲟϫϥ ⲉⲡⲃⲟⲗ ⲙⲡⲙⲁ ⲛⲉⲗⲟⲟⲗⲉ .,Not Found,8
sahidica-new-testament,41_Mark_12,12,ⲟⲩ ⲡⲉⲧⲉⲣⲉⲡϫⲟⲉⲓⲥ ⲙⲡⲙⲁ ⲛⲉⲗⲟⲟⲗⲉ ⲛⲁⲁⲁϥ . ϥⲛⲏⲩ ⲛϥⲧⲁⲕⲉⲛⲉϭⲙⲏⲩ ⲛϥϯ ⲙⲡⲙⲁ ⲛⲉⲗⲟⲟⲗⲉ ⲛϩⲉⲛⲕⲟⲟⲩⲉ .,Not Found,9
sahidica-new-testament,41_Mark_12,12,ⲧⲉⲓⲅⲣⲁⲫⲏ ⲇⲉ ⲟⲛ ⲙⲡⲉⲧⲛⲟϣⲥ . ϫⲉⲡⲱⲛⲉ ⲛⲧⲁⲛⲉⲧⲕⲱⲧ ⲥⲧⲟϥ ⲉⲃⲟⲗ ⲁϥϣⲱⲡⲉ ⲉⲩⲁⲡⲉ ⲛⲕⲟⲟϩ .,Not Found,10
sahidica-new-testament,41_Mark_12,12,ⲛⲧⲁⲡⲁⲓϣⲱⲡⲉ ϩⲓⲧⲟⲟⲧϥ ⲙⲡϫⲟⲉⲓⲥ ⲁⲩⲱ ⲟⲩϣⲡⲏⲣⲉ ⲡⲉ ⲙⲡⲉⲧⲛⲙⲧⲟ ⲉⲃⲟⲗ .,Not Found,11
sahidica-new-testament,41_Mark_12,12,ⲁⲩⲟⲩⲱϣ ⲇⲉ ⲉⲁⲙⲁϩⲧⲉ ⲙⲙⲟϥ ⲁⲩⲱ ⲁⲩⲣϩⲟⲧⲉ ϩⲏⲧϥ ⲙⲡⲙⲏⲏϣⲉ . ⲁⲩⲉⲓⲙⲉ ⲅⲁⲣ ϫⲉⲛⲧⲁϥϫⲉⲧⲉⲓⲡⲁⲣⲁⲃⲟⲗⲏ ⲉⲧⲃⲏⲏⲧⲟⲩ . ⲁⲩⲱ ⲛⲧⲉⲣⲟⲩⲕⲁⲁϥ ⲁⲩⲃⲱⲕ,Not Found,12
sahidica-new-testament,41_Mark_12,12,ⲁⲩⲱ ⲁⲩϫⲉⲩϩⲟⲓⲛⲉ ⲉⲣⲁⲧϥ ⲛϭⲓⲛⲉⲫⲁⲣⲓⲥⲥⲁⲓⲟⲥ ⲙⲛⲛϩⲏⲣⲱⲇⲓⲁⲛⲟⲥ ⲉⲧⲣⲉⲩϭⲟⲡϥ ϩⲛⲟⲩϣⲁϫⲉ .,Not Found,13
sahidica-new-testament,41_Mark_12,12,ⲁⲩⲱ ⲛⲧⲉⲣⲟⲩϯ ⲡⲉⲩⲟⲩⲟⲉⲓ ⲉⲣⲟϥ ⲡⲉϫⲁⲩ ⲛⲁϥ ϫⲉⲡⲥⲁϩ ⲧⲛⲥⲟⲟⲩⲛ ϫⲉⲛⲧⲕⲟⲩⲣⲙⲙⲙⲉ ⲁⲩⲱ ⲛⲅϩⲏϭⲉ ⲁⲛ ϩⲏⲧϥ ⲛⲗⲁⲁⲩ ⲛⲅϫⲓϩⲟ ⲅⲁⲣ ⲁⲛ ⲛⲣⲱⲙⲉ ⲁⲗⲗⲁ ϩⲛⲟⲩⲙⲉ ⲉⲕϯⲥⲃⲱ ⲛⲧⲉϩⲓⲏ ⲙⲡⲛⲟⲩⲧⲉ ⲉⲝⲉⲥⲧⲓ ⲉϯⲕⲏⲛⲥⲟⲥ ⲙⲡⲣⲣⲟ ϫⲛⲙⲙⲟⲛ ⲧⲁⲣⲛϯ ϫⲛⲙⲡⲱⲣ .,Not Found,14
sahidica-new-testament,41_Mark_12,12,ⲛⲧⲟϥ ⲇⲉ ⲉϥⲥⲟⲟⲩⲛ ⲛⲧⲉⲩϩⲩⲡⲟⲕⲣⲓⲥⲓⲥ ⲡⲉϫⲁϥ ⲛⲁⲩ ϫⲉⲉⲧⲃⲉⲟⲩ ⲧⲉⲧⲛⲡⲉⲓⲣⲁⲍⲉ ⲙⲙⲟⲓ ⲁⲛⲓⲟⲩⲥⲁⲧⲉⲉⲣⲉ ⲛⲁⲓ ϫⲉⲉⲓⲉⲛⲁⲩ ⲉⲣⲟⲥ .,Not Found,15
sahidica-new-testament,41_Mark_12,12,ⲛⲧⲟⲟⲩ ⲇⲉ ⲥⲟⲩⲧⲱⲛⲥ ⲉⲣⲟϥ ⲁⲩⲱ ⲡⲉϫⲁϥ ⲛⲁⲩ ϫⲉⲧⲁⲛⲓⲙ ⲧⲉ ⲧⲉⲓϩⲓⲕⲱⲛ ⲙⲛⲛⲉⲓⲥϩⲁⲓ . ⲛⲧⲟⲟⲩ ⲇⲉ ⲡⲉϫⲁⲩ ⲛⲁϥ ϫⲉⲧⲁⲡⲣⲣⲟ ⲧⲉ .,Not Found,16
sahidica-new-testament,41_Mark_12,12,ⲓⲏⲥⲟⲩⲥ ⲇⲉ ⲡⲉϫⲁϥ ⲛⲁⲩ ϫⲉϯⲛⲁⲡⲣⲣⲟ ϭⲉ ⲙⲡⲣⲣⲟ ⲁⲩⲱ ⲛⲁⲡⲛⲟⲩⲧⲉ ⲙⲡⲛⲟⲩⲧⲉ . ⲁⲩⲱ ⲁⲩⲣϣⲡⲏⲣⲉ ⲙⲙⲟϥ .,Not Found,17
sahidica-new-testament,41_Mark_12,12,ⲁⲩⲉⲓ ⲇⲉ ϣⲁⲣⲟϥ ⲛϭⲓⲛⲥⲁⲇⲇⲟⲩⲕⲁⲓⲟⲥ ⲛⲉⲧϫⲱⲙⲙⲟⲥ ϫⲉⲙⲙⲛⲁⲛⲁⲥⲧⲁⲥⲓⲥ ⲛⲁϣⲱⲡⲉ . ⲁⲩⲱ ⲁⲩϫⲛⲟⲩϥ ⲉⲩϫⲱ ⲙⲙⲟⲥ,Not Found,18
sahidica-new-testament,41_Mark_12,12,ϫⲉⲡⲥⲁϩ ⲙⲱⲩⲥⲏⲥ ⲁϥⲥϩⲁⲓ ⲛⲁⲛ ϫⲉⲉϣⲱⲡⲉ ⲉⲣϣⲁⲛⲡⲥⲟⲛ ⲟⲩⲁ ⲙⲟⲩ ⲁⲩⲱ ⲛϥⲕⲁⲧⲉϥⲥϩⲓⲙⲉ ⲛϥⲧⲙⲕⲁϣⲏⲣⲉ ⲇⲉ ⲉⲣⲉⲡⲉϥⲥⲟⲛ ϫⲓⲧⲉϥⲥϩⲓⲙⲉ ⲛϥⲧⲟⲩⲛⲟⲥⲥⲡⲉⲣⲙⲁ ⲙⲡⲉϥⲥⲟⲛ .,Not Found,19
sahidica-new-testament,41_Mark_12,12,ⲛⲉⲟⲩⲛⲥⲁϣϥ ⲇⲉ ⲛⲥⲟⲛ ⲁⲩⲱ ⲡϣⲟⲣⲡ ⲁϥϫⲓϩⲓⲙⲉ . ⲁⲩⲱ ⲁϥⲙⲟⲩ ⲙⲡϥⲕⲁⲥⲡⲉⲣⲙⲁ .,Not Found,20
sahidica-new-testament,41_Mark_12,12,ⲁⲩⲱ ⲡⲙⲉϩⲥⲛⲁⲩ ⲁϥϫⲓⲧⲥ ⲁⲩⲱ ⲁϥⲙⲟⲩ ⲉⲙⲡϥⲕⲁⲥⲡⲉⲣⲙⲁ . ⲁⲩⲱ ⲡⲙⲉϩϣⲟⲙⲛⲧ ϩⲟⲙⲟⲓⲱⲥ,Not Found,21
sahidica-new-testament,41_Mark_12,12,ϣⲁⲡⲙⲉϩⲥⲁϣϥ . ⲉⲙⲡⲉⲗⲁⲁⲩ ⲙⲙⲟⲟⲩ ⲕⲁⲥⲡⲉⲣⲙⲁ . ⲁⲩⲱ ⲧⲕⲉⲥϩⲓⲙⲉ ⲁⲥⲙⲟⲩ .,Not Found,22
sahidica-new-testament,41_Mark_12,12,ϩⲛⲧⲁⲛⲁⲥⲧⲁⲥⲓⲥ ϭⲉ ⲉⲥⲛⲁⲣⲥϩⲓⲙⲉ ⲛⲛⲓⲙ ⲙⲙⲟⲟⲩ . ⲡⲥⲁϣϥ ⲅⲁⲣ ⲁⲩϩⲙⲟⲟⲥ ⲛⲙⲙⲁⲥ .,Not Found,23
sahidica-new-testament,41_Mark_12,12,ⲓⲏⲥⲟⲩⲥ ⲇⲉ ⲡⲉϫⲁϥ ⲛⲁⲩ ϫⲉⲉⲧⲃⲉⲡⲁⲓ ⲁⲛ ϭⲉ ⲉⲧⲉⲧⲛⲡⲗⲁⲛⲁ ⲉⲛⲧⲉⲧⲛⲥⲟⲟⲩⲛ ⲁⲛ ⲛⲛⲉⲅⲣⲁⲫⲏ ⲟⲩⲇⲉ ⲧϭⲟⲙ ⲙⲡⲛⲟⲩⲧⲉ,Not Found,24
sahidica-new-testament,41_Mark_12,12,ⲉⲩϣⲁⲛⲧⲱⲟⲩⲛ ⲅⲁⲣ ⲉⲃⲟⲗ ϩⲛⲛⲉⲧⲙⲟⲟⲩⲧ ⲟⲩⲧⲉ ⲛⲥⲉⲛⲁϫⲓϩⲓⲙⲉ ⲁⲛ . ⲟⲩⲧⲉ ⲛⲥⲉⲛⲁϫⲓϩⲁⲓ ⲁⲛ . ⲁⲗⲗⲁ ⲉⲩⲛⲁϭⲱ ⲛⲧϩⲉ ⲛⲛⲁⲅⲅⲉⲗⲟⲥ ⲉⲧϩⲛⲙⲡⲏⲩⲉ .,Not Found,25
sahidica-new-testament,41_Mark_12,12,ⲉⲧⲃⲉⲛⲉⲧⲙⲟⲟⲩⲧ ⲇⲉ ϫⲉⲥⲉⲛⲁⲧⲱⲟⲩⲛ ⲙⲡⲉⲧⲛⲱϣ ϩⲙⲡϫⲱⲱⲙⲉ ⲙⲙⲱⲩⲥⲏⲥ ⲛⲧϩⲉ ⲉⲛⲧⲁⲡⲛⲟⲩⲧⲉ ϫⲟⲟⲥ ⲛⲁϥ ϩⲓⲡⲃⲁⲧⲟⲥ ⲉϥϫⲱⲙⲙⲟⲥ ϫⲉ ⲁⲛⲟⲕ ⲡⲉ ⲡⲛⲟⲩⲧⲉ ⲛⲁⲃⲣⲁϩⲁⲙ ⲁⲩⲱ ⲡⲛⲟⲩⲧⲉ ⲛⲓⲥⲁⲁⲕ ⲁⲩⲱ ⲡⲛⲟⲩⲧⲉ ⲛⲓⲁⲕⲱⲃ .,Not Found,26
sahidica-new-testament,41_Mark_12,12,ⲡⲛⲟⲩⲧⲉ ⲁⲛ ⲡⲉ ⲛⲛⲉⲧⲙⲟⲟⲩⲧ ⲁⲗⲗⲁ ⲛⲛⲉⲧⲟⲛϩ . ⲧⲉⲧⲛⲡⲗⲁⲛⲁ ⲉⲙⲁⲧⲉ .,Not Found,27
sahidica-new-testament,41_Mark_12,12,ⲁⲩⲱ ⲛⲧⲉⲣⲉϥϯ ⲡⲉϥⲟⲩⲟⲉⲓ ⲉϩⲟⲩⲛ ⲉⲣⲟϥ ⲛϭⲓⲟⲩⲁ ⲛⲛⲉⲅⲣⲁⲙⲙⲁⲧⲉⲩⲥ ⲉⲁϥⲥⲱⲧⲙ ⲉⲣⲟⲟⲩ ⲉⲩϯⲧⲱⲛ ⲉϥⲥⲟⲟⲩⲛ ϫⲉⲁϥⲣⲟⲩⲱ ⲛⲁⲩ ⲕⲁⲗⲱⲥ . ⲁϥϫⲛⲟⲩϥ ϫⲉⲁϣ ⲧⲉ ⲧϣⲟⲣⲡ ⲛⲉⲛⲧⲟⲗⲏ ⲉⲣⲟⲟⲩ ⲧⲏⲣⲟⲩ .,Not Found,28
sahidica-new-testament,41_Mark_12,12,ⲁϥⲟⲩⲱϣⲃ ⲛϭⲓⲓⲏⲥⲟⲩⲥ ⲉϥϫⲱ ⲙⲙⲟⲥ ϫⲉⲧϣⲟⲣⲡ ⲧⲉ ⲥⲱⲧⲙⲡⲓⲥⲣⲁⲏⲗ ⲡϫⲟⲉⲓⲥ ⲡⲉⲛⲛⲟⲩⲧⲉ ⲡϫⲟⲉⲓⲥ ⲟⲩⲁ ⲡⲉ .,Not Found,29
sahidica-new-testament,41_Mark_12,12,ⲁⲩⲱ ⲉⲕⲉⲙⲉⲣⲉⲡϫⲟⲉⲓⲥ ⲡⲉⲕⲛⲟⲩⲧⲉ ⲉⲃⲟⲗ ϩⲙⲡⲉⲕϩⲏⲧ ⲧⲏⲣϥ ⲁⲩⲱ ⲉⲃⲟⲗ ϩⲛⲧⲉⲕⲯⲩⲭⲏ ⲧⲏⲣⲥ ⲁⲩⲱ ⲉⲃⲟⲗ ϩⲙⲡⲉⲕⲙⲉⲩⲉ ⲧⲏⲣϥ ⲁⲩⲱ ⲉⲃⲟⲗ ϩⲛⲧⲉⲕϭⲟⲙ ⲧⲏⲣⲥ .,Not Found,30
sahidica-new-testament,41_Mark_12,12,ⲧⲙⲉϩⲥⲛⲧⲉ ⲇⲉ ⲧⲉ ⲧⲁⲓ ⲉⲕⲉⲙⲉⲣⲉ ⲡⲉⲧϩⲓⲧⲟⲩⲱⲕ ⲛⲧⲉⲕϩⲉ . ⲙⲙⲛⲕⲉⲉⲛⲧⲟⲗⲏ ⲉⲛⲁⲁⲥ ⲉⲛⲁⲓ .,Not Found,31
sahidica-new-testament,41_Mark_12,12,ⲡⲉϫⲁϥ ⲇⲉ ⲛⲁϥ ⲛϭⲓⲡⲉⲅⲣⲁⲙⲙⲁⲧⲉⲩⲥ ϫⲉⲕⲁⲗⲱⲥ ⲡⲥⲁϩ ϩⲛⲟⲩⲙⲉ ⲁⲕϫⲟⲟⲥ ϫⲉⲟⲩⲁ ⲡⲉ ⲡⲛⲟⲩⲧⲉ ⲁⲩⲱ ⲙⲙⲛϭⲉ ⲃⲃⲗⲗⲁϥ .,Not Found,32
sahidica-new-testament,41_Mark_12,12,ⲁⲩⲱ ⲉⲙⲉⲣⲓⲧϥ ϩⲙⲡϩⲏⲧ ⲧⲏⲣϥ ⲁⲩⲱ ϩⲛⲧⲙⲛⲧⲣⲙⲛⲧϩⲏⲧ ⲧⲏⲣⲥ ⲁⲩⲱ ϩⲛⲧⲉⲕϭⲟⲙ ⲧⲏⲣⲥ ⲁⲩⲱ ⲉⲙⲉⲣⲉⲡⲉⲧϩⲓⲧⲟⲩⲱϥ ⲛⲧⲉϥϩⲉ ⲟⲩϩⲟⲩⲟ ⲡⲉ ⲉⲛⲟⲗⲟⲕⲁⲩⲧⲱⲙⲁ ⲧⲏⲣⲟⲩ ⲙⲛⲛⲑⲩⲥⲓⲁ .,Not Found,33
sahidica-new-testament,41_Mark_12,12,ⲁⲩⲱ ⲓⲏⲥⲟⲩⲥ ⲛⲧⲉⲣⲉϥⲛⲁⲩ ⲉⲣⲟϥ ϫⲉⲁϥⲣⲟⲩⲱ ϩⲁⲣⲱϥ ϩⲛⲟⲩⲙⲛⲧⲣⲙⲛⲧϩⲏⲧ ⲡⲉϫⲁϥ ⲛⲁϥ ϫⲉⲛⲅⲟⲩⲏⲩ ⲁⲛ ⲛⲧⲙⲛⲧⲣⲣⲟ ⲙⲡⲛⲟⲩⲧⲉ ⲁⲩⲱ ⲙⲡⲉϣⲗⲁⲁⲩ ϭⲉ ⲧⲟⲗⲙⲁ ⲉϫⲛⲟⲩϥ .,Not Found,34
sahidica-new-testament,41_Mark_12,12,ⲁϥⲟⲩⲱϣⲃ ⲇⲉ ⲛϭⲓⲓⲏⲥⲟⲩⲥ ⲉϥϯⲥⲃⲱ ϩⲙⲡⲉⲣⲡⲉ ⲉϥϫⲱⲙⲙⲟⲥ ϫⲉⲛⲁϣ ⲛϩⲉ ⲛⲉⲅⲣⲁⲙⲙⲁⲧⲉⲩⲥ ⲥⲉϫⲱⲙⲙⲟⲥ ϫⲉⲡⲉⲭⲣⲓⲥⲧⲟⲥ ⲡϣⲏⲣⲉ ⲛⲇⲁⲩⲉⲓⲇ ⲡⲉ .,Not Found,35
sahidica-new-testament,41_Mark_12,12,ⲛⲧⲟϥ ⲇⲁⲩⲉⲓⲇ ⲁϥϫⲟⲟⲥ ϩⲙⲡⲉⲡⲛⲉⲩⲙⲁ ⲉⲧⲟⲩⲁⲁⲃ ϫⲉⲡⲉϫⲉⲡϫⲟⲉⲓⲥ ⲙⲡⲁϫⲟⲉⲓⲥ ϫⲉϩⲙⲟⲟⲥ ⲛⲥⲁⲟⲩⲛⲁⲙ ⲙⲙⲟⲓ ϣⲁⲛⲧⲓⲕⲱ ⲛⲛⲉⲕϫⲁϫⲉⲉⲩ ϩⲁⲛⲉⲕⲟⲩⲉⲣⲏⲧⲉ .,Not Found,36
sahidica-new-testament,41_Mark_12,12,ⲛⲧⲟϥ ⲇⲁⲩⲉⲓⲇ ϥϫⲱⲙⲙⲟⲥ ϫⲉⲡϫⲟⲉⲓⲥ ⲡⲉ . ⲁⲩⲱ ⲛⲁϣ ⲛϩⲉ ⲡⲉϥϣⲏⲣⲉ ⲡⲉ . ⲁⲩⲱ ⲡⲙⲏⲏϣⲉ ⲧⲏⲣϥ ⲛⲉⲩⲥⲱⲧⲙ ⲉⲣⲟϥ ⲕⲁⲗⲱⲥ,Not Found,37
sahidica-new-testament,41_Mark_12,12,ⲁⲩⲱ ⲛⲉϥϫⲱⲙⲙⲟⲥ ⲛⲁⲩ ϩⲛⲧⲉϥⲥⲃⲱ . ϫⲉϯϩⲧⲏⲧⲛ ⲉⲣⲱⲧⲛ ⲛⲉⲅⲣⲁⲙⲙⲁⲧⲉⲩⲥ ⲛⲉⲧⲟⲩⲱϣ ⲉⲙⲟⲟϣⲉ ϩⲛϩⲉⲛⲥⲧⲟⲗⲏ ⲁⲩⲱ ⲉⲩⲉϣⲛⲁⲥⲡⲁⲥⲙⲟⲥ ϩⲛⲛⲁⲅⲟⲣⲁ,Not Found,38
sahidica-new-testament,41_Mark_12,12,ⲁⲩⲱ ⲙⲙⲁ ⲛϩⲙⲟⲟⲥ ⲉⲧϫⲟⲥⲉ ϩⲛⲛⲥⲩⲛⲁⲅⲱⲅⲏ . ⲁⲩⲱ ⲙⲙⲁ ⲛⲛⲟϫⲟⲩ ⲉⲧϫⲟⲥⲉ ϩⲛⲛⲇⲉⲓⲡⲛⲟⲛ,Not Found,39
sahidica-new-testament,41_Mark_12,12,ⲉⲩⲟⲩⲱⲙ ⲛⲛⲏⲓ ⲛⲛⲉⲭⲏⲣⲁ . ⲁⲩⲱ ϩⲛⲟⲩⲗⲟⲓϭⲉ ⲉⲩⲱⲥⲕ ⲉⲩϣⲗⲏⲗ . ⲛⲁⲓ ⲥⲉϫⲓ ⲛⲟⲩⲕⲣⲓⲙⲁ ⲛϩⲟⲩⲟ .,Not Found,40
sahidica-new-testament,41_Mark_12,12,ⲁⲩⲱ ⲛⲧⲉⲣⲉϥϩⲙⲟⲟⲥ ⲙⲡⲉⲙⲧⲟ ⲉⲃⲟⲗ ⲙⲡⲅⲁⲍⲟⲫⲩⲗⲁⲕⲓⲟⲛ . ⲁϥϯϩⲧⲏϥ ϫⲉⲉⲣⲉⲡⲙⲏⲏϣⲉ ⲛⲉϫϩⲟⲙⲛⲧ ⲛⲁϣ ⲛϩⲉ ⲉⲡⲅⲁⲍⲟⲫⲩⲗⲁⲕⲓⲟⲛ ⲁⲩⲱ ⲟⲩⲙⲏⲏϣⲉ ⲛⲣⲙⲙⲁⲟ ⲛⲉⲩⲛⲟⲩϫ ϩⲁϩ ⲉϩⲣⲁⲓ ⲉⲣⲟϥ .,Not Found,41
sahidica-new-testament,41_Mark_12,12,ⲛⲧⲉⲣⲉⲥⲉⲓ ⲇⲉ ⲛϭⲓⲟⲩⲭⲏⲣⲁ ⲛϩⲏⲕⲉ ⲁⲥⲛⲟⲩϫⲉ ⲉϩⲣⲁⲓ ⲉⲣⲟϥ ⲗⲗⲉⲡⲧⲟⲛ ⲥⲛⲁⲩ ⲉⲧⲉⲟⲩⲕⲟⲇⲣⲁⲛⲧⲏⲥ ⲡⲉ,Not Found,42
sahidica-new-testament,41_Mark_12,12,ⲁⲩⲱ ⲁϥⲙⲟⲩⲧⲉ ⲉⲛⲉϥⲙⲁⲑⲏⲧⲏⲥ ⲉϥϫⲱⲙⲙⲟⲥ ⲛⲁⲩ . ϫⲉϩⲁⲙⲏⲛ ϯϫⲱⲙⲙⲟⲥ ⲛⲏⲧⲛ ϫⲉⲧⲉⲓⲭⲏⲣⲁ ⲛϩⲏⲕⲉ ⲁⲥⲛⲟⲩϫⲉ ⲉⲡⲅⲁⲍⲟⲫⲩⲗⲁⲕⲓⲟⲛ ⲉϩⲟⲩⲉ ⲛⲉⲧⲛⲟⲩϫⲉ ⲧⲏⲣⲟⲩ .,Not Found,43
sahidica-new-testament,41_Mark_12,12,ⲛⲁⲓ ⲅⲁⲣ ⲧⲏⲣⲟⲩ ⲛⲧⲁⲩⲛⲟⲩϫⲉ ⲉⲃⲟⲗ ϩⲙⲡⲉϩⲟⲩⲟ ⲉⲧϣⲟⲟⲡ ⲛⲁⲩ . ⲧⲁⲓ ⲇⲉ ⲉⲃⲟⲗ ⲙⲡⲉⲥϣⲱⲱⲧ ⲡⲉⲥⲃⲓⲟⲥ ⲧⲏⲣϥ ⲉⲧⲉⲟⲩⲛⲧⲁⲥϥ ⲁⲥⲧⲁⲁϥ .,Not Found,44
sahidica-new-testament,66_Revelation_17,17,ⲁϥⲉⲓ ⲛϭⲓⲟⲩⲁ ⲉⲃⲟⲗ ϩⲙⲡⲥⲁϣϥ ⲛⲁⲅⲅⲉⲗⲟⲥ ⲉⲧⲉⲟⲩⲛⲧⲟⲩ ⲧⲥⲁϣϥⲉ ⲙⲫⲓⲁⲗⲏ ⲁϥϣⲁϫⲉ ⲛⲙⲙⲁⲓ ⲉϥϫⲱ ⲙⲙⲟⲥ ϫⲉⲁⲙⲟⲩ ⲛⲧⲁⲧⲥⲁⲃⲟⲕ ⲉⲡϩⲁⲡ ⲛⲧⲛⲟϭ ⲙⲡⲟⲣⲛⲏ ⲧⲉⲧϩⲙⲟⲟⲥ ⲉϩⲣⲁⲓ ⲉϫⲛϩⲉⲛⲙⲟⲟⲩ ⲉⲛⲁϣⲱⲟⲩ,"One of the seven angels who had the seven bowls came and spoke with me, saying, 'Come here. I will show you the judgment of the great prostitute who sits on many waters,",1
sahidica-new-testament,66_Revelation_17,17,ⲧⲁⲓ ⲛⲧⲁⲩⲡⲟⲣⲛⲉⲩⲉ ⲛⲙⲙⲁⲥ ⲛϭⲓⲛⲣⲣⲱⲟⲩ ⲙⲡⲕⲁϩ ⲁⲩⲱ ⲁⲩϯϩⲉ ⲛϭⲓⲛⲉⲧⲟⲩⲏϩ ϩⲓϫⲙⲡⲕⲁϩ ⲉⲃⲟⲗ ϩⲙⲡⲏⲣⲡ ⲛⲧⲉⲥⲡⲟⲣⲛⲉⲓⲁ,"with whom the kings of the earth committed sexual immorality, and those who dwell in the earth were made drunken with the wine of her sexual immorality.'",2
sahidica-new-testament,66_Revelation_17,17,ⲁϥϫⲓⲧ ϩⲙⲡⲉⲡⲛⲉⲩⲙⲁ ⲉⲃⲟⲗ ⲉⲧⲉⲣⲩⲙⲟⲥ . ⲁⲩⲱ ⲁⲛⲁⲩ ⲉⲩⲥϩⲓⲙⲉ ⲉⲥⲧⲁⲗⲏⲩ ⲉⲩⲑⲩⲣⲓⲟⲛ ⲛⲕⲟⲕⲕⲟⲥ ⲉϥⲙⲉϩ ⲛⲣⲁⲛ ⲛⲟⲩⲁ ⲉⲟⲩⲛ ⲥⲁϣϥⲉ ⲛⲁⲡⲏ ⲙⲙⲟϥ ⲙⲛⲙⲏⲧ ⲛⲧⲁⲡ .,"He carried me away in the Spirit into a wilderness. I saw a woman sitting on a scarlet-colored animal, full of blasphemous names, having seven heads and ten horns.",3
sahidica-new-testament,66_Revelation_17,17,ⲁⲩⲱ ⲧⲉⲥϩⲓⲙⲉ ⲛⲉⲥϭⲟⲟⲗⲉ ⲛϫⲏϭⲉ ϩⲓⲕⲟⲕⲕⲟⲥ ϩⲓⲛⲟⲩⲃ ϩⲓⲉⲛⲉⲙⲙⲉ ϩⲓⲙⲁⲣⲅⲁⲣⲓⲧⲏⲥ ⲉⲩⲛ ⲟⲩϫⲱ ⲛⲛⲟⲩⲃ ϩⲛⲧⲉⲥϭⲓϫ ⲉϥⲙⲉϩ ⲛⲃⲟⲧⲉ ⲙⲛⲛⲁⲕⲁⲑⲁⲣⲥⲓⲁ ⲛⲧⲉⲧⲉⲥⲡⲟⲣⲛⲉⲓⲁ ⲙⲛⲛⲁⲡⲕⲁϩ,"The woman was dressed in purple and scarlet, and decked with gold and precious stones and pearls, having in her hand a golden cup full of abominations and the impurities of the sexual immorality of the earth.",4
sahidica-new-testament,66_Revelation_17,17,ⲉⲩⲛ ⲟⲩⲣⲁⲛ ⲙⲙⲏⲥⲧⲩⲣⲓⲟⲛ ⲥⲏϩ ⲉϫⲛⲧⲉⲥⲧⲉϩⲛⲉ ϫⲉⲧⲃⲁⲃⲩⲗⲱⲛ ⲛⲟϭ ⲧⲙⲁⲁⲩ ⲛⲙⲡⲟⲣⲛⲟⲥ ⲙⲛⲛⲃⲟⲧⲉ ⲙⲡⲕⲁϩ .,"And on her forehead a name was written, 'MYSTERY, BABYLON THE GREAT, THE MOTHER OF THE PROSTITUTES AND OF THE ABOMINATIONS OF THE EARTH.'",5
sahidica-new-testament,66_Revelation_17,17,ⲁⲩⲱ ⲁⲛⲁⲩ ⲉⲧⲉⲥϩⲓⲙⲉ ⲉⲥⲧⲁϩⲉ ⲉⲃⲟⲗ ϩⲙⲡⲉⲥⲛⲟϥ ⲛⲛⲉⲧⲟⲩⲁⲁⲃ ⲙⲛⲡⲉⲥⲛⲟϥ ⲛⲙⲙⲛⲧⲣⲉ ⲛⲓⲏⲥⲟⲩⲥ . ⲁⲩⲱ ⲛⲧⲉⲣⲓⲛⲁⲩ ⲉⲣⲟⲥ ⲁⲓⲣϣⲡⲏⲣⲉ .,"I saw the woman drunken with the blood of the saints, and with the blood of the martyrs of Jesus. When I saw her, I wondered with great amazement.",6
sahidica-new-testament,66_Revelation_17,17,ⲡⲉϫⲁϥ ⲛⲁⲓ ⲛϭⲓⲡⲁⲅⲅⲉⲗⲟⲥ ϫⲉⲁϩⲣⲟⲕ ⲕⲣϣⲡⲏⲣⲉ ⲁⲛⲟⲕ ⲡⲉⲧⲛⲁⲧⲁⲙⲟⲕ ⲉⲡⲙⲏ ⲥⲧⲩⲣⲓⲟⲛ ⲛⲧⲉⲥϩⲓⲙⲉ ⲙⲛⲡⲉⲑⲩⲣⲓⲟⲛ ⲉⲧϥⲓ ϩⲁⲣⲟⲥ ⲉⲧⲉⲣⲉⲧⲥⲁϣϥⲉ ⲛⲁⲡⲏ ⲙⲙⲟϥ ⲙⲛⲡⲙⲏⲧ ⲛⲧⲁⲡ .,"The angel said to me, 'Why do you wonder? I will tell you the mystery of the woman, and of the beast that carries her, which has the seven heads and the ten horns.",7
sahidica-new-testament,66_Revelation_17,17,ⲡⲉⲑⲩⲣⲓⲟⲛ ⲛⲧⲁⲕⲛⲁⲩ ⲉⲣⲟϥ ⲛⲉϥϣⲟⲟⲡ ⲡⲉ ⲁⲩⲱ ⲛⲉϥϣⲟⲟⲡ ⲁⲛ ⲁⲩⲱ ϥⲛⲏⲩ ⲉϩⲣⲁⲓ ϩⲙⲡⲛⲟⲩⲛ ⲛⲉϥⲃⲱⲕ ⲉⲡⲧⲁⲕⲟ ⲁⲩⲱ ⲛⲥⲉⲣϣⲡⲏⲣⲉ ⲛϭⲓⲛⲉⲧⲟⲩⲏϩ ϩⲓϫⲙⲡⲕⲁϩ ⲛⲁⲓ ⲉⲧⲉⲛⲛⲉⲩⲣⲁⲛ ⲥⲏϩ ⲁⲛ ⲉⲡϫⲱⲱⲙⲉ ⲙⲡⲱⲛϩ ϫⲓⲛⲛⲧⲕⲁⲧⲁⲃⲟⲗⲏ ⲙⲡⲕⲟⲥⲙⲟⲥ ⲉⲩⲛⲁⲩ ⲉⲡⲉⲑⲩⲣⲓⲟⲛ ϫⲉⲛⲉϥϣⲟⲟⲡ ⲡⲉ ⲁⲩⲱ ⲛⲉϥϣⲟⲟⲡ ⲁⲛ ⲁⲩⲱ ϥⲛⲁϣⲱⲡⲉ,"The beast that you saw was, and is not; and is about to come up out of the abyss and to go into destruction. Those who dwell on the earth and whose names have not been written in the book of life from the foundation of the world will marvel when they see that the beast was, and is not, and shall be present.",8
sahidica-new-testament,66_Revelation_17,17,ⲡⲁⲓ ⲡⲉ ⲡⲙⲁ ⲙⲡϩⲏⲧ ⲉⲧⲉⲟⲩⲛⲧϥ ⲧⲥⲟⲫⲓⲁ ⲁⲩⲱ ⲧⲥⲁϣϥⲉ ⲛⲁⲡⲉ ⲥⲁϣϥ ⲛⲧⲟⲟⲩ ⲛⲉ ⲉⲧⲉⲣⲉⲧⲉⲥϩⲓⲙⲉ ϩⲙⲟⲟⲥ ⲉϩⲣⲁⲓ ⲉϫⲱⲟⲩ . ⲁⲩⲱ ⲥⲁϣϥ ⲛⲣⲣⲟ ⲛⲉ,"Here is the mind that has wisdom. The seven heads are seven mountains, on which the woman sits.",9
sahidica-new-testament,66_Revelation_17,17,ⲡϯⲟⲩ ⲁⲩϩⲉ ⲡⲟⲩⲁ ϣⲟⲟⲡ ⲡⲕⲉⲟⲩⲁ ⲙⲡⲁⲧϥⲉⲓ ⲁⲩⲱ ⲉϥϣⲁⲛⲉⲓ ϥⲛⲁϭⲱ ⲛⲟⲩⲕⲟⲩⲓ .,"They are seven kings. Five have fallen, the one is, the other has not yet come. When he comes, he must continue a little while.",10
sahidica-new-testament,66_Revelation_17,17,ⲁⲩⲱ ⲡⲉⲑⲩⲣⲓⲟⲛ ⲉⲧⲉⲛⲉϥϣⲟⲟⲡ ⲡⲉ ⲁⲩⲱ ⲧⲉⲛⲟⲩ ⲛⲉϥϣⲟⲟⲡ ⲁⲛ ⲛⲧⲟϥ ⲡⲉ ⲡⲙⲉϩ ϣⲙⲟⲩⲛ ⲟⲩⲁ ⲉⲃⲟⲗ ϩⲙⲡⲥⲁϣϥ ⲁⲩⲱ ⲉϥⲛⲁ ⲉⲡⲧⲁⲕⲟ .,"The beast that was, and is not, is himself also an eighth, and is of the seven; and he goes to destruction.",11
sahidica-new-testament,66_Revelation_17,17,ⲁⲩⲱ ⲡⲙⲏⲧ ⲛⲧⲁⲡ ⲛⲧⲁⲕⲛⲁⲩ ⲉⲣⲟⲟⲩ ⲡⲙⲏⲧ ⲛⲣⲣⲟ ⲛⲉ ⲙⲡⲁⲧⲟⲩϫⲓ ⲛⲧⲙⲛⲧⲣⲣⲟ ⲁⲗⲗⲁ ⲉⲩⲛⲁϫⲓ ⲟⲩⲉⲝⲟⲩⲥⲓⲁ ⲙⲡⲉⲑⲩⲣⲓⲟⲛ .,"The ten horns that you saw are ten kings who have received no kingdom as yet, but they receive authority as kings, with the beast, for one hour.",12
sahidica-new-testament,66_Revelation_17,17,ⲛⲁⲓ ⲥⲉⲛⲁⲣⲟⲩϩⲏⲧ ⲛⲟⲩⲱⲧ ⲛⲥⲉϯ ⲛⲧⲉⲩϭⲟⲙ ⲙⲛⲧⲉⲩⲉⲝⲟⲩⲥⲓⲁ ⲙⲡⲉⲑⲏⲣⲓⲟⲛ .,"These have one mind, and they give their power and authority to the beast.",13
sahidica-new-testament,66_Revelation_17,17,ⲛⲁⲓ ⲥⲉⲛⲁⲙⲓϣⲉ ⲙⲛⲡⲉϩⲓⲉⲓⲃ ⲛⲧⲉⲡⲉϩⲓⲉⲓⲃ ϫⲣⲟ ⲉⲣⲟⲟⲩ ϫⲉⲡϫⲟⲉⲓⲥ ⲛⲉⲛϫⲟⲉⲓⲥ ⲡⲉ ⲁⲩⲱ ⲡⲣⲣⲟ ⲛⲛⲉⲣⲣⲱⲟⲩ ⲡⲉ ⲁⲩⲱ ⲛⲉⲧⲛⲙⲙⲁϥ ⲛⲉⲧⲧⲁϩⲙ ⲁⲩⲱ ⲛⲉⲧⲥⲟⲧⲡ ⲙⲡⲓⲥⲧⲟⲥ .,"These will war against the Lamb, and the Lamb will overcome them, for he is Lord of lords, and King of kings. They also will overcome who are with him, called and chosen and faithful.'",14
sahidica-new-testament,66_Revelation_17,17,ⲁⲩⲱ ⲡⲉϫⲁϥ ⲛⲁⲓ ϫⲉⲙⲙⲟⲩ ⲛⲉⲓⲟⲟⲩⲉ ⲛⲧⲁⲕⲛⲁⲩ ⲉⲣⲟⲟⲩ ⲉⲣⲉⲧⲡⲟⲗⲓⲥ ϩⲙⲟⲟⲥ ϩⲓϫⲱⲟⲩ ⲛⲗⲁⲟⲥ ⲛⲉ ⲙⲛⲛⲉⲫⲩⲗⲏ ⲙⲛⲛⲁⲥⲡⲉ .,"He said to me, 'The waters which you saw, where the prostitute sits, are peoples, multitudes, nations, and languages.",15
sahidica-new-testament,66_Revelation_17,17,ⲁⲩⲱ ⲡⲙⲏⲧ ⲛⲧⲁⲡ ⲛⲧⲁⲕⲛⲁⲩ ⲉⲣⲟⲟⲩ ⲙⲛⲡⲉⲑⲩⲣⲓⲟⲛ ⲛⲁⲓ ⲥⲉⲛⲁⲙⲉⲥⲧⲉ ⲧⲡⲟⲣⲛⲏ ⲛⲥⲉⲁⲁⲥ ⲛϫⲁⲓⲉ ⲉⲥⲕⲏ ⲕⲁϩⲏⲩ ⲛⲥⲉⲟⲩⲱⲙ ⲛⲛⲉⲥⲥⲁⲣⲝ ⲁⲩⲱ ⲛⲥⲉⲣⲱⲕϩ ⲙⲙⲟⲥ ϩⲛⲟⲩⲕⲱϩⲧ .,"The ten horns which you saw, and the beast, these will hate the prostitute, and will make her desolate, and will make her naked, and will eat her flesh, and will burn her utterly with fire.",16
sahidica-new-testament,66_Revelation_17,17,ⲡⲛⲟⲩⲧⲉ ⲅⲁⲣ ⲁϥⲧⲁⲁⲥ ⲉⲡⲉⲩϩⲏⲧ ⲉⲧⲣⲉⲩⲉⲓⲣⲉ ⲙⲡⲉϥⲟⲩⲱϣ ⲁⲩⲱ ⲛⲥⲉⲣⲟⲩⲅⲛⲱⲙⲏ ⲛⲟⲩⲱⲧ ⲛⲥⲉϯ ⲛⲧⲉⲩⲙⲛⲧⲣⲣⲟ ⲙⲡⲉⲑⲩⲣⲓⲟⲛ ϣⲁⲛⲧⲟⲩϫⲱⲕ ⲉⲃⲟⲗ ⲛϭⲓⲛϣⲁϫⲉ ⲙⲡⲛⲟⲩⲧⲉ .,"For God has put in their hearts to do what he has in mind, and to be of one mind, and to give their kingdom to the beast, until the words of God should be accomplished.",17
sahidica-new-testament,66_Revelation_17,17,ⲁⲩⲱ ⲧⲉⲥϩⲓⲙⲉ ⲛⲧⲁⲕⲛⲁⲩ ⲉⲣⲟⲥ ⲧⲉ ⲧⲛⲟϭ ⲙⲡⲟⲗⲓⲥ ⲉⲧⲉⲣⲉⲧⲙⲛⲧⲣⲙⲙⲁⲟ ⲛϩⲏⲧⲥ ⲛⲛⲣⲣⲱⲟⲩ ⲙⲡⲕⲁϩ .,"The woman whom you saw is the great city, which reigns over the kings of the earth.'",18
sahidica-new-testament,46_1 Corinthians_16,16,ⲉⲧⲃⲉⲡⲟⲩⲱϭⲥ ⲇⲉ ⲉⲧϫⲓ ⲉϩⲟⲩⲛ ⲉⲛⲉⲧⲟⲩⲁⲁⲃ . ⲛⲧϩⲉ ⲉⲛⲧⲁⲓⲧⲟϣⲥ ϩⲛⲛⲉⲕⲕⲗⲏⲥⲓⲁ ⲛⲧⲅⲁⲗⲁⲧⲓⲁ . ⲁⲣⲓⲥ ϩⲱⲧⲧⲏⲩⲧⲛ,Not Found,1
sahidica-new-testament,46_1 Corinthians_16,16,ⲕⲁⲧⲁⲥⲟⲩⲟⲩⲁ ⲙⲡⲥⲁⲃⲃⲁⲧⲟⲛ . ⲙⲁⲣⲉⲡⲟⲩⲁ ⲡⲟⲩⲁ ⲙⲙⲱⲧⲛ ⲕⲱ ⲛⲧⲟⲟⲧϥ ⲉϥⲥⲱⲟⲩϩ ⲉϩⲟⲩⲛ ⲙⲡⲉⲧϥⲛⲁϩⲉ ⲉⲣⲟϥ . ϫⲉⲕⲁⲁⲥ ⲁⲛ ⲉⲓϣⲁⲛⲉⲓ ⲧⲟⲧⲉ ⲛⲧⲉⲟⲩⲱϭⲥ ϣⲱⲡⲉ .,Not Found,2
sahidica-new-testament,46_1 Corinthians_16,16,ϩⲟⲧⲁⲛ ⲇⲉ ⲉⲓϣⲁⲛⲉⲓ ⲛⲉⲧⲧⲉⲧⲛⲛⲁⲇⲟⲕⲓⲙⲁⲍⲉ ⲙⲙⲟⲟⲩ . ⲛⲁⲓ ⲉⲓⲉϫⲟⲟⲩⲥⲟⲩ ϩⲓⲧⲛⲛⲉⲡⲓⲥⲧⲟⲗⲏ ⲉϫⲓ ⲛⲧⲉⲧⲛⲭⲁⲣⲓⲥ ⲉⲧϩⲓⲉⲣⲟⲩⲥⲁⲗⲏⲙ .,Not Found,3
sahidica-new-testament,46_1 Corinthians_16,16,ⲉϣⲱⲡⲉ ⲇⲉ ⲡⲉⲧϣϣⲉ ⲡⲉ ⲉⲧⲣⲁⲃⲱⲕ ϩⲱ ⲥⲉⲛⲏⲩ ⲛⲙⲙⲁⲓ .,Not Found,4
sahidica-new-testament,46_1 Corinthians_16,16,ϯⲛⲏⲩ ⲇⲉ ϣⲁⲣⲱⲧⲛ ⲉⲓϣⲁⲛⲉⲓ ⲉⲃⲟⲗ ϩⲓⲧⲛⲧⲙⲁⲕⲉⲇⲟⲛⲓⲁ . ϯⲛⲏⲩ ⲅⲁⲣ ⲉⲃⲟⲗ ϩⲓⲧⲛⲧⲙⲁⲕⲉⲇⲟⲛⲓⲁ .,Not Found,5
sahidica-new-testament,46_1 Corinthians_16,16,ⲙⲉϣⲁⲕ ⲇⲉ ϯⲛⲁϭⲱ ϩⲁⲧⲉⲧⲏⲩⲧⲛ . ⲏ ⲛⲧⲁⲣⲧⲉⲡⲣⲱ . ϫⲉⲕⲁⲁⲥ ⲛⲧⲱⲧⲛ ⲉⲧⲉⲧⲛⲉⲑⲡⲟⲓ ⲉⲡⲙⲁ ⲉϯⲛⲁⲃⲱⲕ ⲉⲣⲟϥ .,Not Found,6
sahidica-new-testament,46_1 Corinthians_16,16,ⲛϯⲟⲩⲱϣ ⲅⲁⲣ ⲁⲛ ⲉⲛⲁⲩ ⲉⲣⲱⲧⲛ ⲧⲉⲛⲟⲩ ⲉⲓⲡⲁⲣⲁⲅⲉ . ϯⲙⲉⲉⲩⲉ ⲅⲁⲣ ⲉⲣⲟⲩⲟⲉⲓϣ ϩⲁⲧⲛⲧⲏⲩⲧⲛ ⲉⲣϣⲁⲛⲡϫⲟⲉⲓⲥ ⲟⲩⲉϩⲥⲁϩⲛⲉ .,Not Found,7
sahidica-new-testament,46_1 Corinthians_16,16,ϯϭⲉⲉⲧ ⲇⲉ ϩⲛⲉⲫⲉⲥⲟⲥ ϣⲁⲧⲡⲉⲛⲧⲏⲕⲟⲥⲧⲏ .,Not Found,8
sahidica-new-testament,46_1 Corinthians_16,16,ⲁⲩⲛⲟϭ ⲅⲁⲣ ⲛⲣⲟ ⲟⲩⲱⲛ ⲛⲁⲓ . ⲉϥⲉⲛⲉⲣⲅⲉⲓ . ⲁⲩⲱ ϩⲁϩ ⲛⲁⲛⲧⲓⲕⲓⲙⲉⲛⲟⲥ .,Not Found,9
sahidica-new-testament,46_1 Corinthians_16,16,ⲉⲣϣⲁⲛⲧⲓⲙⲟⲑⲉⲟⲥ ⲇⲉ ⲉⲓ ϯϩⲧⲏⲧⲛ ϫⲉⲉϥⲉϣⲱⲡⲉ ⲁϫⲛϩⲟⲧⲉ ϩⲁⲧⲛⲧⲏⲩⲧⲛ . ⲡϩⲱⲃ ⲅⲁⲣ ⲙⲡϫⲟⲉⲓⲥ ⲡⲉⲧϥⲣϩⲱⲃ ⲉⲣⲟϥ ⲛⲧⲁϩⲉ .,Not Found,10
sahidica-new-testament,46_1 Corinthians_16,16,ⲙⲡⲣⲧⲣⲉⲗⲁⲁⲩ ϭⲉ ⲥⲟϣϥ . ⲙⲁⲧϩⲡⲟϥ ⲇⲉ ϩⲛⲟⲩⲉⲓⲣⲏⲛⲏ ϫⲉⲉϥⲉⲉⲓ ϣⲁⲣⲟⲓ . ϯϭⲱϣⲧ ⲅⲁⲣ ⲉⲃⲟⲗ ϩⲏⲧϥ ⲙⲛⲛⲉⲥⲛⲏⲩ .,Not Found,11
sahidica-new-testament,46_1 Corinthians_16,16,ⲉⲧⲃⲉⲁⲡⲟⲗⲗⲱ ⲇⲉ ⲡⲥⲟⲛ ⲁⲓⲡⲁⲣⲁⲕⲁⲗⲉⲓ ⲙⲙⲟϥ ⲉⲙⲁⲧⲉ ϫⲉⲉϥⲉⲉⲓ ϣⲁⲣⲱⲧⲛ . ⲁⲩⲱ ⲙⲉϣⲁⲕ ⲙⲡⲧⲱϣ ⲁⲛ ⲡⲉ ⲉⲧⲣⲉϥⲉⲓ ⲧⲉⲛⲟⲩ . ϥⲛⲏⲩ ⲇⲉ ⲉϥϣⲁⲛϩⲉ ⲉⲡⲟⲩⲟⲉⲓϣ .,Not Found,12
sahidica-new-testament,46_1 Corinthians_16,16,ⲣⲟⲉⲓⲥ ⲁϩⲉⲣⲁⲧⲧⲏⲩⲧⲛ ϩⲛⲧⲡⲓⲥⲧⲓⲥ . ϫⲣⲟ ⲛⲧⲉⲧⲛϭⲙϭⲟⲙ .,Not Found,13
sahidica-new-testament,46_1 Corinthians_16,16,ⲛⲉⲧⲛϩⲃⲏⲩⲉ ⲧⲏⲣⲟⲩ ⲙⲁⲣⲟⲩϣⲱⲡⲉ ϩⲛⲟⲩⲁⲅⲁⲡⲏ .,Not Found,14
sahidica-new-testament,46_1 Corinthians_16,16,ϯⲡⲁⲣⲁⲕⲁⲗⲉⲓ ⲇⲉ ⲙⲙⲱⲧⲛ ⲛⲁⲥⲛⲏⲩ ⲧⲉⲧⲛⲥⲟⲟⲩⲛ ⲙⲡⲏⲓ ⲛⲥⲧⲉⲫⲁⲛⲁ ϫⲉⲡϣⲟⲣⲡ ⲡⲉ ϩⲛⲧⲁⲭⲁⲓⲁ . ⲁⲩⲱ ⲁⲩⲕⲁⲁⲩ ⲉϩⲣⲁⲓ ⲉⲧⲇⲓⲁⲕⲟⲛⲓⲁ ⲛⲛⲉⲧⲟⲩⲁⲁⲃ .,Not Found,15
sahidica-new-testament,46_1 Corinthians_16,16,ϫⲉⲕⲁⲁⲥ ϩⲱⲧⲧⲏⲩⲧⲛ ⲉⲧⲉⲧⲛⲉϩⲩⲡⲟⲧⲁⲥⲥⲉ ⲛⲛⲁⲓ ⲛⲧⲉⲓⲙⲓⲛⲉ . ⲙⲛⲟⲩⲟⲛ ⲛⲓⲙ ⲉⲧⲟ ⲛϣⲃⲣⲣϩⲱⲃ . ⲁⲩⲱ ⲉⲧϩⲟⲥⲉ .,Not Found,16
sahidica-new-testament,46_1 Corinthians_16,16,ϯⲣⲁϣⲉ ⲇⲉ ⲉϫⲛⲧⲡⲁⲣϩⲟⲩⲥⲓⲁ ⲛⲥⲧⲉⲫⲁⲛⲁ ⲙⲛⲫⲟⲣⲧⲟⲩⲛⲁⲧⲟⲥ ⲙⲛⲁⲭⲁⲓⲕⲟⲥ ϫⲉⲛⲁⲓ ⲛⲉⲛⲧⲁⲩϫⲉⲕⲡⲉⲧⲛϣⲱⲱⲧ ⲉⲃⲟⲗ .,Not Found,17
sahidica-new-testament,46_1 Corinthians_16,16,ⲁⲩϯⲙⲧⲟⲛ ⲅⲁⲣ ⲙⲡⲁⲡⲛⲉⲩⲙⲁ . ⲙⲛⲡⲱⲧⲛ . ⲥⲟⲩⲛⲛⲁⲓ ϭⲉ ⲛⲧⲉⲓⲙⲓⲛⲉ .,Not Found,18
