Book Category,Book Name,Chapter,Verse,Translation,Number
sahidica-new-testament,47_2 Corinthians_2,2,ⲁⲓⲕⲣⲓⲛⲉ ⲅⲁⲣ ⲙⲡⲁⲓ ⲛⲁⲓ ⲉⲧⲙⲉⲓ ⲟⲛ ϣⲁⲣⲱⲧⲛ ϩⲛⲟⲩⲗⲩⲡⲏ .,"But I determined this for myself, that I would not come to you again in sorrow.",1
sahidica-new-testament,47_2 Corinthians_2,2,ⲉϣϫⲉ ⲁⲛⲟⲕ ⲅⲁⲣ ⲡⲉⲧⲛⲁⲗⲩⲡⲉⲓ ⲙⲙⲱⲧⲛ . ⲉⲓⲉ ⲛⲓⲙ ⲡⲉⲧⲛⲁⲉⲩⲫⲣⲁⲛⲉ ⲙⲙⲟⲓ ⲉⲓ ⲙⲏⲧⲓ ⲡⲉⲧⲛⲁⲗⲩⲡⲉⲓ ⲉⲃⲟⲗ ϩⲓⲧⲟⲟⲧ .,"For if I make you sorry, then who will make me glad but he who is made sorry by me?",2
sahidica-new-testament,47_2 Corinthians_2,2,ⲕⲁⲓⲅⲁⲣ ⲉⲛⲧⲁⲓⲥⲉϩ ⲡⲁⲓ ϫⲉⲕⲁⲁⲥ ⲉⲛⲛⲁⲉⲓ ⲧⲁⲗⲩⲡⲉⲓ ⲛⲧⲟⲟⲧⲟⲩ ⲛⲛⲉⲧⲉϣϣⲉ ⲉⲧⲣⲁⲣⲁϣⲉ ⲉⲃⲟⲗ ϩⲓⲧⲟⲟⲧⲟⲩ . ⲉⲓⲕⲱ ⲛϩⲧⲏⲓ ⲉⲣⲱⲧⲛ ⲧⲏⲣⲧⲛ ϫⲉⲡⲁⲣⲁϣⲉ ⲡⲱⲧⲛ ⲧⲏⲣⲧⲛ ⲡⲉ .,"And I wrote this very thing to you, so that, when I came, I wouldn't have sorrow from them of whom I ought to rejoice; having confidence in you all, that my joy would be shared by all of you.",3
sahidica-new-testament,47_2 Corinthians_2,2,ⲉⲃⲟⲗ ⲅⲁⲣ ϩⲛⲟⲩⲛⲟϭ ⲛⲑⲗⲓⲯⲓⲥ . ⲙⲛⲟⲩⲗⲱϫϩ ⲛϩⲏⲧ ⲁⲓⲥϩⲁⲓ ⲛⲏⲧⲛ ϩⲓⲧⲛϩⲁϩ ⲛⲣⲙⲉⲓⲏ ϫⲉⲕⲁⲁⲥ ⲁⲛ ⲉⲧⲉⲧⲛⲉⲗⲩⲡⲉⲓ . ⲁⲗⲗⲁ ϫⲉⲉⲧⲉⲧⲛⲉⲉⲓⲙⲉ ⲉⲧⲁⲅⲁⲡⲏ ⲉⲧⲉⲩⲛⲧⲁⲉⲓⲥ ⲛϩⲟⲩⲟ ⲉϩⲟⲩⲛ ⲉⲣⲱⲧⲛ .,"For out of much affliction and anguish of heart I wrote to you with many tears, not that you should be made sorry, but that you might know the love that I have so abundantly for you.",4
sahidica-new-testament,47_2 Corinthians_2,2,ⲉϣϫⲉ ⲁⲟⲩⲁ ⲇⲉ ⲗⲩⲡⲉⲓ ⲛⲧⲁϥⲗⲩⲡⲉⲓ ⲙⲙⲟⲓ ⲁⲛ . ⲁⲗⲗⲁ ⲁⲡⲟ ⲙⲉⲣⲟⲩⲥ . ϫⲉⲉⲛⲛⲁⲉⲡⲓⲃⲁⲣⲉⲓ ⲙⲙⲱⲧⲛ ⲧⲏⲣⲧⲛ .,"But if any has caused sorrow, he has caused sorrow, not to me, but in part (that I not press too heavily) to you all.",5
sahidica-new-testament,47_2 Corinthians_2,2,ⲧⲉⲓⲉⲡⲓⲧⲓⲙⲓⲁ ϭⲉ ⲣⲱϣⲉ ⲉⲡⲁⲓ ⲧⲉⲃⲟⲗ ϩⲓⲧⲙⲡⲉϩⲟⲩⲟ .,Sufficient to such a one is this punishment which was inflicted by the many;,6
sahidica-new-testament,47_2 Corinthians_2,2,ϩⲱⲥⲧⲉ ⲛⲧⲟϥ ⲛⲧⲉⲧⲛⲕⲱ ⲛⲁϥ ⲉⲃⲟⲗ . ⲁⲩⲱ ⲛⲧⲉⲧⲛⲥⲉⲡⲥⲱⲡϥ . ⲙⲏⲡⲟⲧⲉ ϩⲣⲁⲓ ϩⲙⲡϩⲟⲩⲉ ⲗⲩⲡⲉⲓ ⲛⲥⲉⲟⲩⲱⲙⲕ ⲙⲡⲁⲓ ⲛⲧⲉⲓⲙⲓⲛⲉ .,"so that on the contrary you should rather forgive him and comfort him, lest by any means such a one should be swallowed up with his excessive sorrow.",7
sahidica-new-testament,47_2 Corinthians_2,2,ⲉⲧⲃⲉⲡⲁⲓ ϯⲡⲁⲣⲁⲕⲁⲗⲉⲓ ⲙⲙⲱⲧⲛ ⲙⲁⲧⲁϫⲣⲟ ⲛⲟⲩⲁⲅⲁⲡⲏ ⲉϩⲟⲩⲛ ⲉⲣⲟϥ .,Therefore I beg you to confirm your love toward him.,8
sahidica-new-testament,47_2 Corinthians_2,2,ⲉⲧⲃⲉⲡⲁⲓ ⲅⲁⲣ ⲛⲧⲁⲓⲥϩⲁⲓ ⲛⲏⲧⲛ ϫⲉⲉⲓⲉⲉⲓⲙⲉ ⲉⲧⲉⲧⲛⲇⲟⲕⲓⲙⲏ ϫⲉⲛⲧⲉⲧⲛϩⲉⲛⲥⲧⲙⲏⲧ ϩⲛϩⲱⲃ ⲛⲓⲙ .,"For to this end I also wrote, that I might know the proof of you, whether you are obedient in all things.",9
sahidica-new-testament,47_2 Corinthians_2,2,ⲡⲉⲧⲉⲧⲛⲁⲕⲱ ⲇⲉ ⲛⲁϥ ⲉⲃⲟⲗ ϯⲕⲱ ϩⲱ . ⲕⲁⲓⲅⲁⲣ ⲁⲛⲟⲕ ⲛⲧⲁⲓⲕⲱ ⲉⲃⲟⲗ ⲙⲡⲉⲛⲧⲁⲓ ⲕⲁⲁϥ ⲉⲃⲟⲗ ⲉⲧⲃⲉⲧⲏⲩⲧⲛ ϩⲙⲡϩⲟ ⲙⲡⲉⲭⲣⲓⲥⲧⲟⲥ .,"Now I also forgive whomever you forgive anything. For if indeed I have forgiven anything, I have forgiven that one for your sakes in the presence of Christ,",10
sahidica-new-testament,47_2 Corinthians_2,2,ϫⲉⲕⲁⲁⲥ ⲉⲛⲛⲉⲩϩⲟⲩⲣⲱⲱⲛ ⲉⲃⲟⲗ ϩⲓⲧⲙⲡⲥⲁⲧⲁⲛⲁⲥ . ⲛⲧⲛⲟⲃϣ ⲅⲁⲣ ⲁⲛ ⲉⲛⲉϥⲙⲉⲉⲩⲉ .,that no advantage may be gained over us by Satan; for we are not ignorant of his schemes.,11
sahidica-new-testament,47_2 Corinthians_2,2,ⲛⲧⲉⲣⲓⲉⲓ ⲇⲉ ⲉϩⲣⲁⲓ ⲉⲧⲉⲧⲣⲱⲁⲥ ⲉⲡⲉⲩⲁⲅⲅⲉⲗⲓⲟⲛ ⲙⲡⲉⲭⲣⲓⲥⲧⲟⲥ . ⲁⲩⲱ ⲛⲧⲉⲣⲉⲟⲩⲛⲟϭ ⲛⲣⲟ ⲟⲩⲟⲛ ⲛⲁⲓ ϩⲙⲡϫⲟⲉⲓⲥ .,"Now when I came to Troas for the Good News of Christ, and when a door was opened to me in the Lord,",12
sahidica-new-testament,47_2 Corinthians_2,2,ⲙⲡⲓⲙⲧⲟⲛ ϩⲙⲡⲁⲡⲛⲉⲩⲙⲁ ϫⲉⲙⲡⲓϩⲉ ⲉⲧⲓⲧⲟⲥ ⲡⲁⲥⲟⲛ . ⲁⲗⲗⲁ ⲛⲧⲉⲣⲓ ⲁⲡⲟⲧⲁⲥⲥⲉ ⲛⲁⲩ ⲁⲓⲉⲓ ⲉⲃⲟⲗ ⲉⲧⲙⲁⲕⲉⲇⲟⲛⲓⲁ .,"I had no relief for my spirit, because I didn't find Titus, my brother, but taking my leave of them, I went out into Macedonia.",13
sahidica-new-testament,47_2 Corinthians_2,2,ⲡⲉϩⲙⲟⲧ ⲇⲉ ⲙⲡⲛⲟⲩⲧⲉ ϣⲏⲡ ⲡⲁⲓ ⲉⲧϫⲁⲓⲟ ⲙⲙⲟⲛ ⲉⲃⲟⲗ ⲛⲟⲩⲟⲉⲓϣ ⲛⲓⲙ ϩⲙⲡⲉⲭⲣⲓⲥⲧⲟⲥ . ⲁⲩⲱ ⲉⲧⲟⲩⲱⲛϩ ⲉⲃⲟⲗ ⲙⲡⲉⲥⲧⲟⲓ ⲙⲡⲉϥⲥⲟⲟⲩⲛ ⲉⲃⲟⲗ ϩⲓⲧⲟⲟⲧⲛ ϩⲙⲙⲁ ⲛⲓⲙ .,"Now thanks be to God, who always leads us in triumph in Christ, and reveals through us the sweet aroma of his knowledge in every place.",14
sahidica-new-testament,47_2 Corinthians_2,2,ϫⲉⲁⲛⲟⲛ ⲟⲩⲥϯⲛⲟⲩϥⲉ ⲛⲧⲉⲡⲉⲭⲣⲓⲥⲧⲟⲥ ⲙⲡⲛⲟⲩⲧⲉ ϩⲛⲛⲉⲧⲛⲁⲟⲩϫⲁⲓ ⲙⲛⲛⲉⲧⲛⲁⲧⲁⲕⲟ .,"For we are a sweet aroma of Christ to God, in those who are saved, and in those who perish;",15
sahidica-new-testament,47_2 Corinthians_2,2,ⲛϩⲟⲓⲛⲉ ⲙⲉⲛ ⲛⲥⲧⲟⲓ ⲉⲃⲟⲗ ϩⲙⲡⲙⲟⲩ ⲉⲡⲙⲟⲩ . ⲛϩⲟⲓⲛⲉ ⲇⲉ ⲛⲥⲧⲟⲓ ⲉⲃⲟⲗ ϩⲙⲡⲱⲛϩ ⲉⲡⲱⲛϩ . ⲁⲩⲱ ⲛⲛⲁϩⲣⲛⲛⲁⲓ ⲛⲓⲙ ⲡⲉⲧⲙⲡϣⲁ .,to the one a stench from death to death; to the other a sweet aroma from life to life. Who is sufficient for these things?,16
sahidica-new-testament,47_2 Corinthians_2,2,ⲛⲛⲉⲛⲟ ⲅⲁⲣ ⲁⲛ ⲛⲧϩⲉ ⲛϩⲁϩ ⲉⲧⲟ ⲛⲉϣⲱⲧ ϩⲙⲡϣⲁϫⲉ ⲙⲡⲛⲟⲩⲧⲉ . ⲁⲗⲗⲁ ϩⲱⲥ ⲉⲃⲟⲗ ϩⲛⲟⲩⲧⲃⲃⲟ . ⲁⲗⲗⲁ ϩⲱⲥ ⲉⲃⲟⲗ ϩⲓⲧⲙⲡⲛⲟⲩⲧⲉ ⲙⲡⲉⲙⲧⲟ ⲉⲃⲟⲗ ⲙⲡⲛⲟⲩⲧⲉ ⲉⲛϣⲁϫⲉ ϩⲙⲡⲉⲭⲣⲓⲥⲧⲟⲥ .,"For we are not as so many, peddling the word of God. But as of sincerity, but as of God, in the sight of God, we speak in Christ.",17
sahidica-new-testament,41_Mark_13,13,ⲁⲩⲱ ⲉϥⲛⲏⲩ ⲉⲃⲟⲗ ϩⲙⲡⲉⲣⲡⲉ ⲡⲉϫⲉⲟⲩⲁ ⲛⲁϥ ⲉⲃⲟⲗ ϩⲛⲛⲉϥⲙⲁⲑⲏⲧⲏⲥ ϫⲉⲡⲥⲁϩ ⲁⲛⲁⲩ ⲉⲛⲉⲓⲱⲛⲉ ϫⲉϩⲉⲛ ⲁϣ ⲛϩⲉ ⲛⲉ . ⲙⲛ ⲛⲉⲓⲕⲉⲕⲱⲧ,Not Found,1
sahidica-new-testament,41_Mark_13,13,ⲁⲩⲱ ⲓⲏⲥⲟⲩⲥ ⲡⲉϫⲁϥ ⲛⲁϥ ϫⲉⲛⲅⲛⲁⲩ ⲁⲛ ⲉⲛⲉⲓⲛⲟϭ ⲛⲕⲱⲧ ⲛⲛⲉⲩⲕⲱ ⲙⲡⲉⲓⲙⲁ ⲛⲟⲩⲱⲛⲉ ⲉϫⲛⲟⲩⲱⲛⲉ ⲉⲙⲡⲟⲩⲃⲟⲗⲟⲩ ⲉⲃⲟⲗ .,Not Found,2
sahidica-new-testament,41_Mark_13,13,ⲁⲩⲱ ⲉϥϩⲙⲟⲟⲥ ϩⲓϫⲛⲡⲧⲟⲟⲩ ⲛⲛϫⲟⲉⲓⲧ ⲙⲡⲉⲙⲧⲟ ⲉⲃⲟⲗ ⲙⲡⲉⲣⲡⲉ . ⲁϥϫⲛⲟⲩϥ ⲛϭⲓⲡⲉⲧⲣⲟⲥ ⲛⲙⲓⲁⲕⲱⲃⲟⲥ ⲛⲙⲓⲱϩⲁⲛⲛⲏⲥ ⲙⲛⲁⲛⲇⲣⲉⲁⲥ ⲉⲩϫⲱⲙⲙⲟⲥ,Not Found,3
sahidica-new-testament,41_Mark_13,13,ϫⲉⲁϫⲓⲥ ⲛⲁⲛ ϫⲉⲉⲣⲉⲛⲁⲓ ⲛⲁϣⲱⲡⲉ ⲧⲛⲁⲩ . ⲁⲩⲱ ⲟⲩ ⲡⲉ ⲡⲙⲁⲉⲓⲛ ⲉⲣϣⲁⲛⲛⲁⲓ ⲧⲏⲣⲟⲩ ⲛⲟⲩ ⲉϫⲱⲕ ⲉⲃⲟⲗ .,Not Found,4
sahidica-new-testament,41_Mark_13,13,ⲓⲏⲥⲟⲩⲥ ⲇⲉ ⲁϥⲁⲣⲭⲉⲓ ⲛϫⲟⲟⲥ ⲛⲁⲩ ϫⲉϯϩⲧⲏⲧⲛ ⲙⲏⲡⲱⲥ ⲛⲧⲉⲗⲁⲁⲩ ⲡⲗⲁⲛⲁ ⲙⲙⲱⲧⲛ,Not Found,5
sahidica-new-testament,41_Mark_13,13,ⲟⲩⲛϩⲁϩ ⲅⲁⲣ ⲛⲁⲉⲓ ϩⲙⲡⲁⲣⲁⲛ ⲉⲩϫⲱⲙⲙⲟⲥ ϫⲉⲁⲛⲟⲕ ⲡⲉ ⲁⲩⲱ ⲥⲉⲛⲁⲡⲗⲁⲛⲁ ⲛⲟⲩⲙⲏⲏϣⲉ,Not Found,6
sahidica-new-testament,41_Mark_13,13,ⲉⲧⲉⲧⲛϣⲁⲛⲥⲱⲧⲙ ⲇⲉ ⲉϩⲉⲛⲡⲟⲗⲉⲙⲟⲥ ⲛⲙϩⲉⲛϩⲣⲟⲩ ⲙⲡⲟⲗⲉⲙⲟⲥ ⲙⲡⲣϣⲧⲟⲣⲧⲣ ⲥⲉⲛⲁϫⲡⲓϣⲱⲡⲉ ⲁⲗⲗⲁ ⲙⲡⲁⲧⲉⲧϩⲁⲏ ⲛⲟⲩⲉ ϣⲱⲡⲉ .,Not Found,7
sahidica-new-testament,41_Mark_13,13,ⲟⲩⲛⲟⲩϩⲉⲑⲛⲟⲥ ⲛⲁⲧⲱⲟⲩⲛ ⲉϫⲛⲟⲩϩⲉⲑⲛⲟⲥ ⲁⲩⲱ ⲟⲩⲙⲛⲧⲣⲣⲟ ⲉϫⲛⲟⲩⲙⲛⲧⲣⲣⲟ ⲁⲩⲱ ⲟⲩⲛϩⲉⲛϩⲉⲃⲱⲱⲛ ⲛⲁϣⲱⲡⲉ . ⲛⲁⲓ ⲇⲉ ⲧⲁⲣⲭⲏ ⲧⲉ ⲛⲛⲛⲁⲁⲕⲉ .,Not Found,8
sahidica-new-testament,41_Mark_13,13,ⲛⲧⲱⲧⲛ ⲇⲉ ϯϩⲧⲏⲧⲛ ⲉⲣⲱⲧⲛ . ⲥⲉⲛⲁⲡⲁⲣⲁⲇⲓⲇⲟⲩ ⲅⲁⲣ ⲙⲙⲱⲧⲛ ⲉⲛⲥⲩⲛϩⲉⲇⲣⲓⲟⲛ ⲛⲥⲉϩⲓⲟⲩⲉ ⲉⲣⲱⲧⲛ ϩⲛⲛⲥⲩⲛⲁⲅⲱⲅⲏ ⲛⲥⲉϫⲓⲧⲏⲩⲧⲛ ⲉⲛϩⲏⲅⲉⲙⲱⲛ ⲙⲛⲛⲉⲣⲣⲱⲟⲩ ⲉⲧⲃⲏⲏⲧ ⲉⲟⲩⲙⲛⲧⲙⲛⲧⲣⲉ ⲛⲁⲩ ⲙⲛⲛⲕⲉϩⲉⲑⲛⲟⲥ .,Not Found,9
sahidica-new-testament,41_Mark_13,13,ⲁⲩⲱ ⲥⲉⲛⲁϫⲡⲓⲕⲏⲣⲩⲥⲥⲉ ⲛϣⲟⲣⲡ ⲙⲡⲉⲩⲁⲅⲅⲉⲗⲓⲟⲛ,Not Found,10
sahidica-new-testament,41_Mark_13,13,ⲁⲩⲱ ⲉⲩϣⲁⲛϫⲓ ⲧⲏⲛⲟⲩ ⲉⲡⲁⲣⲁⲇⲓⲇⲟⲩ ⲙⲙⲱⲧⲛ ⲙⲡⲣϥⲓⲣⲟⲟⲩϣ ϫⲉⲟⲩ ⲡⲉⲧⲧⲉⲧⲛⲛⲁϫⲟⲟϥ ⲁⲗⲗⲁ ⲡⲉⲧⲟⲩⲛⲁⲧⲁⲁϥ ⲉⲧⲉⲧⲛⲧⲁⲡⲣⲟ ϩⲛⲧⲉⲩⲛⲟⲩ ⲉⲧⲙⲙⲁⲩ ⲡⲁⲓ ⲡⲉ ⲉⲧⲧⲉⲧⲛⲛⲁϫⲟⲟϥ ⲛⲧⲱⲧⲛ ⲅⲁⲣ ⲁⲛ ⲛⲉⲧϣⲁϫⲉ ⲁⲗⲗⲁ ⲡⲉⲡⲛⲉⲩⲙⲁ ⲡⲉ ⲉⲧⲟⲩⲁⲁⲃ .,Not Found,11
sahidica-new-testament,41_Mark_13,13,ⲁⲩⲱ ⲟⲩⲛⲟⲩⲥⲟⲛ ⲛⲁⲡⲁⲣⲁⲇⲓⲇⲟⲩ ⲛⲟⲩⲥⲟⲛ ⲉϩⲣⲁⲓ ⲉⲡⲙⲟⲩ . ⲁⲩⲱ ⲟⲩⲉⲓⲱⲧ ϥⲛⲁⲡⲁⲣⲁⲇⲓⲇⲟⲩ ⲛⲟⲩϣⲏⲣⲉ ⲛϣⲏⲣⲉ ⲛⲁⲧⲱⲟⲩⲛ ⲉϫⲛⲛⲉⲩⲉⲓⲟⲧⲉ ⲛⲥⲉⲙⲟⲟⲩⲧⲟⲩ,Not Found,12
sahidica-new-testament,41_Mark_13,13,ⲛⲧⲉⲧⲛϣⲱⲡⲉ ⲉⲣⲉⲟⲩⲟⲛⲛⲓⲙⲙⲟⲥⲧⲉ ⲙⲙⲱⲧⲛ ⲉⲧⲃⲉⲡⲁⲣⲁⲛ ⲡⲉⲧⲛⲁϩⲩⲡⲟⲙⲓⲛⲉ ⲇⲉ ϣⲁⲃⲟⲗ ⲡⲁⲓ ⲡⲉⲧⲛⲁⲟⲩϫⲁⲓ .,Not Found,13
sahidica-new-testament,41_Mark_13,13,ⲉⲧⲉⲧⲛϣⲁⲛⲛⲁⲩ ⲇⲉ ⲉⲧⲃⲟⲧⲉ ⲙⲡϣⲱϥ ⲉⲥⲁϩⲉⲣⲁⲧⲥ ⲙⲡⲙⲁ ⲉⲧⲉⲛϣϣⲉ ⲁⲛ . ⲡⲉⲧⲱϣ ⲙⲁⲣⲉϥⲛⲟⲉⲓ ⲧⲟⲧⲉ ⲛⲉⲧϩⲛⲧⲓⲟⲩⲇⲁⲓⲁ ⲙⲁⲣⲟⲩⲡⲱⲧ ⲉⲛⲧⲟⲩⲓⲏ,Not Found,14
sahidica-new-testament,41_Mark_13,13,ⲡⲉⲧϩⲓϫⲉⲛⲉⲡⲱⲣ ⲙⲡⲣⲧⲣⲉϥⲉⲓ ⲉⲡⲉⲥⲏⲧ ⲟⲩⲇⲉ ⲙⲡⲣⲧⲣⲉϥⲃⲱⲕ ⲉϩⲟⲩⲛ ⲉϥⲓⲗⲁⲁⲩ ϩⲙⲡⲉϥⲏⲓ .,Not Found,15
sahidica-new-testament,41_Mark_13,13,ⲁⲩⲱ ⲡⲉⲧϩⲛⲧⲥⲱϣⲉ ⲙⲡⲣⲧⲣⲉϥⲕⲟⲧϥ ⲉⲡⲁϩⲟⲩ ⲉϥⲓⲡⲉϥϩⲟⲉⲓⲧⲉ .,Not Found,16
sahidica-new-testament,41_Mark_13,13,ⲟⲩⲟⲉⲓ ⲇⲉ ⲛⲛⲉⲧⲉⲉⲧ ⲙⲛⲛⲉⲧⲧⲥⲛⲕⲟ ϩⲛⲛⲉϩⲟⲟⲩ ⲉⲧⲙⲙⲁⲩ .,Not Found,17
sahidica-new-testament,41_Mark_13,13,ϣⲗⲏⲗ ϫⲉⲕⲁⲁⲥⲉⲛⲛⲉⲡⲉⲧⲛⲡⲱⲧ ϣⲱⲡⲉ ⲛⲧⲉⲡⲣⲱ .,Not Found,18
sahidica-new-testament,41_Mark_13,13,ⲥⲉⲛⲁϣⲱⲡⲉ ⲅⲁⲣ ⲛϭⲓⲛⲉϩⲟⲟⲩ ⲉⲧⲙⲙⲁⲩ ⲛⲟⲩⲑⲗⲓⲯⲓⲥ ⲧⲁⲓ ⲉⲧⲉⲙⲡⲉⲟⲩⲟⲛ ⲛⲧⲉⲥϭⲟⲧ ϣⲱⲡⲉ ϫⲓⲛⲧⲁⲣⲭⲏ ⲙⲡⲥⲱⲛⲧ ⲛⲧⲁⲡⲛⲟⲩⲧⲉ ⲥⲟⲛⲧϥ ϣⲁϩⲣⲁⲓ ⲉⲧⲉⲛⲟⲩ ⲁⲩⲱ ⲙⲙⲛⲟⲩⲟⲛ ⲛⲧⲉⲥϭⲟⲧ ⲛⲁϣⲱⲡⲉ,Not Found,19
sahidica-new-testament,41_Mark_13,13,ⲁⲩⲱ ⲉⲛⲉⲙⲡⲉⲡϫⲟⲉⲓⲥ ⲧⲥⲃⲕⲉϩⲟⲟⲩ ⲛⲉⲙⲙⲛⲗⲁⲁⲩ ⲛⲥⲁⲣⲝ ⲛⲁⲱⲛϩ . ⲁⲗⲗⲁ ⲉⲧⲃⲉⲛⲥⲱⲧⲡ ⲛⲧⲁϥⲥⲟⲧⲡⲟⲩ ⲁϥⲧⲥⲃⲕⲉⲛⲉϩⲟⲟⲩ,Not Found,20
sahidica-new-testament,41_Mark_13,13,ⲁⲩⲱ ⲉⲣϣⲁⲛⲗⲁⲁⲩ ϫⲟⲟⲥ ⲛⲏⲧⲛ ϫⲉⲉⲓⲥ ⲡⲉⲭⲣⲓⲥⲧⲟⲥ ⲙⲡⲉⲓⲙⲁ . ⲁⲩⲱ ⲉⲓⲥ ϩⲏⲏⲧⲉ ϥϩⲛⲡⲉⲓⲙⲁ ⲙⲡⲣⲡⲓⲥⲧⲉⲩⲉ,Not Found,21
sahidica-new-testament,41_Mark_13,13,ⲥⲉⲛⲁⲧⲱⲟⲩⲛⲟⲩ ⲅⲁⲣ ⲛϭⲓϩⲉⲛⲭⲣⲓⲥⲧⲟⲥ ⲛⲛⲟⲩϫ ⲛⲙϩⲉⲛⲡⲣⲟⲫⲏⲧⲏⲥ ⲛⲛⲟⲩϫ ⲛⲥⲉϯ ⲛϩⲉⲛⲙⲁⲓⲛ ⲛⲙϩⲉⲛϣⲡⲏⲣⲉ ⲉϣⲱⲡⲉ ⲉⲟⲩⲛϭⲟⲙ ⲉⲡⲗⲁⲛⲁ ⲛⲛⲥⲱⲧⲡ,Not Found,22
sahidica-new-testament,41_Mark_13,13,ⲛⲧⲱⲧⲛ ⲇⲉ ϯϩⲧⲏⲧⲛ ⲉⲣⲱⲧⲛ ⲁⲓϣⲣⲡϫⲱ ⲉⲣⲱⲧⲛ ⲛϩⲱⲃ ⲛⲓⲙ .,Not Found,23
sahidica-new-testament,41_Mark_13,13,ⲁⲗⲗⲁ ϩⲛⲛⲉϩⲟⲟⲩ ⲉⲧⲙⲙⲁⲩ ⲙⲛⲛⲥⲁⲧⲉⲑⲗⲓⲯⲓⲥ ⲉⲧⲙⲙⲁⲩ ⲡⲣⲏⲛⲁⲣⲉⲃⲏ . ⲁⲩⲱ ⲡⲟⲟϩ ⲛϥⲛⲁϯⲡⲉϥⲟⲩⲟⲉⲓⲛ ⲁⲛ .,Not Found,24
sahidica-new-testament,41_Mark_13,13,ⲁⲩⲱ ⲛⲥⲓⲟⲩ ⲥⲉⲛⲁϩⲉ ⲉⲃⲟⲗ ϩⲛⲧⲡⲉ ⲁⲩⲱ ⲛϭⲟⲙ ⲉⲧϩⲛⲙⲡⲏⲩⲉ ⲥⲉⲛⲁⲛⲟⲓⲛ,Not Found,25
sahidica-new-testament,41_Mark_13,13,ⲁⲩⲱ ⲧⲟⲧⲉ ⲥⲉⲛⲁⲛⲁⲩ ⲉⲡϣⲏⲣⲉ ⲙⲡⲣⲱⲙⲉ ⲉϥⲛⲏⲩ ϩⲛⲟⲩⲕⲗⲟⲟⲗⲉ ⲛⲙⲟⲩⲛⲟϭ ⲛϭⲟⲙ ⲁⲩⲱ ⲟⲩⲉⲟⲟⲩ .,Not Found,26
sahidica-new-testament,41_Mark_13,13,ⲁⲩⲱ ⲧⲟⲧⲉ ϥⲛⲁϫⲉⲩ ⲛⲉϥⲁⲅⲅⲉⲗⲟⲥ ⲛϥⲥⲱⲟⲩϩ ⲉϩⲟⲩⲛ ⲛⲛⲉϥⲥⲱⲧⲡ ⲉⲃⲟⲗ ϩⲙⲡⲉϥⲧⲟⲩⲧⲏⲩ . ϫⲓⲛϫⲱϥ ⲙⲡⲕⲁϩ ϣⲁϫⲱⲥ ⲛⲧⲡⲉ .,Not Found,27
sahidica-new-testament,41_Mark_13,13,ⲉⲃⲟⲗ ⲇⲉ ⲛⲧⲃⲱ ⲛⲕⲛⲧⲉ ⲉⲧⲉⲧⲛⲉⲉⲓⲙⲉ ⲉⲧⲡⲁⲣⲁⲃⲟⲗⲏ . ⲉⲣϣⲁⲛⲡⲉⲥⲕⲗⲁⲇⲟⲥ ⲏⲇⲏ ⲗⲱⲕ ⲛⲧⲉⲛⲉⲥϭⲱⲃⲉ ϯⲟⲩⲱ ⲛϣⲁⲧⲉⲧⲛⲉⲓⲙⲉ ϫⲉⲁⲡϣⲱⲙ ϩⲱⲛ ⲉϩⲟⲩⲛ .,Not Found,28
sahidica-new-testament,41_Mark_13,13,ⲧⲁⲓ ϩⲱⲧⲧⲏⲩⲧⲛ ⲧⲉ ⲧⲉⲧⲛϩⲉ ⲉⲧⲉⲧⲛϣⲁⲛⲛⲁⲩ ⲉⲛⲁⲓ ⲧⲏⲣⲟⲩ ⲉⲩⲛⲁϣⲱⲡⲉ ⲉⲧⲉⲧⲛⲛⲁⲉⲓⲙⲉ ϫⲉⲁϥϩⲱⲛ ⲉϩⲟⲩⲛ ϩⲓⲣⲛⲛⲣⲟ .,Not Found,29
sahidica-new-testament,41_Mark_13,13,ϩⲁⲙⲏⲛ ϯϫⲱⲙⲙⲟⲥ ⲛⲏⲧⲛ ϫⲉⲛⲛⲉⲧⲉⲓⲅⲉⲛⲉⲁ ⲗⲟ ⲙⲙⲁⲩ ϣⲁⲛⲧⲉⲛⲁⲓ ⲧⲏⲣⲟⲩ ϣⲱⲡⲉ .,Not Found,30
sahidica-new-testament,41_Mark_13,13,ⲧⲡⲉ ⲛⲙⲡⲕⲁϩ ⲥⲉⲛⲁⲗⲟ ⲙⲙⲁⲩ ⲛⲁϣⲁϫⲉ ⲇⲉ ⲛⲥⲉⲛⲁⲗⲟ ⲙⲙⲁⲩ ⲁⲛ .,Not Found,31
sahidica-new-testament,41_Mark_13,13,ⲉⲧⲃⲉⲡⲉϩⲟⲟⲩ ⲇⲉ ⲉⲧⲙⲙⲁⲩ ⲏ ⲧⲉⲩⲛⲟⲩ ⲙⲛⲗⲁⲁⲩ ⲥⲟⲟⲩⲛ ⲟⲩⲇⲉ ⲛⲁⲅⲅⲉⲗⲟⲥ ϩⲛⲧⲡⲉ . ⲟⲩⲇⲉ ⲡϣⲏⲣⲉ ⲛⲥⲁⲡⲉⲓⲱⲧ ⲙⲙⲁⲩⲁⲁϥ .,Not Found,32
sahidica-new-testament,41_Mark_13,13,ϯϩⲧⲏⲧⲛ ⲛⲧⲉⲧⲛⲣⲟⲉⲓⲥ ⲁⲩⲱ ⲛⲧⲉⲧⲛϣⲗⲏⲗ ⲛⲧⲉⲧⲛⲥⲟⲟⲩⲛ ⲅⲁⲣ ⲁⲛ ϫⲉⲁϣ ⲡⲉ ⲡⲉⲩⲟⲉⲓϣ .,Not Found,33
sahidica-new-testament,41_Mark_13,13,ⲛⲧϩⲉ ⲛⲟⲩⲣⲱⲙⲉ ⲉϥⲛⲁⲁⲡⲟⲇⲏⲙⲉⲓ ⲉⲁϥⲕⲁⲡⲉϥⲏⲉⲓ ⲁⲩⲱ ⲁϥϯ ⲛⲧⲉⲝⲟⲩⲥⲓⲁ ⲛⲛⲉϥϩⲙϩⲁⲗ ⲡⲟⲩⲁ ⲡⲟⲩⲁ ⲉⲁϥϯ ⲛⲁϥ ⲙⲡⲉϥϩⲱⲃ . ⲁⲩⲱ ⲡⲉⲙⲛⲟⲩⲧ ⲁϥϩⲱⲛ ⲉⲧⲟⲟⲧϥ ϫⲉⲕⲁⲁⲥ ⲉϥⲉⲣⲟⲉⲓⲥ,Not Found,34
sahidica-new-testament,41_Mark_13,13,ⲣⲟⲉⲓⲥ ϭⲉ ϩⲱⲧⲧⲏⲩⲧⲛ ⲛⲧⲉⲧⲛⲥⲟⲟⲩⲛ ⲅⲁⲣ ⲁⲛ ϫⲉⲉⲣⲉⲡϫⲟⲉⲓⲥ ⲙⲡⲏⲓ ⲛⲏⲩ ⲛⲁϣ ⲛⲛⲁⲩ ⲏ ⲛⲣⲟⲩϩⲉ ⲏ ϩⲛⲧⲡⲁϣⲉ ⲛⲧⲉⲩϣⲏ ⲏ ⲙⲡⲛⲁⲩ ⲉⲣⲉⲡⲁⲗⲉⲕⲧⲱⲣ ⲛⲁⲙⲟⲩⲧⲉ ⲏ ⲙⲡⲛⲁⲩ ⲛϩⲧⲟⲟⲩⲉ,Not Found,35
sahidica-new-testament,41_Mark_13,13,ⲙⲏⲡⲱⲥ ⲛϥⲉⲓ ϩⲛⲟⲩϣⲥⲛⲉ ⲛϥϩⲉ ⲉⲣⲱⲧⲛ ⲉⲧⲉⲧⲛⲟⲃϣ .,Not Found,36
sahidica-new-testament,41_Mark_13,13,ⲡⲉϯϫⲱ ⲙⲙⲟϥ ⲛⲏⲧⲛ ϯϫⲱ ⲙⲙⲟϥ ⲛⲟⲩⲟⲛ ⲛⲓⲙ ϫⲉⲣⲟⲉⲓⲥ .,Not Found,37
sahidica-new-testament,58_Hebrews_11,11,ⲧⲡⲓⲥⲧⲓⲥ ⲇⲉ ⲡⲧⲁϫⲣⲟ ⲧⲉ ⲛⲛⲉⲧⲉⲛϩⲉⲗⲡⲓⲍⲉ ⲉⲣⲟⲟⲩ . ⲁⲩⲱ ⲡⲟⲩⲱⲛϩ ⲉⲃⲟⲗ ⲛⲛⲉϩⲃⲏⲩⲉ ⲉⲧⲉⲛⲧⲛⲛⲁⲩ ⲉⲣⲟⲟⲩ ⲁⲛ .,"Now faith is assurance of things hoped for, proof of things not seen.",1
sahidica-new-testament,58_Hebrews_11,11,ⲛⲧⲁⲩⲣⲙⲛⲧⲣⲉ ⲅⲁⲣ ϩⲁⲛⲉⲡⲣⲉⲥⲃⲩⲧⲉⲣⲟⲥ ϩⲛⲧⲁⲓ .,"For by this, the elders obtained testimony.",2
sahidica-new-testament,58_Hebrews_11,11,ϩⲛⲟⲩⲡⲓⲥⲧⲓⲥ ⲉⲛⲛⲟⲉⲓ ϫⲉⲛⲧⲁⲩⲥⲟⲃⲧⲉ ⲛⲛⲁⲓⲱⲛ ϩⲙⲡϣⲁϫⲉ ⲙⲡⲛⲟⲩⲧⲉ . ϫⲉⲡⲉⲧⲛⲛⲁⲩ ⲉⲣⲟϥ ⲛⲧⲁϥϣⲱⲡⲉ ⲉⲃⲟⲗ ϩⲙⲡⲉⲧⲉⲛϥϣⲟⲟⲡ ⲁⲛ .,"By faith, we understand that the universe has been framed by the word of God, so that what is seen has not been made out of things which are visible.",3
sahidica-new-testament,58_Hebrews_11,11,ϩⲛⲟⲩⲡⲓⲥⲧⲓⲥ ⲁⲁⲃⲉⲗ ⲧⲁⲗⲉϩⲟⲩⲉ ⲑⲩⲥⲓⲁ ⲉϩⲣⲁⲓ ⲡⲁⲣⲁⲕⲁⲉⲓⲛ ⲙⲡⲛⲟⲩⲧⲉ ⲁⲩⲱ ⲉⲃⲟⲗ ϩⲓⲧⲟⲟⲧⲥ ⲛⲧⲁⲩⲣⲙⲛⲧⲣⲉ ϩⲁⲣⲟϥ ϫⲉⲟⲩⲇⲓⲕⲁⲓⲟⲥ ⲡⲉ ⲉⲣⲉⲡⲛⲟⲩⲧⲉ ⲣⲙⲛⲧⲣⲉ ⲛⲁϥ ⲉϫⲛⲛⲉϥⲇⲱⲣⲟⲛ ⲁⲩⲱ ⲉⲃⲟⲗ ϩⲓⲧⲟⲟⲧⲥ ⲛⲧⲉⲣⲉϥⲙⲟⲩ ⲉⲧⲓ ⲟⲛ ϥϣⲁϫⲉ .,"By faith, Abel offered to God a more excellent sacrifice than Cain, through which he had testimony given to him that he was righteous, God testifying with respect to his gifts; and through it he, being dead, still speaks.",4
sahidica-new-testament,58_Hebrews_11,11,ϩⲛⲟⲩⲡⲓⲥⲧⲓⲥ ⲉⲛⲱⲭ ⲁⲩⲡⲟⲟⲛⲉϥ ⲉⲃⲟⲗ ⲉⲧⲙⲧⲣⲉϥⲛⲁⲩ ⲉⲡⲙⲟⲩ . ⲁⲩⲱ ⲙⲡⲟⲩϩⲉ ⲉⲣⲟϥ ϫⲉⲁⲡⲛⲟⲩⲧⲉ ⲡⲟⲟⲛⲉϥ ⲉⲃⲟⲗ . ϩⲁⲧϩⲏ ⲅⲁⲣ ⲉⲙⲡⲁⲧⲟⲩⲡⲟⲟⲛⲉϥ ⲉⲃⲟⲗ ⲁⲩⲣⲙⲛⲧⲣⲉ ϩⲁⲣⲟϥ ϫⲉⲁϥⲣⲁⲛⲁϥ ⲙⲡⲛⲟⲩⲧⲉ .,"By faith, Enoch was taken away, so that he wouldn't see death, and he was not found, because God translated him. For he has had testimony given to him that before his translation he had been well pleasing to God.",5
sahidica-new-testament,58_Hebrews_11,11,ⲁϫⲛⲡⲓⲥⲧⲓⲥ ⲇⲉ ⲟⲩⲁⲧϭⲟⲙ ⲡⲉ ⲉⲣⲁⲛⲁϥ . ϣϣⲉ ⲅⲁⲣ ⲉⲡⲉⲧⲛⲁϯ ⲡⲉϥⲟⲩⲟⲉⲓ ⲉⲡⲛⲟⲩⲧⲉ ⲉⲡⲓⲥⲧⲉⲩⲉ ϫⲉϥϣⲟⲟⲡ ⲁⲩⲱ ϫⲉϥⲛⲁϣⲱⲡⲉ ⲛⲧⲁⲓⲃⲉⲕⲉ ⲛⲛⲉⲧϣⲓⲛⲉ ⲛⲥⲱϥ .,"Without faith it is impossible to be well pleasing to him, for he who comes to God must believe that he exists, and that he is a rewarder of those who seek him.",6
sahidica-new-testament,58_Hebrews_11,11,ϩⲛⲟⲩⲡⲓⲥⲧⲓⲥ ⲉⲁⲩⲧⲟⲩⲛⲟⲩⲉⲓⲁⲧϥ ⲉⲃⲟⲗ ⲛⲛⲱϩⲉ ⲉⲧⲃⲉⲛⲉⲧϥⲛⲁⲩ ⲉⲣⲟⲟⲩ ⲁⲛ ⲛⲧⲉⲣⲉϥⲣϩⲟⲧⲉ ⲁϥⲧⲁⲙⲓⲟ ⲛⲟⲩϭⲓⲃⲱⲧⲟⲥ ⲉⲡⲉⲩϫⲁⲓ ⲙⲡⲉϥⲏⲓ ⲉⲃⲟⲗ ϩⲓⲧⲟⲟⲧⲥ ⲁϥⲧϭⲁⲓⲉ ⲡⲕⲟⲥⲙⲟⲥ ⲁⲩⲱ ⲁϥϣⲱⲡⲉ ⲛⲕⲗⲏⲣⲟⲛⲟⲙⲟⲥ ⲛⲧⲇⲓⲕⲁⲓⲟⲥⲩⲛⲏ ⲕⲁⲧⲁⲧⲡⲓⲥⲧⲓⲥ .,"By faith, Noah, being warned about things not yet seen, moved with godly fear, prepared a ship for the saving of his house, through which he condemned the world, and became heir of the righteousness which is according to faith.",7
sahidica-new-testament,58_Hebrews_11,11,ϩⲛⲟⲩⲡⲓⲥⲧⲓⲥ ⲉⲁⲩⲙⲟⲩⲧⲉ ⲉⲁⲃⲣⲁϩⲁⲙ ⲁϥⲥⲱⲧⲙ ⲉⲉⲓ ⲉⲃⲟⲗ ⲉⲡⲙⲁ ⲉⲧϥⲛⲁϫⲓⲧϥ ⲉⲩⲕⲗⲏ ⲣⲟⲛⲟⲙⲓⲁ ⲁϥⲉⲓ ⲉⲃⲟⲗ ⲉⲛϥⲥⲟⲟⲩⲛ ⲁⲛ ϫⲉⲉϥⲙⲟⲟϣⲉ ⲉⲧⲱⲛ .,"By faith, Abraham, when he was called, obeyed to go out to the place which he was to receive for an inheritance. He went out, not knowing where he went.",8
sahidica-new-testament,58_Hebrews_11,11,ϩⲛⲟⲩⲡⲓⲥⲧⲓⲥ ⲁϥⲟⲩⲱϩ ϩⲙⲡⲕⲁϩ ⲙⲡⲉⲣⲏⲧ ϩⲱⲥ ϣⲙⲙⲟ . ⲉⲁϥⲟⲩⲱϩ ϩⲛϩⲉⲛϩⲃⲱ ⲙⲛⲓⲥⲁⲁⲕ ⲁⲩⲱ ⲓⲁⲕⲱⲃ ⲛϣⲃⲣⲕⲗⲏⲣⲟⲛⲟⲙⲟⲥ ⲙⲡⲓⲉⲣⲏⲧ ⲛⲟⲩⲱⲧ .,"By faith, he lived as an alien in the land of promise, as in a land not his own, dwelling in tents, with Isaac and Jacob, the heirs with him of the same promise.",9
sahidica-new-testament,58_Hebrews_11,11,ⲛⲉϥϭⲱϣⲧ ⲅⲁⲣ ⲉⲃⲟⲗ ϩⲏⲧⲥ ⲛⲧⲡⲟⲗⲓⲥ ⲉⲧⲉⲩⲛⲧⲥ ⲥⲛⲧⲉ ⲙⲙⲁⲩ . ⲧⲁⲓ ⲉⲡⲉⲥⲧⲉⲭⲛⲓⲧⲏⲥ ⲙⲛⲡⲉⲥⲇⲏⲙⲓⲟⲩⲣⲅⲟⲥ ⲡⲉ ⲡⲛⲟⲩⲧⲉ .,"For he looked for the city which has the foundations, whose builder and maker is God.",10
sahidica-new-testament,58_Hebrews_11,11,ϩⲛⲟⲩⲡⲓⲥⲧⲓⲥ ϩⲱⲱⲥ ⲥⲁⲣⲣⲁ ⲧⲁϭⲣⲏⲛ ⲁⲥϫⲓ ⲛⲟⲩϭⲟⲙ ⲉⲩⲕⲁⲧⲁⲃⲟⲗⲏ ⲛⲥⲡⲉⲣⲙⲁ ⲡⲁⲣⲁⲡⲟⲩⲟⲉⲓϣ ⲛⲧⲉⲥϭⲟⲧ ⲉⲃⲟⲗ ϫⲉⲁⲥⲧⲁⲛϩⲉⲧ ⲡⲉⲛⲧⲁϥⲉⲣⲏⲧ .,"By faith, even Sarah herself received power to conceive, and she bore a child when she was past age, since she counted him faithful who had promised.",11
sahidica-new-testament,58_Hebrews_11,11,ⲉⲧⲃⲉⲡⲁⲓ ⲉⲁⲩϫⲡⲟⲟⲩ ⲉⲃⲟⲗ ϩⲛⲟⲩⲁ ⲉⲁⲡⲉϥⲥⲱⲙⲁ ⲣⲡⲕⲉⲕⲁϭⲟⲙ ⲉⲃⲟⲗ ⲛⲧϩⲉ ⲛⲛⲥⲓⲟⲩ ⲛⲧⲡⲉ ϩⲛⲧⲉⲩⲁϣⲏ . ⲁⲩⲱ ⲛⲧϩⲉ ⲙⲡϣⲟ ⲉⲧϩⲁⲧⲙ ⲡⲉⲥⲡⲟⲧⲟⲩ ⲛⲧⲑⲁⲗⲁⲥⲥⲁ ⲉⲧⲉⲙⲛⲧϥ ⲏⲡⲉ .,"Therefore as many as the stars of the sky in multitude, and as innumerable as the sand which is by the sea shore, were fathered by one man, and him as good as dead.",12
sahidica-new-testament,58_Hebrews_11,11,ⲕⲁⲧⲁⲧⲡⲓⲥⲧⲓⲥ ⲁⲩⲙⲟⲩ ⲛϭⲓⲛⲁⲓ ⲧⲏⲣⲟⲩ ⲙⲡⲟⲩϫⲓ ⲛⲛⲉⲣⲏⲧ ⲁⲗⲗⲁ ⲁⲩⲛⲁⲩ ⲉⲣⲟⲟⲩ ⲙⲡⲟⲩⲉ ⲁⲩⲁⲥⲡⲁⲍⲉ . ⲁⲩⲱ ⲁⲩϩⲟⲙⲟⲗⲟⲅⲉⲓ ϫⲉⲁⲛϩⲉⲛϣⲙⲙⲟ . ⲁⲩⲱ ⲁⲛϩⲉⲛⲣⲙⲛϭⲟⲓⲗⲉ ϩⲓϫⲙⲡⲕⲁϩ .,"These all died in faith, not having received the promises, but having seen them and embraced them from afar, and having confessed that they were strangers and pilgrims on the earth.",13
sahidica-new-testament,58_Hebrews_11,11,ⲛⲉⲧϫⲱ ⲅⲁⲣ ⲛⲛⲁⲓ ⲛⲧⲉⲓϩⲉ ⲉⲩⲟⲩⲱⲛϩ ⲙⲙⲟⲟⲩ ⲉⲃⲟⲗ ϫⲉⲉⲩϣⲓⲛⲉ ⲛⲥⲁⲟⲩⲡⲟⲗⲓⲥ .,For those who say such things make it clear that they are seeking a country of their own.,14
sahidica-new-testament,58_Hebrews_11,11,ⲛⲛⲉⲩⲣⲡⲙⲉⲉⲩⲉ ⲇⲉ ⲛⲧⲉⲛⲧⲁⲩⲉⲓ ⲉⲃⲟⲗ ⲛϩⲏⲧⲥ . ⲛⲉⲁⲩⲣⲧⲉ ⲡⲉ ⲛⲕⲟⲧⲟⲩ ⲉⲣⲟⲥ .,"If indeed they had been thinking of that country from which they went out, they would have had enough time to return.",15
sahidica-new-testament,58_Hebrews_11,11,ⲧⲉⲛⲟⲩ ⲇⲉ ⲉⲩⲟⲩⲉϣⲧⲉⲧⲛⲥⲟⲧⲡ ⲉⲧⲉⲧⲁⲧⲡⲉ ⲧⲉ . ⲉⲧⲃⲉⲡⲁⲓ ⲙⲡⲛⲟⲩⲧⲉ ϯϣⲓⲡⲉ ⲛⲁⲩ ⲁⲛ ⲉⲧⲣⲉⲩⲉⲡⲓⲕⲁⲗⲉⲓ ⲙⲙⲟϥ ⲛⲛⲟⲩⲧⲉ ⲉϫⲱⲟⲩ ⲁϥⲥⲟⲃⲧⲉ ⲅⲁⲣ ⲛⲁⲩ ⲛⲟⲩⲡⲟⲗⲓⲥ .,"But now they desire a better country, that is, a heavenly one. Therefore God is not ashamed of them, to be called their God, for he has prepared a city for them.",16
sahidica-new-testament,58_Hebrews_11,11,ϩⲛⲟⲩⲡⲓⲥⲧⲓⲥ ⲁⲃⲣⲁϩⲁⲙ ⲁϥⲧⲁⲗⲉ ⲓⲥⲁⲁⲕ ⲉϩⲣⲁⲓ ⲉⲩⲡⲉⲓⲣⲁⲍⲉ ⲙⲙⲟϥ . ⲁⲩⲱ ⲁϥⲧⲁⲗⲉ ⲡⲉϥϣⲏⲣⲉ ⲛⲟⲩⲱⲧ ⲉϩⲣⲁⲓ ⲛϭⲓⲡⲉⲛⲧⲁϥϣⲱⲡ ⲉⲣⲟϥ ⲛⲛⲉⲣⲏⲧ,"By faith, Abraham, being tested, offered up Isaac. Yes, he who had gladly received the promises was offering up his one and only son;",17
sahidica-new-testament,58_Hebrews_11,11,ⲡⲁⲓ ⲉⲛⲧⲁⲩϣⲁϫⲉ ⲛⲙⲙⲁϥ ϫⲉϩⲛⲓⲥⲁⲁⲕ ⲉⲩⲛⲁⲙⲟⲩⲧⲉ ⲛⲁⲕ ⲉⲩⲥⲡⲉⲣⲙⲁ .,"even he to whom it was said, 'In Isaac will your seed be called;'",18
sahidica-new-testament,58_Hebrews_11,11,ⲉⲁϥⲙⲟⲕⲙⲉⲕ ϫⲉⲟⲩⲛϭⲟⲙ ⲙⲡⲛⲟⲩⲧⲉ ⲉⲧⲟⲩⲛⲟⲥϥ ⲉⲃⲟⲗ ϩⲛⲛⲉⲧⲙⲟⲟⲩⲧ ⲉⲧⲃⲉⲡⲁⲓ ⲟⲛ ⲁϥϫⲓⲧϥ ϩⲛⲟⲩⲡⲁⲣⲁⲃⲟⲗⲏ .,"concluding that God is able to raise up even from the dead. Figuratively speaking, he also did receive him back from the dead.",19
